start,end,text
1.043,29.747,"This is a training video detailing techniques for laparoscopic small bowel anastomosis. Surgical approach to small bowel resections varies with the underlying abnormality, which can affect placement of the trocars depending on the area of focus. There are a few principles regarding performing laparoscopic small bowel anastomosis. The end-to-end anastomosis restores more accurately the natural continuity of the bowel, but a side-to-side anastomosis is most commonly performed."
30.247,53.045,"Entry into the peritoneal cavity can be performed by what is most comfortable to the surgeon, but trochars should allow for identifying the area of concern, lysis of adhesions, creation of a mesenteric window, stapling of the bowel, division of the mesentery of the abnormal segment of the bowel, reanastomosis of the bowel, and closure of the mesenteric defect."
53.545,82.982,"The standard operating room setup for SBR is the surgeon, most often on the right, and the first assist on the left. Ports depend on where larger instruments, such as the stapler, will be used. The surgeon's left hand is most often a five millimeter trocar, and the right hand is a twelve millimeter trocar, in order to use the stapler and suturing device. Usually a two-oh polysorb on SH needle, cut to six inches. The assistant left hand is a camera, and the right hand is a five millimeter port."
83.482,101.471,The surgeon identifies the proximal and distal ends of the abnormal bowel segment. The mesentery is held perpendicular to the surgical instrument to create a mesenteric window at the site of bowel transection.
101.971,129.467,The surgeon uses a 2.5 mm linear stapler to divide the small bowel through the mesenteric window. The mesentery of the specimen is then divided using an electrosurgical device.
129.967,156.88,"The surgeon places a traction suture at the anti-mesenteric side of the bowel to align the two portions before re-anastomosis, ensuring proper alignment and support at the end of the anastomotic staple line."
157.38,173.631,"The surgeon uses hook electrocautery to create openings in the bowel lumen, taking care to avoid injury to the back wall of the bowel during the procedure."
174.131,202.173,"The surgeon uses a 60mm long, 2.5mm linear stapler to reestablish intestinal continuity, ensuring the stapler is fully placed within the bowel lumen and the bowel is evenly aligned. For a larger anastomosis, the surgeon rotates the anastomosis 180 degrees to accommodate another stapler."
202.673,227.957,"The surgeon inspects the stapled suture line for any signs of bleeding, applying interrupted sutures to control any bleeding observed. A proximal stitch is then placed to secure the anastomosis."
228.457,268.558,"The surgeon closes the common enterotomy using a running stitch technique, employing a single layer closure with absorbable suture, such as a 2-0 polysorb. A target suture is placed to facilitate dexterity, minimizing tissue handling."
269.058,301.17,"The surgeon utilizes sutures to ensure complete resection of the enterotomy, followed by a stapled closure performed in a Heinecke-Mikulitz orientation, closing the enterotomy transversally."
301.67,338.553,"The completed suture line and staple line are visible. The surgeon places a stay suture at the end of the mesenteric defect and begins a running suture to close the remainder of the defect, finishing at the previously placed stay suture."
339.053,340.464,This concludes the training video.
