start,end,text
4.931,36.162,"Persistent gastrocutaneous fistulas can be a complication after feeding tubes that have been placed are ultimately removed. Surgical closure is occasionally required. Previously, this was done through a midline incision approximately six to eight inches in length. However, with the assistance of robotic surgery, this is now easily and safely done through three small incisions."
36.662,58.012,"The surgeon isolates the stomach from surrounding adhesions, with visible transection of vessels and minor bleeding due to the stomach's rich vascularization."
58.512,77.403,"The surgeon uses a stapler to seal and transect the isolated portion of the stomach, which is connected to the anterior abdominal wall."
77.903,96.615,"The surgeon leaves the staple line exposed, noting that leaks are uncommon, but proceeds to imbricate the staple line using a running monofilament suture for added security."
97.115,116.825,"The surgeon dissects and removes the remnant of the stomach that is connected to the anterior abdominal wall. All suture material is extracted, and the single twelve millimeter port site is closed."
117.325,124.169,"As there is no large midline incision, the potential for an incisional hernia is nearly eliminated."
