start,end,text
28.609,49.412,"The surgeon uses an OptiView technique with a robotic eight millimeter trocar to access the peritoneum, achieving insufflation to fifteen millimeters of mercury. A small umbilical defect is visible with a portion of incarcerated fat. Additional trocars are placed under direct visualization."
95.66,128.587,"A small umbilical hernia is visualized. The surgeon uses hot scissors with electrocautery and a pro grasp to begin the procedure. A wide peritoneal flap, approximately ten centimeters in diameter, is created to provide ample space for the mesh placement, tailored to the size of the hernia defect."
129.087,196.242,"The surgeon performs blunt dissection using scissors, sparingly applying electrocautery to preserve muscle fibers and avoid excessive injury. The dissection occurs in a fine plane above the peritoneum, aiming to avoid penetrating the umbilical hernia sac. The robotic 3D optics enhance visualization, showing the defect opening up with minimal bleeding."
196.742,226.643,"The surgeon separates the skin from the hernia sac, revealing a clear defect in the fascia at the umbilicus. The video is sped up to show this process more quickly."
227.143,271.835,"The surgeon identifies the hernia defect, measuring approximately two centimeters. A nine-centimeter mesh is opened for placement over the defect. The TAP approach is considered to preserve anatomical integrity and prevent mesh migration."
272.335,323.373,"The robotic system provides a clear view of the anatomy. The surgeon uses a pro grasp instrument, with tips measuring approximately two centimeters, as a measuring device. Sutures are being passed to close the peritoneum, starting slightly away from the defect. The suture is locked in place, and several throws are made to ensure a secure closure."
323.873,377.8,"The surgeon begins closing the fascial defect using a PDS suture, reducing intra-abdominal pressure to 12 mmHg to facilitate closure. The suture is tightened after each throw, and a second layer is prepared to reinforce the closure by returning to the initial suture entry point."
378.3,433.774,"The surgeon confirms the complete closure of the hernia defect and ensures no lipoma is trapped inside by having the assistant push out any air. The coated mesh is unrolled and positioned with the coating facing the bowel to prevent direct contact with intra-abdominal organs. An absorbable two-arm suture is used to secure the mesh, avoiding the need for laparoscopic tacks."
434.274,484.97,"The surgeon uses a plier to suture the mesh in place on one side, employing a double arm suture technique to secure the remainder of the mesh. The CT-one needle is used for fascial closure, with sutures available in various lengths, including a 24x24 cm bidirectional suture for mesh fixation."
485.47,529.978,"The surgeon finalizes the closure of the peritoneum, ensuring the mesh is securely fixed in place and separated from the small bowel. The mesh is sandwiched between the patient's peritoneum to minimize future adhesions. The sutures are tied down and removed to complete the procedure."
