start,end,text
64.228,91.198,"The video displays axial CT colonography images showing a one-centimeter polyp, along with volume-rendered images. Adhesions of the sigmoid colon to the abdominal wall in the right iliac fossa and pelvis are visible."
91.698,144.342,"The surgeon completes the mobilization of the sigmoid colon after dividing its attachments to the lateral abdominal wall and pelvis, allowing for improved access and manipulation."
144.842,230.99,"The colonoscope is introduced into the sigmoid colon, with laparoscopic clamps assisting its advancement. The scope progresses visually through the ascending colon and posteriorly navigates the splenic flexure towards the transverse colon."
231.49,274.157,"The endoscopic view shows the cecum, where a polyp is identified on the lateral wall. The polyp appears as a submucosal nodule with preserved mucosa."
274.657,341.893,"Adrenaline mixed with Mechelin Blue is injected submucosally, highlighting the depth of the scar and precisely delineating the edges. The polypectomy loop is then inserted, and the tumor is excised with assistance from laparoscopic compression of the intestinal wall."
342.393,396.205,The surgeon places approximation clips on the edges of the intestinal wall after confirming no perforation. The specimen is then retrieved using a basket rod net.
