start,end,text
1.808,29.843,"The next step is dissecting the mid and lower thoracic esophagus. This point is very simple. This is not a difficult point. Usually, thoracoscopic surgery is enough for this procedure. Robot is maybe not necessary. However, we can do it using robot surgery."
30.343,37.808,"The thoracic duct is visible in the surgical field, identifiable as a tubular structure within the thoracic cavity."
37.868,89.408,"So, in an advanced stages, I sometimes do remove the whole tissue here. It's a periaurtic tissue. Somebody called it mesoesophagus, but I don't agree. Because it does not surround the whole esophagus. located around just here, around the aortic arch. So I think that most of the lymphatics are related to the aorta, less than the esophagus. So I don't think that this is a mesoesophageal tissue. But sometimes the tumor metastasizes to this area. I sometimes remove it. Today, this patient is early stage esophageal cancer. I will not do that."
89.908,152.222,"So, in this tower area, usually harmony is enough. It is a very simple procedure."
152.722,186.727,The surgeon uses a harmonic scalpel to control small branches from the descending aorta connecting to the esophagus. The left lung is visible in the surgical field.
187.227,219.985,"The surgeon carefully freezes out the parabiotic tissue near the thoracic duct to avoid damaging it, with the thoracic duct visibly identifiable in the surgical field."
220.485,244.77,"Some papers, some surgeons recommended routine ligation of the duct and it can prevent carotid rupture, but I don't agree. So if we can see the thoracic duct and not to, if we try to not to damage the duct, during the operation."
245.27,309.843,The surgeon identifies the left vagus nerve knob adjacent to the esophagus and proceeds to open the space between them before cutting the vagus nerve.
310.343,337.114,"The surgeon identifies lymph nodes in the left hyaline region, noting their proximity to the vagus nerve. These lymph nodes are visually distinguished as pulmonary rather than esophageal lymph nodes."
337.614,458.625,"The surgeon identifies the pulmonary vein and adjacent lymph nodes, noting an injury to the sinister pulmonary vein. The pulmonary ligament, numbered as a nine-year pulmonary ligament, is removed due to its shared lymph nodes between the lung and esophagus."
459.125,500.895,"The surgeon operates in a straightforward area using an energy device, with no additional commentary provided on the specific actions or structures involved."
501.395,529.911,"The surgeon navigates the area of diaphragmatic lymph nodes, moving upwards alongside the esophagus."
530.411,560.192,"The surgeon cuts the right vagus nerve after dividing the pulmonary branch, using precise dissection techniques to separate these structures."
560.692,619.396,"The surgeon observes an injury to the lung, indicating a need for future suturing. The surgeon examines a structure, possibly identifying it as a Nereidspazial node, labeled as a nine R lymph node."
619.896,650.55,"Then, we should put it up, put it down. Okay? Okay. Can you wipe the camera for me? Okay."
651.05,765.86,"The surgeon removes a diaphragmatic lymph node, identified as number fifteen, from a common area of metastasis near the rib. The lymph node is pulled up to expose the membrane portion of the diaphragm."
766.36,796.731,Number fifteen. You have to turn it. Turn it to ninety degrees. That's right. And hold it. Okay? Okay. What is it? Okay.
