start,end,text
10.593,22.661,A thirty-five-year-old female presented with symptomatic gallstones. Liver function tests were normal. Ultrasound showed multiple gallstones with no features of acute cholecystitis.
23.161,32.888,After review the patient was planned for laparoscopic cholecystectomy. How to perform a standard laparoscopic cholecystectomy.
33.388,42.342,"The surgeon reviews the gallbladder anatomy, highlighting the long cystic duct that visibly overhangs the left lobe of the liver."
42.842,84.34,"The surgeon begins the dissection of the gallbladder by separating the posterior leaf, followed by the anterior leaf, using precise surgical techniques."
84.84,174.335,"The surgeon creates a window in Collar's triangle to access the cystic duct, milks the duct, and applies clips before cutting it. A similar window is created for the cystic artery, which is then clipped."
174.835,203.653,"The surgeon dissects the gallbladder away from the liver bed, leaving behind a thin white layer of tissue."
204.153,224.383,"The surgeon extracts the gallbladder specimen, reviewing the gallbladder fossa and the placement of clips. The extracted specimen includes the gallbladder and visible gallstones."
