start,end,text
38.856,57.108,The surgeon inserts plastic trocars through small incisions in the patient's abdomen to facilitate the laparoscopic gastric bypass procedure.
57.608,99.423,"The assistant lifts the omentum, revealing the underlying small intestine. The surgeon holds the small intestine while identifying the transverse colon. The gastric bypass procedure involves creating a small pouch and connecting it to the intestine, with the current focus on the intestinal connection."
99.923,160.93,"The surgeon identifies the ligament of Treitz at the beginning of the small intestine and measures approximately fifty centimeters to create the bilopancreatic limb. The small intestine is grasped and divided using an Ethicon stapler equipped with Gore Seam Guard for staple line reinforcement, aiming to minimize bleeding or oozing."
161.43,201.039,"The surgeon divides the mesentery, which contains the blood supply to the bowel, to facilitate the movement of the intestinal limb towards the gastric pouch."
201.539,240.849,The surgeon identifies a blood vessel near the small intestine and carefully preserves it to maintain blood supply during the laparoscopic gastric bypass procedure. The mesentery has been divided to facilitate the positioning of the intestinal limb.
241.349,324.395,The surgeon measures and counts out 125 centimeters of the small intestine to create the Roux limb for the Roux-en-Y gastric bypass procedure. The Roux limb will be connected to the gastric pouch to prevent bile reflux.
324.895,389.06,"The surgeon sutures two limbs of the small intestine together to create an anastomosis, forming a connection that allows bile and pancreatic juices to flow through the bilopancreatic limb. Enterotomies, or intentional holes, are made in the small intestine to facilitate this connection."
389.56,531.942,"The surgeon uses a 60mm stapler to connect two bowel lumens, advancing the stapler into both lumens to create an anastomosis. The hole created between the two limbs is closed, completing the connection."
532.442,584.409,"The surgeon uses a Stryker camera system to inspect the surgical site, confirming the closure of the defect between the bilopancreatic limb and the Roux limb. The newly formed connection creates a common channel for pancreatic juices and food, visually resembling a 'baby's butt.'"
584.909,713.538,"The surgeon performs the 'baby's butt stitch' between the common channel and the bilopancreatic limb, ensuring the connection of bile and pancreatic juices with the alimentary tract. The mesenteric defect is closed to prevent the risk of internal hernia, which could occur if a loop of bowel becomes trapped in the space."
713.538,798.587,"The surgeon closes the mesenteric defect using a green permanent stitch to prevent bowel from entering the space, minimizing the risk of internal hernia. The stitch is tied off, and the defect is now closed. There is slight oozing from the mesentery, which is expected to stop with time or by tying the knot. The anastomosis, referred to as JJ or jejunojejunostomy, is completed, and care is taken to avoid adhesions that could lead to bowel obstruction."
798.587,919.37,"The surgeon grasps the omentum and divides it in the middle to create a path for the Roux limb to reach the gastric pouch, aiming to reduce tension on the connection between the pouch and the Roux limb. The colon is visible, appearing whiter and larger than the small intestine, with bands of longitudinal muscle called teniae coli."
919.87,1040.064,"The surgeon retracts the purple-colored liver to expose the stomach, located near the liver. The roux limb, measuring 125 centimeters, is mobilized and tacked to the underside of the stomach to prevent it from falling into the pelvis during patient repositioning. The diaphragm, a fibrous muscular sheet aiding in breathing, is visible with the heart beating above it."
1040.564,1137.698,"The surgeon examines the hiatus in the diaphragm, identifying a sliding hiatal hernia where the stomach slides into the chest. The esophagus is visible as a muscular structure within the hiatus, and the vagus nerve is noted nearby. The surgeon assesses the laxity in the hiatus and plans to tighten it to prevent postoperative acid reflux."
1138.198,1244.935,"The surgeon places stitches to tighten the area around the gastric pouch, preventing it from slipping into a defect or space over time. A zero surge pack is used, and the stitches are cut to ensure snug closure."
1245.435,1322.277,"The surgeon identifies the gastropathic omentum with the liver visible on the left side of the screen. The stomach is located below, and the surgeon begins creating a defect to access the area behind the stomach. A small pouch is formed from the top of the stomach, intended to serve as the new, smaller stomach for the patient."
1322.777,1368.296,"The surgeon uses a stapler to divide a descending branch of the gastric artery, ensuring hemostasis to prevent bleeding. The stomach is then prepared for the creation of a small gastric pouch, with the first staple line placed to begin the division, aiming to restrict food intake post-surgery."
1368.796,1441.938,The surgeon uses a stapler to create a window in the posterior portion of the gastric pouch during the gastric bypass procedure. The camera provides a clear view of the surgical field as the pouch is straightened.
1441.938,1557.42,"The surgeon continues creating the gastric pouch, successfully forming a window behind the stomach. The pouch is visibly low and bold, with the esophagus positioned above it. The pouch is of reasonable size, intended to restrict food intake as it descends from the esophagus."
1557.92,1661.864,"The surgeon prepares the roux limb, a divided section of intestine, to be anastomosed to the gastric pouch. A temporary suture is placed to secure the roux limb to the pouch, reducing tension during the gastrojejunal anastomosis. The procedure involves connecting the stomach pouch to the intestine, ensuring stability while performing the anastomosis."
1662.364,1742.488,"The surgeon tightens the stitch on the gastrojejunal anastomosis, using a suture to approximate the stomach and jejunum. The seam guard is removed to clear the area for sewing, and a hole is created in the stomach for the anastomosis."
1867.313,1952.015,"The surgeon prepares to connect the roux limb to the stomach using a surgical stapler. The stapler fires three rows of titanium staples on each side and cuts between them, creating a secure connection. The staples are visible and are MRI compatible."
1952.515,2027.557,"The surgeon sutures the anastomosis, using absorbable sutures that will be replaced by scar tissue over time. The liver is retracted on the left-hand side, revealing its enlarged size due to hepatic steatosis, a common condition in overweight individuals."
2028.057,2174.17,"The surgeon connects the stomach to the jejunum, sewing the defect shut to complete the gastrojejunal anastomosis. A small vessel in the anastomosis is bleeding, which the surgeon plans to over-sew to control the bleeding."
2174.67,2337.285,"The surgeon applies direct pressure to a bleeding site using gauze sponges, which are visibly placed in the surgical field to slow down the bleeding. After holding pressure for about thirty seconds to a minute, the bleeding appears to have stopped, and the sponges are removed from the abdominal cavity."
2446.635,2565.47,The surgeon identifies a bleeder at the anastomosis site and applies a second suture line to ensure the connection is airtight and not prone to leaks.
2770.463,2971.15,"The surgeon completes the anastomosis, noting that the bleeding has stopped, with approximately 90 cc of blood loss. A leak test is performed by inflating the anastomosis under saline to check for air bubbles, confirming no leaks. The gastric pouch, esophagus, and Roux limb are visible. A hiatal hernia repair and gastric bypass are completed, followed by closing a mesenteric defect known as Peterson's defect by suturing it to the omentum to prevent hernia formation."
