start,end,text
1.08,15.852,"All right, welcome to another episode. Today we're talking about robotic inguinal hernia repair in patients who have previously had preperitoneal dissection, specifically with a tap inguinal hernia on the contralateral side."
16.352,46.608,"This was a seventy-two-year-old man presented to my clinic with multiple hernia procedures, a symptomatic recurrent left inguinal hernia, surgical history, bilateral open inguinal hernia repairs that were tissue-based, And then a right contralateral TEP inguinal hernia repair with mesh. They, during the operation, explored the left side with no evidence of hernia. He had irreducible left inguinal hernia. Again, no mesh on that side."
47.108,65.886,"But we did review their prior surgical history and operator reports found that they had used a balloon dissector during the prior repair. No significant dissection really described, acknowledged that the open repairs had probably caused some complex anatomy for an open anterior repair. And so we planned our operation."
66.386,86.807,"Patient previously had an umbilical hernia repair with mesh, so we were going to definitely avoid umbilical trocar. I booked an extra thirty minutes for the case to account for potential need for license of adhesions and need for a more careful dissection of the preperitoneal plane. For this, I thought a robotic tab was still a very safe option."
88.308,110.234,"The surgeon begins the procedure by developing the preperitoneal flap. An indirect hernia is visible on the left side with no mesh present. The silhouette of a mesh is observed on the contralateral side, not extending beyond the midline, which will be encountered during dissection."
110.734,139.921,"The surgeon carefully performs a bloodless dissection in the preperitoneal space using heat, avoiding blunt dissection to prevent bleeding due to potential adhesions from previous repairs."
140.421,177.798,"The surgeon performs lateral dissection, unaffected by previous operations, and progresses to medial dissection. The medial aspect of the contralateral mesh is visible, positioned away from the current dissection site."
178.298,214.117,"The surgeon ensures visibility of the contralateral pubis to establish a landing zone for the mesh. The medial and lateral dissections have been completed, and the focus shifts to reducing the hernia sac, carefully dissecting it away from surrounding tissue."
214.177,248.88,"The surgeon carefully dissects distally to bring down tissue, identifying the beginning of the hernia sac and spermatic structures. A well-demarcated edge of the sac is visible, which is reduced with ease. The focus shifts to developing a dissection to establish a clear view of the myopectenial orifice."
249.38,283.61,"The surgeon carefully dissects the structures, focusing on parietalizing the vas deferens and associated vasculature. The vas deferens is clearly visible as the surgeon emphasizes creating a suitable landing zone for the mesh by alternating between easily accessible areas to develop the dissection."
283.65,318.443,"The surgeon shows the previously dissected space with mesh visible on top of the bladder. A clear space is prepared for the mesh placement. Extra tissue is seen falling into the femoral canal, which is addressed by taking down the aerial tissue fibers. The external iliac artery is pointed out as it enters the femoral canal, with further development of the space."
318.483,342.786,"The surgeon focuses on lateral dissection, revealing the iliopubic tract while confirming the absence of a cord lipoma."
342.806,401.739,"The surgeon uses a combination of sharp and blunt dissection to develop the lateral space, carefully manipulating the spermatic cord structures and teasing the peritoneum down. The pre-peritoneal aspect of the medial umbilical ligament is taken down, allowing the vas to retract over the external iliac vein. The critical view of the myopectenial orifice is established."
402.239,436.725,"The surgeon points out anatomical landmarks, drawing an imaginary line from Cooper's ligament to the lateral sidewall. An extra-large mid-weight mesh is positioned and fixated with a single stitch over Cooper's ligament."
437.225,458.534,"Some people don't fixate. I try to. I think that in scenarios where you're using like a heavyweight mesh, it can be difficult. And so if, If it's very challenging to see or you have a lot of vessels over the coopers, you want to be careful."
459.034,481.493,"The corner of the mesh is visible, slightly protruding from its intended position."
481.993,532.551,"The surgeon adjusts the corners of the mesh to ensure proper positioning, preventing clam shelling that could lead to recurrence. A standard flap closure is performed, addressing a visible hole below the mesh. The robotic approach facilitates refined suturing techniques, allowing for efficient closure of peritoneal defects."
533.051,550.349,"we can stay safe in our dissection. Operation went great with a total time of fifty minutes, consult time of thirty-seven. Patient was discharged with standard multi-modal pain meds, no narcotics used, and returned to normal activities within a week of discharge. Thank you very much. I hope that was educational."
