start,end,text
0.898,20.319,"The surgeon suspends the uterus to improve visibility of the pelvis, preparing for a robotic sigmoid resection where the sigmoid colon is adhered to the left pelvis."
20.819,36.812,"The surgeon examines adhesions in the pelvic region, noting the presence of a long, floppy mesentery while planning to preserve the superior hemorrhoidal artery."
37.312,52.612,"The surgeon begins a lateral to medial dissection of the sigmoid colon, using robotic instruments to carefully separate the tissue layers."
53.112,92.548,"The surgeon observes the redundant bowel with a long floppy mesentery, noting the sigmoid colon adhered to the left pelvic sidewall. The iliac vessels and left adnexa are visible as the surgeon lifts the sigmoid mesentery off the retroperitoneum, identifying the left ureter."
93.048,107.58,"The surgeon demonstrates proximal mobilization of the bowel, highlighting the redundant and long floppy mesentery. The splenic flexure remains unmobilized due to the bowel's redundancy."
108.08,141.475,"The surgeon attempts to elevate the sigmoid colon, which is adhered to the left adnexa, from the pelvis. The thickened rectal mesentery is visible, indicating the sigmoid colon's adherence and its position over the top of the pelvis."
141.975,163.174,"The surgeon frees the distal epiploic appendages of the sigmoid colon from the rectal mesentery, aiding in the elevation of the sigmoid out of the pelvis."
163.674,179.601,"The surgeon frees the distal sigmoid colon to visualize the planned transection margin on the rectum. The mesentery is then taken, revealing its long and floppy nature."
180.101,209.043,"The surgeon carefully preserves the superior hemorrhoidal artery while hugging the bowel wall, preparing to take the mesentery up to the proximal margin."
209.543,251.167,"The surgeon uses a vessel sealer to take the mesentery to the distal margin, encountering extremely thickened mesentery tissue that requires multiple firings to transect."
251.667,300.583,"The surgeon works towards the upper rectum, cleaning the area around the distal target. The rectal region appears inflamed due to the sigmoid colon resting on top, but the surgeon prepares for transrectal extraction of the specimen."
301.083,323.645,"The surgeon uses indocyanine green (ICG) to check the margins, marking them for visibility under white light. The distal margin is then assessed before proceeding with the transection."
459.732,498.115,"The surgeon performs a sewn single-layer anastomosis, beginning posteriorly in the middle and sewing out to the far side on the left. The bowel is held without a stay suture, using two, three or six inch Velox sutures to achieve full thickness bites."
498.615,548.469,"The surgeon performs an anastomosis with a well-matched proximal and distal bowel, taking even full-thickness bites. The anterior wall is imbricated, and the surgeon parks the needle before introducing a second one."
548.969,592.626,"The surgeon continues the anastomosis by taking full thickness bites around the bowel, ensuring the sutures extend beyond the cut serosa. After assessing a previous bite as thin, the surgeon revisits the area to take a larger bite before proceeding with the suturing."
630.344,652.572,"The surgeon cannels over the top of the anastomosis, ensuring the sutures end in the middle rather than at the edge, before returning to the other suture."
719.19,751.145,The surgeon completes the anastomosis and performs a leak test using a rigid scope through the anastomosis. The anastomosis appears widely patent with no bleeding or bubbles observed.
