start,end,text
24.263,50.782,"The surgeon begins a medial to lateral dissection, searching for the ureter while using stents and ICG. The right pelvic peritoneum is visibly drawn up into the tumor, along with the appendix."
51.282,76.921,"The surgeon traces along the inferior mesenteric artery (IMA), identifying bulky lymph nodes at the junction with the aorta. The surgeon aims to excise these lymph nodes while preserving the surrounding nerves."
77.421,108.806,The surgeon isolates the inferior mesenteric vein (IMV) while considering the patient's calcified mesenteric vessels and abdominal aortic aneurysm (AAA) visible on the CAT scan.
109.306,159.854,"The surgeon performs a medial dissection, carefully preserving nerves while isolating the superior hemorrhoidal artery just distal to the take-off of the left colic artery. The vessel is prepared for sealing using a vessel sealer."
160.354,207.566,"The surgeon continues the medial dissection, identifying the ureter before proceeding to ligate the left colic artery. The dissection progresses from medial to lateral, completing the separation of tissue layers."
208.066,257.941,"The surgeon identifies the molybdenum fistula to the bladder and the appendix, deciding to remove them en bloc. The procedure continues with lateral dissection before addressing the fistula."
258.441,281.987,"The surgeon completes the medial dissection, clearly visualizing the ureter while progressing towards the area of adherence to the fistula. The surrounding tissue appears inflamed, suggesting an inflammatory reaction rather than malignancy."
282.027,329.166,"The surgeon marks the junction between the colon and bladder, then begins to incise into the bladder. As the incision progresses, a large exophytic frond-like tumor becomes visible, leading to some fragmentation. The surgeon carefully enters the mucosa of the bladder, exposing the tumor."
329.666,385.866,"The surgeon visualizes the interior of the bladder, facilitating the excision of the tumor margin. The large frond-like tumor is visible at the dome of the bladder. The surgeon carefully cauterizes tissue on the left side, ensuring the ureter, which is visibly distant, is not at risk."
386.366,425.597,"The surgeon carefully dissects around the posterior wall of the bladder, revealing the Foley catheter and ureteral stents in the background. The dissection progresses along the most inferior posterior margin of the bladder."
426.097,493.171,"The surgeon performs a distal division of the bowel, followed by transection of the proximal mesentery, avoiding a small diverticulum by going proximal to it. A fan and steel incision is made to extract the specimen and clean up tumor debris, preparing for bladder repair in an open fashion."
493.671,566.233,"The surgeon mobilizes the bladder completely below the pubic tubercle, ensuring it is free for extraction through a fan and steel incision. A direct hernia is visible on the right side. The specimen is extracted, and the bladder is repaired in layers using PDS and serosal silk sutures. The surgeon returns to robotic assistance to perform the sononastomosis."
566.733,680.332,"The surgeon sutures the stapled ends of the bowel together using a minimally invasive approach, followed by creating a proctotomy and colotomy. The inner back row is sewn towards the patient's left side, with ICG checks performed for verification. The robotic system is utilized for precision in the sewn anastomosis."
763.55,883.832,"The surgeon demonstrates a wide open anastomosis, with the inner layer sutures on the outer row being crossed and tied together. The original suture used for sewing the staple lines is run over the top to imbricate the anterior row, completing the two-layer anastomosis. The suture is tied to the original stay suture for added security, followed by a leak test."
884.332,934.691,"The surgeon performs a leak test on the repaired bladder by instilling methylene blue in saline up to 300 cc's, observing no leakage. The stents are removed, ensuring no encroachment on the ureter orifices, while the Foley catheter remains in place."
