start,end,text
4.964,25.697,"Robotic ventral hernia. One of the greatest advancements with the use of robotics in general surgery has been the development of ventral hernia repair and abdominal wall reconstruction. Using the robotic system, we now have the capability to perform extensive adhesiolysis using flexible scissors and dissection hooks in a way not previously possible."
26.197,45.831,"The surgeon uses wristed robotic instruments to close primary hernia defects, enhancing the functional architecture of the abdominal wall. The mesh is sutured to the abdominal fascia with precise control."
46.331,65.109,"The result is a hernia patient with a much more functional repair, a patient with lower rates of hernia recurrence, and significantly less wound complications. In addition, there's markedly less pain postoperatively."
65.609,76.888,"The surgical field reveals two hernia defects, with the larger defect located near the umbilicus, characteristic of an incisional hernia developed after a previous operation."
77.388,98.582,"The surgeon clears the peritoneum and preperitoneal fat to expose the posterior rectus fascia, preparing a clean surface for mesh placement against the abdominal wall. After clearing sufficient surface area, the focus shifts to closing the hernia defect."
99.082,121.303,"The surgeon uses a monopolar hook to assist in the process, while a zero-sized V-lock barb suture is passed through one of the ports to begin closing the hernia defect. The suture's one-way barbs help retain tension with each pass."
121.803,141.069,"The surgeon makes relaxing incisions laterally in the posterior rectus fascia to reduce tension on the closure, ensuring these incisions will be covered with mesh later in the procedure."
141.569,157.194,"The surgeon closes the abdominal wall defect, enhancing the integrity of the repair by reinforcing it with mesh, aiming for a strong repair and reduced recurrence rate."
157.694,191.782,"After completely closing the defect, the surgeon introduces the Ethicon PhysioMesh through an eight-millimeter port. A needle is attached to the center of the mesh, which is then passed through the fascial closure and out through the abdominal wall, securing it in place for suturing."
192.282,221.815,"The surgeon uses endo-wrist instrumentation to suture the mesh to the abdominal wall, mimicking open surgery techniques. The sutures are placed circumferentially, ensuring secure fascial purchase with each bite."
222.315,242.646,"This also makes robotic hernia repair less expensive on a case by case basis when compared to laparoscopic repairs due to the need for less disposable instrumentation. It is more efficient, more effective, and absolutely less painful for the patient."
245.125,264.334,"In our own practice series, Out of two hundred and seventy repairs, we have had three recurrences, which is a one point one recurrence rate over the past three years, and a three point three rate of seroma formation, none of which have been clinically significant. In addition, there have been no serious wound infections."
264.834,284.389,"Thus far in our experience, a very effective and safe approach to hernia repair. In addition, Since it is almost identical to suturing during an open procedure, the learning curve for new robotic surgeons is virtually non-existent."
284.889,300.955,Operative times have been comparable with laparoscopic operative times as well as open procedures. One of the myths perpetuated about robotic surgery is that longer operating times and longer setup times are a necessary evil.
301.455,316.08,"However, our center has debunked both of those myths and shown that a team approach with a dedication to efficiency can produce equal times in the operating room as well as turnover time between cases."
316.58,332.068,"The surgeon completes the hernia repair with a robust primary closure of the defect. A symmetric, tension-free mesh is placed without overlap, and a circumferential suture line is secured to the fascia, resulting in a typical outcome."
