start,end,text
7.775,45.684,"I appreciate your patience with it all. So I do a posterior approach. It's what I've always done. I did it laparoscopically when I switched over to robotics. I just never got rid of it and been real happy with it. What I do is my fourth arm, you'll notice on the right-hand side, and this is going to become important later on in the case. I found that having the fourth arm on the right benefits me a lot because when I swap instruments, If I start off with these two here, I've got a cutter and a grasper, and when I switch, I end up with two graspers, which lets me do a lot of hand-over-hand maneuvers. You'll see that I pass things to myself a whole lot, and I found that to be a real advantage during the case."
46.184,63.642,"The surgeon applies gentle traction using the robotic fourth arm during the posterior dissection. Scissors and a bipolar instrument are used to manipulate the tissue, with the tip of the Foley catheter visible in the surgical field."
64.082,92.509,"The surgeon identifies the rectum as a reliable anatomical landmark, noting the yellow fat surrounding it and the fold where the peritoneum reflects off the rectum and ascends towards the bladder."
93.009,118.704,"The surgeon lifts the tissue slightly to reveal a fold, then makes a small perineotomy approximately half a centimeter above the fold. This exposes the seminal vesicles and vas deferens while ensuring the ureters are not disturbed by staying low and midline."
119.064,164.17,"The surgeon uses blunt dissection with the left hand positioned up and the right hand down, navigating into the correct anatomical plane. As the dissection progresses, the seminal vesicles and vas deferens are revealed, located lower than initially anticipated. The vas deferens is identified on the right-hand side, facilitated by the blunt dissection technique."
164.21,211.364,"The surgeon identifies the vas deferens by tracing the white structure to the midline, ensuring it is not the ureter. Two white structures meet at the midline, confirming the vas deferens. Directly behind the vas deferens, a grayish structure is visible, identified as the seminal vesicle."
211.364,250.971,"The surgeon confirms the identification of the vas deferens and seminal vesicle, distinguishing them from the ureter. The vas deferens and seminal vesicle are clearly visible, and the surgeon prepares to dissect them out carefully."
251.031,292.463,"You know, a ureteral injury is really just a horrible complication to have. I mean, you can reimplant it, but that's just not something that you want to do during a case, and it's so easily avoidable, and you're absolutely right. You've got great exposure down here, so use it. Expose your anatomy, watch the two vas deferens, join up with each other, see the seminal vesicles behind it, and you're absolutely certain that what you're dealing with is vas deferens, and that makes it completely safe. So I fully agree with you. The one thing, you know, I used to always clip lateral to my seminal vesicles. And I've actually stopped doing that because I felt like, you know, sometimes it was almost creating bleeding. I felt like sometimes it could be actually causing an injury to my nerve vascular bundles."
292.463,329.025,"The surgeon uses cautery directly on the seminal vesicle, ensuring localized heat application without affecting surrounding tissues. The seminal vesicle is dissected off using blunt dissection, following natural tissue planes, without the need for clips. The procedure is repeated on the left side."
329.525,407.886,"The surgeon uses cautery to spot treat areas around the left seminal vesicle and vas deferens, minimizing thermal spread by reducing pedal time. The assistant provides exposure by lifting tissue during the posterior dissection."
407.906,448.264,"The surgeon uses both hands to dissect directly on the seminal vesicles and vas deferens, emphasizing the importance of avoiding dissection around these structures to prevent injury to surrounding tissues. The approach is carefully chosen based on the patient's surgical history."
448.304,495.335,"The surgeon makes a small incision to open the non-vas tissue slightly, allowing the seminal vesicles and vas deferens to be lifted through the bladder neck without adhering to the rectum. The dissection reveals the point where the two vas deferens converge, marking the location of the bladder neck."
495.815,565.09,"The surgeon dissects up to the point where the two vas deferens meet, ensuring clear identification of the bladder neck. The approach avoids dissecting through adhesions in cases where the bowel is stuck to the posterior bladder, opting instead for an anterior approach through the bladder neck. The dissection begins lateral to the lateral umbilical ligament to establish the lower limit, particularly in patients with prior mesh hernia repairs or obesity."
565.59,642.577,"The surgeon begins dissection on the right-hand side, working through areolar tissue without reaching the pubic bone, then proceeds to the left-hand side, dissecting lateral to the lateral umbilical ligament down to the vas deferens. The dissection is kept shallow to maintain orientation, and once both sides are dissected, the surgeon connects the dissection across the top, avoiding the bladder."
643.077,686.202,"Randy, if you see a direct inguinal hernia, do you do anything with those? I don't. I don't repair it. I let them know about it, and I have it repaired later. And it's a fear of mine. Maybe it's an irrational fear, but I worry that if I repair it and they have a complication, you know, that's really not a complication that I should be managing because I don't do hernia repairs on a regular basis. And secondly... God forbid this person has some urinoma and gets an infection. If they got infected mesh, that would just be horrendous. So I have a maybe unnecessary amount of worry about doing it, so I just leave it alone and have it repaired later."
686.702,750.113,"The surgeon continues dissection in the thin areolar tissue, aligning with the previously defined lateral dissection boundaries. Using a zero-degree lens, the surgeon performs posterior dissection of the seminal vesicles and lifts the prostate gland to expose the posterior bladder neck."
750.613,805.428,"The surgeon dissects the fat from the pelvis to expose the endopelvic fascia and the junction between the bladder and prostate. The fat is more adherent at this junction, and the surgeon cauterizes the superficial dorsal vein located deep to this tissue before continuing laterally to remove all the fat."
805.728,896.852,"The surgeon opens the endopelvic fascia using cautery, causing the underlying muscle to contract and create a space, facilitating the dissection. The technique helps avoid injury to the Santorini plexus and potential bleeding. The surgeon also considers the presence of an accessory pudendal artery during the procedure."
897.352,1009.174,"The surgeon identifies and manages a small accessory vessel using bipolar cautery, ensuring minimal dissection around the dorsal vein. The surgeon carefully applies cautery to blanch the muscle and maintain dissection away from the levator muscle, minimizing thermal damage. The surgical field is in thin areolar tissue, and any small bleeders are addressed with selective bipolar cautery."
1009.674,1095.45,"The surgeon prepares to use two needle drivers as the fourth arm becomes crucial for dynamic manipulation after passing through the anterior bladder neck. The surgeon ties off the dorsal vein to prevent back bleeding, ensuring thorough dissection around the dorsal vein complex and levators before placing a single stitch."
1095.47,1145.161,"So I used to put two stitches. I used to put two stitches and do a urethra pexy kind of like Vip was doing. And then I tried doing two stitches through the leaving it through the pure prosthetic portion, cut the shirring, and eventually I just came back and said, you know, I'm just going to put a single stitch, and I've been happy. Very simple, very straightforward, nothing fancy. Thank you, Sherry. So Sherry also, when I do that, checks the Foley catheter. And this is one thing that I want to point out to folks. As they're doing robotics, you can't forget that you're sitting at a console with your head in this viewfinder, and you can't see what's going on around you. So communication between you and your assistant is critical. Folks, just forget to talk. So Sherry always tells me, needle out. She tells me when an instrument's out. She tells me that the Foley catheter is free. And I acknowledge that by saying thank you or responding to her."
1145.181,1227.991,"The surgeon uses the left hand to apply tension on the bladder while the open scissor jaws are positioned in the correct plane, causing the bladder muscle to contract and spring back, aiding in the dissection."
1228.491,1295.548,"The surgeon gently grazes the tissue with an open scissor jaw, revealing the urethra as it approaches the prostate gland from the bladder. The muscle melts away in the correct plane, while darker areas indicate where the jaws were closed. The surgeon aims to preserve the bladder neck tissue unless aggressive cancer is present."
1296.048,1376.947,"The surgeon observes the longitudinal fibers of the urethra as it enters the prostate gland, with the bladder positioned posteriorly. The urethra is dissected from nine to three o'clock, revealing its thickness. The fourth arm is utilized to assist in grabbing the Foley catheter, while the assistant provides counter-traction. The posterior bladder neck is exposed using a spreading technique with the left hand."
1377.447,1455.72,"The surgeon cuts through the muscle of the bladder neck, maintaining traction to expose a lip of prostate tissue. This maneuver lifts the prostate significantly out of the pelvis, enhancing visibility of the tissue planes. The surgeon performs an 'up and out' move to improve exposure and create tension, revealing a clear line indicating the plane. The bladder is checked to ensure its orientation is straight down, indicating further dissection is needed."
1456.021,1540.56,"The surgeon carefully inspects the bladder to avoid buttonholing, then traces the median lobe if present. The dissection reveals longitudinal fibers indicating proximity to the seminal vesicles and vas deferens. The surgeon opens the area further, preparing for posterior reconstruction by targeting these fibers for attachment to the recta urethralis."
1541.04,1654.208,"The surgeon carefully thins out tissue at the corners away from the neurovascular bundles, identifying a small vessel in the process. Sherry assists by dropping in probes for nerve mapping, inserting monopolar listening electrodes into the distal part of the levator complex near the urethra on both sides."
1654.708,1711.356,"The surgeon switches to a round-tip scissor for nerve-sparing, starting the dissection near the posterior lip of the prostate gland. The goal is to reach Santorini's plexus, identifying the correct plane for nerve preservation."
1711.856,1776.553,"The surgeon uses a bipolar instrument to stimulate the perineal branch of the pudendal nerve, causing visible contraction of the pelvic floor muscles. The bipolar instrument's jaws are adjusted to target either a wide or narrow area for stimulation. The nerve and muscle are visually distinguishable, with the muscle twitching upon nerve stimulation."
1776.553,1867.934,"The surgeon opens the superficial layer near the prostate gland, revealing the nerve responsible for urinary control. The nerve is visually identified as being slightly pulled off the prostate, situated within the pelvic floor area. The surgeon emphasizes the importance of preserving this nerve throughout the dissection to ensure better urinary control recovery."
1868.374,1929.447,"The surgeon demonstrates the contraction of the pelvic floor muscles, highlighting the perineal branch of the pudendal nerve sitting on top of the prostate gland. As the superficial layer is opened, the nerve is carefully dissected away from the prostate, aiding in nerve sparing for both sexual function and urinary control."
1931.757,1999.995,"The surgeon opens the superficial layer of the lateral prostatic fascia, revealing the Santorini plexus and creating a separation between the nerve and the prostate gland. The nerve is visibly pushed off to the side, demonstrating the nerve sparing technique aimed at preserving urinary control."
2000.035,2074.669,"The surgeon demonstrates the position of the nerve, which is now moved away from the prostate gland on both sides, highlighting its role in innervating the entire ipsilateral pelvic floor, including the rectum. With the nerve out of the way, the surgeon prepares to begin the sexual function nerve sparing procedure."
2074.709,2136.529,"Or maybe it's that muscles that were further out are actually helping to contract the ones more medially that are no longer getting stimulation. So if I were to summarize it then, you know, you think it mainly impacts time to recovery, not overall recovery. That's correct. Although I, you know, the folks, click there, please. I will say that folks that have either low or no response, even at the beginning, those folks do have a higher incidence of stress incontinence. Hey, Doug, can we relax them just a little bit more? Thanks. I still want to keep our, and one of the things that's important is that you communicate with your anesthesiologist. You know, I still don't want this guy to be neuromuscularly blockaded because I want to show you guys at the end how our pelvis contracts. So I just don't want him breathing, so Doug's going to help us out to make sure that we're not paralyzing him, but that we're still, still don't have a moving target on us."
2137.029,2211.403,"The surgeon identifies the neurovascular bundles below the prostate gland and performs lateral dissection to clean the posterolateral corner. The dissection follows the plane from the base to the apex, revealing the pelvic floor contraction when the nerve is preserved. The surgeon carefully traces the nerve, ensuring minimal cutting to avoid capsulotomy, and confirms the preservation of the nerve with visible pelvic floor contraction."
2211.784,2294.099,"The surgeon measures amplitude on the computer and uses the DaVinci Classic system to view the procedure on the monitor. The lateral area has been opened, and the surgeon proceeds medially, following a posterior plane with blunt dissection. The surgeon cuts where tissue is stuck and peels where it is easy, maneuvering around a flap of seminal vesicle. Two instruments are used to create space for clipping, ensuring clips go plastic on plastic to avoid issues with thicker tissue."
2294.119,2384.544,"The surgeon traces the posterior plane around the prostate, cutting attachments where necessary and peeling tissue where possible. The posterior lateral corner is exposed, and the surgeon adjusts the positioning of the robotic arms for better access. The neurovascular bundles are separated, revealing a nerve bundle. The peroneal branch of the pudendal nerve is observed to be more lateral on this side compared to the other side, highlighting anatomical variability."
2385.044,2466.992,"The surgeon uses a foot pedal to switch between bipolar cautery and nerve stimulation, ensuring no arcing occurs. The bipolar device is used to separate the prostate from the dorsal vein, with the jaws closing around the tissue to confirm the correct plane. Cautery is applied to maintain separation, avoiding the prostate gland due to its thickness."
2467.012,2550.117,"The surgeon identifies the urethra and dorsal vein, noting anterior attachments. The fourth arm is used to retract back, revealing the neurovascular bundle on the side. Care is taken to minimize traction on the bundle. The surgeon addresses a small bleeder by cauterizing it, ensuring to avoid thermal spread to the neurovascular bundles and levator muscles. The perineal branch of the pudendal nerve is noted for its variable anatomical position relative to the neurovascular bundle."
2550.617,2638.555,"The surgeon identifies the posterior edge of the prostate and proceeds to dissect through the rectourethralis. The perineal branch of the pudendal nerve is observed, with stimulation causing visible contraction of the rectum and levator muscles. The neurovascular bundle is visible, with the nerve located just beneath it."
2638.856,2708.127,"There's nothing there. On the other side, nothing there. This one's actually sitting further out in here. And when I touch out here is when we get that whole contraction where you can see the rectum is twitching and everything down here is twitching. So there's a lot of variability to the location of this nerve. And using just the simple tool and the outcomes that I'm seeing on the computer monitor that you can just tile pro in have actually affected the way I do the operation because I found that The anatomy isn't always what you think it is. And nerves, unfortunately, you can't see them. And this is just evidence of it, where here it's right there under the bundle. Here it's not. It's just way out here. It's variable in its course. How does this device differ from the CAVR map? Yeah, well, CaverMap is looking at an end-organ response. CaverMap is sticking a probe around the penis, around the urethra, stimulating these nerves and waiting to actually induce vasodilation and an erection. This is not doing that. This is not CaverMap. This is not looking for an erectile response. This is looking at a compound motor action potential. So when you stimulate a nerve, with a certain signal. It sends that signal down the nerve."
2708.587,2800.995,"It releases acetylcholine into the muscle, and this will record the acetylcholine response, which is going to be this compound motor action potential. At the end of the case, I'll show you kind of the sine waveform. So cavern map is looking for a sexual function response. This is looking for a motor response. This is looking for specifically a nerve-creating response in a muscle. It's looking at the motor end plate response, not the end organ response. So we know there's a lot of things that affect erectile function. Whereas if I know the nerve is intact, I know the nerve is intact. That's an important piece of information. Knowing where that nerve is is critical for me because I want to make sure that that's preserved there and that's preserved there because his continence is dependent on it. But based on that, then, if the nerve typically sits, it never sits medial, the perineal branch of the pituitary nerve, and only sits either posterior or lateral, if you do a standard or, let's say, high-quality nerve sparing for potency, for all intents and purposes, you should be routinely sparing this nerve. You should be, yes. If you're doing a high quality nerve sparing, then yes, you should be. However, if you get bleeders out here, I know now that if I get a little bleeder here, I'm going to leave it or put pressure on it. I don't want to cauterize it because my nerve is there. Whereas on this side, if I get a bleeder out here, I'm comfortable to cauterize it. So I guess I would say that as a surgeon, the more information I get, the better I can make decisions in the operating room regardless of what's happening around me. And really, I don't think a tool like this"
2801.495,2891.921,"in and of itself affects outcomes, I think it provides important information to the surgeon. And as surgeons, what we all want is more information about stuff that we can't see. And the more information I have, the better I can do at making an informed decision. Hi, Dr. Fagan. I think this is really exciting, and I enjoyed how you mentioned yesterday that this is standard of care by some other specialties to locate nerves with similar technology. I tend to sort of agree with the last question in that I think of the perineal nerve as running in a different location, though, much below this in the perineum. So have there been any anatomical studies to say that this is actually a branch? of the perineal nerve you're stimulating there, or is that just kind of the closest named nerve and we're using that name then? Well, there actually are studies that show that it's a branch of this perineal branch of the pudendal nerve. Studies on fetuses, as well as studies on I believe it was done on postpartum women using MRIs, but the fetus studies are the ones that did the anatomical ones. And actually, I don't know if you all have access to the copy of the PowerPoint that I had yesterday, but in that PowerPoint where I talk about the MRI studies and showing variability of this nerve location, I mentioned the actual study itself. If you're interested though, just email me, just randy.fagan at gmail.com and I'll be happy to just send you a laundry list of the studies that I looked at and trying to figure out what it is that we were finding."
2891.941,2998.828,"The surgeon identifies a lip of tissue with longitudinal fibers and connects them to the rectourethralis using a PDS suture on an RB1 needle. Two sutures are tied together, running through the tissue twice to cinch it down securely."
2999.328,3086.934,"The surgeon performs posterior reconstruction by attaching the visceral vesicle fascia to the rectourethralis using a single layer of sutures. Two instruments are used to rotate in opposite directions to pop the suture, while the fourth arm is utilized to keep the sutures organized and out of the way."
3087.434,3185.882,"The surgeon begins suturing underneath a tissue layer to avoid placing a knot near the anastomosis. The bladder neck is identified, and a double throw technique is used to secure the knot, starting at the four o'clock position on the urethra and moving towards six o'clock. The posterior part of the bladder is brought into continuity with the posterior aspect of the urethra, without fixation, allowing the bladder's weight to rest on the anterior surface of the rectum and along the bed of the seminal vesicles."
3185.902,3283.486,"The surgeon uses an RB-I needle to suture the bladder closer to the urethra, avoiding the Denonvilliers' fascia on the anterior surface of the rectum. The first suture bite is taken beyond the raw surface where the prostate was attached to the bladder, followed by a second bite at the mucosal level. This technique aims to restore the anatomical position of the fibers and conceal the raw surface area, replicating aspects of open surgery."
3283.546,3356.378,"This is what I'm happy with. I do it all the time. And it's consistent. I just do SCDs. I don't do... I don't do low molecular weight heparins. I just do SCDs. That's really it. I have had one DVT in about twenty-five hundred cases. It happens. And I guess, you know, just one DVT in twenty-five hundred cases, I don't know that the low molecular weight heparin would have made the difference. Just like any complication, obviously, I've found at least in my hands the incidence is very low. Maybe it's because my operative times are fairly short. But with such a low incidence, I decided not to change the way I did things. One area that we don't necessarily, I mean, I do think that the, if you look at the papers published on, Ari Shalhoub has published one we just recently published, a lot of people have looked at, if you go into univariate and multivariate analysis on either time to continence or overall continence rates relative to nerve sparing, the nerve sparing, it always drops out."
3356.878,3425.516,"IT'S NOT, IT DOES NOT APPEAR TO HAVE ANY IMPACT ON THE TIME TO CONTINENTS OR ON THE OVERALL CONTINENTS RATE. AND THE REASON WHY IF YOU DON'T DO THE, IF YOU JUST DO UNIVARIATE ANALYSIS IT HAS A VERY TIGHT STATISTICAL ANALYSIS IS BECAUSE THE IIF-FIVE IS THE FACTOR THAT drives the continence rate more. So, in essence, what the IIF-V is doing is it's basically like a Charlson. It's a vitality, and if the guys have a high IIF-V, then they tend to recover their continence quicker and better, whether you do a wide excision or not. You can do a complete wide excision of the neurovascular bundle, and they get their continence back quicker and better and faster because they tend to be you know, have better vitality. And usually they'll be younger, too, in general. So I think, you know, that's one reason why I've always had a problem with this. I mean, you know, I make the assertion that if you look at what the impact of the IIF-V and age on continents, it's huge."
