start,end,text
1.154,22.759,"I'm sharing a case of a recent sigmoid colectomy, complicated diverticulitis in a young patient who had presented about a month earlier with a perforation and a pelvic abscess. This was managed with antibiotics alone. He never got a chance to get a colonoscopy because he continued to have smoldering disease."
1.154,22.759,"I'm sharing a case of a recent sigmoid colectomy, complicated diverticulitis in a young patient who had presented about a month earlier with a perforation and a pelvic abscess. This was managed with antibiotics alone. He never got a chance to get a colonoscopy because he continued to have smoldering disease."
23.259,48.543,"The surgeon begins by freeing adhesions between the omentum and the small bowel on the medial aspect of the sigmoid colon, followed by initiating a medial to lateral dissection."
23.259,48.543,"The surgeon begins by freeing adhesions between the omentum and the small bowel on the medial aspect of the sigmoid colon, followed by a medial to lateral dissection."
49.043,69.098,I almost always will do a medial to lateral dissection in these cases. I find that the retroperitoneal plane is often unviolated. And I usually do a high ligation of the superior hemorrhoidal or the IMA because I feel that it helps with length on these cases.
49.043,69.098,"The surgeon performs a medial to lateral dissection, preserving the retroperitoneal plane, and proceeds with a high ligation of the superior hemorrhoidal artery or the inferior mesenteric artery (IMA) to optimize bowel length."
69.598,107.431,"The surgeon isolates the superior hemorrhoidal artery, carefully skeletonizing the vessel to ensure a clean division. The ureter is checked for proximity before using a vessel sealer to divide the artery, ensuring no surrounding tissue impedes the seal."
69.598,107.431,"The surgeon isolates the superior hemorrhoidal artery, carefully skeletonizing the vessel to ensure a clean division. The ureter is checked for proximity before using the vessel sealer to divide the artery, ensuring no surrounding tissue impedes the seal."
107.931,133.389,"The surgeon identifies the tethering of the left colic artery and plans to continue the medial dissection. A high ligation of the inferior mesenteric vein (IMB) is performed, with the intention to release tension by taking the left colic artery."
107.931,140.071,"The surgeon identifies the left colic vessel, noting its tethering effect, and plans to continue the medial dissection. A high ligation of the inferior mesenteric vein (IMB) is performed, with the intention to take the left colic vessel to release tension before mobilizing the splenic flexure."
133.889,158.777,"The surgeon isolates the left colic branch and prepares to divide it using a vessel sealer, opting not to perform a high ligation of the inferior mesenteric artery (IMA) in this instance."
140.571,196.829,The surgeon isolates the left colic branch and uses a vessel sealer to divide it. The medial to lateral dissection continues up to the splenic flexure for maximal mobilization. The inferior mesenteric vein (IMV) is also isolated and divided using the vessel sealer.
158.817,196.829,"The surgeon performs a medial to lateral dissection, progressing towards the splenic flexure for maximal mobilization. The inferior mesenteric vein (IMV) is isolated and divided using a vessel sealer."
197.329,224.303,"The surgeon completes the full medial dissection and begins the lateral dissection, placing a sponge to protect the ureter. The entry into the lateral plane is facilitated by the extensive medial dissection."
197.329,253.678,"The surgeon completes the medial dissection and begins the lateral dissection, placing a sponge to protect the ureter. The entry into the lateral plane is facilitated by the prior medial dissection, and the surgeon progresses towards the splenic flexure."
224.803,253.678,"The surgeon approaches from the lateral side, revealing the medial plane for entry. The dissection progresses upwards towards the splenic flexure."
254.178,301.285,"In this case, you'll see a little bit later in the video, there was another enlarged diverticulum pretty far proximal to where the obvious area of disease is that I didn't want to leave in. So in order to get that to reach for the anastomosis, I end up doing a full splenic flexure release. It's edited out of the video just for time, but I was able to do that as a single doc. Here's starting from the lateral side. All I do is reverse the trundellenberg with table motion and I'm able to take the splenic flexure down completely with the same ports without double docking."
254.178,301.285,"In this case, you'll see a little bit later in the video, there was another enlarged diverticulum pretty far proximal to where the obvious area of disease is that I didn't want to leave in. So in order to get that to reach for the anastomosis, I end up doing a full splenic flexure release. It's edited out of the video just for time, but I was able to do that as a single doc. Here's starting from the lateral side. All I do is reverse the trundellenberg with table motion and I'm able to take the splenic flexure down completely with the same ports without double docking."
301.785,330.079,"The surgeon exposes the kidney and the tail of the pancreas, then transitions to the pelvic region to continue freeing up the remaining diseased tissue."
301.785,330.079,"The surgeon exposes the kidney and the tail of the pancreas, revealing these anatomical structures clearly. The focus then shifts back to the pelvis to continue freeing up the remaining diseased tissue."
330.579,358.93,"The surgeon completes the lateral dissection on the left side wall, carefully identifying anatomical planes to avoid encroaching upon the ureter, which is clearly visualized."
330.579,358.93,"The surgeon completes the lateral dissection on the left side wall, carefully identifying anatomical planes to avoid encroaching upon the ureter, which is clearly visible."
359.43,409.293,"The surgeon divides the margins, starting with the upper rectum, and proceeds to take the mesentery to the proximal margin. The previously mentioned diverticulum is visible, and the surgeon approaches from beneath the ligated superior hemorrhoidal artery."
359.43,385.534,"The surgeon prepares to divide the margins, focusing on the upper rectum. The mesentery is then taken to the proximal margin, ensuring clear separation of these structures."
386.034,422.08,"The surgeon identifies the diverticulum located proximal to the ligated superior hemorrhoidal artery, visible in the distance near the grasper, preparing for its excision."
409.793,435.262,"The surgeon identifies a diverticulum located proximal to the grasper, preparing to excise it. A perfusion assessment is performed before proceeding with the division."
422.58,474.732,"We'll do our perfusion assessment and then we'll go ahead and divide I like to do trans rectal extraction and specimen in cases like this for benign disease this gentleman had never had a colonoscopy. And I just have a personal preference of not doing trans rectal extraction, where you would have to chop up the specimen smaller pieces if you don't clearly know that there's no concerns for malignancy so. I did not do a trans rectal extraction for the specimen and after. It was divided and the anastomosis was created. It was removed via a fan and steel extraction."
435.762,458.903,"I like to do trans rectal extraction and specimen in cases like this for benign disease this gentleman had never had a colonoscopy. And I just have a personal preference of not doing trans rectal extraction, where you would have to chop up the specimen smaller pieces if you don't clearly know that there's no concerns for malignancy so. I did not do a trans rectal extraction for the specimen and after."
459.403,495.516,"The surgeon completes the division of the bowel and creates an anastomosis using absorbable V-lock sutures, joining the outer posterior row by aligning the staple lines. The specimen is removed via a Pfannenstiel incision and placed in the right upper quadrant."
475.232,510.822,"The surgeon places the specimen in the right upper quadrant and begins creating an anastomosis. A hand-sewn technique is used with absorbable V-lock sutures, starting with the outer posterior row by joining the two staple lines. The surgeon then performs a partotomy followed by a collotomy."
496.016,532.251,"The surgeon performs a partotomy followed by a collotomy, preparing to sew the inner row of the anastomosis using a baseball stitch technique on the posterior lip, maneuvering around the far corner of the surgical site."
511.322,579.207,"The surgeon performs a hand-sewn anastomosis using absorbable V-lock sutures, sewing the inner row in a baseball stitch pattern on the posterior lip. The transition stitch is applied to position the suture on the outside, starting on the posterior row inside on the near side and sewing out and around. The anterior row is imbricated by canalizing over the top."
532.751,579.207,"The surgeon performs a transition stitch to position the suture on the outside, beginning with the posterior row on the near side. The stitch is sewn out and around, followed by canalization over the top to imbricate the anterior row."
579.707,602.41,"It does take a little bit longer to do this obviously than to staple, but I feel a lot more secure with it. And I've been really happy with these anastomosis. So I continue to do it. I think it's worth it. I hate staplers."
579.707,602.41,"It does take a little bit longer to do this obviously than to staple, but I feel a lot more secure with it. And I've been really happy with these anastomosis. So I continue to do it. I think it's worth it. I hate staplers."
602.91,635.653,"The surgeon alternates between two sutures to ensure the closure of the anterior wall, then returns to the initial suture to imbricate the anterior suture line over the top of the back row of staple lines."
602.91,670.298,"The surgeon alternates between two sutures to ensure closure of the anterior wall, then uses the initial suture to imbricate the anterior suture line over the staple lines. A leak test is performed using a rigid proctoscopy scope or flexible sigmoidoscopy, confirming a widely patent anastomosis with no bleeding or leaks."
636.153,651.466,"And as he had never had a colonoscopy prior to this episode, my plan is in the next two to three months to get him his first colonoscopy. Final pathology was just diverticular disease."
651.966,670.298,"The surgeon performs a leak test on the anastomosis using a 19mm rigid proctoscopy scope or flexible sigmoidoscopy, observing that the anastomosis is widely patent with no bleeding and no leakage."
670.798,677.162,The surgical specimen is extracted through a Pfannenstiel incision at the conclusion of the colectomy procedure.
670.798,677.162,The specimen is extracted through a Pfannenstiel incision at the end of the surgical procedure.
