start,end,text
22.899,48.468,"The surgeon begins creating a flap from the anterior superior iliac spine (ASIS) to the medial umbilical ligaments, followed by a medial dissection."
48.968,86.986,"The surgeon identifies the bone structure and begins lateral dissection adjacent to it, carefully separating tissue layers."
87.486,115.114,"The surgeon sweeps cremasteric tissue laterally, revealing the chord structures and the vas deferens in the surgical field."
115.614,153.679,"The surgeon reduces the hernia sac, which includes some preperitoneal fat, and proceeds to parietalize the cord structures, highlighting anatomical features during the dissection."
154.179,192.767,"The surgeon exposes the femoral defect and continues dissection down to the outer hyperspace, revealing the anatomical structures in this area."
193.267,220.434,"The surgeon continues to parietalize the cord structures, ensuring the mesh can sit flat against the sidewall without clamshelling. Further parietalization is performed down to the psoas muscle."
220.934,241.525,"The surgeon demonstrates the anatomy of the myopectineal orifice and searches for a cord lipoma. Fatty tissue is observed extending into the inguinal canal, with the iliopubic tract visible nearby."
242.025,267.452,"The surgeon identifies herniated fat entering a separate defect lateral to the internal ring and removes the tissue. As the dissection continues, nodal tissue over the iliac vessels becomes visible."
267.952,280.219,"The surgeon encounters increased bleeding during dissection and decides to halt further dissection, leaving the tissue in place after reducing the herniated fat."
280.719,348.567,"The surgeon places a 16x12 mesh over the myopectineal orifice to cover the defect. Once the mesh is positioned correctly, the flap is closed to secure the mesh in place."
