start,end,text
0.783,22.6,"Hello everyone, a quick surgical operation to connect the white bag to the left white after we lost the right white in a good condition. We found this bag on the left white, we put it in a plastic bag so that even if anything happens to the contents inside the bag, it is found in the cornea."
23.1,41.58,"As you can see now, the white with the white bag inside this plastic bag. Then we will start searching for the place where we will cut through it so that we can separate it from the white. The white, of course, is this outer white color. As you can see here,"
42.08,76.994,"The surgeon employs a technique to separate the outer layer of the bag from its inner contents without cutting through the bag itself, minimizing the risk of rupture. The outer white layer is incised to facilitate peeling off the bag."
77.014,106.146,"As you can see, this is the multiple part of the small clothes, which is the white bag, which after being observed for a good period of time Therefore, there was a suspicion that it was one of the non-operational bags that resisted the treatment by drugs. Here, as you can see in the upper part, the bag is sometimes more sticky."
106.646,127.976,"The surgeon smoothly cuts the remaining transparent coating from the white bag, ensuring preservation of the surrounding white parts without affecting their integrity."
128.476,136.827,"Now we wash and clean, and in this process, we made a single cut on the white paper for the shape to fit evenly. After that, we remove the plastic bag. Thank you for watching."
