start,end,text
5.589,35.216,This video presents the case of a surgical procedure performed in a sixteen years old girl presenting with a huge mass in the tail of pancreas. The patient complained of abdominal pain. The CT scan demonstrated a ten centimeter lesion including both solid and cystic areas and calcification. Tumor markers were normal. Preoperative diagnosis was solid.
35.716,47.442,"or vein was not observed. Considering the radiologic findings, a spleen-preserving distal pyogradectomy is decided."
47.942,90.375,"The surgeon exposes the tumor located behind the greater omentum, with the gastrocolic ligament visibly divided to access the surgical site."
90.875,147.821,"The surgeon divides adhesions between the posterior gastric wall and the pancreas, separating these structures to improve access to the surgical site."
148.321,177.966,"The surgeon divides the inferior and posterior attachments of the pancreas, utilizing hue coloring to differentiate tissue planes during the dissection."
178.466,267.437,"The surgeon exposes the splenic vein, revealing its location and orientation in relation to surrounding anatomical structures."
267.937,309.511,"The surgeon isolates the splenic artery and vein, clearly separating these vascular structures from surrounding tissues."
310.011,387.506,"The surgeon transects the pancreas with a tumor-free margin using a 60mm green cartridge and GIS stapler. Subsequently, veins between the pancreas and the splenic vein are isolated and divided."
388.006,405.498,The specimen is placed into an endo bag and extracted through a Pfannenstiel incision. A Jackson-Pratt drain is then positioned in the surgical site.
