start,end,text
14.985,40.82,"Prior to the operative approach to these patients, surgeons must perform a correct staging of the disease, performing a video colonoscopy with exploration of the terminal ileum and imaging studies to explore the small intestine looking for stenosis or fistulas. This way, the surgeon will be able to obtain information to plan the surgical procedure before going to the operating room."
46.703,64.931,"Among the specific studies to study the small intestine, we will find the capsule endoscopy. When requesting the study in patients with Crohn's disease, we must bear in mind that in those with the stenosing pattern, the capsule may be returned proximal to the stenosis, which could result in an indication for emergency surgery."
65.431,98.551,"During the preoperative evaluation, it should be taken into account that these patients often have severe nutritional deficiencies that require intensive nutrition prior to surgery. For those patients who are receiving chronic steroids, a reduction prior to surgery would help to reduce the mortality of the procedure. Finally, we must remember that the evidence has shown that perioperative treatment with biological drugs does not increase the complication of surgical treatment."
99.051,111.837,"Regarding the minimally invasive approach in complicated Crohn's disease, several publications have shown that it is feasible for these patients improving operative results compared to the conventional approach."
112.337,147.598,"The surgeon attempts to mobilize the right colon using a medial approach, encountering difficulty due to inflammatory tumors from a fistulizing pattern. Firmly adhered bowel loops and intermediate abscesses become visible as the surgeon works to release these adhesions."
148.098,171.418,"For all of the above, in patients with complicated Crohn's disease, we suggest mobilizing the right colon using a lateral approach, a plan that is oftenly respected in these patients. Particular attention must be paid to the correct identification of the duodenum, a structure that may be attached to the posterior face of the inflammatory tumor, especially in patients with fistulizing disease."
171.918,202.999,"Regardless of this advice, surgeons must be ready to use combined approaches if the complexity of the case requires it. The mobilization of the inflammatory tumor must be complete including the opening and dissection of the mesatory to liberate the terminal ileum and cecum and the complete mobilization of the hepatic flexure. After this, end-block exteriorization of the specimen can be performed through a midline incision."
203.499,227.689,"When choosing the place to perform the mini laparotomy, we suggest performing it in the midline, in order to protect sides of the possible future ostomies. Also, it is advisable that ostomies are performed through the midline abdominal wall, as can be seen in this image."
228.189,264.788,"After completing the dissection and performing the mini laparotomy, the surgeon prepares for the NM block exteriorization of the specimen. The incision may be lengthened to accommodate the large inflammatory tumor involving multiple bowel segments."
265.288,320.334,"The surgeon performs small bowel semiology, examining the proximal intestine for disease complications either laparoscopically or after a mini-laparotomy. The intestinal mesentery is ligated extracorporeally using reabsorbable stitches, noting its thickened appearance due to disease involvement, which increases the risk of postoperative bleeding."
320.834,353.355,"In case of performing a primary anastomosis, following the recommendations of equal guidelines for surgery in Crohn's disease, this should be performed in lateral fashion using a stapler and performing a wide mouth, which could reduce the risk of postoperative stenosis. A new alternative that is gaining popularity these days is the CONOS-S technique, which exceeds the purpose of this video."
353.855,402.084,"Those cases in which it is decided not to perform a primary anastomosis, particular care must be taken not to leave the distal bowel stump in the abdominal cavity, since the poor general conditions of these patients may predispose to the easiness of the stump's closure. In those cases in which the patient presents short stenosis in the proximal small intestine, this could be treated using the Heinecke-Mikulich technique, which consists of making a longitudinal incision at the level of the stricture that involves all the bowel layers, and subsequently performing the transverse closure of the incision with separate reabsorbable stitches, being able to perform multiple stricture plasters at the same time."
402.584,440.92,"For the treatment of longer strictures, we recommend Finney's technique which consists of performing an enterotomy and opening a healthy bowel loop to the one presented the stenosis and firing a mechanical suture imitating a lateral-lateral anastomosis. It should be noted that the patient can present multiple strictures and all of them should be treated during surgery."
441.42,459.951,"Finally, we must remember that these patients must be managed in a multidisciplinary way during the postoperative period, performing a video colonoscopy after six months to detect early relapses of the disease that make the intensification of medical treatment necessary."
