start,end,text
3.125,30.785,Recently I posted a robotic right colectomy and I got some very welcomed feedback about my approach and technique and I was really looking forward to recording another one and on my next one really focusing on more meticulously dissecting out the root of the ileocolic pedicle and even individually dissecting out the artery and vein and ligating those separately.
31.285,65.841,"The surgeon encounters a high BMI male patient with significant intra-abdominal fat, obscuring the transverse colon. The greater omentum is lifted, revealing the transverse colon encased in fat. The surgeon spends several minutes freeing atypical adhesions to expose the transverse colon and restore normal anatomy."
66.341,90.419,"But after doing this for a while and evaluating his mesentery and anatomy for a medial to lateral approach, which is my typical approach, I felt that this gentleman would be a good candidate for a lateral to medial approach just to make it easier on myself and to have better visualization when I finally got to take the pedicle."
90.919,117.146,"So I put together this quick video just to kind of illustrate pivoting based on the patient's anatomy and needing to feel comfortable approaching these cases in different ways. So I hope you enjoy and again As always, the feedback is very much welcome."
117.646,181.171,"So after getting a feel of what it would be like to try to approach this medial to lateral through that very thick mesentery, this is where I changed the approach and decided to go lateral to medial for the majority of the case here. I will kind of speed through this dissection."
181.671,235.672,"reasonable person may ask well if this is an easier approach if this is the fallback well then why isn't this the standard approach and into that I would say the medial to lateral approach feels easier to me at this point for most patients most patients with more favorable anatomy with maybe thinner mesentery without so much scarring on that medial mesentery That does feel easier and quicker in the dissection. But just with certain patients' body habitus, I think this lateral to medial approach is a good fallback. And I can feel a little bit more safe than just trying to directly dissect through that thick mesentery down to the iliocolic pedicle."
236.172,303.648,"The surgeon proceeds with a lateral to medial dissection approach, stopping short of the duodenum. They then focus on freeing the greater omentum from the transverse colon to better define the anatomy. The hepatic flexure is mobilized using a vessel sealer, aiming to connect the two dissection planes."
304.148,416.919,"The surgeon completes the hepatic flexure mobilization, connecting two dissection planes. The supramesocolic dissection is extended to the proximal transverse colon at the distal resection margin. The duodenum is identified and brought down, with dissection continuing on top of it to complete the lateral to medial approach."
417.419,622.886,"The surgeon places a Raytech sponge on top of the duodenum to guide the dissection through the thick ileocolic mesentery. The ileocolic vein is visible as the surgeon cleans the area, preparing to select the distal resection margin and dissect through the colonic mesentery down to the root of the ileocolic vessels."
623.386,714.861,"So listen, I will be the first to admit that this is not the prettiest dissection. I went into this case or I guess I went into the idea of my next right colectomy that I would post to be a case where I took the criticisms of my previous post and really worked hard on more cleanly dissecting out the root of the ileocolic vessels, the right colic vessel, individually taking these after scissor dissection. But I found that this just was not the right case for that. I'm continuing to learn, continuing to try to improve with every case. Heck, that's why I'm posting these things is so that I can learn from your criticisms and your ideas and especially from watching your surgeries as well. For this kind of patient with this thick of a mesentery, I felt that changing the approach was what was best for me and the patient. I felt that taking his ileocolic vessels with this white load was going to make me feel most secure. And ultimately, I am pretty satisfied, you know, with his outcome and with the result of the operation."
715.361,779.488,"I do wonder, however, if I am in the minority of surgeons out there that would have felt like he or she had to change their approach to this case to feel more comfortable with it. So I look forward to hearing that back from any of you and also any hints that you have in this case particularly. about how to maybe position yourself for success with a medial to lateral approach, positioning his bowels. Also about running into those strange cocoon-like adhesions around the transverse colon if you've seen that and how you dealt with that or what that might be from. And also about, you know, skeletonizing the ileocolic vessels through, you know, a two-inch thick mesentery. All these things, this won't be the last patient that I have with this type of body habitus. Heck, it probably won't be the last one in the next couple of weeks. So I really do look forward to learning from your experience and any hints that you might have for me for the next time I try to tackle this."
779.988,788.371,So thank you again for watching. I get a lot from your feedback and also from watching your videos. Take care.
