start,end,text
23.864,47.275,"The transabdominal view reveals the deep inguinal ring, vas deferens, and spermatic vessels. The lateral and medial umbilical folds are visible alongside the inferior epigastric vessels. The hernia defect is observed lateral to the epigastric vessels and medial to the deep ring."
47.775,96.106,"The surgeon fast-forwards through the dissection to reveal the hernia site. They grasp the preperitoneal fat and begin to separate the pseudosac, which is the transversalis fascia attached to the distal aspect of the preperitoneal fat, confirming the presence of a lateral direct hernia."
96.606,152.472,"The surgeon pauses the initial hernia reduction to focus on developing a medial dissection, entering the parietal compartment. Tissue is pushed towards the lateral side wall to prepare for mesh placement, while achieving parietalization of the vas and vessels."
152.972,202.437,"The surgeon returns to the preperitoneal fat hernia, with the epigastric vessels visible medially. The preperitoneal fat is nearly completely reduced, revealing the iliopubic tract and the peritoneal edge. Henle's ligament and Hasselbeck's ligament are identified, confirming the presence of a direct hernia with defined margins lateral to the epigastric vessels."
202.937,253.433,"The surgeon continues the dissection, ensuring the spermatic vessels and vas deferens are clearly separated from the hernia and supported by the transversalis sling. The hernia is reduced, and the surgeon develops an appropriate pocket for further surgical steps."
253.933,314.117,"The surgeon uses their left hand to grasp the obliterated umbilical artery, a consistent anatomical landmark, while the vas deferens and peritoneal edge are visible in the surgical field. This helps define the extent of the dissection needed in the preperitoneal inguinal region."
