start,end,text
0.516,25.069,"We present a robotic anterior resection utilizing the natural orifice intracorporeal anastomosis with extraction of specimen, or NICE procedure, for the management of recurrent acute diverticulitis not relieved by non-operative management, with a focus on the step-by-step approach to this method utilizing the da Vinci XI platform. This could be considered a form of natural orifice specimen extraction surgery, or NOSES."
25.569,43.24,A sixty nine year old female presented with CT proven recurrent acute sigmoid diverticulitis non-responsive to conservative management. The patient had been admitted three times in the year up to her operative intervention to manage these episodes with further courses of oral antibiotics as an inpatient.
43.74,73.039,"Patient's relevant past history included rheumatoid arthritis, for which she was on methotrexate and hydroxychloroquine, a gastric bypass procedure via midline laparotomy many years prior, vaginal hysterectomy, cholecystectomy, endopendicectomy, as well as ventral rectopexy for rectal prolapse with a biodesigned collagen graft in Preoperative CT demonstrated recurrent mild to moderate acute sigmoid diverticulitis within a redundant sigmoid colon."
73.539,89.86,A coronal slice here demonstrates the associated bowel thickening and associated fat stranding. CRP at the same time as the pictured CT was elevated at seventy four milligrams per litre The patient was managed with further antibiotics prior to being consented and booked for operative intervention.
90.36,107.004,Preoperative CRP was two milligrams per liter and preoperative colonoscopy excluded underlying malignancy. The patient was fasted and routine mechanical bowel preparation was prescribed. The patient was given intravenous kefazolin and metronidazole on induction.
107.504,118.568,The patient is positioned in low lithotomy with a fifteen-degree Trendelenburg and twelve-degree left-sided tilt. A rectal washout is performed using a rectal tube with dilute iodine solution.
119.068,140.812,"The surgeon performs optical entry using a 5mm FiOS port and a 5mm zero-degree laparoscope in the right upper quadrant. Four 8mm robotic ports are inserted in a typical array for robotic anterior resection, visible on the left side of the screen."
141.312,173.282,"The surgeon performs a lateral to medial dissection using monopolar curved scissors, retracting the sigmoid and descending colon with a tip-up grasper and fenestrated bipolar graspers. Adhesions from previous ventral rectopexy are divided as the dissection progresses towards the flexure."
173.782,199.718,"The surgeon identifies and preserves the left ureter while continuing dissection through the left paracolic gutter, facilitating the mobilization of the descending colon. Further mobilization of the upper rectum is also performed."
200.218,239.777,"The surgeon encounters evidence of diverticulitis, dividing adhesions between the diseased sigmoid colon and the bladder and pelvic sidewall. The distal transection site is marked in the mesorectum, while the proximal transection site is marked in the disease-free colon, ensuring the dissection line is in the upper rectum for transrectal specimen extraction."
240.257,275.393,"The surgeon uses a vessel sealer in the left hand to perform resection along the sigmoid mesentery, closely following the colon. The inferior mesenteric artery and superior rectal artery are visibly preserved during this process."
275.893,309.709,The surgeon transects the upper rectum using a vessel sealer. The tissue is excised in preparation for a double purse-string anastomosis. A SureForm 60mm blue load stapler is used to staple the specimen ends via a 12mm port in the right lower quadrant.
310.209,330.523,A PDS endolute is secured to the distal aspect of the specimen to facilitate retrieval. The surgeon then transects the proximal bowel along a healthy portion of the descending colon.
331.023,367.283,"The surgeon introduces a small-sized soft Alexis retractor via the rectum using a Rampley instrument, which flattens the rectal valves and shortens the rectum to protect the rectal cuff from tearing. The specimen is retrieved by grasping the secured endo-loop, with circular motion aiding the extraction process."
367.783,395.955,"The surgeon performs a double per-string stapled anastomosis, passing a 33mm circular stapler anvil transanally. The Alexis retractor is removed using a Cocker clamp. The anvil is positioned within the colon, and a 3-0 V-lock suture is used to create a purse string, securing the stapler anvil in place."
396.455,430.011,"The surgeon uses a PDS endo loop to snugly secure the colon around the anvil spike. The robotic platform facilitates efficient suturing of the IIIo B-lock. A purse string suture is placed in the distal rectum, with the stapler pistol in situ aiding the placement."
430.511,477.852,"The surgeon uses a drape clip to hold the stapler in place, facilitating the placement of the distal purse string suture with a two OV lock to align the bowel edges. A PDS endo-loop is utilized to secure the thick anastomotic donuts, requiring an experienced assistant due to reach challenges. A double ender loop is achieved by placing a port more caudally, or alternatively, a second V-lock can be run around the spike."
478.352,508.659,"The surgeon engages the stapler anvil with the stapler pistol, confirming correct orientation. Indocyanine green is injected intravenously, and vascularity is confirmed using the firefly mode. The bowel is transsected using diathermy or a vessel sealer, with no visible anastomotic problems."
509.159,532.973,"The surgeon uses interrupted 3-0 Vicryl sutures to reinforce the anastomosis, ensuring it is tension-free by freeing the mesentery medially. The redundant sigmoid is addressed, and full splenic flexural mobilization is performed retrograde after the anastomosis is completed."
533.473,552.598,"The surgeon performs an insufflation test with a colonoscope to check for leaks at the anastomosis. The 8mm port sites below the umbilicus are closed using transvascular ovicryl sutures, and the skin is sealed with hysteroacryl glue."
553.098,585.615,"Histopathology demonstrated moderately severe diverticular disease with acute diverticulitis and abscess formation. The longitudinal margins were not inflamed. The image on the left demonstrates the anastomosis and no residual diverticulosis. The patient had an uncomplicated post-operative course. The indwelling catheter was removed in theatre, oral analgesia alone was used with paracetamol and PRN to pentadol, no intravenous fluids were prescribed post-operatively, and the patient was discharged on post-operative day two."
586.115,593.126,"The authors of this vignette would like to thank Eric Haas and his team for their work, who originally described this technique in their publication in"
