start,end,text
0.723,20.047,"This video presents the modified robotic-assisted nephro-ureterectomy and partial cystectomy for a UVJ tumor. The surgery was performed by Dr. Huang Zhaoyuan at Department of Urology, National Taiwan University Hospital, Taiwan."
20.547,33.814,The fifty-two-year-old man has a past history of hypertension. He presented painless gross hematuria and the CT scan showed a left UVJ tumor with hydronephrosis.
34.314,48.664,"The patient is positioned in the full flank position with the affected side facing up. The surgical team adjusts the robotic system for ureterectomy and partial cystectomy following kidney dissection. The ports are rearranged: the first robotic arm's port is now an assistant port, the second robotic arm's port is converted to the first robotic arm's port, and the assistant port is changed to the second robotic arm's port."
68.193,140.578,"The surgeon dissects the descending colon from the surface of Gerota's fascia, exposing the left ureter, which is then identified and looped."
141.078,193.63,"The surgeon opens the rotous fascia, revealing the renal artery through careful dissection. The renal artery is then ligated."
194.13,238.887,"The surgeon uses an endo-GIA stapler to ligate the renal vein, accommodating its wide diameter."
239.387,331.541,"The surgeon manipulates the ureterovesical junction (UVJ) after separating the kidney and upper ureter from surrounding tissue. A stay suture is placed for further dissection. Partial cystectomy is performed by dissecting the detrusor muscle, revealing the urothelial mucosa with a tenting pattern."
332.041,421.378,"The surgeon repairs the bladder using a continuous v-lock suture, securing the tissue edges together."
421.878,434.991,"A seven-centimeter incision is made over the lower abdominal midline near the umbilicus for the extraction procedure, with visible blood loss amounting to approximately 150 milliliters."
