start,end,text
1.16,45.983,"This video demonstrates a technical standardized technique for a laparoscopic extended mesenterectomy in an ileocolic resection. There are two ways to perform an ileocolic resection. The first type is a close to bowel resection, which is the conventional technique wherein the vessels and nerves are preserved. The second type is an extended mesenterectomy in which the mesentery is taken conform an oncological operation. In order to preserve adequate vascularization on the colonic side, the mesentery is taken but the ileocolic trunk should be preserved. It is important that on the bowel side the operation is identical to the conventional technique and that not more bowel is removed."
46.483,81.143,"The surgeon begins a single-port ileocolic resection with mesenterectomy by creating a submesenteric tunnel, preparing the mesentery for resection."
81.643,108.323,"Following the creation of the submesenteric tunnel, the surgeon takes the lateral peritoneal attachments to achieve lateral mobilization. The proximal transaction line is then marked on the bowel."
108.823,130.199,"The surgeon identifies the ileocolic trunk, ensuring it is spared during the extended mesenterectomy. Once the position of the ileocolic trunk is confirmed, a mesenteric window is created."
130.699,189.82,"The surgeon dissects the mesentery away from the ileocolic trunk, carefully continuing the dissection towards the marked proximal transection point along the trunk."
190.32,231.223,"The surgeon continues the dissection alongside the ileocolic trunk towards the colonic transaction point, revealing the dissected triangular-shaped mesentery."
231.723,239.21,"The surgeon closes the mesenteric defect using clips after completing the extracorporeal anastomosis, ensuring the mesentery is securely sealed."
