start,end,text
0.574,29.482,"So this is a case of a MIS exploration for an appendiceal lesion found on a CAT scan done for abdominal pain. As you can see here, my initial exploration found some what looked like these chocolate cysts, and I was very suspicious of endometriosis just by talking to her in the preoperative consultation. She'd actually seen another surgeon who had recommended a right hemicolectomy based upon imaging and concerns for cancer."
0.574,29.482,"So this is a case of a MIS exploration for an appendiceal lesion found on a CAT scan done for abdominal pain. As you can see here, my initial exploration found some what looked like these chocolate cysts, and I was very suspicious of endometriosis just by talking to her in the preoperative consultation. She'd actually seen another surgeon who had recommended a right hemicolectomy based upon imaging and concerns for cancer."
29.982,57.317,"The surgeon examines the ileocolic area, observing endometrial implants on the ileum and noting that the appendix is replaced by an endometrial implant."
29.982,58.96,"The surgeon examines the ileocolic area, observing endometrial implants in the ileum and noting that the appendix is largely replaced by an endometrial implant."
57.817,71.232,"The surgeon navigates through the mesentery towards the appendix, assessing the margin on the cecum for the appendectomy procedure."
59,99.221,"The surgeon navigates through the mesentery to access the appendix, assessing the margin on the cecum for a potential appendectomy."
71.732,84.935,"Obviously, an ileocolic resection would deal with the additional ileal disease. I chose not to do that, and you'll see what I did with the ileal disease a little bit later in the video."
85.435,104.664,"But most importantly, this patient had never had a diagnosis of endometriosis, has never been on hormonal therapy before, and I thought that just going straight to an ileocolic resection was a little aggressive. but certainly reasonable if that option had been chosen."
99.721,130.052,"The surgeon clears the mesentery from the base of the cecum, creating space for the stapler to be positioned. The stapler is then brought into view to proceed with the appendectomy."
105.024,130.052,The surgeon clears the mesentery from the base of the cecum to ensure adequate space for stapler placement. The stapler is then positioned across the cecum.
130.552,151.169,"The surgeon carefully maneuvers around the ileocecal valve, ensuring not to encroach upon its lumen, while the intraoperative frozen section has confirmed the presence of endometriosis."
130.552,151.169,"The surgeon carefully maneuvers to avoid encroaching upon the lumen of the ileocecal valve, with the intraoperative frozen section having confirmed the diagnosis of endometriosis."
151.669,179.206,"The surgeon divides the appendix, taking a wedge of the cecum using a stapler. The staple line is oversewn to prevent exposure of staples, and the specimen is prepared for sending."
151.669,179.206,"The surgeon divides the appendix, taking a wedge of the cecum. The staple line is over-sewn to prevent exposure, and the specimen is prepared to be sent off."
179.706,206.764,"The surgeon targets an additional intramural implant on the ileum, carefully dissecting underneath the lesion to wedge it out. The defect is addressed by suture closure, ensuring the lesion is removed without full thickness penetration."
179.706,206.764,"The surgeon targets an additional intramural implant on the ileum, carefully excising it with a wedge resection. The defect created by the removal is addressed with suture closure, following the lesion's path beneath the surface."
207.264,233.443,"The surgeon closes the surgical site using interrupted 3-0 Vicryl sutures, focusing on the appendectomy without addressing the ovarian or pelvic endometriosis visible in the field."
207.264,253.982,"And then I'm going to close this with some interrupted threovacral. Again, this patient has never been medically treated for her endometriosis. So, um, I didn't feel that it was necessary to be too aggressive, uh, with her surgery. Um, you know, there is disease on her ovaries, there's disease in the pelvis. Um, and I certainly wasn't going to be addressing that at the time of this operation. This was more to, uh, obtain the diagnosis of, uh, endometriosis and, um, to allow her to get onto, uh, therapy."
233.483,253.982,"This was more to, uh, obtain the diagnosis of, uh, endometriosis and, um, to allow her to get onto, uh, therapy."
254.482,285.257,"The surgeon closes the incision transversely, ensuring proper apposition of the cut edges to prevent luminal narrowing. Stitches are placed at both corners before proceeding to the center to avoid the corners ducking in during closure."
254.482,285.257,"The surgeon closes the incision transversely, ensuring proper apposition of the cut edges to prevent luminal narrowing. Stitches are placed at both corners before proceeding to the center to avoid the corners ducking in during closure."
285.757,295.181,"The surgeon places additional sutures in the surgical site, ensuring secure closure of the tissue layers."
285.757,332.951,"And then I put some additional sutures here. This was done as an outpatient surgery. She did very well. All of the areas that I removed, and there were some other little areas that I biopsied in other locations of the abdomen, all came back as endometriomas. And she is now working with her gynecologist on suppressive therapy. to help prevent recurrence."
295.461,332.951,"All of the areas that I removed, and there were some other little areas that I biopsied in other locations of the abdomen, all came back as endometriomas. And she is now working with her gynecologist on suppressive therapy. to help prevent recurrence."
333.451,338.372,Everything looked good to me and time has shown that she has done well. I hope you enjoyed.
333.451,338.372,Everything looked good to me and time has shown that she has done well. I hope you enjoyed.
