start,end,text
19.349,39.672,"The surgeon places ports in the left upper quadrant, aligning them in a straight line spaced eight centimeters apart, extending towards the right lower quadrant."
40.172,63.323,"The surgeon uses robotic instruments to switch the transverse colon and right colon to the abdominal wall, enhancing exposure and freeing the instruments for further dissection."
63.823,124.579,"The surgeon opens the mesenteric envelope and dissects tumors using a medial-lateral approach, exposing the duodenum. The ileocolic vessels are identified, with the ileocolic vein clipped and divided from the superior mesenteric vein. The distal ileum is identified, and the mesentery is divided to address pelvic adhesions, freeing the small intestine for later anastomosis."
125.079,167.984,"The surgeon uses the robotic fourth arm to continue the cephalad dissection, identifying and clipping the right colic vein and artery. The robotic clips are applied to divide these vessels without laparoscopic assistance."
168.484,197.989,"The surgeon dissects over the pancreas and duodenum, demonstrating proximity to these structures. The suture is taken down for further retraction using the robotic fourth arm."
198.489,226.627,"The surgeon identifies the right branch of the midcolic vessels, clips them, and then divides them using robotic instruments."
227.127,322.451,"The surgical team replaces a sponge underneath the transverse colon and pulls it caudally to enter the lesser sac. They divide the omentum and identify the right gastroepiploic vessels on the greater curvature of the stomach, which are then divided. The dissection proceeds towards the hepatic flexure, connecting spaces around the gastrocolic trunk, and continues to mobilize the right colon using a previously taken down suture to relieve tension."
322.951,356.784,"The surgeon divides the distal ileum and marks it with a suture for later reference. The transverse colon is also divided, and any remaining attachments are completely severed using a vessel sealer."
357.284,377.461,"The surgeon has completed the disconnection and placed the specimen aside. The distal ileum is positioned close to the transverse colon. The anastomosis is parked in the right upper quadrant, with a suture placed and the fourth arm used for proper exposure."
377.961,386.555,"The surgeon performs an isoperistaltic anastomosis, creating a metacollotomy to connect the bowel segments."
387.055,512.841,"The surgeon uses ICG to assess the blood supply of the small intestine and transverse colon. A 45 stapler is then used for the anastomosis, with the fourth arm aligning the anastomosis. The common channel opening is closed using a 3-0 absorbable barbed suture in a canal suture technique."
513.341,537.808,"The completed anastomosis is visible, with the barbed suture locked in place. The surgeon uses ICG to assess the blood supply to the anastomosis."
