start,end,text
3.173,20.487,The patient is a sixty-two year old female with one day history of lower abdominal pain. CT scan of the abdomen suggests acute Meckel's diverticulitis without perforation.
20.987,45.359,"Upon entering the abdomen, the surgeon observes inflammatory adhesions surrounding a Meckel's diverticulum. The adhesions are carefully dissected using scissors and electrocautery, revealing the diverticulum."
45.859,118.118,"The surgeon identifies an area of perforation in the small bowel, visually distinct from surrounding tissue."
118.618,181.197,"The surgeon identifies and frees the base of the Meckel's diverticulum. An endoscopic stapler is carefully positioned around the base, ensuring the small bowel lumen remains unobstructed."
181.697,240.442,"The surgeon frees the last attachment of the Meckel's diverticulum, completing its separation from surrounding tissues."
240.942,243.667,The surgeon places the resected specimen into an endo bag for removal from the abdominal cavity.
