start,end,text
60.304,90.705,"During the robot-assisted laparoscopy, the surgeon identifies the leiomyoma, fallopian tubes, ovaries, and ureters within the pelvic cavity."
91.205,315.812,"Vasopressin is injected into the posterior leiomyoma, followed by an incision over the myoma site. The capsule surrounding the myoma is identified, but no clear plane for enucleation is visible."
316.312,473.897,"The surgeon continues dissection, draining necrotic material from the degenerating myoma, which is suctioned away. A suture is placed on the myoma for tagging, facilitating its future removal. The base of the myoma is coagulated and cut, separating it from the underlying myometrium."
474.397,573.023,"The surgeon identifies the second myoma and makes an incision over its site. The capsule is identified, and enucleation is performed. A suture is placed for tagging, and the base of the myoma is cut and coagulated before being separated from the underlying endometrium and myometrium."
573.523,748.203,"The surgeon repeats the procedure for the third myoma, making an incision to identify the capsule, followed by enucleation and coagulation of the base, separating the myoma from the underlying endometrium and myometrium."
748.703,1124.33,"The surgeon identifies the endometrium and approximates it using a 2-0 Vicryl suture. The myomectomy incision is then closed with a 2-0 VLAC suture in two layers, ensuring secure closure of the surgical site."
