start,end,text
27.108,37.611,The laparoscopic view reveals a large subserous fibroid located at the fundus of the uterus. The surgical procedure is conducted without the use of a uterine manipulator.
38.111,51.034,The surgeon injects vasopressin into the uterine tissue to reduce blood flow and devascularize the area prior to fibroid removal.
51.534,162.275,"The surgeon makes an oblique incision on the anterior surface of the large subserous fundal uterine fibroid, followed by the enucleation of the fibroid from the surrounding uterine tissue."
162.775,236.29,The surgeon removes a small fibroid and sutures the inner layer of the defect using a continuous V-lock barb suture.
236.79,303.04,"The surgeon sutures the cirrhosa of the uterus using interrupted sutures, showing the appearance of the uterus after the completion of suturing."
303.54,328.447,The surgeon makes an incision on another subserous fibroid and enucleates it. The resulting defect is sutured in one layer using interrupted sutures.
328.947,385.829,"A surgical bag is introduced into the abdominal cavity, and the fibroids are placed inside. The fibroids are then morcellated within the bag, reducing their size for removal."
386.329,425.583,"The surgeon applies anti-adhesion gel over the incisions on the uterus, covering the areas where fibroids were previously removed and sutured."
