start,end,text
0.847,12.035,"In this video, we present the case of a thirty-three years old male patient who underwent single incision laparoscopic subtotal colectomy for ulcerative colitis."
12.535,23.163,"The surgeon inserts a single incision port at the ileostomy site in the right iliac fossa, followed by the placement of a wound protector to prevent gas leakage during the laparoscopic procedure."
23.663,39.153,The patient was diagnosed with ulcerative colitis one year ago and due to failure of medical treatment it was decided to proceed to a three-stage restorative proctocolectomy.
39.653,51.327,This patient was an ideal candidate for single incision laparoscopic surgery with the body mass index of twenty point five and no previous history of abdominal surgery.
51.827,81.317,"The patient is positioned in the Lloyd Davis position with the surgeon and assistant on the right side. In the Trendelenburg position, the small bowel is lifted out of the pelvis, exposing the mesosigmoid."
81.817,121.539,The surgeon creates a window in the sigmoid colon mesentery and divides the bowel distally using an endo-GIA stapler. The N-seal articulating vessel sealing device is used to facilitate dissection by adjusting the angle for better retraction of the specimen.
122.039,157.028,"The surgeon alternates between median and lateral dissection techniques to fully mobilize the sigmoid colon, ensuring complete separation from surrounding tissues."
157.528,179.222,The surgeon progressively lifts the sigmoid colon while carefully protecting the adjacent gonadal vessels and the left ureter.
179.722,216.778,"The surgeon approaches the splenic flexure, carefully preserving the splenunculus from dissection."
217.278,266.699,"The surgeon gains medial access to the lesser sac to facilitate the full mobilization of the splenic flexure, with visible manipulation of surrounding tissues."
267.199,385.505,"The surgeon progressively divides the transverse mesocolon and detaches the gastric attachments, fully mobilizing the hepatic flexure of the colon. The specimen is lifted from the duodenum, and the mobilization of the right colon is completed with lateral dissection."
386.005,438.388,"The surgeon incises the peritoneum at the pelvic brim to elevate the terminal ileum, navigating the challenging operative field located beneath the silt port at the ileostomy site."
438.888,449.918,"The surgeon removes the sealed port and extracts the specimen through the ileostomy site. The terminal ileum is divided extracorporeally, and an end-ileostomy is matured, completing the procedure."
450.418,455.262,The patient had an eventful recovery and was discharged home on post-operative day three.
