start,end,text
24.4,38.829,"The surgeon applies two LH forceps to invert the umbilicus, then uses a scalpel to make a small stab wound over the inferior crease of the umbilicus."
39.329,54.522,"The surgeon holds the Veress needle with a guarded grip, ensuring that no more than four centimeters of the needle is exposed while supporting the thickness of the abdominal wall."
55.022,106.575,"The surgeon lifts the abdominal wall midway between the pubic surfaces, ensuring the varice needle is directed towards the anus but perpendicular to the abdominal wall. The irrigation and suction tests are performed, followed by the hanging drop test. Insufflation is then attached, introducing 800 ml of gas into the pediatric patient's abdomen."
107.075,154.897,"The surgeon performs a smiling incision at the inferior crease of the umbilicus, resembling a smiling face. The incision is dilated caudally to open the oblique vitreous intestinal tract using a Scandinavian technique. The trocar is held like a pistol, with only four centimeters exposed, and inserted with a screwing motion. A telescope is introduced through the umbilical port, while the second port is placed in the epigastric region, left of the falciform ligament."
155.397,190.968,"A small 10mm incision is made just left to the falciform ligament. The trocar is inserted perpendicular to the abdominal wall, piercing the membranous part of the falciform ligament, and directed towards the right. A 1mm nick is created with minimal scarring. A Striker mini alligator is used percutaneously to perform both the cholecystectomy and appendicectomy."
191.468,218.782,"The surgeon uses a Striker mini-alligator instrument to grasp the gallbladder slightly above the Hartmann's pouch. The instrument provides retraction of the gallbladder and liver without the need for a port, scar, dressing, or cannula."
219.282,273.172,"The surgeon uses a 1.8 millimeter striker mini alligator instrument to separate flimsy adhesions, pushing the duodenum down. The harmonic scalpel's silicon jaw is positioned towards the gallbladder to avoid vibrations. The angle of the cystic pedicle with the gallbladder body, referred to as the 'mouth of the elephant,' is visible. The posterior peritoneum is carefully dissected with entro medial traction."
273.672,353.433,"The surgeon opens the posterior peritoneum and applies anterolateral traction. The Teflon jaw of the harmonic device lifts the liver, allowing for the stripping of the peritoneum around the cystic pedicle. The Maryland dissector is used to create a posterior window, with its convex edge towards the liver, followed by an anterior window between the cystic artery and duct. The full jaw of the Maryland, measuring twenty-two millimeters, is utilized to create these windows in the pediatric patient."
353.933,494.74,"The surgeon creates a posterior window in the cystic duct using laparoscopic techniques, visualizing the inferior surface of the liver. Titanium clips are applied to the cystic artery, with three clips placed at specific intervals for secure ligation. The harmonic device is used to cut and separate the artery. An extracorporeal knot, Mishra's knot, is used to ligate the cystic duct, which is then cut with scissors. The duct is sealed with the harmonic, preventing spillage."
495.24,624.725,"The surgeon uses entromedial and entrolateral traction with the left hand to separate the gallbladder from the liver. The striker mini alligator is rearranged to minimize traction, while the teflon or silicon jaw of the harmonic is kept towards the liver to prevent puncture. Blunt dissection is employed to achieve a clear aerial plane for separation, and the final part of the gallbladder fundus is carefully detached."
625.225,665.347,"The surgeon inspects the area below the gallbladder fundus, ensuring clear visibility and absence of bleeding. The light cable is adjusted to improve illumination, and the final part of the gallbladder is separated using a two-port technique with one percutaneous instrument."
665.847,710.825,"The surgeon uses a striker mini alligator needle instrument to hold the neck of the gallbladder, inserting it into the cannula. The gallbladder is carefully extracted, revealing multiple large stones. Ovum forceps are used to crush and remove the stones before the gallbladder is fully taken out."
711.325,733.583,"After the removal of the gallbladder, the surgeon switches the ten millimeter cannula to the epigastric region while the striker mini alligator holds the tissue. The harmonic device is positioned in the umbilical port, indicating the setup for performing an appendectomy using the same laparoscopic ports."
734.083,788.965,"The surgeon uses the harmonic device with a silicon and Teflon jaw to carefully separate the appendix from the cecum, ensuring vibrations do not affect the surrounding tissue. The base of the appendix is approached closely, and the appendix is separated. An endo loop knot, pre-tagged as Mishra's knot, is applied using a knot pusher, securing the appendix by bringing the tip of the knot pusher over the tinea coli."
789.465,849.487,"The surgeon uses a knot pusher to secure the knot over the tinea coli, ensuring the appendix is tightly ligated. Scissors are then used to cut the knot, followed by partial cutting with the harmonic device. The appendix is rotated and fully transected, burning and sealing the mucosa. The appendix is held longitudinally and pulled into the cannula using the striker mini alligator."
849.987,910.649,"The surgeon pulls the appendix into the cannula and extracts it. During diagnostic laparoscopy, the ureter is observed crossing the common iliac vessel. The sacral promontory is visible in the middle. The fimbrial end of the fallopian tube is identified, along with the external iliac artery and vein. The small uterus of the six-year-old child is visible, along with the developing ovaries and uterosacral ligament. The sigmoid colon is seen, and the bladder is noted above, appearing slightly full."
910.689,933.521,"The surgeon identifies the medial amygdala ligament and the deep ring. The common iliac vessel and external iliac vessel on the left side are visible. The left ureter is observed, showing peristalsis."
