start,end,text
1.539,18.112,"In this educational video, we present the technical details of a rectovaginal fistula repair with episoprototomy and sphincteroplasty. A rectovaginal fistula developed after a vaginal delivery in a nine-year-old woman."
18.612,30.8,"The patient is positioned in a modified lithotomy position under general anesthesia, with preoperative findings indicating an anterior defect in the external anal sphincter."
31.3,41.99,"The surgeon removes the cetum after local marking with epinephrine injection, revealing the underlying tissue."
42.49,65.506,"The surgeon opens the skin and mobilizes the sphincter complex on both sides, dividing it across the fistula. Dissection proceeds along the perineal body, excising the fistula tract along the vagina until clean and healthy tissue is visible."
66.006,142.08,"The surgeon performs a layered closure, first closing the rectum, followed by the vagina, and placing intervening sutures between the levator muscles. The mobilized C-factor is overlapped and sutured using two O-PDA sutures, with a total of four sutures placed."
142.58,179.101,The surgeon closes the rectal and vaginal mucosa with two O-vital sutures. A JP drain is placed in the center of the wound and exits through a small stab incision in the left groin area. The skin along the perineal body is closed using three polysorb sutures.
179.601,193.185,A vaginal tampon was placed into the vagina and removed at postoperative day one. Postoperative course was uneventful and the patient was discharged on postoperative day three.
193.685,204.028,Functional and quality of life scores were good and there were no urination and defecation complaint at eight-week office visit.
