start,end,text
24.092,51.542,"The laparoscopic view reveals significant lump formation with adhesions. The omentum is visibly adhered to the surrounding structures, including the cecum, which is stuck to the lateral abdominal wall."
89.246,112.709,"The surgeon carefully removes the omentum from the lateral abdominal wall, revealing the ileocecal junction adhered to the wall."
113.209,141.642,"The surgeon performs the Cheetle's maneuver, medializing the cecum by detaching it from the lateral abdominal wall. This allows the cecum to be flipped medially, providing access to the appendix from the lateral side."
183.191,226.448,"The surgeon has localized the appendix amidst significant adhesions. The surgical field shows the appendix surrounded by dense tissue adhesions, which require careful and patient dissection to separate."
226.948,273.773,"The surgeon carefully separates the omentum strands to expose the burst tip of the appendix, which is buried within the omental tissue. The process is slow and meticulous to avoid bleeding, as the omentum is known to bleed heavily. The laparoscopic approach minimizes the risk of wound infection by keeping the port of access distant from the surgical field."
274.273,328.928,"The surgeon carefully examines the attachments to the appendix, while managing smoke and fogging in the laparoscopic field. The cecum has been medialized, providing ample space for dissection. The surgeon uses both hands to achieve the optimal angle for dissection, ensuring instruments do not cross."
329.428,375.823,"The surgeon holds the appendix while observing that the terminal ileum, just before the ileocecal junction, is adhered to the appendix. This site of perforation has caused the ileum and omentum to form a large lump. The surgeon carefully maneuvers instruments from the left side to avoid crossing them and obstructing the view."
376.323,402.822,"The surgeon carefully strips the serosa from the appendix while preserving the serosa of the ileum, avoiding serosal tears. The approach is from the lateral abdominal wall to minimize damage."
528.071,574.935,"The surgeon performs a thorough wash of the surgical field to clear blood, enhancing visibility. The omentum, cecum, and ileum are carefully reassessed for bleeding, serosal tears, or perforations before proceeding with the appendectomy."
575.435,615.875,"The surgeon applies a transfixation suture to secure the base of the appendix, ensuring stability and preventing slippage or sloughing off. This technique is used in cases of acute appendicitis without the use of an endolube."
695.967,747.558,"The surgeon prepares to remove the appendix specimen, which is visibly inflamed and previously perforated, by placing it into an endo bag for extraction. Improved illumination in the surgical field is noted after clearing blood from the area."
