start,end,text
105.847,121.501,"The surgeon suspends the uterus using a polyamide suture, visibly securing it in place during the procedure."
122.001,145.026,"The appendices epiploica of the sigmoid colon are sutured with a rubber band for traction, while the small bowel is positioned on the right side with a cotton gauze. A hockey stick incision is marked over the pelvic peritoneum."
145.526,189.245,"The surgeon deepens the incision to expose the sacral promontory, a key anatomical landmark. The peritoneal incision is extended along the marked line. The rectovaginal pouch is elevated, and the septum is divided, visibly separating the vaginal vault from the underlying rectum, with both the rectum and vagina clearly observable."
189.745,250.468,"The surgeon dissects in the area of rectocele, revealing fibrosis. Traction is applied on the posterior vaginal wall anteriorly, while the rectum is depressed using the left robotic grasper. A speculum is placed in the vagina and elevated to facilitate dissection deep within the narrow pelvis, showcasing the advantages of robotic assistance."
250.968,311.43,"The surgeon continues dissection until the perineal body and pelvic floor are visible anteriorly. A 15x4 cm macroporous partially absorbable lightweight mesh is then fixed to the ventral surface of the mobilized rectum using multiple seromuscular non-absorbable polyester sutures. The upper end of the mesh is secured to the sacral promontory, a crucial step for successful repair."
311.93,356.669,"The surgeon uses a 2-0 absorbable barbed suture to re-approximate the peritoneum and extra peritonealize the mesh, potentially reducing the number of stitches with additional fixation techniques such as glue."
357.169,418.847,"The surgeon redocks the robotic system to proceed with the cholecystectomy. The gallbladder is retracted using the third arm, and adhesions are carefully released. Dissection of the Calot's triangle is performed to achieve the critical view of safety. The cystic duct and artery are clipped and divided. The gallbladder is dissected from the fossa, ensuring the cystic plate remains undamaged. The gallbladder specimen is placed in a retrieval bag and removed from the surgical field."
