start,end,text
102.596,160.255,"During a low anterior resection, the surgeon uses a robotic endo-wrist stapler to clamp the tissue after trimming the mesocolon. The stapler firing process is initiated, but the system alerts a failure in firing, prompting the surgeon to remove and inspect the stapler. The system warns of potential blade exposure, indicating an incomplete transaction."
160.755,200.677,"The surgeon identifies a fallen piece of the damaged instrument within the patient's body and carefully removes it, addressing the malfunction that prevented the stapler blade from fully firing."
201.177,233.744,"The video shows the instrument thread becoming loose or disrupted, a condition that can occur after long-term use, potentially affecting the functionality of the surgical tool."
236.086,306.055,"During a single-port anterior resection, the surgeon uses one grip for traction of the mesentery and an endo-wrist stapler to ligate the inferior mesenteric artery. However, after firing the stapler, it is visually apparent that the ureter has been accidentally transected."
307.516,345.949,"During the dissection of locally advanced rectal cancer, presacral bleeding occurs. The surgical team attempts to secure the bleeding points using packing and compression methods, but the bleeding persists, necessitating conversion to open surgery."
348.31,383.64,"The surgeon encounters soft tissue entrapment at the joint of the surgical instrument. The table assistant attempts to pull the entrapped tissue forcefully, risking trauma and bleeding. The surgeon carefully adjusts the instrument angle to release the tissue without causing damage."
385.742,422.664,"The surgeon inserts an anal tube into the extended rectum for decompression. Without removing the tube, the surgeon accidentally clamps it along with the rectum, and staples are fired, resulting in the transection of the anal tube."
