start,end,text
44.437,55.481,"The surgeon performs dissection and mobilization of the colon, carefully separating it from surrounding tissues to access the left kidney for partial nephrectomy."
55.981,96.665,"The surgeon identifies the gonadal vein and ureter, proceeding with dissection towards the renal hilum. The renal artery is dissected and isolated from surrounding tissues."
97.165,120.989,"The surgeon opens the Gerota's fascia, revealing the renal mass located at the inferior pole of the left kidney."
121.489,149.104,"An additional port is placed to secure the kidney, followed by dissection and adhesiolysis of the thick, adherent toxic perirenal fat surrounding the renal capsule."
149.604,194.835,"The renal mass is visualized with adherent perirenal fat. Following the dissection of the toxic perirenal fat, the renal mass is clearly seen attached to the kidney."
195.335,242.972,"The surgeon marks the margins of resection on the kidney. A laparoscopic bulldog clamp is applied to the renal artery, visibly occluding blood flow, followed by the resection of the renal tumor."
243.472,324.447,"Following the tumor resection, the surgeon performs the first layer repair closure of the collecting system, then proceeds to close the renal capsule as part of the second layer repair."
324.947,369.773,"The surgeon unclamps the renal artery following the repair of the collecting system and renal capsule. Subsequently, the Gerota's fascia is repaired, completing the closure process."
370.273,378.719,The surgeon checks for bleeders and confirms hemostasis before placing a JP drain in the surgical site. A laparoscopic bag is then introduced to retrieve the specimen from the abdominal cavity.
