start,end,text
4.168,16.578,Good afternoon. My name is Ann Chung. I'll be presenting a case from the University of North Carolina. I'd like to thank SAGES and our moderators for this opportunity to present. I have no disclosures.
17.078,24.759,This is a case of malrotation in an adult for which we performed a laparoscopic LADS procedure.
25.259,66.565,"Just a little bit of background. Intestinal malrotation is a congenital condition caused by a rest of abnormal rotation of the gut during fetal development. In normal development, the primary intestinal loop is pushed out into the area of the yolk stack and begins a normal rotation of the bowel twisting ninety degrees counterclockwise. During weeks eight to ten of gestation, the loop then returns into the abdomen, and as it returns, there is an additional rotation of a hundred and eighty degrees counterclockwise. Any interruption of this pathway can lead to an aberrant location of the intestines, formation of LADS bands, and a shortened mesentery. This abnormal anatomy can lead to issues with volvulus and ballast ischemia."
67.065,109.766,"There are various anomalies of gut rotation with the most common types being non-rotation and mal-rotation. In non-rotation, The primary loop of intestine does not rotate when it returns to the abdominal cavity, thus the small bowel is located on the right, the colon is located on the left. There's less risk of volvulus with this type of variation. With malrotation, which is what we commonly see clinically, the duodenal jejunal limb is non-rotated. The cecum is partially rotated and fixed in the upper abdomen by LADS bands, and these LADS bands can cross the duodenum and cause extrinsic compression and obstruction of the duodenum. In this situation, these patients tend to present commonly with volvulus."
110.266,132.408,"Malrotation is typically diagnosed in childhood, although the incidence of diagnosis in adults is reportedly as high as forty percent. Adults tend to have a chronic indolent course with intermittent colicky abdominal pain and vomiting. It is more common in children to present acutely associated with volvulus. The gold standard for diagnosing malrotation is an upper GI series, but a CT scan is also commonly used."
132.908,167.787,"The treatment for intestinal malrotation is a LAS procedure, which can be performed laparoscopically or open. The steps for the procedure are as follows. If there is a volvulus present, then the bowel is rotated counterclockwise. Then the LAS bands that run between the cecum, duodenum, and mesentery are divided. An appendectomy is performed as part of this procedure. and the procedure is completed by placing the small bowel on the right and the colon on the left. Currently, the laparoscopic approach is most commonly undertaken and has been shown to be as safe and effective as the traditional open reproach in both children and adults."
168.287,188.23,"Our case is a fifty-four year old male who presented to our clinic with a history of chronic intermittent abdominal pain and no prior abdominal surgeries. He underwent a CT scan and was found to have intestinal malrotation with small bowel wall thickening concerning for intermittent volvulus. Given his symptoms and imaging consistent with malrotation, we offered him a laparoscopic LADS procedure."
188.73,203.962,The CT scan images show intestinal malrotation with visible small bowel wall thickening on several loops of the small bowel.
204.462,249.172,"Upon entering the abdomen, the surgeon identifies the cecum abnormally located in the right upper quadrant and retracts it medially. The right colon is mobilized along the white line of Toldt towards the hepatic flexure. The appendix is found in a retrocecal position, and the right ureter is identified lateral to it. Adhesions surrounding the appendix are lysed, revealing the psoas muscle posteriorly. The appendix is positioned over the inferior vena cava and the duodenum. The appendectomy is completed, and the appendix is removed using an endocatch bag."
249.672,293.783,"The surgeon flips the right colon medially to expose the duodenum, revealing adhesions or Ladd's bands from the duodenum to the retroperitoneum and colon. Interloop adhesions causing kinking of the bowel are also visible. These adhesions are divided using a combination of blunt dissection and electrocautery."
294.283,309.918,"The surgeon identifies adhesions between the duodenum and the retroperitoneum, with the duodenum overlying the inferior vena cava (IVC). These adhesions are carefully dissected away."
310.418,378.333,"The surgeon completes the mobilization of the right colon by opening the gastrocolic ligament at the mid-transverse colon and dividing it towards the hepatic flexure. The right colon is flipped medially, exposing the duodenum and the head of the pancreas. Adhesions between the duodenum and the mesentery are dissected using blunt and electrocautery techniques."
378.833,401.345,"During adhesiolysis, the surgeon identifies a fatty band adhered to the terminal ileum overlying the duodenum, causing obstruction. The band is divided to relieve the obstruction."
401.845,442.312,"The surgeon runs the small bowel proximally towards the ligament of Treitz, encountering adhesions between the bowel and the root of the mesentery. These adhesions are divided using electrocautery."
442.812,484.03,"After removing the adhesions, the surgeon broadens the mesentery, a crucial step in the Ladd's procedure. The staple line from the appendectomy is visible, aiding in identifying the colon and small bowel. The small bowel is positioned on the right, and the colon is placed in the left upper quadrant to ensure proper mesenteric broadening."
484.53,504.613,"So the patient tolerated the procedure well. He was admitted for observation and was discharged on post-operative day one, tolerating a regular diet. He was seen in clinic for his post-operative appointment about two weeks following surgery and was tolerating a regular diet and having no further episodes of abdominal pain or vomiting. Thank you for, again, allowing me to present. I'd be happy to take any questions."
