start,end,text
1.229,26.174,"We present a twenty-eight-year-old female with fistulizing Crohn's disease refractory to medical treatment. She was complaining of anorexia, abdominal pain, and multiple episodes of watery diarrhea for the last six months. CT enterography revealed a complex fistulizing process involving several segments of the ileum, the ascending colon, transverse duodenum, distal sigmoid, and the dome of the urinary bladder."
26.594,40.358,The video shows the diseased ileocolic area with visible colonic and small bowel margins. An inflammatory and fistulizing mass is observed fistulizing to the duodenum.
40.858,56.497,"The surgeon identifies the base of the iliopsoas artery and the superior mesenteric artery (SMA) in the surgical field. The duodenum is visible, and the surgeon performs distal and proximal transections around the affected area."
56.997,66.121,"The surgeon removes tissue from the duodenum, minimizing the size of the duodenal opening beyond the fistula."
66.321,87.24,"The surgeon prepares to close the surgical site using a 2-0 suture, performing an anastomosis in the colon. The duodenum is positioned as a patch to cover the repair area."
87.74,140.15,The surgical field reveals severe fistulizing disease with visible fistulas connecting the proximal bowel and colon to the surrounding area. The surgeon prepares to create a diverging ileostomy to manage the condition.
140.65,184.14,"The surgeon places a purse-string suture and creates a side-to-end ileocolic anastomosis using a 31mm circular stapler. Following the resection of the sigmoid colon, a colorectal anastomosis is also performed with the same 31mm circular stapler."
184.64,215.193,"The video shows an ileocolic resection with multiple anteroenteric fistulas. The transverse colon, duodenum, and proximal small bowel are visibly fistulizing to the resection area. Multiple holes are observed in the ileosigmoid region, indicating fistulization."
215.693,223.313,Patient developed postoperative ileus which was managed non-operatively and discharged without any surgical complication on postoperative day nine.
