start,end,text
41.484,54.382,"The surgeon uses robotic instruments to set up for the procedure on a patient with an abdominal hernia, preparing to perform adhesiolysis and hernia repair."
54.522,69.466,"The surgeon begins by carefully dissecting and removing scar tissue from the abdominal cavity, which is a result of previous surgeries or inflammation."
69.966,102.733,"The camera is introduced into the abdomen, revealing normal intestinal contents. The anterior abdominal wall shows scarring from previous surgery, with the omentum and intestines suspended by the scar tissue."
103.233,122.146,"The surgeon uses fine scissors and occasional cautery to carefully dissect through adhesions, freeing the anterior abdominal wall from scar tissue."
164.472,200.265,"The surgeon releases adhesions using cautery, carefully navigating through fat tissue. As the dissection approaches the intestines, the surgeon proceeds with caution to avoid injury, highlighting the importance of slow and deliberate movements."
200.765,233.453,"The surgeon uses robotic assistance to meticulously dissect individual strands of scar tissue within the abdomen, demonstrating the precision and steadiness of the robotic instruments during the adhesiolysis procedure."
