start,end,text
130.262,143.262,"The surgeon visualizes the right ureter crossing the right iliac artery. The assistant retracts the mesosigmoid ventrally, while the surgeon makes a peritoneal incision over the sacral promontory."
143.282,174.611,"The surgeon exposes the sacral hollow using a combination of blunt and sharp dissection, preparing the area for subsequent mesh fixation."
175.111,206.577,"The surgeon identifies and preserves the right hypogastric nerve while opening the rectovaginal septum, revealing the underlying anatomical structures."
207.077,249.481,"The surgeon dissects between the rectum and the posterior vaginal wall, preserving the lateral ligament to prevent recurrence and reduce constipation risk. The rectovaginal septum is opened widely down to the pelvic floor."
249.981,303.364,"The surgeon extends the peritoneal incision caudally into an inverted J shape along the right side of the rectum, curving to the left over the ventral aspect of the rectum and the pouch of Douglas. A strip of prolene mesh, trimmed to three by fifteen centimeters, is inserted. Temporary hysteropexy is achieved using transparietal sutures, suspending the uterus to the abdominal wall."
303.864,374.567,"The surgeon uses non-absorbable sutures to attach the mesh to the ventral aspect on both sides of the distal rectum, securing it in place."
375.067,498.494,"The surgeon positions the mesh to reinforce the rectovaginal septum, securing it to the sacral promontory with a tacker. The lateral borders of the incised peritoneum are then closed over the mesh using resorbable sutures."
