start,end,text
0.571,111.632,"Hello everyone, this is a video that is minimally edited of a XI-ETEP Reef Stopa Incisional Hernia Repair. This is an eighty-one year old female with a BMI of thirty-two. Her past medical history is significant for type two diabetes, fatty liver disease, hypertension, hypercholesterolemia, osteopenia, a history of CVA, and facial nerve palsy. Her surgical history is significant for an open umbilical hernia repair in nineteen ninety nine and two thousand three. I'm not sure whether mesh was used then. She then had a laparoscopic incisional hernia repair with an eye palm mesh in two thousand fourteen and then in two thousand eighteen she underwent an open aortic endarterectomy and the operative note mentions that mesh was removed. She has developed several midline incisional hernias. The largest hernia is about nine by twelve centimeter, but above that she has multiple smaller defects within some diastasis. As you can see, the hernia contains some colon. Her rectus muscles are about eight to nine centimeters wide. The largest defect is in the lower half of the abdomen. in the N-three and N-four position. She is an ideal candidate for ETEP because her rectus muscle is nice and wide and also she has a very long laparotomy scar and incisional hernia which makes it difficult for other minimally invasive approaches."
0.571,111.632,"Hello everyone, this is a video that is minimally edited of a XI-ETEP Reef Stopa Incisional Hernia Repair. This is an eighty-one year old female with a BMI of thirty-two. Her past medical history is significant for type two diabetes, fatty liver disease, hypertension, hypercholesterolemia, osteopenia, a history of CVA, and facial nerve palsy. Her surgical history is significant for an open umbilical hernia repair in nineteen ninety nine and two thousand three. I'm not sure whether mesh was used then. She then had a laparoscopic incisional hernia repair with an eye palm mesh in two thousand fourteen and then in two thousand eighteen she underwent an open aortic endarterectomy and the operative note mentions that mesh was removed. She has developed several midline incisional hernias. The largest hernia is about nine by twelve centimeter, but above that she has multiple smaller defects within some diastasis. As you can see, the hernia contains some colon. Her rectus muscles are about eight to nine centimeters wide. The largest defect is in the lower half of the abdomen. in the N-three and N-four position. She is an ideal candidate for ETEP because her rectus muscle is nice and wide and also she has a very long laparotomy scar and incisional hernia which makes it difficult for other minimally invasive approaches."
112.132,167.582,The sagittal view reveals a dominant defect in the lower abdomen with multiple smaller 'Swiss cheese' defects above it. The intraoperative measurement of the defects is approximately twenty-five centimeters in length.
112.132,167.582,"The sagittal view reveals a dominant defect in the lower abdomen, with multiple smaller 'Swiss cheese' defects above it. The intraoperative measurement of the defects is approximately twenty-five centimeters in length."
168.082,200.666,"The surgeon uses bedside ultrasound to identify the ipsilateral linea semilunaris and performs bilateral TAP blocks. A 5mm optical trocar is inserted into the left upper quadrant of the abdomen, dilating into the retro-rectus space. The space is then insufflated to 15 mmHg."
190.137,233.908,"The surgeon uses bedside ultrasound to identify the ipsilateral linea semilunaris and performs bilateral TAP blocks. A 5mm optical trocar is inserted into the left upper quadrant, dilating into the retro-rectus space. The space is insufflated to 15 mmHg, ensuring adequate room behind the rectus muscle. The fibroareolar tissue is carefully pushed up to prevent laceration of the neurovascular bundle, including the inferior epigastric vessels, while hugging the posterior rectus sheath."
201.166,251.548,"The surgeon carefully navigates the optical trocar in the retro-rectus space, ensuring adequate space behind the rectus muscle. The fibroareolar tissue is pushed upwards to prevent laceration of the neurovascular bundle, including the inferior epigastric vessels and their branches. The posterior rectus sheath is closely followed to avoid puncturing the peritoneum, maintaining the integrity of the working space."
234.408,317.497,"The surgeon carefully maneuvers the obturator to avoid piercing the posterior sheath and peritoneum, ensuring no holes are created to maintain the working space. The second port is positioned 6 to 7 centimeters below the initial port, with pneumoperitoneum increased to 20 mmHg for enhanced CO2 pressure density. The surgeon dissects the retro-rectal space on one side, aiming to identify the entire length of the linea alba and clear fibroareolar tissue from the posterior sheath to prepare for mesh placement."
252.048,302.97,"The surgeon locates space for the second port, positioned six to seven centimeters below the initial port, and increases pneumoperitoneum to twenty millimeters mercury for enhanced CO2 pressure. Using the lower port, the surgeon plans to upsize the initial five-millimeter port. The hernia spans most of the midline, prompting dissection of the entire retro-rectal space on one side. This stage involves identifying the full length of the linea alba and dissecting fibroareolar tissue from the posterior sheath to create space for mesh placement."
303.41,407.502,"The surgeon identifies the medial edge of the rectus muscle and demonstrates the dissection plane between the transversalis fascia and the retro-rectus fat. The linea alba is fully identified, and the surgeon prepares to cross over approximately one centimeter away from it to avoid injury. The operation is kept bloodless to maintain clear visibility of fascial planes."
317.997,407.502,"The surgeon carefully identifies the medial edge of the rectus muscle, aiming to maintain a bloodless field to accurately locate fascial planes. The dissection is performed between the transversalis fascia and retro-rectus fat, below the arcuate line, treating the transversalis fascia like the posterior sheath. The entire linea alba is identified, and the surgeon begins crossing over approximately one centimeter away from it to avoid injury, ensuring a robust tissue cuff for future suturing."
408.002,504.21,"The surgeon carefully scores the ventral side of the posterior rectus sheath without using cautery, then uses scissors to cut the dorsal side, ensuring the incision remains a centimeter away from the linea alba to avoid injury. Preperitoneal fat is brought down to maintain proximity to the fascia, facilitating navigation in the space."
408.002,496.789,"The surgeon carefully scores the ventral side of the posterior rectus sheath without using cautery, due to uncertainty about the structures on the other side. Once preperitoneal fat is visible, energy is used judiciously. In the preperitoneal space, the surgeon brings the fat down to stay close to the fascia, facilitating navigation. Scissors are used to cut the dorsal side of the posterior rectus sheath, minimizing risk to potential bowel underneath."
497.289,551.299,"The surgeon maintains the incision a centimeter away from the linea alba to prevent injury and facilitate visibility of the ipsilateral fascia during defect closure. The posterior rectus sheath is opened to initiate stage two, entering the preperitoneal space. Preperitoneal dissection is performed in areas with abundant fat, while the posterior rectus sheath is opened broadly when encountering the hernia sac."
504.71,563.395,"The surgeon opens the posterior rectus sheath to initiate entry into the preperitoneal space, performing dissection between the preperitoneal fat and fascia. When encountering the hernia sac, the posterior rectus sheath is opened broadly to facilitate the removal of the hernia sac, maintaining separation between the hernia sac and the pseudosac."
551.799,617.065,"The surgeon navigates between the preperitoneal fat and fascia, as well as between the hernia sac and pseudosac. A deliberate hole is made in the peritoneum, allowing CO₂ to enter the abdominal cavity, revealing the contents of the peritoneal cavity and hernia sac."
563.895,610.662,"The surgeon intentionally creates a hole in the peritoneum during stage two of the procedure, allowing CO₂ to enter the abdominal cavity. This maneuver reveals the contents within the peritoneal cavity or hernia sac, which may drop out if not adherent."
611.162,691.075,"The surgeon approaches the arcuate line and cuts the transverse salus fascia, similar to the technique used for the posterior rectus sheath. The anatomy is distorted due to a prior incision extending to the pubic area. Visible bowel is present on the other side of the peritoneum, prompting careful cauterization away from the bowel with short bursts of energy. The surgeon reduces the hernia sac, opting to leave part of it within the hernia due to sufficient peritoneum and sac from the upper defect, while maintaining position in the preperitoneal space."
617.565,703.327,"The surgeon approaches the arcuate line, cutting the transverse salus fascia similarly to the posterior rectus sheath. The anatomy is distorted due to a prior incision extending to the pubic area. Visible bowel is observed on the other side of the peritoneum, prompting careful cauterization away from the bowel with brief energy bursts. The surgeon reduces the hernia sac, opting to leave it within the hernia due to sufficient peritoneum from the upper defect. The procedure continues in the preperitoneal space, navigating close to the posterior rectus sheath within the retro-rectus space."
691.575,754.637,"The surgeon navigates the retro-rectus space, identifying retro-rectus fat adjacent to the rectus muscle and positioning between the retro-rectus fat and transverse salus fascia. The exploration progresses to stage three, entering the contralateral retro-rectus space from left to right, using a grasper to guide the incision along the linea alba."
703.827,801.088,"The surgeon explores the retro-rectus space, identifying retro-rectus fat against the rectus muscle and navigating between the retro-rectus fat and transverse salus fascia. The surgeon enters the contralateral retro-rectus space, using a grasper to dock on the left side and cut between the jaws, maintaining a distance of about a centimeter from the linea alba. Scar tissue is visible, making it challenging to access the retro-rectus space, prompting the surgeon to move caudally to find unviolated tissue."
755.137,801.088,"The surgeon identifies weakened diastatic tissue above the main defect, indicative of an incisional hernia. They cut approximately one centimeter away from the linea alba using a grasper to maintain this distance. Scar tissue is visible, causing difficulty in accessing the retro-rectus space, prompting the surgeon to move caudally to locate an unscarred area."
801.588,860.627,"The surgeon identifies the plane of dissection and notes the fusion of the posterior rectus sheath to the rectus muscle. They ensure no bowel is present against the posterior rectus sheath before making an incision. The surgeon elevates the fibro-areolar tissue in the retro-rectus space, staying close to the posterior rectus sheath to avoid neurovascular injury. Fat is observed coming off the rectus muscle, indicating the dissection is too superficial or ventral."
801.588,909.746,"The surgeon identifies the plane between the retro-rectus fat and the rectus muscle, ensuring no bowel is against the posterior rectus sheath before incising it. The fibro-areolar tissue is elevated to avoid injury to neurovascular bundles, and the dissection plane is adjusted to stay on the posterior rectus sheath and transverse salus fascia. The retro-rectus fat is pushed away from the transverse salus fascia, revealing a clearer dissection plane as the surgeon completes stage three near the linea semilunaris."
861.127,946.652,"The surgeon carefully dissects between the transverse salus fascia and the retroarctus fat, pushing the fat away to reveal a clearer plane. The dissection progresses towards the linea semilunaris, where larger neurovascular bundles become visible, indicating proximity to this anatomical landmark. The surgeon slows down to avoid injuring these bundles as they emanate through the posterior lamella of the internal oblique."
910.246,1005.372,"The surgeon identifies a large neurovascular bundle near the linea semilunaris, visible through the posterior lamella of the internal oblique. The peritoneum appears thin and transparent, with no bowel visible beneath it. The surgeon carefully dissects laterally in an unscarred plane to avoid injuring the neurovascular bundles, while pushing the peritoneum back to develop the retro-rectus space."
947.152,1005.372,"The surgeon dissects laterally in the unscarred plane to identify the correct surgical plane. The peritoneum appears very thin and transparent, with no visible bowel beneath it. The peritoneum is pushed back to avoid cutting through it while developing the retro-rectus space. Fibro-areolar tissue is elevated, keeping the neurovascular bundles against the rectus muscle."
1005.872,1049.682,"The surgeon adjusts the robotic arms by pressing the port clutch button, shifting the entire arm towards the head to increase the range of motion for the scissors and camera. This adjustment provides better access for instrument manipulation in the surgical field."
1005.872,1074.526,"The surgeon adjusts the robotic arm to improve instrument range, flexing joints towards the head to facilitate movement of the scissors and camera. The surgical field shows significant scarring, with visible neurovascular bundles medially indicating proximity to the xiphoid area. The posterior rectus sheath incision is directed based on the location of the rectus muscle and retroactive space."
1050.182,1106.431,"The surgeon navigates through significant scarring, identifying the rectus muscle and retroactive space to guide the incision of the posterior rectus sheath. Neurovascular bundles become visible medially, indicating proximity to the xiphoid area. The muscular portion of the transverse abdominis approaches the medial edge of the posterior rectus sheath, confirming closeness to the xiphoid. The diastasis extends to the xiphoid, and the surgeon plans an upper TAR for optimal mesh placement under the diaphragm."
1075.026,1149.853,"The surgeon navigates the muscular portion of the transverse abdominis as it approaches the medial edge of the posterior rectus sheath, indicating proximity to the xiphoid. The diastasis extends up to the xiphoid, and the surgeon plans to perform an upper TAR for mesh placement under the diaphragm. The XI robot's flex joints allow for extensive range of motion from the xiphoid to the pubis, facilitating the procedure."
1106.931,1186.377,"The surgeon uses the XI robot's flex joints to work from the xiphoid down to the pubis without range limitations. The muscular portion of the transverse abdominis is visible and positioned medially, indicating proximity to the xiphoid. The muscles are observed adjacent to the linea alba."
1150.353,1221.687,"The surgeon approaches the xiphoid level, where the transversus abdominis muscle is visible and positioned medially against the linea alba. The surgeon initiates an upper TAR (Transversus Abdominis Release) on the patient's right side by cutting the posterior rectus sheath, which involves incising through the posterior lamella of the internal oblique and the transversus abdominis muscle. The white layer behind the transversus abdominis muscle, identified as the diaphragmatic contribution to the posterior rectus sheath, is also cut."
1186.877,1265.155,"The surgeon initiates the upper TAR procedure at the xiphoid level, starting on the patient's right side by cutting the posterior rectus sheath. The incision involves cutting through the posterior lamella of the internal oblique and the transverse abdominus muscle, reaching the white diaphragmatic layer behind the transverse abdominus muscle. The surgeon uses a bipolar instrument to control bleeding in the field."
1222.027,1297.369,"The surgeon identifies a plane deep to the white layer, which is the posterior diaphragmatic contribution to the posterior rectus sheath, to avoid causing a hernia. Blood is observed dripping into the surgical field, and the surgeon uses a bipolar instrument to control bleeding without muscle contraction. The left side of the TAR procedure is initiated, ensuring no muscle is visible beneath the dissection plane, indicating proper positioning below the diaphragm."
1265.655,1397.314,"The surgeon works on the left side of the transversus abdominis release (TAR), ensuring there is no muscle beneath the dissection plane. The diaphragm muscle is visible above, indicating the correct plane. The surgeon flexes the robotic joints towards the head to access the ipsilateral upper retro-rectus space, cutting through the posterior lamella of the internal oblique, transverse abdominis, and the diaphragm's posterior contribution to the posterior rectus sheath. The surgeon checks for muscle presence below and evaluates caudal overlap, dissecting further into the pelvis to ensure proper mesh overlap over the defect. The dissection is completed while avoiding injury to the bladder."
1297.869,1377.533,"The surgeon observes the diaphragm muscle above while working in the ipsilateral upper retro-rectus space to complete the left-sided upper TAR. The posterior lamella of the internal oblique, transverse abdominis, and the posterior contribution of the diaphragm to the posterior rectus sheath are being cut. The surgeon ensures no muscle is visible below and evaluates the caudal overlap of the mesh, dissecting further into the pelvis for adequate coverage."
1378.033,1429.533,"The surgeon navigates around midline scarring while staying close to the rectus muscle to avoid injury to the bladder, completing the pelvic dissection. The dissection resembles an inguinal hernia procedure."
1397.814,1429.533,I split this video into two videos so part two will be the rest of the operation which is closure of the posterior and anterior defect and placing of the mesh. This is wrapping up the pelvic dissection. This part is just like an inguinal hernia dissection. So this is the end of part one. Please watch part two for the rest of the operation.
