start,end,text
55.341,72.681,"Όπως μπορείτε να δείτε στο σκάννι, είναι μια μεγάλη περικάρτη ασφάλιση, 4,8 εκατομμύρια και μπιλατερική πλούρα ασφάλιση επίσης, με 2,5 εκατομμύρια ασφάλιση στο δεύτερο κομμάτι, η κάμερα εμφανίστηκε και το δεύτερο κομμάτι εμφανίστηκε."
72.661,82.494,"Αυτό είναι ένα σακέρι και όπως μπορείτε να δείτε, ασπρίζω το πλούρα φλούδι που είναι γελοϊσμένο."
82.534,91.865,Στην ίδια στιγμή μπορώ να επισκεφτώ την αριθμότητα και να δω αν υπάρχει κάτι σκληρό εκεί.
91.885,94.669,"Μπορώ να επισκεφτώ το μυαλό, μπορώ να επισκεφτώ το πλούρα."
103.812,114.883,"Τώρα, το δεύτερο μυαλό θα χρησιμοποιηθεί με ένα γραμμό και θα αφαιρεθεί στην άλλη πλευρά, ώστε να υπάρξει ανοιχτό χώρο."
114.903,122.01,"Αυτό που βλέπετε εδώ είναι το διευθυντικό περικάρδιο, το οποίο είναι πλούτο με φλούδι, όπως μπορείτε να δείτε."
122.03,126.655,"Με μία μικρή κομμάτια, θα αφαιρέσω το μέρος του φλούδι, για να βεβαιώσω ότι είμαι στο σωστό μέρος."
128.757,131.76,"Όπως μπορείτε να δείτε, είναι ένα εμμορραγικό εμφύσιμο."
133.765,160.228,"Με το κοτόπουλο θα φτιάξω ένα μικρό χώρο στο ίδιο περιβάλλον, θα προσθέσω το κοτόπουλο και όπως μπορείτε να δείτε το φλούδι ξεκίνησε να ξεχωρίζει Έχω προσθέσει τη σακσιόν στο μικρό χώρο και όπως μπορείτε να δείτε με το φόρσεπ θα φτιάξω το μικρό κοτόπουλο μεγαλύτερο"
169.473,174.859,ο οποίος τώρα είναι πολύ καλύτερος.
174.879,181.207,Το κεφάλι είναι ανοιχτό από αυτήν την περικαρδιακή εμμορραγική εμφύσιμο.
181.747,192.08,"Έχω καταφέρει να βάζω 1,5 λίτρα πλυντικού λάδου, εμμορραγικού λάδου, το οποίο νομίζω είναι το πρόγραμμα μου."
192.1,195.784,Δεν έχω ποτέ αφαιρεθεί περισσότερο λάδος από την περικαρδιακή.
197.637,208.431,"Ο σύγχρονος μπαίνει στο μικρό χώρο και το περικαρτιούμ που είναι ήδη εξακολουθεί, εξακολουθεί."
208.451,209.233,Συνεχίζω να σύγχρομαι.
210.682,223.571,και με το ενδοσκοπικό μου σύζερ θα αφήσω ένα σάμπλο και θα το έδωσω για μικροβιολογική και ιστολογική τεστ.
223.591,229.163,"Επίσης, ένα κομμάτι του φλούδου θα έδωσαι για σαϊτολογική και μικροβιολογική."
241.833,248.637,Η ασφάλιση του περικάρτιου είναι μόνο μερικές εκατομμύρια μεγαλύτερη.
248.657,253.615,Αυτή είναι μια μεγάλη ευκαιρία
256.21,257.633,της περικαρδιοσύντασης.
258.394,273.966,"Αυτό το χώρο δεν θα κλείσει ποτέ και θα συνεχίσει να δραντεύει ό,τι υπάρχει μέσα στο περικαρδιούμ προς τη δεύτερη κομμάτια και η ικανότητα της δεύτερης κομμάτιας για να προσθέσει το φλούδι είναι πολύ καλύτερη."
278.637,286.487,"Έτσι, πιο πολλά περικάρτων θα ανοίξονται και θα προσθέσουν για ιστολογία και μικροβιολογία."
288.205,310.737,"Με αυτήν την τεχνική μπορείτε να έχετε δύο φωτιά με ένα κομμάτι, με την κάμερα που έχετε εξελίξει το δεύτερο κομμάτι, που έχετε εξελίξει το μυαλό και σύντομα θα δείτε ότι με το μυαλό μου θα εξελίξω το περικαρδιόμενο και θα προσθέσω την κάμερα"
310.717,320.277,"Λοιπόν, τώρα θα συζητήσουμε περισσότερη πληροφορία για το τι συμβαίνει στο κορυφό, το οποίο μπορείτε να δείτε κάτω πίσω."
320.297,326.209,Το κορυφό είναι το κορυφό.
326.229,331.56,"Λοιπόν, θα πάρουμε τόσο πολλά πληροφορία, ότι θα ήταν αδύνατο να συζητήσουμε με κάποιο άλλο προχώρημα."
335.438,341.265,Η διαδικασία λειτουργήθηκε 15 λεπτά.
341.285,347.131,"Όπως μπορείτε να δείτε τώρα, εφαρμόζω μία μικρή 24 φρέντς δάσκη στο περίκαρδιο."
347.331,360.366,"Συμφωνικά, κάποια από τις δάσκες του δάσκαλου θα βρίσκονται έξω από το περίκαρδιο και θα μείνουν στο κομμάτι του κεφαλού, ώστε να δάσκει την πιθανότητα."
