start,end,text
35.624,41.832,Preoperative bronchoscopy provided a tissue diagnosis of squamous cell carcinoma and confirmed the presence of an endobronchial lesion.
43.694,47.479,Our operative setup was as for a standard VATS right upper lobectomy.
49.782,53.387,We identified and dissected out the right superior pulmonary vein.
54.448,58.033,It was freed up circumferentially and encircled with a silk tie.
59.549,63.514,The vein was subsequently divided with an endoscopic stapling device.
73.727,77.973,Next we identified and dissected out the truncus anterior pulmonary arterial branch.
78.694,82.399,This was also freed up circumferentially and encircled with a silk tie.
84.561,88.206,Next we divided this branch with another
88.507,89.869,vascular stapling device.
99.523,110.539,Next we identified and began our dissection of the superior segmental pulmonary arterial branch and proceeded to divide the lung first along its minor fissure staying above the superior segmental branch.
112.482,115.847,We continued with our division of the lung now along its major fissure
119.776,124.1,continuing with this dissection to the greatest extent possible.
127.063,146.222,We continued to develop our fissure dissection and proceeded on the posterior aspect of the thorax with dissection of the azicus vein and then divided the vein with a vascular stapling device.
149.257,153.365,We then proceeded to bluntly dissect a portion of the posterior airway.
154.667,160.959,We completed our anterior fissure dissection and were able to pass a silk tie across the remaining portion of major fissure.
164.045,171.72,"In this fashion, we were able to divide the remaining segment of major fissure with an endoscopic stapling device."
176.088,179.691,"Again, we maintain a safe distance above the superior segmental branch."
183.615,189.661,"Next, we dissect out the bronchus intermedius and encircle it with umbilical tapes."
192.824,197.869,Here we have created a posterolateral utility port and have divided the bronchus intermedius.
198.95,203.614,We are in the process of dividing the right main stem bronchus above the endobronchial lesion.
210.04,216.368,We have now removed the right upper lobe from the right hemithorax and are displaying the endobronchial lesion.
219.152,225.861,Next we begin our bronchial anastomosis starting with several rows of 4-0 Vicryl in the back wall of the anastomosis.
229.025,235.373,The sutures are tied down so that the knots will lay on the inside of the airway on the back wall of the anastomosis.
236.332,240.077,Here we are continuing the airway anastomosis using 4-0 PDS suture.
242.261,247.488,Now the sutures are oriented so that the knots will lie on the outer aspect of the anastomosis.
259.365,264.853,"The remaining PDS sutures are placed, anastomosing the bronchus intermedius to the right main stem bronchus,"
268.36,282.863,"Once all the sutures are placed, they are tied down and the bronchial anastomosis is completed."
282.903,294.942,The anastomosis is then tested under water using a sustained pressure of 25 mmHg.
299.393,305.427,"For tissue coverage of the bronchial anastomosis, a portion of parietal pleura is harvested from the posterior thorax."
309.216,316.052,It will then be placed over the bronchial anastomosis and sutured in place using 3-ovicral suture in interrupted fashion.
325.145,329.273,"At this point, our right upper lobectomy with bronchial anastomosis is complete."
333.16,337.889,"We perform a paravertebral block, instilling marcaine into the intercostal spaces."
343.34,347.608,A 28 French chest tube is placed in the posterior aspect of the hemithorax.
351.267,355.613,"In addition to this, a 16 French pigtail catheter is laid anteriorly."
361.823,365.668,Here is the 10 cm incision we used for our posterolateral utility port.
370.195,378.507,"Intraoperative bronchoscopy reveals the back wall suture line, as well as a patent right middle lobe bronchus."
384.764,391.973,"An intraoperative frozen section of the specimen revealed clear margins, and the final pathology was a squamous cell carcinoma."
