start,end,text
5903.817,5907.022,"Guys, see this image carefully and then tell me what is being done."
5908.063,5912.851,"You can notice here, the surgeon is applying a suture, can you see, around the anus."
5913.932,5921.484,"Circumferentially, surgeon is applying the suture around anus and he is going to tight it around the anus."
5921.684,5923.306,Can you tell me what is the name of this procedure?
5923.607,5924.388,Waiting for your reply.
5926.491,5926.872,Very good.
5927.132,5927.873,"Now, read the question."
5927.994,5928.354,Very good.
6298.688,6301.071,"It is written here, rhomboid flap."
