start,end,text
42.429,55.603,"Because of his relatively limited lung functions, we decided not to perform bilateral lobectomy, but wet resection for the left side and lobectomy for the right side."
56.782,66.116,You see now the uniportal Watts wedge resection for the left lower lobe superior segment tumor.
79.597,84.645,And you see here the safe margins around the tumor.
109.465,128.554,malignancy in the body and he showed it showed that there was no malignant tissue other than the middle of tumor so we decided to perform Watts middle lobectomy this is the patient position before the Watts lobectomy
130.762,146.977,And you see here the stabling of the pulmonary vein of the middle lobe as well as the middle lobe bronchus and the pulmonary artery of the middle lobe.
146.997,157.647,"After taking the middle lobe into an endobag outside of thoracic cavity, we perform mediastinal lymph node dissection."
