start,end,text
181.876,187.184,"For an upper lobe, I usually try to target the superior hilum."
187.284,192.072,I moved a little posterior with my targeting only because
192.862,197.212,"I was targeting the apical posterior segment, and then I put all the instruments in."
197.232,205.33,So I used the tip-up fenestrated grasper posteriorly to retract and expose the lung.
205.41,208.457,I used the bipolar
208.437,209.239,grasper.
209.48,214.372,I like it because I can combine bipolar energy with monopolar energy.
214.552,217.921,So I have this going through one of the posterior ports.
218.663,224.016,And then I have my assistant have a little five millimeter port for the suction irrigator.
225.245,230.693,I always start most of my resections for lung cancer with a posterior approach.
230.713,234.78,"So we take the inferior ligament, I take the lymph nodes out."
234.82,241.55,The five millimeter port actually for single normal lymph nodes is sufficient to take the nodes out through that port.
241.57,248.841,"So you don't have to put a, you know, either a bag or you don't have to put like a rubber glove that's cut into the chest."
249.702,251.485,So this is the aorta.
251.505,253.969,"I'm grabbing the lung for myself and I'm,"
254.624,261.96,"pushing it anteriorly, and I'm just dividing the pleura posteriorly to expose the posterior hilum."
262.501,265.648,And I like to do my hilar lymphadenectomy.
266.369,275.248,"I like the spatula because I can use small bursts of energy, and then I like the blunt aspect of the spatula very well."
275.228,296.528,it's it's if you injure the vessel it's typically because you're too aggressive with the cautery not because you're getting into it with this the spatula some people like the hook cautery i think that's fine i've used it on occasion when for whatever reason the spatula is not available but i really like the the blunt aspect of the spatula and i just do a
296.508,298.913,careful hilar lymphadenectomy.
298.933,309.673,"I find for most anatomic resections, segments included, that if you do a good hilar lymphadenectomy, really all the anatomy is out there for you."
310.447,315.278,I also like to commit myself to doing my mediastinal lymph node dissection.
315.338,317.684,So this is the subcrinal space.
318.606,320.871,The inferior vein is here.
320.931,322.014,The bronchus is here.
322.996,328.168,And I almost always do a dissection rather than a sampling.
329.752,336.746,The key maneuver here is to have your assistant with the suction push the vein down to really open up the space.
336.786,351.355,"And the other is that you should expose and see the esophagus, the pericardium, and you must see the right main stem bronchus and take all the tissue out if you're truly gonna do a lymph node dissection."
351.335,364.254,And I find the robot is really ideal for the subcranial lymph node dissection because you can really get your camera magnified really deep in that space and see all of the structures.
365.335,378.574,You can also retract a lot with the heel of your instrument and you can really get in there and work in a deep hole there and take the nodes out as an entire block of lymph nodes there.
380.056,392.237,"Then once I've done that, again, I will, for anatomic resections, also take the hilar lymph nodes in the secondary, area of the secondary carina."
393.199,399.87,"I usually approach it underneath the, between the inferior vein here and the superior vein here."
401.065,402.968,find this lymph node pretty easily.
403.208,406.953,"And again, the robotic technology allows you to take it completely out."
408.335,425.037,"It's particularly useful if the fissure is incomplete and you wanna do a lower lobectomy, for instance, from below, because it shows you exactly where the lower lobe bronchus and the upper lobe bronchus is so that you'll never make a mistake in terms of dividing the bronchus here."
425.057,428.642,"So you can see the basilar artery is there, it's all clear."
430.158,437.852,"So here now, because I'm gonna do the apical posterior segment, I'll go in the fissure here."
438.073,442.36,The robot's really good because you can see the fissural tissue very well.
442.481,448.973,You don't often mistakenly injure part of the parenchyma there.
452.399,456.767,then you can easily find the space there and just complete the fissure with the stapler.
457.007,459.652,My assistant is doing that with the handheld stapler.
460.434,463.219,The reason is because you could easily use the robotic stapler.
463.82,465.904,It just happens to be a lot more expensive.
466.224,470.632,"At our institution, we pay the minimum amount for the non-robotic staplers."
470.712,474.88,The robotic staplers are about 200 US dollars more per fire.
474.86,485.595,"So I do, I typically only use the robotic staplers for upper lobe division of the vessels."
486.436,494.607,"But for this, so for instance, this, again, this apical posterior segmental branches, it's easily stapled by the bedside assistant, it's quite easy."
494.587,497.31,and they just move one of the arms out very quickly.
498.511,502.875,I don't put an extra 12 millimeter port to pass the stapler.
502.895,506.578,But you can see I'm doing all my hilar lymph node dissection.
506.598,509.421,I find it very easy to do with the cautery.
510.322,517.008,And you can get all the branches out of the posterior segment and the apical segments.
517.949,519.01,And I just take my time.
519.13,523.935,I don't find any utility to
524.843,529.089,"Dividing veins, particularly for lobectomy up front, there's no reason."
529.129,531.011,I do most of my hilar dissection first.
531.732,534.155,"So here again, my assistant is passing the stapler."
534.816,536.899,I could easily have used the robotic stapler again.
536.939,537.8,It's fine.
537.84,542.726,"If you choose to do that, because perhaps you don't have good bedside assistance, that's totally fine."
544.148,546.692,"But again, for cost purposes, I do that."
547.333,549.455,And then more hilar lymphadenectomy here.
549.495,553.821,Another posterior branch here.
553.801,555.963,and the bronchus right over here.
557.925,564.531,"So if you just take the lymph nodes out, you take your time, it's usually very hemostatic, it's not, I don't have any gauze in there."
565.172,576.282,"If you get behind the vessel and you open the vessel, the grasper all the way, you'll have plenty of space and you don't need a vessel loop, it's unnecessary."
576.322,582.508,It's just extra time to use the vessel loop and something you have to worry about not leaving in the chest.
583.788,585.29,"So again, everything's open."
585.33,586.732,I get the bronchus out here.
586.772,588.354,I'm not in any particular rush.
588.415,594.764,I think it's a little bit harder to get around this bronchus because of the parenchymal lung tissue.
595.905,600.712,"And oftentimes when I'm getting around with the robotic instrument, I don't try to push the instrument through."
600.732,604.798,I position the instrument and then I push the tissue over it.
605.659,608.563,And then here's the bronchus here.
610.552,622.87,"I've gotten to using routinely, once the arteries are divided to the segment, using isocyanine green and Firefly technology to identify the segmental fissures."
623.791,640.255,"In this case, I just used the old-fashioned method, which was after I divided all the vessels and the bronchus, I just verified where the lesion was, and in this instance, the stapler's coming from the back."
640.235,648.25,"But you'll see I just take my finger through the utility incision, identify where the lesion is, and then staple the fissure."
648.791,655.843,"So I'm just confirming that the lesions... By the time you all do all this work, the lung is quite nicely atelectatic."
659.827,661.569,So I just stapled the fissure here.
661.609,668.138,"But Firefly is really a great technology, and I would recommend that you use that to identify the segmental fissures."
668.198,670.622,"It's very well, easily to do."
674.086,680.415,"And then again, you can pass the staplers in any direction you feel is the most feasible to do that."
683.319,689.547,"And then you use a bag, which I take the lesion out through that small utility incision."
690.067,697.098,"If somebody has a high-riding diaphragm, they're obese, they have a lot of emphysema, you could certainly do a total port technique."
699.862,700.944,We don't use epidurals.
701.505,709.117,And then our anesthesiologists are actually now trialing doing serratus anterior blocks at the end of the case as well for pain control.
710.198,711.42,And then a single chest tube.
718.99,720.692,You can see the lung inflates nicely.
