start,end,text
0.689,5.116,Welcome to this series of videos on posterior approach vatsalabectomy.
5.536,28.57,"These videos have been performed by Professor Tristan Yan at the Royal Prince Alfred Hospital in Sydney and we're using the posterior approach where the surgeon stands at the back of the patient, the camera is just posterior to the inferior border of the scapula and then there are two lower down ports, one more anterior, one more posterior and you can see"
28.55,54.304,two Roberts with peanuts here just coming from those lower ports so some really important things to say firstly this is not sped up this is not edited this is real-time the whole lobectomy so actually posterior approach can be a very fast technique the other useful thing for watching this video for is let's say you're doing redo surgery and want to look for a new technique
54.284,82.587,if you go posterior having gone anterior then you're going to have far fewer adhesions and be able to take them down also robotics is much more of an either posterior or inferior technique and the view is very similar to what you're going to see in the video here so let's get cracking so we've got an absolutely wonderful fissure here so at the top of the screen is an upper lobe and the lower lobe is at the bottom of the screen
82.567,88.813,And we're just gently using peanuts to brush away the lung off the pulmonary artery.
89.574,103.428,"A lot of people call posterior approach the Fischer based technique because you go straight into the fish, you identify the pulmonary artery, which is the thing we're almost interested in, and you deal with everything from there."
104.049,111.156,"Also, Tristan is going to find some quite silicotic or stuck lymph nodes, and we're going to show you a few things about that."
111.575,126.018,"So you can already see that we've straight away got to the posterior segmental artery, a bit lower down just where the peanut is below is the lingula fur, which we can do later."
126.058,135.253,"But generally just get the vessels you can see and right in front of us, beautiful view straight ahead of us is a posterior segmental artery."
135.233,145.163,"So we're going by vats so we've got really good feel and we can use a nice disector, a nice blunt tip disector to get around this vessel."
145.604,157.376,Just anterior to this disector in Tristan's left hand is the bronchus so you can feel that and he's just going to use a lovely gentle blunt dissection technique.
157.396,160.639,So you're going to push till you feel any resistance and then separate.
161.12,163.502,Push a little bit and separate.
163.482,171.192,Junior surgeons do is to push too hard and separates too infrequently But Tristan's just on a really nice gentle dog.
171.252,182.548,No poking until you see the tips of your instruments But now we've seen the tips of these instruments He's got round this posterior segmental artery and we can instantly come in with a staple gun.
182.568,190.198,So Tristan's got the Cavidian Tan 45 here doesn't really need to articulate it much comes from
190.178,205.2,anterior utility incision probably about the eighth space pretty low down or seventh and it's in a nice line because it's along the line of the fissure so it's a great line to bring your stapler in
205.18,218.427,You can use either a 10mm camera or a 5mm camera posteriorly and again your third incision can be about 5-7mm and doesn't even need a port in it with this technique.
219.87,223.257,So you can just see a nice metal tipped sucker there just to
223.237,240.84,clean up everywhere and do a little bit of dissection as we now go and look at the anatomy and what you can see there is a slightly silicotic or stuck lymph node this could potentially cause us some problems but what we're going to use is use nice blunt instruments to try and see if we can
240.82,257.766,push that off the pulmonary artery and the little key thing here is to make sure that we don't accidentally poke through this silicotic lymph node and damage the pulmonary artery and the absolute key which Tristan will share with us is to get into the sheath of the pulmonary artery because
257.746,273.021,silicotic lymph nodes won't really disrupt the sheath of the pulmonary artery so if you can get into that and they certainly won't invade into it it's very different to an invasive malignant lymph node where you might have concerns
273.001,282.503,"that it could have invaded that vessel, in which case you need to make sure you've got control and a safety mechanism if you get bleeding."
282.964,286.251,So even potentially exposing the pulmonary artery anteriorly.
286.712,289.238,But here it looks silicotic.
289.218,290.94,Doesn't look too malignant to me.
290.96,299.507,"You can see the upper low bronchus just to the left of it, then a silicotic lymph node, then the apical segmental artery."
299.527,302.73,"So the key thing is, can we get into the sheath?"
302.79,306.474,"Tristan's going to use nice blunt dissection, not going to diathermy."
306.894,312.379,Just going to see if the tissues separate away enough so we can get a dissection.
312.399,313.48,"And yep, there we go."
313.94,315.622,We can see the tissue plane.
315.642,317.403,You can see the pulmonary artery there.
318.264,319.225,It's in the sheath.
319.205,323.255,and we're just going to push until there's any resistance and then separate.
323.816,334.463,"We're actually just at the posterior side of the vessel, so there's some soft tissue here, just some pleura and things, so we can just diathermy this off."
334.443,337.748,This will give us a lovely view of the apical segmental artery.
337.768,339.27,"We're just on the aorta, the tips."
339.831,343.617,You can see the aorta miles away from the recurrent laryngeal nerve and the vagus.
344.278,348.264,"And you can see to the left of this soft tissue, you can see the bronchus there."
348.284,351.949,"And further to the left, the far left, is the lingular artery."
352.911,357.037,And just bringing in a nice diathermy.
357.157,358.659,We haven't used much diathermy here.
358.76,363.066,Just blunt dissection and peanuts is plenty.
363.046,368.694,"We owe this technique to Bill Walker, who invented the posterior approach."
368.754,380.73,"He started it way back in 1992, nearly 30 years ago, and he did vatslobectomy for 15 years before anyone else was really doing it in great numbers."
380.791,386.218,So a huge amount of thanks and gratitude has to go to this incredible pioneer.
386.198,389.005,He was the European Bill McKenna.
389.406,402.942,He was the person trying to tell us all that we should be doing lobectomies more gently in an era that all mixed practice surgeons wanted to do was lots of sets of grafts and just bang on a quick lobectomy at the end.
402.922,426.28,then we're turning down all the high-risk cases whereas now in VATS lobectomy we know we can do much higher risk cases we know we can do good lobectomies so many thanks to Bill Walker for his inspirational leadership and incredible training that both Tristan and I benefited from so so we're now around the apical segmental artery we've got past that silicotic lymph node we've gently
426.26,430.545,"Got round it, we used tactile feedback as well as visual feedback there."
430.986,434.21,"We weren't poking, we were just spreading when we could see the tips."
434.971,439.957,And we're round and now that was a nice straight dissector and we can follow this with a straight load.
440.778,445.905,This is another tan 45 with no articulation and we can just slip under there.
446.392,448.935,We don't really need a vessel loop around here.
449.675,450.917,We could if we had any worries.
451.377,453.82,"Nice and straight, looking at the tension on the vessel."
454.28,456.863,"And then this, when you do the firing, it's the critical point."
456.883,459.085,You don't want to do any motion of the stapler.
459.566,464.811,"And until you've pulled it back and opened it, no motion at all in your stapling."
466.273,468.315,"And also, there's no tension on the lung."
469.136,470.937,Tristan wasn't pulling up in any way.
470.957,472.279,So that was a really good firing.
472.959,474.441,We've got the lymph node.
474.421,492.413,dissected out pretty nicely just giving it a little clean just looking to see if we can see the anterior segmental artery a little bit of soft tissue and around so so the next thing we're going to do is just have a little look at can we expose out this lingular artery and can we get the anterior oblique fissure
492.393,494.217,Keeping it really nice and dry.
494.257,497.023,It's done a beautiful job here of keeping it dry.
497.043,499.909,It's quite a good anterior oblique fissure.
501.172,503.698,Here's another nice advantage of the posterior technique.
503.718,508.528,You can just lift up and you can really see the tips in the anterior oblique fissure.
508.508,537.03,and so you can just use this dissector just to come just anterior to the lingula you know this is a safe spot you can see your tips and we'll just get the tips to poke out here and then we can follow this up with a stapler you can see it's a great fissure Tristan is paying a lot of attention on not doing any diatherming on the lower lobe we want to keep away from the lower lobe because even just the smallest of
537.01,552.775,of diathermies on lower lobe pleura is going to cause an air leak and the real key to success here is having air leak less surgery as well as painless surgery because no pain and no drain that pain that patient's going to go home so if you can get the drain out day one
552.755,582.205,and they're not sore you know why are they in hospital so get them out quick so there was a lovely exposure of the anterior oblique fissure it's now just ready for a quick firing because it's such a thin anterior oblique tissue anterior oblique fissure tristan's using a tan reload if it was any thicker you could use a purple but that was lovely and thin and you'll get better more aerostatic seal
582.185,584.93,in a thin fissure if you use the tan.
585.551,588.936,So now we can see the lingular artery very nicely.
588.956,592.282,There's a few slightly tedious lymph nodes there.
592.783,596.369,"Again, just let's see if we can push them off the artery."
596.429,598.032,Can we get in the sheath properly?
598.573,601.678,"You can just see it as a sort of glassy, almost like"
601.658,618.081,uh a sort of just a little layer just on that lingular artery can we get inside that um almost like cellophane just covering so you want to just get just inside that so we're just seeing can we get inside that and get the other side
618.061,639.597,uh so not poking but spreading really really important beautifully demonstrated here and and so that was a really neat demonstration how you don't poke you separate and do five seven ten separations far better than doing one poke and getting in trouble so following this up with a another tan 45
639.577,642.041,And a nice stapling of the lingular artery.
642.061,650.976,"So now all we've got is the anterior segmental artery, the A1, and we've got the bronchus."
651.076,653.581,And then the vein is right at the front.
654.442,661.534,But the posterior approach is great because you can almost ignore or not worry about getting around the vein because we're going to worry about getting around the bronchus.
661.514,665.648,We'll have that final artery and then the vein just is the last thing to fire.
666.35,673.313,So Tristan's just cleaning up before getting round the left upper lobe bronchus.
674.845,678.21,You want to just make sure you know you've got the correct tissue plane.
678.23,680.173,"If you're in the correct tissue plane, it's easy."
680.754,683.979,"If you're in the wrong tissue plane, it's difficult and you get resistance."
684.039,693.253,"So stop, regroup, clean up, get rid of lymph nodes if you think you're not making progress around either a bronchus or a vessel."
693.413,695.436,Really important tip there.
695.416,717.525,so he's just separating these lymph nodes just looking at the inferior border of the bronchus and then we've got a really good vision of the pulmonary artery there's just a small bit of tissue so you can see the pulmonary artery really nicely so this technique getting around the bronchus is absolutely key to know exactly where your pulmonary artery is
717.505,740.712,and this holds for anterior approach and robotic approach all sorts of approaches just know exactly where that artery is so when you're getting around a bronchus so so he's just separating the tissue plane between the bronchus and the vein and trying to keep the instrument on the bronchus and now he's imagining in his mind where the tip of
740.692,761.62,his dissector is and also using that tactile feedback and also looking to where he needs to go never pushing just moving it up and down or separating and you being really patient so it's being really patient he's done lots of separations and he's not poking at this stage if he were to just poke
761.6,775.491,you know he could get in trouble but he's going to make sure he sees the tips before poking now he's just wiggling it up and down he's not poking and he's doing lots more separating before
776.045,794.796,before he's pushing so just separating up and down getting an impression of where the instrument tips are and and when you're new to this just spend loads of time doing this if if you're really worried about whether you can get through just take that lymph node out make sure you've got good vision
794.776,799.083,And then sort of spend lots of time looking to see how the tissue is moving.
799.745,803.872,And Tristan with his peanut is feeling the tips as well.
803.932,805.675,That's a thing you can do.
806.096,810.123,So he's just feeling so you can feel where the tips are at the moment as well.
810.323,812.667,So he knows where they are.
814.486,817.069,And he's just lifting up.
818.11,823.677,"And because he could feel with his dissector where it was, he knows where this is going to come out."
823.697,829.784,You're actually starting to see that anterior segmental pulmonary artery just underneath the lymph node there.
831.025,834.99,And so you know where the structure at risk is.
835.451,835.871,And there you go.
835.891,837.733,You can just see the tips now coming through.
837.813,840.156,"We just got a glimpse of the tip, so you know you're safe."
840.136,841.838,We can maybe peanut on them.
842.279,843.561,But now we know that we're safe.
843.581,845.043,We're just behind that lymph node.
846.065,848.628,And part of that was knowing where the tips are.
848.689,850.912,Part of that was feeling with the peanut.
851.973,858.583,And it was absolutely vital to not poke just to sort of spend some time there.
858.563,887.153,and get around safely so we're safely around the bronchus this is very clearly the upper low bronchus it was a perfect fissure the lower low bronchus clearly will be behind the pulmonary artery there's no need for an inflation test here particularly and we're going to lift up as bill walker calls it the crane maneuver and you're going to lift up with a vessel loop and that will make the stapling really easy and we've made the track do a few separations before you pull a vessel loop through
887.133,913.36,sometimes it's a mistake where as soon as you get your dissector through you pull the vessel loop through and you've forgotten to increase the size of the track always do a nice good load of separations before you pull your vessel loop through otherwise a stapler is bigger than a vessel loop so you might get stuck again so we're just going to lift up nicely with our posterior instrument
913.34,937.12,"and get a good hold and lift up, craning it up into the sky there keeping it nicely far away from the pulmonary artery just to make absolutely sure that there's a good track for the stapler and then got a nice non-articulated firing for a purple 45 and this is a Covidian purple 45"
937.1,943.348,This is a manual stapler but you could add the Signia gun if you wanted to if you like automatic staples.
944.009,957.025,Also get lots of lubrication on your staple firing so that you don't have too many staples because it's not very safe to have a staple in a firing because it can get caught in the knife.
959.107,961.47,And we're just going to do the firing and that's the bronchus done.
963.391,964.292,So nice and easily.
964.312,967.097,So we're 16 minutes into a lobectomy.
967.217,968.179,We've not sped it up.
968.199,968.98,We've not edited it.
969.0,969.921,We've not cut away.
970.402,973.146,So you can see how this can be a very quick technique.
974.208,987.529,And it's really important to work on your efficiency and on getting the times down so you can spend time on difficult bits if you get stuck because then you know you can go quickly at the easy part.
987.569,988.751,So we've got the bronchus done.
988.771,990.073,There's now just a
990.053,1019.453,a vein anteriorly but most importantly we want to get this anterior segmental artery the A1 artery dissected out and you can see it there there's a bit of a silicotic lymph node but just gently brushing between the vein and the artery and obviously the absolute key thing is to get a a dissection between the artery and the main pulmonary artery and this wants to be with a lovely gentle sort of dissection technique
1019.433,1022.94,"So we can lift up by holding the bronchus, that's the structure that's coming out."
1023.462,1027.029,"And then we are, this is really key, this, don't poke too much here."
1027.55,1029.574,So only poke if you know what you can see.
1029.615,1031.699,We can see the tips there very easily.
1032.18,1035.427,So we know we're above the pulmonary artery.
1035.447,1037.391,"So that was very, very easy."
1037.371,1042.437,"But if you were to not quite see the tips, don't be encouraged to push too much."
1042.477,1044.2,Just occasionally you can have a second vessel.
1044.26,1049.566,"There's quite a lot of variable anatomy, especially the left upper lobe is probably the most variable."
1050.407,1054.733,Always watch out for another early separation of segmental vessels.
1056.255,1058.418,But here that was really nice and safe.
1058.998,1063.564,We know that we're around the anterior segmental artery and
1063.544,1086.801,and we are safe from the main pulmonary artery so we can now just follow up with a staple got a tan 45 or we could use a tan 30 whichever you like lovely easy staple no articulation straight up the fissure with a nice low intercostal space there the intercostal space widen out the lower you get and the more anterior you get causing less pain
1086.781,1099.525,so that's beautifully done so now we've got is the vein but we don't have to dissect out the vein because we know we're above the pulmonary artery there and if i can get my stapler now around what's left in the hilum
1099.64,1124.112,there's absolutely zero chance that you can get the main pulmonary artery if you can get the staple around the back there it's impossible to get the pulmonary artery so we can now just staple everything which is a real nice little technique for the posterior approach you almost don't have to think about the vein you only have arteries and bronchus to do so there you go impossible to hit the main pulmonary artery so whatever else is in there
1124.092,1143.028,it's expendable it's all vein even that little tiny apical vein branch there that Tristan's just looking at and there's a little lymph node that he'll come back and take out fully as he's doing his lymphadenectomy so not shown in these videos here is the full lymphadenectomy after he's taken the
1143.008,1159.718,the lobe out then it really is very straightforward to do station seven you to get just the most beautiful view of it with posterior approach and then we'll go and take station five and six and also go and look at the inferior vein and take out eight nine because we all need to do
1159.698,1162.022,three different stations that are N2.
1162.042,1164.005,"But look, no dissection of the vein at all."
1164.486,1168.833,"We know we're above the pulmonary artery, so you just staple the hilum."
1169.935,1171.157,This is a purple 60.
1171.838,1173.26,Don't even have to think about the vein.
1173.321,1177.808,"Lovely, easy, quick and rapid way to complete your lobectomy."
1177.788,1183.262,"I hope you found that interesting, and even if you're not used to posterior approach, you've liked the look of it, it'll help you."
1184.104,1188.976,"If you're difficult in an anterior approach, you could go to posterior, or maybe it'll help you in a robotic surgery."
1189.698,1192.405,"Let us know what you think, and thank you very much for watching."
