start,end,text
110.542,115.549,"I conducted a lot of uniportal surgery, so I think I should get studied."
115.569,122.458,"I get studied with robotic lobectomy, but it depends whether you are really experienced."
122.579,124.902,You can start with a VAS resection or whatever.
125.042,131.271,"I started with lobectomy, so this is a patient with, you know, lower lobectomy."
131.251,140.529,"right lower lobectomy, you can either direct from vein to bronchus to artery if the fissure is not good."
140.589,148.585,"But for this patient, the fissure is good, so I firstly lay pulmonary vein, then pulmonary artery, then the bronchus."
148.565,151.49,"Anyway, it's one of my first training cases."
151.911,168.16,"I think when you get started, you should just take your time, just dissect and name structures, and there'll be no problem from the experienced open surgeon or traditional VAS surgeon to conduct initially with lobectomy."
169.355,185.551,"So, for my simple cases, I also, you know, get analyzed the data for the first more than – for the first 150 cases, we conducted a propensity score matching analysis and got a paper published in EGCTS."
186.112,194.62,"And we found that there's no – there's superiority for rats with regard to, you know,"
205.494,215.006,"And then when I got finished about 150 cases of lobectomy, I moved to a segmentectomy."
215.027,217.41,I think segmentectomy might be a little more complex.
217.51,223.898,"But firstly, you should initiate some typical segmentectomy, for example, S1 or S6."
223.878,227.003,and maybe lingual segmentectomy.
227.483,238.24,"So for segmentectomy, I think you just dissect the namal structures a little bit more distal than lobectomy."
238.36,243.688,It will be not difficult when you have experience of a lot of lobectomies.
244.649,251.64,"So here for this S1, firstly I dissect V1a, then dissect A1a."
252.987,266.001,"and then I remove the level 13 lymph node, then I move to the S1B1 bronchus."
268.445,278.448,"So for my initial 100 cases of semantectomy, we analyzed it and give a learning curve study."
278.468,282.558,"I found that for the first 20 cases, it is a learning experience."
282.878,287.449,"For another 20, you got consolidation experience."
287.429,296.762,"After 150 cases, after 100 cases, you can, you know, achieve a stable, you know, operative time, lymph node yield, and morbidity and mortalities."
297.143,302.591,"Then based on this retrospective analysis, we conducted two clinical trials."
302.651,309.1,"One is to, you know, identify the long intersegmental plan with some kind of a dye."
309.08,316.953,"Yes, maybe we can use inflation-deflation method, but for some patients with COPD, it's not a good method."
316.993,325.587,And then another kind of trial is to compare energy instruments or stabilizing device to dissect into segmental plane.
356.954,369.429,"So, for this patient, this case is S2B plus S3A, we get a preoperative 3D reconstruction."
369.89,380.042,"For this case, in the first we will dissect V2C, then we will expose the bronchus B2A and B3B."
382.216,386.709,"For this case, we will then dissect the B2B."
387.812,396.917,"When the B2B dissected, the A2B arising from the recurrent A2 will be exposed."
401.757,412.257,"Now the A2 exposed, we mobilize the A2 and actually dissect it with a curved stapler, but you can also dissect with the harmonic."
413.64,416.966,It will be no problem because it's less than seven millimeter.
421.555,424.12,Then we mobilize B3B.
426.344,428.608,The subsegmental branch is very small.
428.628,433.758,"You can dissect it with a white cartridge, or you can either ligate it."
434.799,438.947,"When the B3B is dissected, the A3A is exposed."
439.268,442.193,"You can dissect it, or either you can use harmonic."
443.956,444.437,"Actually,"
445.497,459.074,"When all the named structures dissected right, then you can use inflation and deflation method, and you get a very nice margin in an intersegmental plane."
459.795,469.968,"And for the subsegmentectomies, we got it analyzed and published a paper in ATS 2018."
470.148,473.412,It's about the first 20 cases.
485.356,488.18,"And for this case, it's a preoperative."
488.621,492.947,It's a locally advanced left upper lobe lung cancer.
493.147,494.449,It's very central.
495.13,497.894,And it's with new adren chemotherapy.
498.254,505.905,"But I want to say whether it is a simple case or a complex case, I think the most important thing is to make sure the procedure is smooth."
506.326,507.307,Don't risk the patient.
507.327,508.689,That's the most important issue.
508.97,514.958,"So firstly, I dissect the left upper superior vein."
514.938,521.59,"Then we, because the tumor is very close to the bronchus, so I"
522.515,528.002,actually get a vessel loop to get the proximal PA controlled.
528.482,535.371,Then we try to remove the left upper lobe to get a good exposure.
536.653,543.04,"But at this point, I'm just trying to whether I can mobilize the PA from the bronchus."
543.841,545.003,Seems like I'm not sure.
545.063,550.75,"So the following steps, I will actually control"
551.793,556.24,proximal and distally for the PA with the bulldog.
558.884,564.233,Because I'm not sure whether it is really invasion or just another invasion.
564.634,574.189,"Then we went after the PA controlled, we tried to give it another try to mobilize the PA from the bronchus."
577.223,588.009,"For me, I used, actually, unfortunately, I used S system because the other advanced system is not available in my hospital."
588.71,589.693,I used forearms.
589.993,593.722,"With the fourth arm, we can retract the PA away."
593.742,594.945,It seems like it's...
594.925,612.067,"it's not invasion, it's not real invasion, so we retract the PA away, remove the bulldog, then we can very smoothly to reconstruct to give a sleeve resection because, you know, with the advantage of a suture of a robot, there will be no problem."
614.97,622.84,"Okay, and I get this series of case published in a journal, World Journal of Surgical Oncology in 2019."
625.587,629.45,"I will not show the suture, the anastomosis."
