start,end,text
9.245,14.271,In LapSim VAS module you dissect and mobilize the upper right lung lobe for complete lobe resection.
14.531,19.177,"The vessels, the fissures and the bronchus are divided sequentially with appropriate endosteplars."
20.278,25.024,Structures are prepared with sponge sticks or if you like other instruments selected from the menu.
27.747,35.877,Turacoscopic forceps introduced through the posterior port is passed behind the superior pulmonary vein after clear identification of the middle lobe vein.
37.156,44.404,The superior pulmonary vein is then encircled with a vessel rubber loop and enough space to introduce a stapler around the vessel is created.
53.615,63.366,The endovascular stapler is introduced through the posterior port and the thin blade is passed behind the superior pulmonary vein which is then divided after removal of the vessel loop.
109.128,114.119,"When the pulmonary vein is divided, the pulmonary artery and the truncus anterior are visualized."
123.441,126.107,The minor fissure is divided with endosteplars.
137.073,147.405,"After the transection of the fissure past the artery, the middle lobe drops down and exposes the posterior part of the artery and the remaining arterial branches to the upper lobe, which are then transected."
148.686,154.313,The exercise ends with the removal of the complete upper lobe in an endobag through the utility incision.
155.834,159.098,"To see the complete exercise, please contact Surgical Science."
