start,end,text
19.15,23.698,Welcome to this amazing new era of uniportal robotic surgery.
24.44,26.022,So Diego's done it again.
26.042,29.228,"10 years ago, he invented uniportal VAT surgery."
29.849,37.002,"And in the last year, since September, 2021, he's done over 100 uniportal robotic operations."
37.643,41.31,And I'm delighted to say that we have been given the opportunity
41.29,68.597,to watch this fantastic operation which is a left upper lobe uniportal robotic sleeve resection in a young lady with a carcinoid in the left upper lobe occluding it completely so here we join Diego the left upper lobe was completely collapsed because the carcinoid tumour was occluding the left upper lobe bronchus and so first of all he obviously had to get down a load of the adhesion so how does he do it?
68.577,74.024,The uniportal incision is usually one space lower than is normal uniportal incision.
74.665,77.429,You'll get some glimpses of the setup.
77.469,79.472,"Basically, this is an XI robot."
80.033,84.579,The gantries are set to the top of the patient.
84.999,90.407,"The camera is posterior, looking 30 down, as you can see in arm 3."
91.148,94.332,And then there's an arm in arm 1 and arm 2.
94.767,112.101,of note they're not crossed the left and right hand controllers you do not have to switch over so actually there's no clashing which is quite a surprise and Diego's been working very hard on this with Mugger and and several other surgeons from around the world and
112.452,116.156,And so it really has refined this process brilliantly.
116.596,123.743,"So here we see him at the anterior hilum of the left upper lobe, just exposing up the phrenic, getting rid of some more adhesions."
123.764,125.325,And now he's getting into the fissure.
125.886,135.315,"As we see in just a moment, young people, even if they do have a collapsed left upper lobe, often do have a very good fissure because they're young non-smokers."
135.555,138.038,And we can just see the pulmonary artery and the fissure there.
138.372,142.338,"quite a lot of adhesions, but the fissure itself isn't too bad at all."
142.358,147.186,So Diego is using a fenestrated bipolar in his left hand and a Maryland bipolar.
147.547,151.313,"Both have bipolar energy, which is really great for diathermy."
151.333,153.336,You can see the views are absolutely fantastic.
153.676,155.419,You can look straight down your instruments.
155.737,160.991,And then his assistant has a long sub-xiphoid metal sucker.
161.452,171.197,"Needs to be a sub-xiphoid, which is a 50 centimeter long sucker, because you do need that extra length to get past the standard robotic arms."
172.578,181.907,Other important modifications to move from multiportal robotics to uniportal robotics is that it's good to use the TORS trocars.
181.927,189.834,"They're the trocars that the ENT surgeons use as they are thinner and obviously use no CO2, normal Alexis ports."
190.815,191.595,And off you go.
191.696,195.239,"So there's just a station L11 lymph node, an interlobar node."
195.679,199.783,Diego's just freeing up some more adhesions at the posterior hilum there.
199.763,201.245,And now we're coming anterior.
201.545,203.148,You can see the pulmonary artery at the top.
203.188,210.879,Just look at the anterior hilum where the upper lobe vein is and cleaning up this area.
210.919,217.688,There's some lymph nodes just anterior to the pulmonary artery which are basically going to be on the bronchus.
217.837,220.141,So we use just three arms.
220.161,224.768,So one camera arm you can see bottom left and then two instrument arms.
224.808,226.491,It's actually really easy to set up.
226.551,228.894,It's much quicker than multiportal robotics.
229.756,235.244,"You just do uniportal incision, put your Lexus port in and drop in your three arms."
235.344,237.027,So it's actually quite a quick setup.
237.007,260.854,which is a very attractive part of the operation obviously the view is exactly the same as uniportal vats but you have your wrist instrumentation you've got bipolar diathermy which is great so here we are looking at the lingula artery we've got round it very nicely and so Diego slings it an assistant is really useful really important it's good if they've got good vats skills
260.834,269.262,"They do have to dance around the arms a little bit, but actually they're really useful for bringing slings in, for retracting, for suction."
270.423,281.154,"Also in multiportal robotics use quite a lot of cigars because it's difficult with the CO2 to use a sucker, but in uniportal robotics it's very easy to use very liberal suction, which is great."
281.194,289.862,"So when you staple, as we're seeing here using the SureForm stapler with a white load, you take out"
289.842,312.627,your 8mm TORS trocar you insert the 12mm trocar and introduce your stapler quite often you need to pull the remote centre back quite a bit further out of the chest just so you can get a good straight shot and there's the Sureform 45 just dividing that lingular branch of the pulmonary artery to the left upper lobe very nicely done so again you do need
312.607,329.265,a decent assistant who knows how to change the arms quite nicely so that you can seamlessly change from your 8mm trocars and your Maryland to a 12mm trocar for the stapling so now we've found two quite small
329.954,340.192,posterior segmental branch is maybe quite small due to the fact that the lobe has been collapsed and Diego is now going to take both at the same time.
340.633,350.73,"So we pulled out the 8mm trocar on the arm, we've swapped it for a 12mm and in goes the stapler, pulling back the remote centre a little bit and then nice straight run."
350.71,357.298,The real advantage is you can look straight down the stapler with uniportalism and a really nice firing there.
358.019,362.906,Straighten it and pull it out and then change over back to the Maryland.
363.346,376.363,So that's three segmental pulmonary artery branches just going in the fissure just to divide out the rest of the pulmonary artery and start to get the back of the bronchus freed up.
376.816,379.989,"So just looking, it is a different view to multiportal robotics."
380.009,387.619,"Multiportal robotics is quite a posterior or an inferior approach looking from below, but you do get that anterior uniportal view."
387.97,389.692,This is a nice little view.
389.732,393.497,"The very, very small little vessel looks like it's coming from the pulmonary artery."
393.838,398.704,"So instead of trying to bring the huge stapler in, because you've got robotic arms, it's really easy to tie knots."
399.465,404.752,Diego's brought in a medium black tie and he's just going to tie this branch.
405.212,416.847,Quite a lot of robotic surgeons do quite liberal tying of branches rather than stapling due to cheapness and due to how easy it is to tie in the robotic world.
417.097,443.56,nice and quickly tied there and actually you can then use his bipolar instrumentation to just divide that vessel distally so a really good safe way to get rid of a small segmental branch there nicely done and then his assistant can come in and just cut those ends short so they don't get in the way of anything and a really good way much better than stapling that tiny branch there really
446.358,448.94,We're just now going to go to the anterior hilum.
449.0,455.827,"So we've taken the lingular branch, either a couple of posterior segmental vessels, or maybe one was posterior, one was an apical."
456.387,463.974,And now we're going to go anterior and we're going to go and identify the superior pulmonary vein and the pulmonary artery.
464.655,466.156,"So again, really nice view."
466.617,467.658,It's really close up.
468.298,471.622,You've got your bipolar instrumentation in both hands.
471.722,473.243,Here's just a view on the outside.
473.695,478.404,"The assistant does have to work hard, keep the camera clean, keep things away from clashing."
478.444,481.49,Just have a little look at how the gantry is set up.
481.931,483.715,A little bit angulated posteriorly.
484.336,489.105,That's just the best way to set up your robot.
489.406,506.553,"We're just looking at a station 5 lymph node, quite a decent size station 5 lymph node and really good example of how the bipolar instrumentation can keep that, and diathermy can keep that quite dry and remove that station 5 lymph node very nicely."
506.593,509.237,Now just in the anterior hilum here.
509.217,516.625,removing some station 10 nodes and now identifying the gap between the bronchus and the vein.
517.026,534.685,The bipolar instrument in the left hand is really quite a soft grasper so it's quite safe to grasp the pulmonary vein and then Diego's just now looking for the exit point between the main pulmonary artery and the vein so that we can get an instrument safely passed around the back of the pulmonary vein.
534.833,548.052,"I'm sure Diego misses a little the tactile feedback, but this is more than compensated for by the 3D vision and the fantastic vision you get in robotics, so that as long as you watch your instruments around, it's entirely safe."
548.072,562.292,"So slung the left superior pulmonary vein, and now again we can introduce the short form 45 with a curved tip and a really nice shot on this pulmonary vein."
564.753,589.14,the short form 45 does a really good nice staple line it's a great stapler has nice adaptive compression so it really knows how much compressive force to use and it won't even fire if you're using tissue that's too thick for it so a really good safety step there so that's the vein taken so we've taken nearly all the arteries it's probably an anterior
589.323,607.905,segmental branch that we now need to have a look for so we're just going to carefully lift up the vein the assistance just doing a bit of suction a little bit of retraction and we're going to see if we can identify an anterior segmental branch of the pulmonary artery and here indeed we're starting to see it really nicely
608.122,612.571,"Remember the surgeon has 3D vision, far better vision on the console."
613.633,617.902,You can also have a second console as well for a second surgeon.
617.922,627.261,And we've identified from anteriorly and now we're going into the fissure to posteriorly identify the back of the anterior segmental branch of this pulmonary artery.
628.034,632.546,And you can now see also the bronchus really quite well dissected out.
632.626,636.977,So we've been anterior and now from posterior just making sure.
637.037,638.902,And you just saw a little sling there.
639.183,644.777,I think you may have just seen a little yellow sling and identifying that we have gone all the way to front to back.
644.757,650.446,So that is quite a nice little step so that you're absolutely sure you're around the vessel correctly.
650.826,661.062,Getting a sling round to be 100% sure that we're around the vessel safely and then instrument round just to make sure we've got a good space to pass the stapler.
661.042,686.205,probably could have taken this vessel from the front or the back but it's very nicely demonstrated here that we can take this vessel from behind because we've got space we've got a sling we've cleaned it up from both sides and so this is the last segmental branch using the short form 45 and that's all the arterial branches out that comes
686.523,714.775,and change back there's a bit of telestration you might just see just there just showing that some lymph nodes in front of the bronchus there indicating to the surgeon that that's what we want out so we can just grasp that with our fenestrated bipolar and dissect that out because that's now going to show us the bronchus which is really the main event because this is the bronchus with the occlusive tumor in it it's a tumor in the left upper lobe bronchus but it does cross
714.755,739.952,the lower lobe orifice although the lower lobe orifice was not occluded it was going across it as you'll see so now just taking off this lymph node lymph nodes are the key to good thoracic surgery if you get rid of your lymph nodes you see the anatomy so taking this L11 interlobar node is going to be really good for being able to see between the artery and the bronchus
740.185,744.191,And now just quickly taking the inferior pulmonary ligament.
744.211,751.142,It's probably quite a good part in the video just to show how easy it is to get all the way to the inferior pulmonary ligament by uniportal robotics.
752.384,760.778,"When I first started doing some cases, I was a little bit worried that you wouldn't be able to get all the way to the top of the bottom of the chest, but it's absolutely very straightforward."
761.259,763.442,So here's the inferior pulmonary ligament.
763.422,783.49,ligament just taken very easily and quickly a little bit of help from the assistant to provide suction and lift the lower lobe up now that's the ligaments taken so that the lower lobe will be able to move upwards be quite good because we're going to take quite a good sleeve so we're gonna have to move that lower lobe bronchus up quite high so that was a really nice move now
783.47,793.33,"just going between the bronchus and the basal pulmonary artery, get out all the lymph nodes so we can really see both sides of the bronchus really clearly."
793.771,801.546,That's a really nice demonstration of how it's really important to get your anatomy out very nicely before you dive in and cut the bronchus.
802.842,808.234,"So we can see there the basal pulmonary artery, you can see the segment 6 artery just going to the back there."
808.275,813.346,Here's a view of this absolutely beautiful operating room in Brasilia.
813.928,818.779,"You can see the surgeon console to the right, you can see your assistant with screens everywhere."
819.22,821.425,You've got the beautiful blue.
821.405,827.893,lighting so that you've got great contrast between the red of the screens and that you've got good light for the nurses.
828.794,836.082,A really beautiful setup here in Brasilia where this was performed as live surgery in July.
836.783,851.04,"So now to get optimal vision, Diego's done a great job of slinging the base of pulmonary artery and he's actually going to use a trick he commonly uses in uniportal VAT surgery, which is to sling things to the back of the chest just by stitching it to the chest."
851.02,855.436,It takes just five minutes but really helps with your view.
855.938,862.06,I think this is a really important tip to anybody who's low in experience in the complex cases.
862.31,864.072,that vision is everything.
864.092,878.65,"You've got to see everything as well as possible, and it's really worth slinging things out the way, making sure your vision is as perfect as possible, because there's nothing worse than trying to stitch down a deep, dark hole where you can't see nicely."
878.73,889.363,"So slinging the pulmonary artery with a stitch to the back of the chair, super easy, five minutes work, and yet definitely worthwhile."
889.343,912.87,doing that so now we're going to go back to the bronchus so cleaning it up anteriorly we get a nice view of the pulmonary artery in the distance the left upper lobe bronchus looking really fat and full of tumour as it is there's the pulmonary artery just checking the stumps there now we're going to go look for the lower lobe bronchus here's our console surgeon
913.238,915.241,just there operating busily away.
915.742,920.029,He actually has a microphone to his assistant so you get really good communication by the way.
920.851,930.226,Now going to the posterior backside of the bronchus to really clean so you can see the lower lobe bronchus and also see the left main bronchus beyond the lower lobe bronchus.
930.667,936.456,So now the sucker's just indicating the lower lobe bronchus dissecting out with fantastic vision.
936.596,938.74,Let's just take a moment to just see how the
938.72,957.437,"cameras just perfectly lined up with instruments which are working in tandem really nicely, no clashing and so I'm sure a lot of multiportal robotic surgeons will be surprised to see how good the view is, how there is actually no clashing and actually how simple and straightforward this is."
957.457,960.964,So we've got our Maryland round the lower lobe bronchus
960.944,967.332,"So there we go, slinging it nicely so we can get a really good view of the lower lobe bronchus which we're going to have to cut."
967.412,972.498,So now out comes the Maryland bipolar forceps and in comes our scissors.
972.578,973.84,These are actually hot scissors.
973.88,978.545,"They can provide monopolar energy as well, which is really great."
979.126,981.148,So that just helps with haemostasis.
981.168,986.715,You can see that the surgeon is providing a bit of monopolar energy as he cuts.
986.695,1015.302,and just retracting with the left hand and also some assistance you can see a real great vision and the advantage over perhaps uniportal vats is to get the angles just exactly right but I think the real advantage of uniportal robotics over uniportal vats is going to come in the suturing so there's the lower lobe bronchus looks macroscopically very clear of tumour there so really nice margin nice stitching circle so good job there
1015.282,1018.546,And then we can see that huge tumour just there.
1018.566,1022.61,So clean out the back of the left upper lobe bronchus away from the pulmonary artery.
1023.711,1027.375,And then absolutely what we need is a good resection margin.
1027.856,1039.508,"So pulling the left main bronchus into the surgical field, Diego and his team is doing a really good job of a really nice, safe resection margin there."
1039.528,1040.65,You can see the tumour.
1041.01,1043.753,You can see there is a really good margin there.
1044.34,1047.146,You really hardly need to wait for frozen section for that.
1047.206,1047.667,And there it is.
1047.687,1049.891,There's the tumour in the sleeve.
1049.911,1050.533,Great job.
1050.613,1051.835,Good margin.
1051.855,1052.958,Wonderful job.
1053.579,1057.607,And the team's going to take this tumour out first before we proceed to the sleeve resection.
1058.144,1065.29,"So all the arms come out, just quickly push them away and then in with a bag and straight out with a tumour."
1065.31,1069.294,"Again, really easy because of having a uniportal incision there."
1069.334,1070.395,"Ready, out it comes."
1070.435,1072.357,You can see bottom right and off we go.
1072.377,1073.618,So what do we got?
1073.658,1078.422,"Well, blimey, it's quite deep, this left main bronchus stump."
1078.903,1080.104,So look at that.
1080.124,1088.151,"So that's quite impressive, but really impressive to make sure that we're not taking any oncological compromise"
1088.131,1117.868,and that's really important so before suturing before anastomosing these of course the team know that a good lymphadenectomy is absolutely key so they do a really nice station 7 lymphadenectomy here advantage of robotics again bipolar energy so these little bleeding vessels can be addressed really nicely and easily assistant doing a really good job of retracting here and there goes the station 7 lymph node which looks fairly small really and quite benign which is good and then
1118.067,1127.79,you can see really that is very deep but you've got a nice thing to stitch to there which is great but because it's so deep
1128.158,1154.065,again Diego using his huge experience to get the vision as good as possible so he's going to sling the pulmonary artery again and he's going to really spend another five minutes on making sure that the visualization for the anastomosis is as good as possible so again much quicker than you think just to do this quick stitch to get some good retraction but probably you save
1154.045,1182.735,more time than it takes to do these quick stitches and especially with robotics robotics are really easy to tie knots so highly recommended and your assistant can easily take out the suture so there's the basal pulmonary artery slung twice and then a really nice trick that I've never actually used before and I've not seen this actually I'm very impressed actually taking the pericardium and just placating the pericardium a bit just to pull
1183.188,1213.009,that distal part of the pericardium forward towards us I thought this is a really nice trick I'm certainly going to use this myself if I ever get the opportunity and again because of the robotic suturing really really easy to do just a quick few ties and that's just pulling that posterior pericardium towards us just to roll the left main bronchus towards us a bit just to reduce the distance between the lower lobe bronchus and the left main bronchus so we've now brought in a large needle driver
1213.85,1218.019,And this is one of Diego's extremely special sutures.
1218.46,1224.734,He's had specially manufactured this V-lock suture with a needle on either side.
1225.115,1231.048,"And then the barbs go in different directions, meeting in the middle."
1231.028,1254.252,whereas most of us will use two v-lock sutures and have to go through the loop halfway because he's got this double-ended barb suture and in the middle of this the the barbs change direction he can literally just stitch with one needle stitch with the other needle get it to the middle and then he doesn't need to do a knot you can just go
1254.232,1282.483,one set of stitches one way one the other and a single knot at the end so so really great development he's also got a similar suture for vascular anastomosis I believe it's a 40 proline but it has got a needle on each end and it's about 15 centimeters long so if you're interested in obtaining some of these sutures just let us know or contact Diego I'm sure he'll tell you where you can get this fantastic suture
1282.463,1292.235,So he's just stitched one needle from either side just to the side of the membranous portion between the cartilaginous and the membranous portion.
1292.617,1295.747,Got one needle on either side and then he's going to
1296.065,1324.215,do a continuous suture on the membranous portion first so just tucking away one of the needles now and now he's going to get a bit of retraction from his assistant and just do a continuous forehand series of sutures on the membranous portion of the lower lobe which with bronchus which you can see here and then stitch that to the membranous portion of the left main bronchus which you can now see here
1324.313,1328.178,"As I said, the fenestrated bipolar is really quite a gentle instrument."
1328.198,1332.863,You can safely grasp the membranous portion and the cartilaginous portion without destroying it.
1332.923,1341.133,"Also, these V-lock sutures are really quite delicate, so I would never really want to grasp it with the needle driver because it has a very strong grip strength."
1341.493,1346.98,But you can grasp it with the fenestrated bipolar to tighten it up.
1346.96,1353.568,And actually it's quite a good idea to keep tightening as you go for these barbed sutures.
1354.389,1361.098,"So just pulling along, tightening it as you go each time and that'll keep it really nicely."
1361.759,1375.296,"If you are new to doing sleeve resections, even if you don't have this double ended needled V-lock or Stratofix, definitely recommend getting a barbed suture."
1375.276,1404.608,if you're doing it robotically or endoscopically far superior to the non-barbed because they just come loose all the time so just proceeding our way along the membranous portion also because Diego's done this so many times he's just making the pairing up of the membranous portions look absolutely simple but remember the lower lobe orifice is actually about half the orifice of the left main bronchus so you do have to take almost double
1404.588,1425.195,the stitch distances in the left main bronchus compared to the lower low bronchus because if you don't pair it up properly you're going to be left with a giant dog end at the end so so do just think every single time just think small on the lower low bronchus large on the main bronchus and
1426.357,1430.302,"Just looking here, you can really see the advantage of robotics over vats."
1430.403,1433.807,I always found vats suturing tremendously difficult.
1434.128,1436.531,And it wasn't just because the instruments are non-wristed.
1436.852,1439.095,It was actually because the camera isn't 3D.
1440.577,1444.122,"When you've got a 3D camera, you can just grasp the needle so accurately."
1444.562,1447.767,"You've also got 10 times magnification, which is another advantage."
1447.787,1455.317,"But actually, it's just the grasping of the needle that is so easy when you've got 3D cameras and wristed instrumentation."
1455.82,1462.224,"as seen here, and really the advantage of robotics is that it allows more advanced procedures."
1462.244,1463.147,I think we could probably
1463.532,1487.65,"all say that we could do a nice easy lower lobectomy anyway at all really, uniportal vats, multiportal vats, multiportal robotics, but actually it's when it comes to the advanced cases that's when robotics comes to the fore because you need that vision and you need that dexterity and as evidenced here really nicely."
1489.587,1495.579,So Diego and his team have done over 100 uniportal robotic operations now.
1496.961,1505.217,I believe Daniel O and the team at Intuitive that he's visited are investigating the safety and utility of it in their labs
1505.197,1522.918,in San Francisco so I'm sure we'll hear a lot more from Intuitive officially about their views and thoughts of using the standard XI robot in this fashion of course they do have a single port robot but Diego has used it and tried it
