start,end,text
1522.898,1548.636,San Francisco and actually believes this is actually not even just equivalent superior to that single port system mainly because the single port robot does not have a stapler and it has a has a very large trocar and also it has a 12 centimeter distance between the trocar and where you can actually work so so actually in his view using the standard XI to do uniportal robotics is
1548.616,1549.738,going to be the future.
1550.319,1558.811,"It is the best way and even better than the single port XI, which is a really interesting development."
1560.153,1568.025,"And as you can see here, he's not only done advanced cases such as sleeves, but if you check out his YouTube channel, you can find segmentectomies."
1568.425,1571.53,There's a beautiful S3 segmentectomy he's done recently.
1572.111,1577.779,And check out his YouTube channel or LinkedIn for every time that he posts
1577.759,1583.873,video so that we can all learn together because we are still less than a year from the invention of uniportal robotics.
1583.913,1586.799,I believe we did his first case in September 2021.
1587.861,1594.897,So I'm sure we're all going to be learning together how to bring this technique into our practice.
1594.917,1596.24,"And for those of you thinking, well,"
1596.507,1599.192,What is the advantage over multiportal robotics?
1599.252,1600.814,I think it's cheaper.
1601.496,1602.517,You don't have a third arm.
1602.758,1603.279,It's quicker.
1604.06,1606.124,Docking and undocking is definitely quicker.
1607.065,1609.87,So it is a simpler way of doing things.
1610.651,1619.747,"And whether you believe that one port versus multiport is different for pain, I think the speed and simplicity is a compelling argument."
1619.727,1626.232,"So as opposed to that, the more difficult thing about uniportal robotics is that you need a very good assistant."
1626.654,1630.75,"You cannot, I don't believe, do uniportal robotics with a"
1631.017,1656.012,brand new new to assisting assistant who does not know how to exchange instruments how to place ports nicely so so and how to retract knowing where you want to be as the surgeon so so that that would be I would say a contraindication to use uniportal robotics at the moment it's it's not having extremely high quality assistance
1656.987,1679.856,that's my view but tell us what you think drop a comment below and here's the very comfortable setup as you can see here three non clashing instruments camera at the back and the two instrument arms non clashing because it's as you can see at the bottom it's arm one and two next to each other not crossing over at all throughout the whole case
1680.545,1691.526,"And I'm sure as I've been, you've been impressed by the quality of the vision, the range of vision all the way from the top to the bottom of the chest by this approach."
1692.348,1699.401,"And so, yeah, a really great job by Diego and Mugua and the whole team in Brasilia here."
1699.561,1700.443,So there we go.
1701.284,1702.666,There's the anastomosis done.
1703.988,1708.494,Then just need to tie one single tie of the suture.
1709.936,1712.339,Urologists don't even tie these sutures.
1712.379,1714.642,They just stitch four or five times and cut.
1714.662,1721.792,But I think most of us are happy to spend two minutes doing a few knots as Diego does here.
1721.852,1723.555,"Also, really good example here."
1723.635,1725.958,Just watch how he doesn't over tighten.
1726.09,1731.538,There is nothing worse than breaking your stitch right now at the end of an anastomosis.
1731.878,1739.449,So he's done all the tightening before tying the knot and then tying the knot is literally just to lay the knot on the surface of the bronchus.
1739.469,1742.493,Should have done all the tightening under vision earlier.
1742.694,1750.765,So great example there and a real example of someone that's extremely highly experienced in advanced resections.
1752.517,1753.178,And that's it.
1753.499,1755.121,We'd love to know what you think.
1755.422,1760.791,I'm sure we'll be posting a lot more videos on Uniportal of robotics as they are performed.
1762.033,1763.295,Well done to the whole team.
1765.559,1773.192,Just left to fill the chest with a bit of fluid and I'm going to leave the last word to the patient.
1773.425,1783.114,as this patient did phenomenally well and so as we see no bubbles the lower lobes inflating really nicely taking the swabs away
1783.398,1787.023,It's going to be extremely quick just to take all the arms out and close that wound.
1787.584,1791.43,Single drain and lovely job from the whole team.
1791.45,1797.559,"So as I say, we will say goodbye from Brasilia and I will leave the last word to the patient."
1798.079,1803.747,"The last words I believe are in Portuguese, but to me she sounds like a very happy person."
