start,end,text
0.031,2.714,"This is the right lateral, the cube, the left chest is up."
2.734,4.116,Here's the patient's scapula.
4.836,6.699,It's a lot thinner than our last patient.
6.719,9.161,"Here's the vertebral body, just right smack in the middle."
9.562,11.444,There's the right lateral pedicle.
11.464,12.665,Everything's based off that.
13.166,14.287,You then count the ribs.
14.608,16.65,There's the 12th.
16.67,17.671,There's the 11th.
18.172,20.594,"There's the 10th, the great, big, giant rib."
20.995,22.056,And that's the ninth rib.
22.076,23.257,"It looks high, doesn't it, Travis?"
23.638,23.718,Yep.
23.738,24.599,So let's count again.
24.639,28.283,"Well, maybe that's 12 and 11."
29.545,33.109,"Maybe that's 10, or maybe that's 9, and it probably is."
33.829,38.074,"And that's 8, because the tip of the scapula really should come to the top of the 6th or 7th rib."
38.574,40.056,"So here's the 10th, and here's 9."
40.156,46.242,"Now, keeping the camera in the same location, really important, you map out the very top of the 9th rib."
47.764,49.786,Our last patient was 280 pounds.
49.846,51.648,This patient is 120 pounds.
52.749,53.89,But you can do it for both.
54.911,55.131,Okay?
55.351,56.012,All the way to here.
56.052,56.953,"Now, ruler."
57.98,62.029,"So, not from the middle of the vertebral body, from the right lateral pedicle."
62.29,68.464,"Because we're using an XI, the XI rule is 4, 8, 8."
69.726,75.981,"The SI is 2, 10, 9."
76.822,77.524,Why?
78.128,80.533,because we have a five millimeter port.
80.553,85.803,"Because we don't have a five millimeter port with the X side, we go four sonomeres away from the spine, so we have a little more room."
85.843,90.752,"So four, eight, oh this is gonna be a good example, eight."
90.772,94.84,"So, look what happens with 488 on this patient, Travis."
95.461,96.964,"Come here, bring the camera over."
96.944,99.307,We have no triangle for our last two ports.
99.948,103.053,"So because he's small, 488 is not going to work."
103.373,104.615,So we're going to cut it down.
104.635,109.462,You really can't go more than 3 because you have an 8mm port.
110.083,111.104,So it's going to be 366.
112.166,120.237,"Again, this should be at a right angle to that."
120.277,125.905,And I put an X over these so you know which mark is which when you do this because it's easy to get confused.
127.437,128.498,So there are your marks.
129.479,131.601,You always start with the camera port.
131.661,132.723,So this is a good example.
132.783,133.403,Keep this going.
133.423,134.064,This will be a good film.
134.104,135.465,We'll put this on Twitter.
136.126,138.168,"Knife, timeout's been done."
139.59,140.991,"When you do this, please don't bovie."
141.271,142.393,And please don't cut like this.
142.433,143.994,"Please saw, because you're just sawing."
144.695,146.877,We're going to go right over the top of the ninth rib.
147.218,148.179,Notice I'm sawing.
149.42,150.081,Exactly.
150.101,151.522,Eight millimeter port.
151.923,152.924,There's no bovie.
152.984,155.166,There's no nonsense with bovying.
155.838,158.2,"You don't put a hole in the lung, no reason to bulge."
158.22,159.742,You go straight down into the chest.
160.823,161.984,You put the camera in.
162.004,176.018,"And when you're sure you're in good shape, and you're not in the lung, now you put the CO2 on."
176.038,177.759,"So come, show the monitor, show the monitor."
179.101,179.361,Right?
180.042,182.404,"Now you put the CO2 on, not a second sooner."
182.424,183.465,Look down here now.
184.205,189.852,"Valves on, CO2, you never put that CO2 on unless you're unequivocally sure you're not in the lung."
189.873,192.676,There have been multiple intraoperative injuries with that.
192.756,193.938,Now you're gonna find your fissure.
194.539,198.684,The left fissure is much steeper than the right fissure.
199.145,200.967,So you wanna be at least three ribs below the fissure.
200.987,202.67,The ninth rib should be about three ribs.
202.69,203.851,"Here it is, three, perfect."
204.993,207.115,"Preemptive analgesia, back away a step."
208.237,209.398,Show the needle.
209.418,213.604,"This patient got 1,000 milligrams of gabapentin before coming in the OR."
215.508,216.952,"Look what I'm doing, show the monitor."
219.137,219.839,Put down a rib.
221.623,224.27,"And he's thin, so I shouldn't be in the pleura like that."
225.313,226.596,Trying not to go in the pleura.
226.797,229.784,"We're just using Marcane, no epi."
229.804,232.15,"Here in New York, we don't even put epi in this."
232.4,235.504,Make everything as easy as possible so no one's mixing any meds.
235.584,238.408,"No Expirel, no Epi, no steroids."
238.428,240.151,I took all that out.
240.171,246.259,"Issues of gabapentin, 1,000 milligrams by mouth, 900 milligrams of Tylenol by mouth before they come to the OR with a sip."
246.279,246.96,Those are pills.
247.761,250.404,"We do this, and these people all go home in a day."
251.005,253.268,"Our lobes, our segments are all going home in a day."
254.15,255.291,"Hard to believe, but true."
255.912,257.294,Not all of them 70%.
257.334,260.398,"Travis, kind of hurting the picture right now."
261.931,265.075,"Come down here, one more."
265.135,267.338,Can you see me or no?
267.358,267.919,"No, you don't really see me."
267.939,269.341,"All right, now let's go back up here."
271.244,277.192,"Now taking the knife once, not three times, we're gonna put this port right here."
278.513,280.015,"Over the top of one rib, you got me?"
280.496,281.057,Sawing.
283.059,285.002,"Eight millimeters, sawing."
285.505,288.088,This is a lingular sparing left upper lobe.
288.108,289.129,"Is that what we're doing, Travis?"
289.149,289.709,Yes.
289.729,292.072,So we'll be stapling from the back here a little.
292.973,293.894,"Okay, now it goes back."
295.015,299.36,"This goes directly in, directly over the rib on a right angle like this."
300.14,300.421,See it?
301.382,303.484,"And this goes straight down, which he can't see."
303.504,305.646,He doesn't need to see it.
305.666,310.752,The lung's not stuck there.
310.772,311.192,Let me know.
314.935,318.328,"Keep going, keep going."
318.348,319.512,The camera comes out now.
320.737,321.52,This goes here.
321.58,326.498,"Now, Prabhu, keeping the camera carefully, walk around to the other side, please."
339.758,342.001,"Now, look where the camera has come."
342.061,344.764,It's not in the posterior port and it's no longer in here.
345.265,348.089,"It's been moved to this port, okay?"
348.749,350.972,"Now, we're going to gauge our triangle."
351.353,353.656,We move this line to here to get room.
354.337,355.418,Really important where you put this.
355.478,356.86,I don't put it over the ninth rib.
357.34,361.666,"Even though it's nice to have a robotic stapler and it gives you more room, we're afraid you get the rectus."
362.107,363.809,There's been some paralyzed rectus from that.
363.829,365.631,You don't want to go up here and get the nipple
366.117,367.159,or a patient's breast.
367.639,370.845,"So you go up usually to the eighth rib, which is right there."
370.945,372.387,So he's gonna stick his needle right there.
372.407,373.729,"Look at the monitor now, Prabhu."
375.512,376.033,Knife to me.
376.954,377.856,He's gonna inject.
379.138,379.578,Perfect.
380.059,384.006,I'm gonna come out and I'm gonna make a 12 millimeter incision right over that rib.
385.548,386.389,This is 12.
386.79,388.633,That's actually where we take the specimen out of.
388.673,393.12,"And now, hang on, here's your triangle to the top of the 10th rib."
419.172,421.934,but it's really a seven millimeter total diameter.
421.975,424.477,That's the internal diameter is five.
424.497,425.998,This goes in at a bit of an angle.
427.78,430.242,"And if you get starey draping there, you don't want to do that."
430.262,431.043,That's what you want.
431.063,431.863,It's a little tight.
433.665,433.945,It's perfect.
433.965,435.006,"Okay, now put this in."
442.153,444.014,"Travis, again, going into direct vision."
444.295,446.517,"Now finally look here, Pabu."
446.537,449.179,This comes off and closes off.
450.948,451.849,This comes here.
451.889,455.455,It's going to hook up to your air seal like this.
456.397,457.759,It spins and gets out of the way.
457.819,459.762,Now stay there and keep filming.
460.744,461.865,And now a field block.
461.885,463.728,Just film the best you can from there.
464.409,474.846,I'm now going to add a field block on top of the paraspinal block on top of the gabapentin and Tylenol PO agents the patient took pre-op.
476.193,478.636,"And I think this incision's a little small, Travis."
478.656,479.217,See that little?
479.237,480.238,You're going to get a little burn.
480.839,482.682,"Knife, I'm going to make it a millimeter bigger."
482.702,483.783,Just keep the camera going.
484.764,486.587,"Now, we're going to show how... Hold this out of my way."
486.927,489.611,We're going to show how we bring the robot in.
489.631,495.939,But notice how the team is already nice and organized in bringing that robot in.
497.862,501.266,"Okay, better."
501.286,504.751,"Get the air seal on also when you guys... Yeah, here we go."
504.771,505.472,Can you feel me?
505.492,505.592,Yeah.
505.859,533.402,go through all these okay arena go through all the steps go trouble great job so when the robot comes in as you can see the target is the camera port which is this one yep once it's on there i drop the height of the boom you can do that with any arm on the robot primarily it's the most posterior cord that's the lowest so i just make sure that this arm can reach the posterior
535.137,539.541,So that move is really important.
539.581,543.845,Travis is going to dock at the same time that she is.
543.865,550.271,Now show us the clearance move.
550.291,558.479,And then the most important part for our cases is patient clearance.
558.499,562.242,So you fan down.
563.082,570.892,All the arms.
570.912,571.172,Pass it out.
571.192,571.713,"Travis, smile."
572.093,572.754,"Irina, smile."
572.974,573.255,Thank you.
573.475,575.217,Have their permission to be on the internet.
575.237,575.618,Thank you.
576.419,579.062,"Finally, I want to show you the room set up and why it's so important."
579.643,581.645,Here's our world-class anesthesiologist.
581.705,582.146,Say hello.
583.207,584.99,I have a direct vision from them.
599.26,602.951,"We're out of the way of the room, yet we have good visibility."
603.032,604.677,So I think OR setup is important.
604.697,611.116,"We put all 14 of our robots in the same place, and every OR back against there, and the consoles in the same place."
