start,end,text
22.272,27.861,The trocar position is used to maximize dissection from the anterior chest wall.
28.297,29.999,Here you can see the trochards in place.
30.659,36.865,"The scope is placed in approximately the fifth intercostal space, just posterior to the mid axillary line."
37.586,44.973,The right and left operating ports are placed above and below this in the anterior axillary line.
44.993,54.982,"Initially, a four millimeter trochard is used for the scope and two three millimeter ports are used for the right and left hand operating port."
55.002,57.004,The three millimeter vessel sealer is used
57.355,60.598,as the primary mode of dissection for the entire procedure.
62.199,69.946,Here you can see the right hand operating port going in approximately the third intercostal space up in the axilla.
71.367,76.472,You can see the hyperinflated apical segment of the lower lobe.
77.733,85.86,Dissection is started at the top where the pulmonary artery transverses below the upper lobe and branches go into the upper lobe.
88.017,97.792,This helps to devascularize the upper lobe and decrease congestion within the lobe during the rest of the deception.
97.812,115.999,"The pleura overlying branches to the anterior to the apical segment are individually isolated, sealed proximally and distally with at least three to four millimeters between the seals and then divided."
116.941,121.947,This technique provides the safest way to approach the pulmonary vasculature.
122.047,136.225,"By making two separate seals and then dividing between them, one can be sure that the vessel is adequately sealed before it retracts and bleeding occurs, which could lead to the need to convert to open."
138.048,144.636,"You can see the vessel being serially divided, ensuring that it is adequately sealed."
148.615,154.564,The other branches of the artery are now better visualized.
154.584,167.043,"Again, the subsegmental branches are taken individually, sealed proximally, and then distally, and divided between them."
167.063,177.238,This technique allows for an extremely safe dissection and prevents uncontrolled bleeding.
192.406,195.694,posterior segmental artery branch can now be visualized.
200.946,210.448,If inadequate length of the vessel cannot be obtained
212.048,223.304,"in order to get adequate vascular control, then one should dissect down into the lung, creating length by dissecting into the placenta."
228.051,240.79,"The vessel sealer will take vessels up to 5 millimeters in diameter, and most of these vessels at the subsegmental level in this size child are 2 to 3 millimeters in diameter."
255.383,265.175,This is a relatively fast and efficient way to take the pulmonary vasculature while ensuring adequate vascular control throughout the procedure.
268.099,283.838,"As opposed to the lower lobe where the main trunk can easily be identified as it courses through the fissure, it's often necessary to take the upper lobe vessels at the sub-segmental level to ensure there is no injury to vessels transversing"
284.729,289.355,behind the upper lobe and going to the middle and lower lobe.
289.375,299.589,"With the main primary branches of the artery sealed and divided, the bronchus to the upper lobe becomes visible."
300.891,313.909,"You can see behind the sealer the right main stem bronchus, which will then later divide into the upper, middle, and lower lobe bronchi."
322.057,345.422,This will become important for taking the bronchus later on in the deception.
345.442,348.385,"Now, with the arterial branches taken,"
350.204,351.806,the minor fissure is evaluated.
352.766,358.152,"Here you can see the major fissure is complete anteriorly, but the minor fissure is almost non-existent."
358.852,369.623,There is a small cleft posteriorly where the minor fissure adjoins the major fissure.
369.643,378.051,One can see the hyperinflated apical and posterior segments of the upper lobe secondary to the CPAP.
378.824,385.114,There is a slight cleft at the most anterior portion of the minor fissure and this is now being sealed and divided.
386.276,392.966,The sealer is an excellent way to go across one parenchyma in the area of the fissure when it is incomplete.
395.129,406.367,"The fissure can be developed in a layer by layer process, sealing and then dividing in the middle of the seal as one works across the fissure."
408.524,415.155,"However, because this fissure is so incomplete, further devascularization will be done to try and better delineate this."
416.597,422.267,"With the lung retracted superiorly, we are exposing the superior pulmonary vein."
423.549,432.844,"Because of the hyperinflated lung, it is difficult to visualize, and so a few moments will be taken to try and compress the upper lobe using the energy device."
434.545,439.912,"This works extremely well with large cysts, but even works when the cysts are much smaller."
441.614,449.623,"Now the pulmonary vein to the upper lobe can be visualized, and it is sealed and divided in the same fashion."
449.643,455.17,"Care must be taken here, however, to ensure that there is no injury to the vein to the middle lung."
464.347,480.036,Surgeons should reorient as often as possible to have a clear understanding of the plane between the upper and middle lobes as he continues to take the pulmonary vasculature.
480.056,483.402,These branches are clearly going to the hyperinflated upper lobe.
494.502,498.67,The proximal seal here did not appear complete and therefore it's being resealed.
501.856,510.553,"Again, the area between the two seals is slowly divided to ensure that there's no bleeding and the seals are complete."
517.115,524.646,This process is continued until all sub-segmental branches of the vein to the upper lobe are sealed and divided.
542.672,546.497,"At this point, it appears that all the branches"
546.798,550.443,pulmonary vein to the upper lobe are now taken.
558.272,569.987,"One residual branch is now seen as the lung is retracted upwards, exposing the last vein to the upper lobe."
571.908,584.609,The vein to the middle lobe can be seen intact and just to the left of this and is not dissected out.
584.629,593.865,"There is usually a clear delineation between the middle lobe vein and the upper lobe veins, but extreme care must be taken to preserve the middle lobe vein."
597.845,608.643,"With the vein to the upper lobe completely divided, it helps differentiate between the upper and middle lobe."
608.663,624.409,A fairly good guess can be made at where the fissure is by using the ischemic upper lobe as well as the posterior congenital cleft which was earlier seen.
626.515,636.313,"The sealer is then used to create the fissure, again going through the lung in a layer by layer fashion."
638.537,645.891,This is very similar to finger fracturing the liver during a segmentectomy.
657.329,679.434,"Again, the sealer is used to compress the lung where it is believed the fissure exists, and then one parenchyma is divided in the center of the seal."
679.454,680.755,"Occasionally,"
681.089,698.518,"A lot of char can build up on the sealer during this type of deception, so it is important to have the scrub tech clean the jaws of the instrument when it is removed on a regular basis."
698.538,706.692,You can see that there is minimal bleeding because of the devascularization of the upper lobe and because the fissure is a relatively avascular plane.
709.709,718.621,We can now see where the anterior portion of the fissure is lining up with the previously seen posterior congenital cleft.
734.704,737.067,"Again, reorientation showing where the two"
739.021,750.696,aspects of the minor fissure begin to come together and the septum between the anteriorly created fissure and the posterior cleft is now sealed and then divided.
756.785,766.918,"This method is not only very hemostatic, there is also no"
768.164,773.291,or significant air leak post-operatively when using this method.
778.779,788.552,"By lifting the lung anteriorly, we can see the last bit of parenchyma between the middle and the upper lobe anteriorly."
793.158,797.344,"By taking this, we will get better exposure of the bronchus to the upper lobe."
807.854,812.301,"In cases of a complete fissure, this portion of the dissection is much quicker."
814.484,828.365,"Rather than taking 10 to 15 minutes, it requires only a few minutes to complete."
828.385,837.118,There is usually a branch of the artery coming back up from the pulmonary artery to the anterior segmental branch.
838.988,840.61,anterior segmental segment.
843.574,845.637,And that should be sealed and divided as well.
860.659,867.949,And then the lung pulling from the overlying bronchus in the last arterial branch is
868.334,870.461,dissect it out and see it.
878.066,880.032,There's that branch of the artery.
926.89,937.466,"Now with that portion of the dissection complete, we are near the hilum of the upper lobe."
937.486,949.744,We then flip back anteriorly and superiorly to re-expose the bronchus which was previously seen.
949.764,951.447,Here you can clearly see the bronchus.
955.308,957.571,and this can now be safely dissected out.
959.754,977.135,"In general, we get the upper lobe bronchus past the point of bifurcation, taking the apical and posterior segmental bronchus separately from the anterior segmental bronchus."
977.155,983.543,"The lower or left-hand port, which is in the larger inner space, is then changed to a 5 mm port,"
984.113,986.917,and the 5mm endoscopic stapler is inserted.
1008.228,1009.53,The second application
1013.071,1021.123,is used to divide the segmental bronchus at this level.
1051.951,1060.226,"When this is done, the tension is then turned back into the valve minor fissure."
1063.473,1066.939,Some residual plinkum in the fissure is sealed and divided.
1098.661,1101.184,and the last segmental bronchus is now dissected out.
1121.846,1127.352,The stapler can also be used to complete the incomplete major fissure
1127.973,1128.686,posterior.
1159.782,1172.238,Some residual tissue is then divided with a second application in this table.
1172.258,1179.627,The upper lobe is now disconnected from the rest of the lung.
1191.187,1200.937,The 5mm port in the anterior axial line is slightly increased in size to allow for the tonsil clamp to be inserted.
1201.898,1205.842,The lung is removed piecemeal to the incision site.
1207.124,1213.971,Here you see the hilum of the upper lobe after the specimen is removed.
1213.991,1217.835,This operation took 1 hour and 35 minutes.
