start,end,text
53.379,59.907,The surgery begins with a classical posterior lateral thoracotomy and then we raise an intercostal muscle flap
60.258,63.962,in case we need to use it to wrap around the anastomosis.
63.982,73.252,Here you can see the pleura being incised at the junction of the azygous vein and the superior vena cava.
73.272,79.679,Then we approach the right main bronchus anteriorly and clear all the soft tissues and the lymph nodes surrounding it.
81.781,89.59,"Just to orient our viewers to the anatomy, here we are dissecting on the anterior surface of the right main bronchus in the infra-azygous region."
100.665,104.85,We try and preserve the vagus nerve if possible by separating it out from the right main bronchus.
105.531,107.894,This is followed by looping of the right main bronchus.
108.114,113.06,"Once the right main bronchus has been looped, before we start the resection, we take a few stage sutures."
117.125,119.728,"Now, we move on to the resectional part of the surgery."
120.198,122.622,where we are dividing the right main bronchus.
123.383,126.749,This is a crucial part of the surgery where we have to ensure negative margins.
128.652,135.783,The margins are then sent for frozen section analysis and we try to preserve as much of the posterior wall as possible.
135.803,141.452,It is our policy to perform a formal lymphadenectomy in all cases of carcinoid tumours.
142.774,145.058,"Coming to the anastomosis part of the surgery,"
145.561,150.929,The principles of airway anastomosis remain the same as other anastomosis in other parts of the body.
151.569,156.536,The principles are to achieve a tension-free closure and an airtight closure.
157.318,161.563,"To do this, we usually use a continuous or a running suture technique."
162.144,165.489,We use a non-absorbable suture such as PDF or ProLeaf.
166.931,171.197,We generally prefer to use a 4-0 suture for this anastomosis.
172.055,178.063,We start off usually with the posterior wall of the bronchus after taking adequate amount of stress sutures to bring the two ends together.
179.785,181.828,There are various ways to do this anastomosis.
182.369,186.975,Some surgeons prefer to use an interrupted technique which is also acceptable.
188.497,193.444,"Like in any other anastomosis, blood supply is important to ensure adequate healing of the anastomosis."
194.305,201.775,The bronchial tree is usually supplied by the bronchial arteries which are a direct branch of the aorta and the supply is through the lateral wall
202.008,210.496,"of the bronchus and hence while mobilizing the bronchus or doing a lymphadenectomy, the surgeon should not be too aggressive in his approach."
212.057,222.186,"If possible, the surgeon should try and preserve the branches of the bronchial artery in this region."
222.206,225.91,Some salient points need to be kept in mind while doing this anastomosis.
227.171,229.433,It is necessary to ensure an uniform tension
229.632,238.041,This is done by placing equidistant sutures and also by using a nerve hook as shown in the pictures to ensure that the sutures are adequately tightened.
239.262,242.545,It is also important to ensure the orientation of the anastomosis.
243.326,250.374,The cartilaginous part of one end should be anastomosed to the cartilaginous part of the other and the same should be followed for the muscular part.
250.954,256.5,"Once the anastomosis is completed, an air leak test is done to ensure the air tightness of the anastomosis."
257.392,261.778,An intercostal muscle flap can be placed to reinforce the anastomosis.
262.619,267.465,This patient had an uneventful post-operative course and his HPR was suggestible for typical carcinoid tumor.
334.28,344.149,"In this intraoperative illustration, we would like to orient our viewers to the location of the tumors which is located between the junction of the right upper lobe bronchus and the bronchus intermediate."
347.2,352.108,Here we join the surgery after looping the right upper lobe bronchus and the bronchus intermedius.
352.689,354.492,We go on and divide them sharply.
355.313,360.101,"Once the specimen has been resected, we send it for frozen section analysis."
361.283,365.53,"For carcinoid tumors, a microscopic negative margin is sufficient."
366.471,371.74,Here you can see the bronchus intermedius being divided followed by division of the right main bronchus.
381.264,384.97,First anastomosis is between the bronchus intermedius and the right main bronchus.
385.751,389.157,"As previously elucidated, the principles of right-way anastomosis remain the same."
389.638,400.495,That is to achieve an adequate tension-free tight closure and also a healthy anastomosis by ensuring adequate blood supply to the anastomotic region.
401.977,405.621,start off by taking stay sutures to approximate both the ends of the bronchus.
406.221,414.309,"And then we use a continuous running suture technique, follow starting with the posterior wall and then moving on to the anterior wall."
415.09,422.037,Intermittently the sutures are tightened by using a nerve hook as shown in the video.
422.057,426.381,There are many factors to consider before designing on the configuration of this anastomosis.
426.982,429.925,One of them is the size disparity between the right upper lobe bronchus.
430.36,432.522,and the bronchus intermediates in the right main bronchus.
433.483,440.79,The lumen of the bronchus intermediates in the right main bronchus were comparable in size and hence we decided to go with this configuration.
442.752,449.559,Reanastomosing the upper lobe at a point higher up in the right main bronchus had two reasons.
450.0,458.308,"One, we thought it would be more physiological and would mimic the natural anatomy more closely than if we had"
459.74,463.844,created a trifurcation point and a new secondary carina on the right side.
465.906,472.272,"And secondly, this would take care of the size disparity between the right upper lobe and the right main bronchus."
472.293,479.76,"As you can see, a new ostia is created for the right upper lobe at a point closer to the carina on the right main bronchus."
480.561,488.869,"This anastomosis, because it involves smaller sizes of lumen, is more challenging than the anastomosis shown earlier."
491.228,493.551,"The technique of an anastomosis, however, remains the same."
494.132,498.698,We have used a continuous suturing technique using PDS 4-0.
500.1,517.843,"The objective of using these two cases in the same presentation was to show that in spite of having relatively large size tumor, we were able to completely preserve all the three lobes of the lump using apparent time of preserving or a bronchoplasty technique."
519.916,526.846,"The immediate post-op bronchoscopy showed all the lumens to be patent, including that of the right upper lobe bronchus."
527.688,533.817,And then a post-operative reformatted CT scan confirmed the same finding.
