start,end,text
915.501,917.463,So this is what was actually done for the patient.
917.904,920.067,You can see that there was a mesh laparostomy done.
920.407,924.352,"A mesh was put in over the bowel, and it was allowed to granulate."
924.593,927.496,We did have a very close discussion when this case was being done.
928.097,930.681,And this is a patient at around day 7.
954.059,979.442,and now you remove the mesh and then you do a closure now interestingly when we were discussing this what we should do i said we should plan for an anterior component separation technique onto the left side uh we should not go for any kind of component separation inside the abdomen like a pcsq or a posterior component separation he's a young boy and why particular on the left side my thought process was that we should try to keep the right side of the abdomen always virgin
980.063,989.332,"And the reason why, because in future, most of the surgeries which we perform as surgeons are on the right side, the cholecystectomy, the appendectomy, the colectomies, the hepatectomies."
989.613,992.656,So try to keep the right side of the abdomen as virgin as possible.
1500.472,1506.358,"So on exploration, you can see the gangrenous duodenal segment of a dilated cut."
1506.378,1511.263,"And in this, a herniated content through the hernia defect."
2474.615,2482.063,"Now, I established the diaphragmatic service around five years ago, and I started joint operating with a thoracic surgeon."
2482.403,2490.092,We have a thoracic anesthetist who will generally always intubate the patient with a double human tube so that we can take one of the lungs down if we had to.
2491.313,2503.086,"So on initial laparoscopy, we found that a lot of the abdominal contents were in the left hemithorax, but more importantly, the entire transverse colon, as you can see, was completely plastered into the left side."
2503.876,2526.222,so we go with the general uh principles of repairing any hernia that we have to go outside the sac and define the sac somehow that is the first thing that structure that is now coming into view and you will uh you'll be surprised when you see it and this is the pleura that we are pushing back whilst we are dissecting and trying to reduce this hernia on the left hand side
2527.265,2531.69,"Now, the structure that you can see on the left is the spleen, and that was the kidney that was up in the chest."
2531.71,2539.018,So this was a very interesting case in which the left kidney was anterior to the left spleen because of the diaphragmatic hernia.
2539.218,2541.941,It seems that the posterior components had migrated.
2541.981,2553.593,"So general principles of any hernia surgery, you dissect all around the sac, and your aim is to reduce the hernia completely along with the sac."
2553.978,2580.205,you can use sometimes a triangular liver retractor as i've shown you in this case to keep the contents down and then push a mess inside now the mesh is usually a composite mesh and the rough side i would usually like keeping it towards the thorax thoracic side while the smooth side is towards the abdominal side the advantage of that is you do not have any abdominal contents that adhere to this mesh
2580.758,2590.673,"But at the same time, the other big advantage is that once the lung starts getting adherent to the mesh, there is a very limited chance of having a herniation again."
2592.275,2596.121,One of the biggest problems of diaphragmatic hernia repairs is the recurrence rates.
2597.042,2608.099,"So once we have done an inner crown, we went in thoracoscopically on the left-hand side, and we started putting an outside crown of stitches in order to secure the mesh."
2608.417,2616.791,Here you can be much braver and go very close to thoracic contents and put deep stitches in in order to secure the mesh again.
2617.211,2620.877,So this is a double crown technique of fixing the mesh from the chest side.
2622.48,2626.006,You can also utilize this technique to fish the mesh posteriorly.
2626.206,2634.88,"Now, one of the biggest problems in some of the diaphragmatic hernia repairs is recurrence of the hernias posteriorly where the fixation is inadequate."
2635.754,2664.141,in those cases what we can do is we can do pericostal stitches so we would make an incision on top of the rib and pass a suture across the rib fixing the mesh onto the rib and that ensures that the posterior fixation is adequate here you can see the fixation is right close to the to the left side of the heart but you will just see the pericostal stitches as well now vats
2664.796,2668.2,thoracoscopic stitching is quite challenging because of the angles.
2669.12,2681.153,"In the abdomen, as you know, you can use any angles that you want, but when you start operating thoracoscopically because of the ribs, the angulations are quite difficult, quite challenging, and the movements of the needle holder are very limited."
2681.794,2684.657,So you have to be quite patient in the chest to make sure.
2684.677,2687.299,"And this was a very good example of a pericostal stitch, as you can see."
2687.7,2693.706,"I've taken a stitch around the rib, and that then ensures that the mesh is well fixed posteriorly."
2694.327,2699.815,"Now, this operation took around five to six hours overall, including anesthetic time."
2701.037,2702.98,The mesh is very well fixed on all sides.
2704.422,2706.906,This is a CT scan of the patient one year.
2734.509,2735.611,"Now, this is my second video."
2736.473,2744.668,"Now, when we went in again, a very large herniation on the right hand side, as you can see, you can see the lung, you can see all the contents of the abdomen in the chest."
2746.673,2750.178,"Now, when you start reducing these contents, the initial bit is quite easy."
2750.719,2753.683,You can reduce the contents without much of a problem.
2754.303,2759.15,There are hardly any adhesions in these blunt trauma patients I've noticed.
2759.17,2763.095,"A penetrating trauma is a totally different thing, and I don't have any videos of penetrating trauma."
2763.115,2763.596,I've done those.
2764.337,2770.926,"But the biggest problem I was facing in this patient was the reduction of the heart, reduction of the liver."
2771.21,2772.912,"As you can see, we viewed the heart there."
2778.22,2782.265,"But when we tried reducing the liver into the abdominal cavity, it was quite challenging."
2783.607,2789.836,"I tried using multiple swabs, kept them on the liver, tried pushing it down, but it just would not move."
2797.286,2800.17,"So despite maximal traction with swabs,"
2800.741,2802.423,And there were no adhesions holding the liver.
2802.623,2803.725,I could not move the liver down.
2805.107,2808.691,"This was complete loss of the diaphragm on the right-hand side, especially on the posterior aspect."
2808.992,2816.541,So I use a triangular liver attractor then to push the liver down so that I can just deliver the liver into the abdomen and start preparing the hernia.
2818.404,2822.449,"But despite that, I was not able to get the liver down, as you can see very well."
2823.571,2828.537,"We could move the lateral lobes, but still the liver just would not come down."
2833.715,2857.309,at this point we decided that i cannot continue with this operation laparoscopically so we did a right postal lateral thoracotomy did a mesh and after finishing the thoracotomy i came back in laparoscopically to see if there are any additional areas that need reinforcement or that we have missed from the thoracic side now i always go back in laparoscopically even if i've done a thoracotomy to repair the cernia
2857.289,2884.022,because i think it's good practice it makes sure that you have not fixed any bowel to the mesh and any weak areas you can refix now the third patient is again an rta blunt trauma patient and then let me show you this video now again the hernia is on the right hand side but immediately you can see the hernia defect is much smaller here again small bowel large bowel in the chest
2885.285,2887.567,And this is always very easy to deliver.
2887.627,2889.99,I've never had problem with delivering bowel from the chest.
2890.61,2891.471,There is no sack.
2891.551,2897.357,"If you can see in a traumatic hernia, there is no sack as opposed to the last case, the first case that we saw."
2897.818,2903.263,"Now you can use the falciform to pull the liver down, which is what I am trying to do."
2903.683,2904.905,And you can get good purchase.
2904.925,2910.33,"But again, as you can see, the liver just did not want to come down without a fight."
2911.88,2921.021,"I tried looking for different adhesions that could be holding the liver down, different things that I could dissect to deliver this liver down, but then the liver retractor came in handy again."
2921.683,2930.142,"So you put a triangular liver retractor in, and it has a very wide surface area, so it ensures that you don't tear the liver, you don't break the liver at all."
2933.395,2936.439,The aim is to find what adhesions has this liver formed.
2936.92,2944.811,"This I was not able to do in the last case, but I wanted to find out if there are any adhesions that the liver has formed that is keeping the liver into the hemiparox."
2946.113,2953.884,"In this case, we managed to get quite lucky and we were able to locate some adhesions that were keeping the liver up into the chest."
2953.904,2959.372,I used two liver tractors to keep the liver down and then I proceeded with dividing these adhesions.
2959.432,2962.677,"Now, because of distorted anatomy,"
2963.011,2970.793,I would like to point out to some of our junior surgeons registrars who are in the group that you have to keep on visualizing
2971.178,2994.452,uh where the ivc is where the hepatic veins are i was i'm always thinking while i'm dissecting this that is there a chance that i could be going too medial and i could hit the ivc or i could be going too inferiorly and i could hit the right hepatic vein and this is something that you have to constantly keep thinking about in this area as to where we are
2998.482,3003.628,So we kept on dissecting this area whilst being careful that we are not going into any vascular structures.
3004.269,3009.195,"Posteriorly, you are also worried that you may breach the Girota's fascia if you go too posteriorly."
3009.655,3011.257,So you have to be just very cautious.
3011.277,3014.161,You cannot just keep dividing all the structures in this area.
3014.561,3018.286,"You have to stop, rethink, and then understand where the diaphragm is."
3018.346,3023.612,What you can see there is adhesions of the liver onto the posterior lip of the diaphragm.
3024.082,3027.086,So I think this is a good thing that we have started seeing diaphragm here already.
3027.667,3034.376,And I'm here trying to dissect the liver of the diaphragm so that I can get the liver into the abdominal cavity.
3035.337,3039.282,These tonsil swabs that we are quite used to using are quite helpful.
3039.903,3043.127,They don't leave a lot of strands and you can use them to move bowel around.
3045.15,3048.775,And this is now the mobilization of the liver of the diaphragm.
3049.976,3053.481,"So clearly, despite having blunt trauma, this patient formed adhesions"
3053.832,3081.612,that i had to divide so that the liver can be safely delivered into the abdominal cavity again i was being quite cautious checking each structure multiple times now this is where the tiger territory i call it whenever i'm teaching my registrars how to do a diaphragmatic hernia or a complex hiatus hernia i'm telling them what the tiger territory is and the tiger territory is where the vascular structures are coming
3082.334,3086.081,"Now here, just inferior to me, obviously, as you know, the vascular structures will be there."
3086.682,3093.734,"So we just have to be very, very, very, very mindful all the time of where the vascular structures are whilst trying to deliver the liver."
3093.794,3095.017,And I leave a lighted bougie.
3095.538,3099.685,That light that you can see coming from the chest is a lighted 34 French bougie.
3100.036,3120.171,we have a set of bougies that are available which have a light on the tip of it so it's very helpful to visualize the esophagus where the esophagus is to keep your bearings right especially in hiatus hernias in this in this case it wasn't important but we only have lighted bougies in my department now so it's easy just to use them so we continue
3120.657,3150.293,delineate delineating circumferentially the edge of the diaphragm and that is the most important thing that you have a good diaphragmatic edge a good diaphragmatic rim all the way around so that you can secure a mesh and this is what will prevent future recurrences this triangular liver attractor is very very very helpful as you can see none of these cases would have been possible without using a triangular liver extractor because you have to press so much abdominal viscera down
3151.083,3153.086,And that's the only way to press it safely.
3154.228,3167.59,"Again, as you can see the hesitation in my mind when I'm dissecting these structures, you can see I'm slowing down and I intentionally did not edit this part of the video because I wanted to show you the decision making, the fear in the mind of the surgeon that the vascular structures could be here."
3168.397,3169.919,"Now, again, a composite mesh."
3170.339,3176.006,"Now, after making a few mistakes in the beginning when I never used to write on the mesh, I've started writing on the mesh."
3176.046,3181.573,"Now that the heart side is H, the F is the front side, and there's a costal side."
3181.974,3189.763,And this is important because it is very difficult to understand the mesh placement sometimes when the mesh is put into the abdomen.
3191.465,3196.311,"Now, once you have placed the mesh in the right, the correct direction, it's usually a piece of cake."
3196.351,3199.395,You can see that I'm checking the strength of the diaphragm there.
3199.455,3201.277,And here I did a telescoping technique.
3202.078,3205.582,So I did not start suturing it and tying the knots immediately.
3206.183,3214.773,"I telescoped a few sutures in so that I can get the tiger territory, the area where all the vasculature is done properly first."
3215.774,3217.877,So I took a lot of interrupted
3218.414,3247.425,extra corporeal sutures but i did not throw the notch down so that i have good visualization and this kind of a technique you use in vascular surgery as well so when you're doing a difficult vascular anastomosis or you're trying to put a tube graft onto the iota you sometimes telescope the posterior part of the graft and telescoping technique or parachuting technique is very very good because it allows you to see the edges very well and then you can throw all of these knots down together so that the mesh is in place
3249.481,3253.748,"I prefer using Proline for most of my work, but I think Ethabond is equally good."
3254.289,3258.235,"Although you cannot throw any extra copper in knots with Ethabond, that is quite tricky."
3258.836,3261.06,So I end up using Proline for most of my work.
3261.961,3265.287,I use a tool Proline with a 90 centimeter thread and that makes it quite easy.
3265.387,3272.398,"Once the posterior fixation is done, then you can start with anterior fixation and now you can start seeing how it looks like."
3272.438,3275.303,"Now, please visualize the size of the defect now."
3276.262,3303.754,please visualize the size of the defect this defect is quite big right now but as i start closing the diaphragmatic defect now you can see the defect is getting smaller and smaller with every stitch now this is the final appearance that we have now i'll show you all the way around we have good closure of the diaphragm the mesh is very well secure it is moving with respiration and it is
3304.477,3307.26,It is very unlikely that there will be any records in this case.
3315.671,3315.991,Okay.
