start,end,text
42.654,51.425,"Following the induction of general anaesthesia, a dual lumen endotracheal tube is sighted and the patient is positioned in the left lateral position with the right side facing up."
51.445,56.751,Standard 3 ports vats is established and a wound retractor is used in the utility incision.
60.173,65.398,The upper lobe lesion is first identified by palpation and then marked lightly with a diathermy.
67.96,70.963,The posterior lesion is then palpated and marked in a similar fashion.
74.106,77.349,Here you can see the instrument for holding the laser fibre in the VATS setting.
78.47,82.494,"The laser fibre is mounted firmly within the tube, giving precise control at the tip."
83.054,87.919,The colour and intensity of the laser light at the tip can be customised to personal preference.
88.186,95.258,The laser is activated using a foot pedal and the distance between the laser tip and the lung tissue can be varied to control the intensity of the beam.
95.298,105.475,"You can see that the laser is extremely precise and dissection is developed in a circumferential manner, taking care to ensure a 5mm margin is respected around the whole lesion."
106.417,113.248,"Thermal extension of the laser into the tissue is approximately 5mm, giving an effective resection margin of 1cm."
113.87,118.455,The wavelength of the laser is then modified to allow coagulation of the nodule bed.
119.957,124.643,Our attention is then turned to the lower lobe lesion and the laser blender is switched back to vaporise.
131.811,137.818,"The same technique is used to resect the lower lobe lesion, which is almost twice the size of its upper lobe counterpart."
138.237,146.767,"Extra care should be taken when lasering a thin piece of tissue in close proximity to the chest wall, since inadvertent thermal injury can exacerbate post-operative pain."
148.029,152.674,"The second specimen is removed, and a final cycle of coagulation is applied to the nodule bed."
153.375,167.232,"A thorough washout with warm water is performed, and then local anaesthetic, typically 40 mL of 0.25% bupivacaine, is instilled directly in the intercostal spaces, using a hypodermic needle mounted on a Robert's forceps."
167.498,170.522,Any ooze can be controlled with light pressure from a peanut swab.
171.564,177.552,Our practice is to over-sew the nodule resection beds using a 3O PDS suture in two layers.
178.253,181.197,This may help increase pneumostasis and haemostasis.
182.378,188.066,"On inspection of the lower lobe nodule resection bed, there was an area of tissue which was concerning for residual tumour."
188.407,193.894,"Therefore, before over-sewing, the laser was again used to resect this suspicious piece of tissue."
194.228,205.331,"To overcome challenging angles and positions, the laser can also be used through incisions other than the utility, as can be seen here when delivering a coagulation cycle to the rather posterior lower lobe resection bed."
206.653,211.984,A second sequence of oversewing with a dual layer of PDS is performed for the lower lobe resection bed.
218.326,224.572,"Some additional warm water is used to test for pneumostasis, as any significant air leak should be repaired at this stage."
225.313,229.678,A chest tube is sighted apically and full lung expansion is ensured at the end of the case.
