start,end,text
735.276,743.445,"So this is how we position ourselves to perform the non-intubated vets, and that's the specimen on the right side of the screen."
820.763,844.864,so we decided that yeah she needs to go for surgical resection and reconstruction of the trachea and the decision was made that we should attempt a non-intubated manner rather than an intubated technique and so we went on with the idea of non-intubated surgery
845.3,859.258,uh and and we had plan a and plan b plan c the plan a was carried on with non-integrated from beginning to the end plan b is if she deteriorates along the way we can know to open through our potomac and put in our cross field ventilation
860.268,880.96,uh sorry that is plan c plan b is we put a cross view ventilation uh by open thoracotomy or if before i transact the trachea actually deteriorates i just put in a tube above the stenosis and ventilate uh ventilate her from above the stenosis
880.94,906.93,so we started off uh the access as usual into uh bats and then this here i use wiggle block to control the mediastinal movement this hematoma is because of the post uh due to the paravertebral block given pre-operatively in interest of time you'll just uh uh increase the uh what you call uh past under video and uh
911.197,917.004,"So once the block is given, dissect the azygous vein and divide it."
919.867,929.318,And then dissect the vagus and hitch it posteriorly so that the vagus and vein will be away from the dissection area.
933.683,938.048,And then the dissection of the trachea is done.
938.197,946.872,"By both sharp and blunt method, and then there will be some addition because she underwent multiple dilatation before this."
946.892,952.001,So the addition between esophagus and the trachea and the surrounding structure is quite dense.
952.161,954.184,So we need to dissect and take our time.
954.866,958.652,A stay suture is applied in the proximal part of the trachea.
969.145,974.295,"So once confirmed, incision is made at the point of stenosis"
975.862,978.064,and the scissors is used to cut.
978.164,984.631,Try not to use energy device to divide the trachea because it may disrupt the blood vessels and that can hinder the healing process.
985.632,997.284,"So here you can appreciate the stenosis and the fibrotic trachea lumen and continue the separation between the esophagus and the trachea, membranous part of the trachea."
997.985,1001.228,And now we're going to divide the proximal portion of the stenosis
1002.777,1006.722,End division of the trachea is done carefully.
1008.444,1017.035,"And once all that is performed, the two airways are disconnected."
1017.495,1018.837,There's no tube in between them.
1019.398,1025.826,The patient is just breathing by spontaneous ventilation with laryngeal mass airway.
1027.228,1031.653,"So throughout this procedure, the saturation airway actually dropped below 90%."
1031.903,1034.287,"Most of the time it was about 95, 96%."
1035.93,1038.474,But there was a CO2 buildup up to 70.
1039.756,1047.369,And it was successfully washed out once I completed the anastomosis by our anesthetist.
1048.511,1057.827,"So here you can see that we are dividing the, I'm trimming the distal part of the trachea to have a better anastomosis."
1059.73,1064.175,So here's the patient on LMA with a bispectral index monitor.
1065.616,1069.6,And this is how we perform the surgery in a uniportal access.
1071.602,1072.783,And those are the monitors.
1073.004,1080.411,"Here you can appreciate, you can see it's about 97% SpO2 and the bispectral index monitor is there."
1081.673,1087.999,And so this procedure is completed by anastomosing the two ends of the trachea.
1088.722,1104.874,And one more thing that we need to appreciate in this procedure is that the bleeding must be taken care so that there's no flooding of the airway due to overwhelming or uncontrolled bleeding.
1106.693,1120.492,"So in this situation, anastomosis is performed in a continuous manner using a monofilament absorbable 3O double-ended needle, just like how vascular anastomosis is performed."
1121.373,1136.194,"And you'll have issues with suture tangling, but you just need to make sure that the way you pass in the suture and take out the suture is monitored and followed, and you can prevent this tangling from happening too frequently."
1137.085,1147.379,"So we just carry on circumferential anastomosis of this trachea and once the anastomosis is complete, a leak test is done before I tie the knot."
1150.203,1162.84,"And then once I'm sure there's no leak, I don't use any patch to secure the anastomosis."
1162.921,1171.839,I just drop all the structures back on itself and it should seal off whatever that's needed if there's any form of leak happens.
