start,end,text
0.031,14.483,자 이번에는 암들 그 중에서 이 포스 바이폴라에 대해서 얘기를 할게요.
14.503,18.872,얘는 제가 이제 3암을 사용하는데 주로 이제 티슈를 홀딩하는데 많이 써요.
18.892,19.153,모양은 이렇게 생겼구요.
19.133,35.808,여기는 둥그런 모양의 이빨을 갖고 있고 특징은 여기 더블 액션이에요.
35.828,35.908,그렇죠?
35.928,36.148,축이 두 개가 있죠.
36.168,37.291,여기 축이 하나 있고 여기 축이 하나 있고 이렇게 두 개의 축을 갖고 있기 때문에 힘이 굉장히 세요.
37.311,37.491,그게 특징이에요.
37.511,38.914,어떤 걸 물고 있어도
38.894,50.523,잘 놓치지도 않고 굉장히 안정적으로 물 수 있어요.
50.543,53.751,이제 로봇 수술을 하는데 그냥 암 두 개만 이렇게 받고 하시는 분도 있어요.
53.771,54.372,그리고 나머지 어시스턴트 서전이 여기를 막 이렇게 멀로
54.352,71.179,흉관경기구나 복관경기구 들어와서 막 잡고 있고 막 이렇게 해줘서 하시는 분도 있는데 저는 기본적으로 처음에 시작할 때부터 세팅을 솔로 서저리로 세팅을 했어요 그게 이제 궁극적인 목적으로 해서 세팅을 했기 때문에
71.412,95.578,어시스턴트 서전의 능력에 관계없이 똑같은 퀄리티의 수술을 계속 만들려고 노력을 했어요.
95.598,96.879,그렇기 때문에 어시스턴트 서전에 들어와서 뭔가 프로세서에 도움을 안 줘도 될 수 있게 만들기 위해서 이 암을 써요.
96.899,97.42,그래서 이 암은 예전에는 여러 가지가 있었어요.
97.44,98.601,다른 형태가 있었는데 이것저것 써보다가 최근 몇 년 전에 이걸로 바꾸고 지금은 현재 이것만 쓰고 있어요.
98.581,121.044,그래서 얘는 주로 홀딩 하는 데 써요.
121.064,121.124,홀딩.
121.144,121.924,이렇게 딱 잡고 팔을 이렇게 바꿔주면 그러면 얘는 절대로 안 움직여요.
121.944,122.165,절대로 안 움직여요.
122.185,123.366,근데 어시스턴트 보고 이거 잡고 있으라고 하면 한 3분만 지나도 막 부들부들거리고 막 움직이고 그러거든요.
123.386,124.487,그래서 안정적이지 않은데 얘는 로봇이기 때문에 멈춰 그러면 절대로 안 움직이는 그런 장점이 있고요.
125.75,149.361,그리고 렁이 이렇게 눌린 자국은 생기지만 렁을 잡아도 인절리가 별로 없어요 그래서 얘를 선호해요 근데 이제 홀딩 하면은 홀딩이야 뭐 어시스턴트 하는거 마음대로 하는거지 라고 생각하지만 이게 로봇이 8개의 관절을 가진 암이잖아요 그래서 홀딩을 다양하게 할 수 있다는게 장점이에요
149.729,175.213,우리가 2d 로 이걸 볼 때는 홀딩을 뭐 하면 이렇게 할까요 이렇게 이정도면 홀딩이죠 그냥 요기가 타겟에이얼이면 요걸 좀 넓게 벌려줘서 티슈를 좀 넓게 해주면 짜리가 터나잖아요 그정도인데 3d 가 되면은 홀딩이 방향이 이렇게도 할 수 있지만 이렇게도 할 수 있어요 이렇게 이렇게 그러면은 디비전 하면서 이게 덱스가 생길 수도 있어요 그래서
175.193,191.559,홀딩도 3D로 할 수가 있어요.
191.579,193.262,"위쪽, 아래쪽, 좌, 우, 상, 바 이런 것들을 3차원적인 홀딩을 할 수가 있어요."
193.282,200.073,"굉장히 어려운 포지션의 홀딩, 이런 홀딩, 이런 홀딩, 이런 것도 돼요."
200.093,201.495,"이런 것도 되고, 이러해서 어시스트 서전이 도와주는 것보다는 훨씬 효율적인 홀딩을 할 수 있는 머신이라고 생각을 하시면 돼요."
201.515,201.876,"자, 이거는 잘 보이는 내용이니까"
202.649,217.519,"근데 이 환자분은 이제 세그멘텍토미 할텐데 물론 여기도 박리를 해야지만은 결국은 세그멘텍토미의 상당 부분은 엔트리아 코치를 하거든요 그럼 얘를 또 홀딩을 해야 돼요 그럼 얘를 잡고, 잡고 있어야 돼요"
219.153,237.789,그리고 얘로 여기를 파고 들어가야 돼요.
237.809,237.869,그쵸?
237.889,238.089,움직이면 안 되죠.
238.109,241.195,플래닝이 바로 옆에 있고 뭐 등등 바이탈 스트럭처들이 있기 때문에 굉장히 중요한 홀딩인데 이거를 자기가 마음대로 이렇게 할 수도 있고 이렇게 할 수도 있고 이렇게 할 수도 있고 이거는 자기가 원하는 대로 홀딩을 할 수 있게 하는 그런 어떤 마법의 암이라고 생각을 하시면 돼요.
241.951,258.185,"물론 이제 궁극적으로는 이소파부스에서 리퀴런트 라인젤러 노 다이섹션, 이쪽 에어리 하세가 가장 효율적이기는 해요."
258.205,258.646,그렇지만 런에서도 잘 쓸 수 있다는 것.
258.666,258.987,그래서 포스 바이폴라였습니다.
259.127,259.167,끝.
