start,end,text
51.584,58.834,"After entering the thoracic cavity, the abnormal artery arising from the descending aorta was identified 1 cm just above the diaphragm."
59.555,63.621,The artery was dissected and was transected using NDGIA vascular stapler.
64.863,68.828,Then we opened the inferior pulmonary ligament and we dissected the inferior pulmonary vein.
70.731,75.718,Then we completed the fissure and we dissected the arterial trunk and the bronchus of the left lower loop.
84.119,85.882,Here is the stump of the abnormal artery.
87.083,89.046,And here is the stump of the inferior pulmonary vein.
94.033,95.636,We took out the loop using endobag.
97.438,101.204,We inserted regular chest tube 16 French throughout the same surgical incision.
102.065,106.171,Then lung inflation under vision by pulling out the endotracheal tube to the level of carina.
