start,end,text
1558.793,1560.935,Затем мы обрисовываем вегас.
1560.955,1568.042,"Некоторые люди регулярно трансцептируют вегас, но мы считаем это удобным, чтобы просто двигать его вперед из нашего пути."
1569.862,1582.434,"Затем мы просто сжимаем нодные пакеты, закрепляя большие вещества или используя диаферму, как мы делаем."
1582.654,1594.185,"Обычно СВЦ дает несколько венозных бронхов, так что небольшая помощь должна быть принята рядом с СВЦ, потому что они могут быть слегка опасными в зависимости от болезни."
1594.285,1597.708,"Итак, вы можете видеть здесь, что пакет Station 2-4 отмечен очень хорошо."
1599.595,1614.925,"В глубине СВС будет Тракея, а Вегас будет виден позже."
1615.306,1616.929,"Иногда это зависит от того, как высоко мы его возьмем."
1618.124,1625.298,"И там прекрасное результат в конце, с чистой станцией 2R-4R."
1625.318,1632.673,"И вы можете видеть тракею и даже аорту внизу СВЦ, и Вегас очень четко."
