start,end,text
317.838,331.935,"Таким образом, мы положим anterior access incision прямо перед latissimus dorsi, где-то около шестого или седьмого интерспейса."
331.955,342.107,"Это в частности направлено на пальпацию, то есть ощущение, что интерспейс дает большую площадь, когда приходится выращивать специи или добавлять в стапельки."
343.066,362.354,"После того, как мы сделали эту инсизию, мы можем поставить камеру и посмотреть вверх, и найти лучшую зону внутри треугольника, чтобы установить оптический порт."
362.374,366.019,Третий порт установлен около уровня с верхней половиной инсизии в середине мировой линии.
367.315,373.161,"Вы положили свои три порта, и у вас есть прекрасное зрение прямо вверх."
406.786,411.07,Это очень важная точка в лобектомии.
411.09,417.636,Мы будем смотреть видео про практику мистера Уокера.
417.656,419.738,Мы находимся на левой стороне честа.
419.758,421.9,Вы можете видеть внешний вид.
422.401,428.166,"Вы можете видеть, что мы использовали два пинута на Робертсе, чтобы открыть лобекту."
428.186,430.848,"Это прекрасная лобекта, в данном случае."
431.149,433.671,"Вы можете видеть, как быстро мы поднимаемся к артерии."
435.119,446.303,"Если вы притягиваете зубы вперед, то вы можете видеть арчу и полмолочную артерию сзади."
446.323,448.107,Мы просто очистим это.
448.127,451.294,"Мы теперь поднимаем шею и используем эндодисептор, чтобы вступить в шею полмолочной артерии."
451.314,455.423,"Вы можете видеть, что сегментарный бронхосклероз идет сверху в 12 часов."
457.782,464.391,"После того, как вы в шее, вы можете проникнуть на полную артерию."
464.411,465.673,Вы можете проникнуть на полную артерию.
465.693,472.883,Вы можете проникнуть на полную артерию.
472.903,475.407,Вы можете проникнуть на полную артерию.
475.888,477.77,Вы можете проникнуть на полную артерию.
477.89,483.438,Вы можете проникнуть на полную артерию.
483.679,486.743,Вы можете проникнуть на полную артерию.
490.199,508.427,"Мы хотим проникнуть через эти узкие места, так что мы проникаем через эти узкие места с сайластичным проником, а затем мы продолжаем проникнуть через эти узкие места с сайластичным проником, так что мы продолжаем проникнуть через эти узкие места с сайластичным проником, так что мы продолжаем проникнуть через эти узкие места с сайластичным проником, так что мы продолжаем проникнуть через эти узкие места с сайластичным проником, так что мы продолжаем проникнуть через эти узкие места с сайластичным проником, так что мы продолжаем проникнуть через эти узкие места с сайластичным проником, так что мы продолжаем проникнуть через эти узкие места с сайластичным проником, так что мы продолжаем проникнуть через эти узкие места с сайластичным пр"
510.112,518.932,"И, как сказал мистер Уокер в интервью, выполнение этого будет открывать пульмонийную артерию и ее бронхи, как в книге."
518.952,521.278,И вы можете видеть это очень красиво здесь.
521.298,526.77,"Вы можете теперь видеть лингулярную артерию и последнюю сегментальную артерию, так же как и базовую ПА."
526.75,532.056,Давайте посмотрим еще одно пример.
532.076,537.863,Это снова на левой стороне.
537.883,539.966,Мы быстро разделяем с курицей.
541.848,548.476,"И снова, я заполнил некоторые из этих фото, только для того, чтобы улучшить время для этого видео."
548.516,549.337,"Просто, чтобы вы знали."
549.357,550.598,Это был красивый фишер.
550.578,563.052,"и вообще не требовало никакого стапелирования и вы можете видеть, что только простой диссекционированием мы можем перейти вверх по полной артерии и давайте просто перейдем на правую сторону"
563.453,577.411,"И снова, мы просто отрабатываем верхний лоб, нижний лоб и нижний лоб в 6 часов."
577.431,578.813,Этот пациент также имеет очень хороший фишер.
578.833,582.097,"И мы используем пинусы, чтобы просто открыть артерию пульмы и распознать ее."
582.117,585.081,И вы видите это довольно четко там.
586.443,588.786,"Там почти невероятно лимфатический нод, и это очень легко видно здесь."
588.766,605.55,"Если у вас есть только небольшое количество легкой ткани на спинном облаке спины, то вместо стапельки вы можете ее прикрепить, измельчить или диатомизировать."
605.991,611.499,Обязательно будьте осознаваемы с риском влажности воздуха.
611.519,614.503,"Здесь мы используем 5 мм стапельку, чтобы прикрепить и измельчить."
616.981,622.752,Прежде чем открывать облако плеча на правом.
622.772,625.297,"Вы можете видеть, что мы хорошо вошли в шею."
625.317,627.04,Вы можете видеть очень хорошо полную артерию.
627.06,634.534,"И вы, возможно, даже просто видите там, что ПА-бранч к апексу нижнего лоба."
636.657,646.548,"Теперь мы проведем пробег Роберта по полной артерии и также по невероятным лимфатическим нотам, которые существуют здесь."
646.568,648.25,Вы не идете под лимфатические ноты.
648.531,657.241,"Мы теперь собираемся притягивать нижний лоб вперед, и мы попытаемся выйти, что очень легко видно, и затем мы заполняем эту часть."
657.261,661.686,"Опять же, у нас есть очень либеральная политика заполняемости, чтобы минимизировать воздействие воздуха."
663.421,690.61,Продолжение следует... Продолжение следует... Продолжение следует...
766.179,770.563,"Давайте посмотрим пример этого, потому что, очевидно, вы только что видели красивые рыбалки, но они не все такие, и некоторые рыбалки могут быть ужасными."
770.999,776.952,"Очень плохой COPD, FEV1 в 30% и очень гиперинфицированные зубы."
776.972,781.001,"У нас очень много трудностей в том, чтобы убрать зубы."
781.021,781.402,Мы на них нажимаем.
781.422,786.814,"Мы, на самом деле, даже украсили большим отверстием, чтобы попытаться избавиться от воздействия воздуха."
786.794,805.315,"но, несмотря на это, пытаться найти ПА в рыбе было очень трудно, поэтому мы двигали ногу вверх."
805.335,806.576,И у нас получился абсолютно замечательный вид.
806.596,808.659,"Это правая главная бронхи, а затем правая верхняя левая бронхи."
808.679,809.76,"Вы можете видеть, что они идут прямо вверх в 12 часов."
809.78,810.961,"Мы просто двигаемся вверх, вверху бронхи-интермедиуса."
810.981,812.363,И полмниартрит был просто за нами.
812.343,816.252,"Вы можете делать все, не используя фишер."
816.272,823.97,"Это левая сторона бронхи, которую мы обсудим сначала, как сказал мистер Уокер в своих техниках."
823.99,828.04,"И вы можете видеть тронкельную бронху, которую мы просто разделяем с другой стороны..."
828.02,844.346,"Несмотря на то, что вы стреляете в неровную сторону, вы можете легко разделить верхние бронхи."
844.366,850.115,"Не нужно делать тест инфляции нижних лобов, потому что вы можете видеть в прекрасном виде, что вы не случайно получили бронхи-интермедиус."
850.135,854.061,"Бронхи разделены первыми, без того, как вы взяли фишер."
854.041,857.965,Вы можете видеть артериальные бронхи.
858.206,863.251,Мы уже видели очень большую бронховую бронху.
864.172,870.399,"Она, в действительности, кажется быть двойной."
870.419,873.823,И в данном случае есть очень маленькая подседка.
873.843,877.007,"И мы могли бы сделать эту подседку первым, если бы она появилась первым, но мы взяли бронхи, и теперь мы используем стейплер."
877.067,882.613,"И опять же, хороший момент от мистера Уокера, что стейплеры могут быть меньше в ватцелебектоме."
888.398,908.798,И это просто стабилизация тромбового или апиконтериального ряда к правому верхнему лобу.
918.67,929.448,"Первое, что я делаю, это указывать на артерию поздней сегменты и рассмотреть, whether we should be dividing that or the right upper lobe bronchus first."
929.488,936.259,That really just depends which one would be the more convenient to take and which would be the safer approach.
937.893,944.422,"И мы только что увидели в технике фишерлесса, что бронхи были взяты сначала, а затем последняя подседка."
944.482,949.389,И в этом видео мы только что видели подседку подседки сцепленную.
949.409,956.499,"И теперь, после того, как мы взяли последнюю подседку, мы теперь взяли правую нижнюю подседку бронхи."
956.599,959.783,"Опять же, мы рутинно слим эти."
959.763,978.351,"И вид, как я уже говорил, так прекрасен, что мы не должны делать тест инфляции, потому что это облажает нашу вид, и мы потеряем время."
978.371,984.3,"Перед тем, как мы делаем бронхи, мы обычно выклепляем весла, которые ходят по бронхи, бронхиолатрии."
984.48,988.386,"После того, как мы разделили бронхи, это создает отличный рычаг."
989.193,1000.472,"Вы поднимаете его с форсепсом и поднимаете его вверх, чтобы измельчить нодный пакет, который сидит перед апелло-бронкосом."
1000.492,1007.343,Вы убираете его от апелло-бронкоса и прикрепляете к нему веселки.
1007.383,1014.475,"Эти веселки потом поднимаются в хайлум, и вы измельчаете апико-антерийный трюк."
1016.193,1022.619,"И это очень приятный пример того, что сказал мистер Уокер."
1022.639,1026.282,"Мы сверлили какие-то ноты, и мы взяли некоторые и послали их для хистологии."
1026.302,1036.632,"У нас есть эпико-антериал или троникол-бранч здесь, с абсолютно удивительным видом на него."
1038.854,1043.618,"Мы сверлили веселье, и используя длину 30 сантиметров, мы открыли эту площадь, так что вы можете очень безопасно и легко"
1043.598,1073.014,Продолжение следует... Продолжение следует...
1073.72,1079.406,"и выполняем операцию, разделяя трансверсийные швы."
1079.527,1084.072,"Опять же, в основном с посередины, но также с anterior."
1084.152,1087.135,"Я думаю, опять же, это что-то другое, чем антиреактивный подход."
1087.155,1090.839,"Суперпоморийный венок будет отталкиваться сзади, вместо переднего."
1090.859,1093.462,"Но я думаю, что вы также можете отталкиваться с переднего, не так ли?"
1093.482,1094.964,Вы можете отталкиваться с переднего.
1094.984,1101.972,"И, конечно же, как и мы об этом обсуждаем, это почти противоположная претензия к антиреактивному подходу, где вы делаете венки сначала, затем артериальные бронхи и затем бронхи."
1103.369,1110.778,"Но это работает очень хорошо, и это полностью репродуктивно и прямо."
1110.798,1113.328,"И я думаю, что я начинаю понимать, что это легко учить."
1115.435,1124.551,"Итак, в видео мы просто демонстрируем точно то, что сказал господин Уолкер о завершении виски."
1124.832,1132.906,"У нас есть замечательное зрение на горизонтальную виску между верхним лобом и средним лобом, и мы выходим из этого виска либо спереди, либо спереди."
1132.946,1139.097,"Мы начинаем с этого виска, с виска, который приходит из нашего более спереднего порта."
1139.077,1154.38,"И теперь мы возвращаемся к себе, чтобы создать фишер на том же уровне, который мы хотим."
1154.841,1160.95,"И вы можете видеть, что у нас есть отличное зрение, и мы можем видеть концы наших инструментов, так что мы знаем точно, где мы срезаем и что мы срезаем."
1163.039,1168.246,И это выполняет диссекцию нижнего лоба.
1168.266,1176.437,"Мы затем удаляем это от честа в то, что мистер Уолкер любит называть «Эдинбургской аустерикой»."
1176.457,1185.41,"Этот пластиковый пакет является тем пакетом, в котором входит честовая трубка, и поэтому он полностью свободен."
1185.77,1190.076,"Вы просто используете четыре Роберта, один в каждом углу, выкладываете их, положите лоб в этот пакет и удаляете его."
1192.756,1207.131,"Обычно большие туманы нуждаются в больших антибиотических портах для удаления, но в целом наши порты никогда не нуждаются в более 4 или 5 сантиметров."
1207.151,1210.9,"И туманы удалены в пакет, чтобы остановить возможность седания."
1220.988,1228.257,"И если мы перейдем на левую сторону, на левую лебедку, как это будет разнообразно?"
1228.277,1229.359,"Я думаю, что это будет не так разнообразно."
1229.379,1230.681,Это будет почти точно то же самое.
1230.701,1247.743,"На самом деле, разница в том, что мы делаем артериальные бронхи, после того, как делаем позтериоблик фишер, а затем бронхи, а затем ванну."
1247.763,1249.645,"И закончим сантериальную часть фишер, если она фишер, перед тем, как мы делаем ванну."
1251.413,1257.255,И вот пример остатка лобектомии.
1259.058,1266.931,Два северных сегментных артерий к левому верхнему лобу.
1266.951,1281.334,"Мы сделали пространство за ними, и вы можете видеть, что стейплер идет вокруг, с отличной видимостью с обеих сторон стейплера, позволяющим безопасную дивизию."
1281.354,1285.521,"Вы можете видеть арчер-дейл, который находится на верхнем лобе стейплера, на 12 часов, на 6 часов."
1287.323,1300.244,"Мы взяли пустые артерии, и теперь мы делаем апокалиптическую артерию."
1300.264,1304.17,"И опять, с хорошей безопасностью."
1304.19,1306.834,"И мы можем очень хорошо видеть, что это безопасно для степени."
1309.497,1314.445,"И, очевидно, у меня есть возможность работать с вами уже за год."
1314.465,1321.878,"И одна вещь, которая меня очень впечатлила, это способность делать сегментальные рецепции вместо полных лобектомий."
1321.898,1323.621,У вас есть какие-то советы и советы?
1323.641,1328.629,"Но, я думаю, главная задача – это сделать позитивный подход очень легко, не так ли?"
1328.649,1329.491,"Я думаю, да."
1329.751,1332.636,"Я думаю, ключ к сегментальной рецепции – это"
1333.139,1345.462,"и потом бронхи, и эти вещи так хорошо распространены во время посттериологического подхода."
1345.482,1352.215,"И вы можете видеть здесь лингвистическую артерию, которую мы просто диссектируем, чтобы мы могли получить отличную виду на лингвистическую бронхи."
1352.235,1355.08,"Итак, мы поднимаем лингвистическую артерию с внутреннего диссектора, и вы можете видеть очень четко внизу лингвистическую бронхи."
1392.577,1400.765,"Это довольно простой вопрос, на самом деле, потому что вы можете очень хорошо посмотреть на субкринальное пространство."
1400.785,1405.35,"Как всегда, это немного сложнее с левой стороны, чем с правой стороны, потому что субкринальное пространство слегка обширное,"
1405.82,1410.167,"Причем, в частности, у старших пациентов."
1410.187,1420.863,"Если у вас есть анестезиолог, который вставляет в ванну с правой стороны, вы получаете хороший доступ с левой стороны и, наоборот, с правой стороны."
1420.883,1426.832,"Я думаю, это ключевая точка, чтобы получить двойную ванну с длинной ванной на противоположной стороне от той, на которой вы работаете."
1427.825,1435.579,"И я думаю, что для этого стационарного 7-го нода, когда камера просто напротив него, с позитивным подходом."
1435.599,1443.473,"Да, и мы обычно разделяем вагонные части, чтобы освободить эсофокус от хайлома."
1444.594,1451.166,"Возьмем стационарный 7-й нодный пакет, связанный с противоположным бронхом."
1452.023,1466.196,"чтобы он остался спрятан от ипсилатеральной бронхи, а затем на ипсилатеральной стороне и наконец-то прикрепить эти маленькие растения, которые входят в верхнюю часть пакета."
1466.216,1470.707,"И вы можете очень хорошо видеть здесь, на видео, точно то, о чем говорил господин Уокер."
1472.037,1486.502,"Мы просто освободимся сначала от глубинного аспекта, нода, а затем от более высокого аспекта, убирая его с заднего левого крышечка."
1488.17,1502.185,"Как вы можете видеть, после того, как мы прикрепили эти вагонки, вид на них действительно прекрасен."
1502.365,1505.609,Это довольно маленькая пакетика стационарных 7-й нод.
1505.629,1509.573,И мы наконец-то оставляем до конца эту часть апокалипсиса.
1510.133,1516.32,"И мы обычно кладем несколько прикреплений на апокалипсисные части или много диэтермии, потому что мы обнаруживаем, что в этой области есть много федоров бронхиальной артерии."
1521.093,1526.765,После удаления нодов вы получите прекрасное видение 7-го стационара.
1526.785,1534.481,Переходим к 2-м и 4-м стационарам на правой стороне.
1534.541,1540.975,С ватцелебектом довольно просто выполнять диссекцию в этом районе.
1542.457,1558.773,"Клюра обрисована и обрисована, и обрисована рядом с superior vena cava."
