start,end,text
140.92,150.572,وهذا هو وضع المساعدات والكاميرا بعد وضع الروبوت.
150.592,159.444,بدأت المساعدة باستخدام قطعة الليجامون التريانجولي للأسفل الجفن الأسفل الجفن الأسفل.
159.464,169.577,باستخدام نظام تصميم التصميم المولتيموديل ، تم إدارة الجفن للمساعدات S9 و S10 بعد إختفاء المساعدات البرونكيالية والأرتيالية.
172.173,202.011,بعد إدارتهم ، كانت الزجاجات V9 و V10 تتحكم ومن ثم تتحكم من خلال استخدام مستقبل مستقبل مستقبل مستقبل مستقبل مستقبل مستقبل مستقبل مستقبل مستقبل
213.483,226.007,في المرحلة الثانية، كانت مكونات الـ A9 و A10 قابلت من خلال الزجاج
228.637,257.749,بعد الوصول الى عضلة النيلسونية والعضلات المتوسطة نستخدم نظام تصميم التصميم المليمودي للوصول الى عضلات ال-S9 و-S10 لم يكن التصميم المتوسط بشكل راديكالي ولكن التصميم المتوسط بشكل مباشر لأن التصميم المتوسط الأول كان نيجاتيباً على التحقق الاقتصادي ولم يكن التصميم المتوسط بشكل راديكالي ولكن التصميم المتوسط بشكل راديكالي
257.982,285.61,بعد تحقيق عائلات A9 و A10 نقوم بإضافة محطة محطة عائلات A9 و A10 هذه هي تحقيق العائلات
290.298,299.92,و بعد تحقيق الارتريات ، نضغط على المحطة المسكينة لقطع الارتريات S9 و S10
316.387,337.99,ثم يمكننا أن نقوم بإعادة التخصيص من أسفل الجبن للأسفل والأسفل من أسفل الجبن للأسفل من أسفل الجبن والأسفل من أسفل الجبن والأسفل من أسفل الجبن والأسفل من أسفل الجبن والأسفل من أسفل الجبن والأسفل من أسفل الجبن والأسفل الجبن والأسفل الجبن والأسفل الجبن والأسفل الجبن والأسفل الجبن والأسفل الجبن والأسفل الجبن والأسفل الجبن والأسفل الجبن والأسفل الجبن والأسفل الجبن والأسفل الجبن والأسفل
349.411,374.406,بعد قيادة البرونكي للمجموعة S9 و S10 و قيادة المكونات المتعلقة بها والمكونات المتعلقة بها والمكونات المتعلقة بها والمكونات المتعلقة بها والمكونات المتعلقة بها والمكونات المتعلقة بها والمكونات المتعلقة بها والمكونات المتعلقة بها والمكونات المتعلقة بها والمكونات المتعلقة بها والمكونات المتعلقة بها والمكونات المتعلقة بها والمكونات المتعلقة بها والمكونات المتعلقة بها والمكونات المتعلقة بها والمكونات المتعلقة بها والمكونات الم
375.382,393.185,يتم إدارة المنطقة القسمية بسرعة بسبب أنه من خلال المنطقة الفاسكولية لا يتم إدارة المنطقة بسهولة.
393.625,402.857,تقريباً تقريباً تقريباً تقريباً تقريباً تقريباً تقريباً تقريباً تقريباً تقريباً تقريباً
405.689,421.96,ثم نضغط على الزجاج بعدما نتبع المنطقة يجب أن نكون حذرين لكي لا ننطلق على المجموعة الأخرى وكذلك على المجموعة الأخرى وكذلك على المجموعة الأخرى
441.532,470.661,بعد تنفيذ التنفيذ التقليدي ، يتم وضع النباتة المستخدمة في مقبضة قطعة قطعة قطعة قطعة قطعة قطعة قطعة قطعة
470.911,482.665,لإيجاد إيجاد أفضل الهيروستازيس والهيموستازيس ، يتم إضافة بطاقة من الهيموستاتيك إلى المنطقات المنطقية.
482.685,495.601,بعد التغطية ، يتم إضافة الأبعاد من المنطقات الأسفل الركضية ، النلسون ، المنطقات السابعة والمنطقات الثانية ، بشكل صحيح.
495.901,498.825,تنتهي التجارة بإضافة مكسورة الجسم.
