start,end,text
1.364,9.356,"This is a robotic-assisted right lower lobectomy, and this patient had a cancer in the right lower lobe, which you can see visualize the dark spot on the lung."
10.017,12.421,I usually do my mediastinal lymph node dissection.
12.481,16.667,This starts with mobilizing the inferior pulmonary ligament.
16.687,23.878,"I'll remove any station 8 or 9 lymph nodes, and I go all the way up to the inferior pulmonary vein, which is visualized."
25.259,33.769,"I sometimes will go to the anterior mediastinum a little bit here to define where the middle of vein, you can see the middle of vein to the right coming off the superior vein."
33.809,36.433,So the inferior vein is going to be separate.
36.453,41.399,I then retract the lung anteriorly and I dissect the posterior mediastinum.
41.599,46.985,"And in this location, you can get station eight lymph nodes along the esophagus, which is visualized here."
47.566,53.173,And then I go along the bronchus to get into the subcarinal area to get station seven lymph nodes.
53.592,61.862,"I use the long bipolar grasper as my energy source, which has very little spread and cauterizes quite nicely."
61.962,65.226,This is the junction between the upper and lower lobe bronchus.
65.246,66.567,There's always a lymph node there.
66.988,72.054,The artery that you can see to the bottom of the screen is the posterior ascending artery.
72.754,77.2,"And if you skeletonize this area, then you open up the fissure."
77.22,79.262,I then retract the lung inferiorly.
79.664,83.769,And I'll look in station two and four areas along the trachea.
85.05,89.135,And then I will go to the anterior mediastinum to finish dissecting out the vein.
89.235,94.481,"In between the upper lobe and lower lobe veins, there's frequently a lymph node."
95.242,100.889,"After I've done my mediastinal lymph node dissection, I then come into the fissure into the hilum."
100.909,108.658,"And if you've done a good job dissecting the posterior mediastinum, then you can easily get through the fissure between the upper and lower lobes."
109.01,110.372,I have a vessel loop around it.
110.452,113.236,I'm going to come in now with the robotic green stapler.
113.696,122.648,"This is the 45 stapler, and it slides through quite nicely, and I can divide the fissure between the upper lobe and the lower lobe."
123.65,127.235,I usually get the vessel loop out so it's not included in the staple line.
127.875,132.522,"This is now divided, and once that's divided, it really opens up the fissure as visualized here."
132.562,134.224,That is the middle lobe artery.
134.693,135.835,to the top of the screen.
136.075,141.342,"There's usually a lymph node between the upper and lower lobe, the middle and lower lobe arteries."
141.823,148.733,"This is removed, and again, that will open up the basilar segmental arteries to the lower lobe."
148.813,150.555,This is the superior segmental artery.
151.076,152.238,Place a vessel loop around.
152.278,153.399,We bring the stapler in.
153.439,155.122,The anvil always comes up.
155.142,156.904,"I rotate it down, clutch my hand,"
157.762,164.951,"get the right position for the stapler, and then I bring the stapler in, again removing the vessel loop, and I divide the artery."
165.712,169.096,"Once this artery is divided, it again opens up the fissure."
169.456,175.143,"Now I can divide the basilar segmental arteries, again passing a vessel loop."
175.204,178.768,I like vessel loops because it holds a vessel up away from other structures.
179.369,181.291,"The stapler comes in, anvil up."
181.311,182.292,I rotate it down.
182.633,184.956,I then get the angle that I need.
185.016,186.958,I bring the stapler in.
187.293,189.736,"I engage it, then I divide the artery."
189.776,192.08,So now the fissure has opened up quite nicely.
192.981,199.45,The fissure between the middle lobe and lower lobe is a little bit incomplete here.
199.47,203.696,So I want to get the fissure started with the 45 green stapler.
204.517,209.945,"And once that's divided, I can get a vessel loop around to complete the fissure."
211.066,215.713,"And again, I get a vessel loop to hold it up away from the arteries and the other structures."
216.149,219.813,I bring the green stapler in and I divide the bronchus.
219.833,221.776,Now they divide the fissure.
221.816,223.978,Now the artery and the fissures are divided.
224.639,227.723,We now have the inferior pulmonary veins.
227.823,230.686,I'll retract the lung superiorly.
230.726,233.67,And we can see the vein visualized.
233.75,235.512,"Again, I get a vessel loop around it."
236.353,239.757,And I always use four arms with the robot.
239.777,242.46,You can see my third arm is holding up the lung.
243.233,247.9,I've got the vessel loop holding the inferior pulmonary vein away from other structures.
248.04,249.722,I can come in with a white stapler.
250.824,252.026,I fix my angle.
253.007,255.03,"I engage it, and then I fire it."
255.851,261.279,"And then once we have completed the arteries, veins, and fissure, we're now ready to divide the bronchus."
262.02,264.083,So I'll retract along again inferiorly.
264.604,272.515,"I'll skeletonize the bronchus to make sure that I'm away from the middle lobe bronchus, which you can see to the right going to the middle lobe."
272.984,274.566,I'll bring the green stapler in.
275.026,279.532,"In this case, I like the 30 stapler because it's got the anvil tip, which is nice and smooth."
279.692,283.537,I'm not going to graze or tear any vessels as I come in.
284.277,285.058,So I've engaged it.
285.819,287.902,I've stapled and now divided.
288.002,294.029,"I'm still old school, so I inflate the lung just to make sure the middle lobe and upper lobe come up normally, which they do."
294.129,297.273,So now our lower lobectomy is completed.
298.735,302.299,I now will fill the chest full of saline.
302.633,305.156,I'll inflate the lung and look for any air leaks.
306.177,310.181,A third of our lobectomies go home the next day and we can't do it if they have an air leak.
310.241,312.863,"And visualize in the middle lobe, there's a small air leak."
312.903,315.566,So we'll come in and we will seal that with Progel.
316.167,319.29,"Alternatively, you could cauterize it or staple it."
319.37,321.352,We put the chest tube in a direct vision.
321.372,322.713,It's a 20 French chest tube.
323.214,324.976,We position it anteriorly.
326.297,332.083,"And once we have the chest tube in place, we then bring our specimen bag in, which is a 15 anchor bag."
332.452,336.539,"Or more recently, we've used the air seal, which is a 12 millimeter."
336.599,341.427,So we use a Medtronic 12 millimeter or 1200 milliliter bag.
342.108,343.55,This is the diaphragm.
343.671,347.657,Usually ends up being about a one or two inch rent in the direction of the fibers.
347.757,352.766,"We use a 2-0 monofilament V-lock suture, which is six inches long."
353.327,355.59,And this is visualizing repair of the diaphragm.
355.61,356.552,We go through the loop.
357.072,362.9,"The V-lock suture has little barbs on it, so you don't need to tie it, and this is the completed result."
363.561,375.678,"As we have repaired the diaphragm, we'll hold that up, and we'll cut it, and then we will get the suture out, and then we inflate the lung under direct vision."
376.479,382.186,"More videos are available on JETMD.com, J-E-T-T-M-D.com."
382.287,382.607,Thank you.
