start,end,text
1483.448,1490.736,"И вы можете видеть, что, к сожалению, ликошер немного большой для этого размера пациента, но все в порядке, мы сможем это преодолеть."
1490.756,1491.597,Я просто продолжаю открывать его медленно.
1491.617,1492.778,И вот мы начинаем видеть пульмонарную артерию.
1492.798,1494.72,Тот нижний лоб просто продолжает хотеть подниматься в моем поле.
1497.08,1502.186,Вы можете видеть артерию?
1502.266,1504.088,"Да, мы можем ее видеть."
1505.029,1516.683,"После того, как мы это обнаружили, нам гораздо проще идти."
1516.703,1518.946,"Как вы видите, это как книга."
1518.966,1521.969,Я иду от переда до зада.
1521.989,1522.69,Я никогда не перевернул лунку.
1522.71,1524.252,Я только работаю на одной планке.
1524.67,1533.182,"Потому что это требует много времени и энергии, чтобы перевернуть зубы и посмотреть на другие вещи."
1533.202,1535.946,Так что я научился это делать.
1536.026,1542.335,"Так что, что я бы предлагал, если вы делаете открытую лобектурию, то вы заставите себя работать таким образом, чтобы вы практиковали для этого."
1542.876,1543.076,Правильно.
1543.096,1548.524,"Так что вы заставите себя привыкнуть к анатомии и к тому, где есть структуры."
1548.584,1551.608,"Доктор Адамберг, мы просто перейдем на аудио в следующий театр на минуту."
1551.628,1552.79,Окей.
1552.81,1554.492,"Доктор Рамчандра, мы с доктором… Да, да."
1637.277,1666.221,"Да, он это делает."
1668.023,1696.9,Продолжение следует...
1698.753,1719.453,"Все работает только с Windows, так что помните это."
1719.473,1719.573,Все.
1719.593,1724.558,"Видите, я думаю, что superior segment artery находится прямо там, видите?"
1724.858,1725.98,Позже.
1726.28,1728.443,"Да, да."
1728.583,1729.665,"Да, да."
1729.765,1737.476,"Да, теперь мы можем его увидеть."
1737.496,1738.578,Так что это идет немного вверх.
1738.598,1740.02,"Может быть, это разрушено из-за СИЗ."
1740.04,1741.041,"Но, опять же, это просто важно."
1741.061,1743.044,"Так что я знал, что оно где-то там."
1743.064,1743.185,Да.
1743.205,1746.209,И я... Вы просто должны продолжать искать.
1746.329,1746.95,Правильно.
1746.97,1753.039,"Так что половина ключа просто знает, что она там."
1753.059,1753.339,"Так, позже."
1753.359,1753.92,Это не сегмент.
1754.373,1784.346,Продолжение следует...
1786.03,1814.012,Здесь мы видим... Хорошо.
1815.157,1837.868,Но вы можете продолжать еще 5 лет с 2.5 каштарами.
1837.888,1839.51,"Посмотреть, как твои инструменты работают."
1839.963,1853.021,"Я не обычно это делаю, я просто пытаюсь уменьшить размер, чтобы вы могли лучше видеть."
1853.041,1856.566,Это нормальный лунный компрессор?
1856.586,1864.677,"Нет, это абнормальный... Если вы посмотрите на CT-скан, мы не видим СИС, но мы знаем, что есть СИС."
1864.697,1865.018,"СИС там, хорошо."
1865.038,1866.78,"Так что, да, мы должны увидеть это лучше."
1870.81,1890.175,Дайте мне этот маленький диссектор.
1890.195,1890.355,Спасибо.
1891.229,1899.822,"Одна из особенностей полимерной секции, что мне нравится, это то, что у меня есть два Мэрилендов."
1899.842,1916.646,"Проблема в том, что ликошер слишком большой, чтобы сделать очень хорошую секцию, поэтому я переключаю свою левую руку на... Так вы можете видеть, что инструмент намного более подходящего размера."
1922.718,1933.35,"Проблема в том, что у меня трокарь 5, поэтому я теряю немного нового мопертониума."
1933.37,1946.946,"И единственный трокарь, о котором я знаю, который имеет 3-5 редуктор, это этот шаг."
1946.966,1948.888,"Так что, опять же, я возьму больше времени, чтобы очистить веселье."
1948.908,1951.371,"Потому что это самая важная часть, верно?"
1951.411,1951.551,Да.
1951.571,1952.472,Вы не хотите... Вы не хотите скрыться здесь.
1953.633,1965.033,Нужно взять больше времени.
1965.053,1969.621,"Хорошо, это довольно хорошая длина."
1969.641,1970.443,"Я знаю, что проблема."
1970.463,1972.105,"Подождите, подождите."
1972.126,1972.747,Вы идете в правую сторону.
1972.767,1973.548,Вот так вы хотите встать.
1974.001,1981.008,"Так вы смотрите в линии, хорошо?"
1981.028,1984.091,"Мы, эм, мы, на самом деле, не обращали внимания, у нас был ориентированный скоп."
1984.151,1986.214,"Видите, насколько это лучше?"
1986.234,2002.27,"Да, да, да, да, да, да, да, да, да, да, да, да, да, да, да, да, да, да, да, да, да, да, да, да, да, да, да, да, да, да, да, да, да, да, да, да, да, да, да, да, да, да, да, да, да, да, да, да, да, да, да, да, да, да, да, да, да, да, да, да, да, да, да, да, да, да, да, да, да, да, да, да, да, да, да, да, да, да, да, да, да, да, да, да, да, да, да, да, да,"
2002.891,2013.528,"Еще один стежок здесь, как он входит в клетку."
2013.548,2015.391,Теперь я возьму 2-миллиметровый стежок.
2015.411,2022.242,"Еще одна хорошая вещь о ликошере, что он говорит вам, когда все готово."
2022.262,2026.028,"Так что он идет, пока вы слышите звук."
2026.108,2029.253,Вот у нас есть два стежка.
2029.273,2029.894,Теперь я возьму стежки.
2030.212,2034.639,И теперь мы можем прийти и увидеть эти два стекла.
2034.659,2043.653,"И так, что я собираюсь сделать, я собираюсь отрезать между стеклами, и я собираюсь отрезать на нижней стороне."
2043.673,2044.094,И я отрезаю на части.
2044.114,2044.254,Хорошо.
2044.274,2046.457,"Если я отрезаю, и оно начинает болеть, я могу сделать что-то."
2046.477,2049.041,Тогда вы можете вернуться.
2049.061,2050.804,"Да, да."
2050.824,2052.767,"А если вы используете гармонику, если вы используете ее там, и оно отрезает, и болит, вы мертвы."
2052.787,2053.588,Релативно.
2053.608,2054.45,Хорошо.
2054.47,2054.65,Мэриленд?
2060.924,2070.294,"Так, теперь мы будем идти, вот главная коробка под нижний лоб."
2070.314,2070.555,Да.
2070.575,2075.5,Так вы возьмете эти две части индивидуально?
2075.52,2087.373,"Ну, я... это просто зависит от анатомии, но идеально, опять же, мы говорили о том, что безопасно."
2087.393,2089.235,"Так, если я могу взять эту часть здесь."
2089.255,2089.315,Да.
2089.335,2090.256,И тогда я могу взять эту часть.
2091.164,2092.746,И там где-то третий бронежилет.
2092.766,2099.572,"Да, сзади."
2099.592,2109.722,Бронежилет возьмет до 7-миллиметрового весла.
2109.742,2113.565,Так что мне комфортно взять главную крышку.
2113.585,2118.37,"Но если бы мне не комфортно, я бы мог взять больше длины."
2121.286,2143.346,"Проблема в том, что Лигишер не имеет такой хорошей точки, как Мэриленд."
2143.366,2145.388,"И так, когда Мэриленд приходит сюда, это довольно легко."
2145.548,2148.771,Не так легко.
2148.791,2149.752,Вот вы можете видеть бифуркат.
2149.812,2149.872,Да.
2149.892,2150.213,"Хорошо, Лигишер."
2150.233,2150.533,"Так, то, что..."
2150.767,2154.433,"Я думаю, что он возьмет это вместе."
2154.454,2173.287,"Я думаю, что это тот, который бронирует, как он идет вниз."
2175.651,2175.711,Да.
2185.327,2203.167,И мы делаем то же самое здесь.
2216.123,2227.795,"Я, на самом деле, у меня есть место, чтобы взять два, но я думаю, что мы просто зайдем сюда."
2227.815,2228.335,И возьмем главный.
2228.355,2228.596,Да.
2228.616,2231.158,"И это, опять же, то, что я называю вакуумным контролем."
2233.18,2234.622,Мы очень далеко от верхнего лоба.
2234.642,2234.702,Да.
2234.722,2235.182,Это должно быть хорошо.
2235.202,2238.786,"Потому что, опять же, диаметр этого инструмента 5 миллиметров."
2238.826,2245.553,"Так что веселка меньше, чем инструмент."
2245.573,2245.713,Хорошо?
2245.733,2245.793,Да.
2246.212,2269.323,"Закройте крючки, пожалуйста."
2269.343,2269.744,Иди сюда.
2269.764,2271.787,"Итак, мы отрезаем этот первый."
2271.807,2271.987,Без боли.
2272.007,2272.748,И снова мы отрезаем между лепестками.
2272.768,2273.929,"И вы не можете отрезать в центре лепестка, если вам нужно."
2273.95,2275.071,"И, на самом деле, это то, что делают другие инструменты."
2276.283,2292.891,Но я бы хотел целый стеклопакет.
2292.911,2293.051,Хорошо.
2293.072,2293.693,Теперь мы срезаем здесь.
2293.713,2294.354,Хорошие яркие ножницы.
2294.374,2295.135,Какое удовольствие.
2314.167,2328.686,"Я думаю, что это очень безопасно и очень эффективно."
2328.706,2343.685,Поэтому я люблю этот инструмент.
2368.37,2388.834,Я десектирую прямо над Баранкасом.
2388.854,2397.904,Должен быть еще один корабль здесь.
2422.471,2447.5,Слышишь?
2453.74,2458.007,Вверх.
2458.027,2474.272,"Да, поставь меня в центре экрана."
2474.292,2474.412,Вверх.
2474.432,2474.592,Вот так.
2474.612,2474.773,Спасибо.
2474.793,2475.073,Вверх немного.
2515.688,2519.232,Видите какие-то лимфатические ноты в ней?
2519.252,2523.657,"Итак, что я делаю сейчас, это просто пытаюсь десектировать на бронхи."
2523.677,2529.022,"Если вы помните рисунки, бронхи лежат прямо под артерией."
2529.042,2529.203,Да.
2529.223,2531.225,Так вы предполагаете там веселье?
2531.245,2533.507,"Я немного боюсь, что может быть еще один бронхи."
2533.527,2537.171,Хорошо.
2537.191,2541.696,"Мы, может быть, получили его, я не полностью уверен, где эта бифрикация."
2542.975,2549.589,"И поскольку верхний сегмент поднялся так высоко, этот может подняться низко."
2549.609,2556.062,"И все еще выглядит так, как если бы луна была немного васкурирована."
2556.082,2556.443,Но мы увидим.
2556.463,2559.87,А что касается бронхиальных весел?
2560.451,2561.553,"Да, не волнуйтесь об них."
2561.573,2563.297,"Окей, они придут в стадию бронхиальных весел."
2563.357,2564.359,"Да, я имею в виду, мы в конце концов поймем их."
2575.561,2594.515,Продолжение следует...
2594.815,2608.841,"Поэтому я люблю делать их очень молодым ребенком, чтобы они не стали инфицированы."
2608.861,2611.707,"Потому что, когда они начнут инфицироваться, самолеты становятся более тяжелыми, они становятся большими нодами."
2611.727,2615.434,"Если бы я мог работать с ними как с новыми ребенками, я бы это сделал."
2615.454,2616.115,"Я думаю, если они присутствуют..."
2616.331,2624.719,"то они не уйдут, в отличие от тех, которые диагностированы пренатально и регрессируют."
2624.739,2642.455,"Я думаю, что если они там, когда они родились, то они не уйдут."
2642.475,2642.615,Хорошо.
2642.635,2644.937,"Итак, мы начинаем?"
2653.051,2680.933,"Я немного не уверен, что в этом месте есть корабль."
2680.953,2681.453,"Мэрленд, выключи локацию."
2681.473,2682.535,Я могу почувствовать бронхи.
2683.561,2691.817,Как-то бонусируется от него.
2692.058,2701.357,"Не могу понять, это веселье или лимфодренаж."
2701.377,2702.419,Повернись немного.
2702.439,2702.599,Вот так.
2712.89,2726.286,"Опять же, вам просто нужно быть пациентом."
2726.306,2733.114,Что это?
2733.134,2734.155,Это кровь.
2752.613,2765.291,"И я сделаю это 100 раз, если мне нужно."
2765.311,2765.491,Вот он.
2765.531,2766.132,Вот он.
2766.152,2769.797,"Я думаю, что это... Вот бронхи, они прямо за мной."
2769.817,2780.252,Маленький корабль в фронте.
2780.272,2780.352,Да.
2780.372,2781.414,"Смотрите, пожалуйста."
2781.434,2781.574,Вот он.
2786.617,2806.984,"Он говорит, что это может быть отдельная культура."
2807.004,2808.145,Корректно.
2808.165,2813.152,"Если мы сделаем одну культуру, то мы попробуем подняться немного и взять еще одну."
2813.172,2813.593,Она не такая большая.
2813.613,2813.873,Мы попробуем.
2815.017,2821.347,sometimes by rotating the instrument you can do it.
2821.367,2836.57,"I don't think we're going to quite get it, but we'll get as much as we can."
2850.742,2857.951,"Нет, нет, останься, останься вверх."
2857.971,2875.333,"Лунка просто уходит в мою сторону, в частности потому, что я ее отрегулирую."
2875.353,2875.574,Хорошо.
2875.594,2879.018,Вот бронхи.
2879.038,2879.559,Немного лимфатических нот.
2879.579,2879.719,Хорошо.
2884.07,2902.358,"Теперь вы видите, что мы начинаем видеть нижнюю полмональную ванну."
2902.378,2903.019,"Это то, что вы хотите."
2903.039,2909.309,"И иногда я беру бронхи первым, если у меня проблемы с ванной."
2909.329,2910.01,Обычно я люблю взять ванну первым.
2930.662,2957.074,Продолжение следует...
2962.218,2983.749,"Вы можете, но, опять же, я бы хотел быть немного безопаснее."
2983.769,2985.391,Иди сюда.
2985.411,2985.912,Смотри сюда и иди сюда.
2985.932,2989.477,"У вас, по-моему, очень хорошая длина главного ряда."
2990.138,2990.959,Да.
2996.963,3012.259,"Вы можете видеть, что эта область более влажная."
3012.279,3014.421,"И мы видели эту неоваскулярность здесь, когда мы приехали."
3014.441,3021.889,"Так что, знаете, в больших пациентах вы можете поставить стейплер здесь."
3021.909,3024.692,"Но опять же, я думаю, если вы идете к первому бифуркации,"
3024.892,3041.267,"Если что-то не так, вы можете вернуться к кухне."
3041.287,3044.53,"Если вы идете к кухне, и что-то не так, вы в большом проблеме."
3044.55,3045.952,Поэтому я люблю быть более консервативным.
3045.972,3047.053,Это дает несколько минут.
3047.073,3048.314,"Но цель здесь – это сделать это, а не быть быстрым."
3048.334,3048.394,Да.
3048.414,3052.658,"Хотя, я считаю, что быстрый – это слабый."
3052.678,3052.738,Да.
3054.052,3077.692,"Вы можете видеть, что здесь много инфляции."
3077.712,3079.574,"Этот ребенок, несмотря на то, что он очень молодой, и... Как много инфекций?"
3079.594,3079.954,Один инфекционный?
3079.974,3080.415,"Да, один инфекционный."
3080.435,3081.476,"Да, но вы можете видеть, что он не чистый и хороший."
3081.496,3081.916,"Не знаю, откуда это."
3082.016,3083.097,"Что-то болит, но мы поймем это."
3084.275,3111.665,Maybe where I've grabbed the lung.
3111.685,3111.925,There we go.
3111.945,3112.105,Scissor.
3113.958,3130.759,"Если у вас больше крови, то вы получите больше чара в ликошере, так что, опять же, очень важно все это очистить, чтобы оно не стыкалось."
3130.779,3143.475,"Вот вы можете начать видеть, где оно бифоркуется."
3145.413,3169.378,Субтитры сделал DimaTorzok
3171.181,3175.199,"Я вытягиваю луну немного выше, чтобы дать мне этот угол."
3175.219,3178.514,Это иногда распределяет бифуркацию.
3178.535,3179.74,Это делает это немного легче видеть.
3209.2,3225.404,"Если бы вы использовали степлер, что бы вы использовали, Стив?"
3225.424,3231.052,Я бы использовал степлер.
3231.072,3231.393,Какого размера?
3231.413,3234.918,"2,5."
3234.938,3235.198,Хорошо.
3235.218,3237.642,"Но это будет очень трудно, чтобы получить степлер в этом ребенке."
3237.662,3237.722,Да.
3239.086,3245.793,Вам понадобится 12-мм порт для этого?
3245.813,3246.153,Да.
3247.754,3262.369,"Но вам также понадобится 6 сантиметров интратерапевтического пространства, чтобы открыть стейблер."
3262.389,3262.829,"О, да, я знаю, я знаю."
3262.849,3263.269,Даже с меньшим весом.
3263.289,3268.254,"Так что, опять же, это дает несколько минут, но я думаю, что это безопаснее."
3268.274,3268.975,Вы можете также выкрутить это.
3270.22,3272.342,You can do a lot of different things.
3272.362,3273.143,There you go.
3273.163,3273.303,Better.
3273.323,3273.423,Nice.
3273.443,3273.723,Thanks.
3273.743,3274.183,Marilyn?
3274.203,3298.725,Back up a little bit.
3308.037,3320.617,You usually can get this branch as it comes off the inferior branch.
3320.637,3325.164,Right there.
3325.184,3330.472,I'm quite getting the exposure I want.
3330.492,3331.313,"No, no, you're rotating it the wrong way."
3331.333,3331.854,"Yeah, there you go."
3331.894,3333.657,"When you rotate that way, you're kind of looking away from me."
3342.108,3357.197,"Если что-то не так, у меня здесь достаточно обозначения, чтобы я мог, надеюсь, просто взять ванну и закрепить ее, но надеюсь, что ничего не произойдет."
3381.663,3402.912,Я. Готов.
3420.695,3445.351,"Рави, ты готов?"
3445.371,3445.671,"Рави, ты готов?"
3445.691,3446.232,"Рави здесь только, не Рави."
3446.252,3446.632,Он может быть слаб.
3446.652,3447.073,Он не пришел сегодня.
3454.833,3459.885,Мы просто двигаем его вверх и ротируем инструмент.
3459.905,3461.012,Убираем его от другого стекла.
3495.35,3515.063,Здесь есть еще две части.
3534.162,3534.523,Да.
3565.432,3593.43,Корректор А.Кулакова Корректор А.Кулакова
3593.883,3611.593,Моменты очень маленькие.
3611.613,3612.114,Это все 3-мм инструменты.
3612.134,3618.585,"Лунка довольно тяжелая, и она просто начинает идти в мою сторону."
3618.605,3618.925,Я пойду и пойду.
3618.945,3619.266,Я пойду и пойду.
3623.853,3633.12,Продолжение следует...
3667.947,3676.658,"Это очень маленькая броня, но я просто возьму ее, потому что я думаю, что это сделает мне легче получить то, что я хочу."
3705.95,3734.1,Вот и всё.
3737.067,3763.552,"И я чувствую себя в безопасности, когда это делаю."
3763.572,3763.632,Да.
3764.405,3775.309,Продолжение следует...
3817.055,3838.573,Продолжение следует...
3839.718,3865.05,Продолжение следует...
3866.279,3873.205,"Так вот, там лампочка, там лампочка, так что мы убираем между ними."
3873.265,3890.72,Они на верхней стороне.
3890.74,3891.701,"Это сделает вас нервничать, когда увидите лампу?"
3891.721,3892.042,"Да, да, да."
3892.062,3894.604,"Смори, Дэн."
3894.624,3894.784,Лигушер.
