start,end,text
3899.793,3923.961,"Я вам скажу, что я никогда не... Если я... Если я... Если я держу seal, в то время, в то время, в то время, в то время, в то время, в то время, в то время, в то время, в то время, в то время, в то время, в то время, в то время, в то время, в то время, в то время, в то время, в то время, в то время, в то время, в то время, в то время, в то время, в то время, в то время, в то время, в то время, в то время, в то время, в то время, в то время, в то время, в то время, в то время, в то время, в то время, в то время, в то время, в то время, в то время, в то время, в то время, в то время, в то время, в то время, в то время, в то время, в то время, в то время, в то время, в то"
3927.232,3931.458,И мы вернемся к верхнему виду в минуту.
3931.518,3948.564,"Как только мы увидим это, мы уберем его."
3948.584,3949.706,Теперь мы перевернем лунку.
3949.726,3955.094,"Выглядит довольно мертвым сейчас, это хорошо."
3955.114,3956.496,"И все, что осталось."
3957.472,3962.917,Это бронхи.
3963.737,3976.969,У вас есть 10-миллиметровый клеп?
3977.109,3979.912,"Я думаю, что мы будем использовать клеп."
3979.932,3984.956,"Но весь трюк немного большой, поэтому я собираюсь отрезать верхний сегмент бронхи."
3986.718,3987.158,Я возьму это отдельно.
3991.407,4007.787,"И мы будем, поскольку у нас нет доступных 5-миллиметровых клапанов, которые длиннее, чем те, которые у вас есть, мы будем использовать 10-миллиметровый клапан, но это нормально, потому что мы должны сделать немного большую инсизию, чтобы удалить лунку."
4007.807,4011.812,"Вы не можете удалить эту лунку через 5-миллиметровую инсизию, к сожалению."
4024.263,4028.172,Вот вы можете видеть бифуркацию.
4028.232,4034.706,"Да, мы можем это увидеть."
4034.726,4041.241,Так что вы индивидуально прикрепите эти два... Да.
4041.301,4042.183,Я просто прикреплю их отдельно.
4042.223,4042.584,Окей.
4042.604,4043.706,"Смысл в том, что... Вы знаете, я всегда делал и срезал."
4043.804,4050.591,"Самое важное, чтобы убедить Мэриленд, что вы не сопротивляете бронхоскопию к верхнему лобу."
4050.611,4050.771,Да.
4050.791,4053.113,Поэтому я бы хотел идти на бифуркацию.
4053.133,4060.941,"И я не думаю, что... Вы знаете, это не стомы, которые длительные, и я думаю, что вам нужно волноваться о том, что стомы разрушатся и... Возвращайтесь."
4060.961,4061.202,Извините.
4061.222,4062.883,У вас были какие-то реверсные бронхоскопии?
4063.104,4064.425,Когда-нибудь?
4064.445,4065.766,"У меня есть, на самом деле."
4065.786,4066.067,"О, у вас есть?"
4066.087,4066.287,"Окей, вау."
4066.307,4068.849,"Да, мы... Это в моих ступенчатых шутках."
4068.869,4069.39,Окей.
4071.31,4079.7,"So, well, I mean, do you find it useful anytime?"
4079.72,4079.8,No.
4079.82,4080.08,"No, okay."
4080.1,4080.721,But it's a neat trick.
4080.741,4080.841,Okay.
4080.861,4097.641,But not much clinical application.
4097.661,4097.841,"Okay, so."
4100.285,4110.777,Это может поместиться в 5-миллиметровый клеп.
4110.797,4116.483,Мы можем попробовать.
4116.503,4116.924,"Так, это очень важно."
4116.944,4122.951,"Ты знаешь, причина того, что я посмотрел внизу, это то, что иногда могут быть вещества сзади."
4122.971,4125.594,Так что нужно просто быть немного осторожным.
4125.614,4128.537,Но мы довольно хорошо скелетонизировали.
4129.563,4146.44,"Я не знаю, это может быть... Давайте посмотрим, насколько это большое."
4146.46,4146.861,Это подходит к нему.
4146.881,4156.591,"Позвольте мне посмотреть ваш клапан, 5-миллиметровый клапан."
4156.611,4158.112,"Опять же, самое хорошее в том, что клапан доступен, это то, что он длиннее."
4158.132,4158.392,Мы посмотрим.
4158.412,4159.013,"Может быть, просто может быть."
4162.84,4191.835,Это 100 или 200 клип?
4192.051,4206.912,"Я не знаю, я не использую эти клипы, я не знаю, что это."
4207.773,4211.439,"200, спасибо."
4211.459,4218.649,ЛТ-200.
4220.654,4241.799,"Я не знаю, что это такое."
4241.819,4244.923,"Я не знаю, что это такое."
4249.848,4265.612,По какой-то причине мы начинаем вентилировать нижний лоб.
4266.723,4271.027,"Это нормально, мы в порядке."
4271.047,4286.94,"Но иногда, когда ты начинаешь принимать бронхи, ты можешь отслеживать их основную инновацию."
4286.96,4290.243,"Поэтому я нажимаю на нее, и я мог бы вернуть ее обратно в тракию."
4290.263,4291.304,"Так что это все моя вина, а не анестезия."
4291.324,4291.904,Это всегда вина анестезии.
4291.924,4295.247,"Хорошо, дай я попробую."
4295.267,4296.168,"Мы посмотрим, можно ли мы получить клип."
4296.188,4296.628,"Да, давайте попробуем."
4296.828,4315.514,"Я не знаю, будет ли это работать или нет, но мы попробуем."
4317.737,4318.878,"Они просто скажут, что мы должны изменить трокарь сейчас."
4318.898,4321.822,"Вы можете увидеть, насколько важна субстратная вентиляция луковицы."
4321.842,4323.084,"Если луковица начинает расти... Я думаю, это будет хорошо."
4323.104,4323.425,В центре.
4323.445,4323.665,5 мм.
4323.685,4325.147,Это будет очень большой проблемой.
4326.342,4336.534,"Мы, может быть, должны, ну, мы посмотрим."
4336.554,4336.995,"Правильно, правильно."
4337.015,4347.207,"Да, довольно близко."
4347.227,4347.507,Еще один клип.
4352.482,4365.899,"Вы можете видеть, что я очень далеко от нижнего и нижнего бронхи и бронхи к лингвиле."
4365.919,4378.274,"Да, и мы можем видеть, что лингва расширяется очень хорошо."
4378.294,4379.636,"Даже если у вас нет расширения, вы должны убедиться, что вы далеко."
4379.656,4380.016,"Да, да, это верно."
4380.036,4380.757,Я собираюсь поставить эту в сторону.
4380.777,4380.958,Иди сюда.
4380.978,4381.358,"А, может быть, нет."
4390.703,4419.242,"Нет, он не использует стейплеры так много."
4420.268,4423.695,Он не очень любит стейплеры.
4423.715,4425.318,Он использует их только для старших детей.
4425.338,4428.785,"Здравствуйте, доктор Рамчатер."
4428.805,4428.905,Да.
4428.945,4432.572,Доктор Стив Роденберг готов к завершению дела.
4432.592,4437.782,"Программа в том, что у доктора Шримуртий пациент уже готов."
4437.802,4439.365,Он будет индуцировать.
4439.385,4441.77,Он будет делать левостороннюю диафрагматическую хронию.
4476.8,4483.608,Sequential clipping.
4483.628,4483.728,Clip.
4483.748,4493.22,"So it's a little unorthodox, but it should work."
4493.24,4493.861,There we go.
4493.881,4503.212,We'll check.
4504.829,4527.138,We'll put some saline in and make sure there's no leak.
4527.218,4530.743,That should be it.
4530.763,4530.863,Yeah.
4530.883,4531.444,So that's a lower lobectomy.
4536.031,4544.259,"Это было прекрасно, доктор Стив."
4544.439,4548.123,Вы слышите аплодисменты?
4550.625,4553.348,"Да, спасибо большое."
4553.368,4553.528,Спасибо.
4553.548,4556.11,"Я хочу, чтобы вы приехали домой со мной."
4556.211,4556.811,Вау.
4556.831,4558.613,Никто не кричит за меня дома.
4558.633,4560.034,Они просто кричат за меня.
4562.737,4563.878,"Хорошо, у нас есть салон?"
4565.663,4575.435,"Итак, мы просто проверим стомп, потому что он немного... Я думаю, что эти клипы будут в порядке."
4575.455,4585.608,"И опять же, все, что мы пытаемся сделать, это получить некрозию, но... Так, мы просто проверим пыль."
4585.628,4586.929,"Так, если вы можете... Да, так что нет пыли."
4587.05,4588.371,"Да, мы можем это увидеть, да."
4588.431,4589.152,"Хорошо, хорошо."
4589.172,4589.232,Да.
4589.252,4589.393,Хорошо.
4589.413,4590.214,"Хорошо, теперь тяжелая часть."
4590.234,4590.494,Открывать ее.
4590.514,4590.574,Да.
4594.79,4600.416,"Это как построить корабль в бутылке, а потом вытащить его."
4600.436,4606.462,"Так что, что я люблю делать, я люблю... Вы всегда можете решать, какую инсизию вы думаете будет самым косметичной."
4606.482,4613.649,"Если это девушка, я спрашиваю медицинских, какую я должен сделать больше."
4613.709,4618.334,Но обычно я делаю эту больше.
4618.354,4618.434,Нет?
4618.454,4621.056,Одной способом вы ставите Легешеву?
4621.077,4621.177,Да.
4621.197,4621.977,Потому что это самая большая инсизия.
4621.997,4622.158,"Да, да."
4622.178,4624.26,Так что мы должны сделать ее чуть ближе к сантиметру в размере.
4624.42,4624.56,Хорошо.
4626.886,4643.617,Добавляем скоп.
4645.861,4648.827,"Нужно взять лунку, которую вы хотите убрать."
4654.932,4673.043,Это как привлечение ребенка.
4673.063,4673.584,У вас есть большая клемма?
4673.604,4673.764,Спасибо.
4673.784,4674.726,Мы расслабляемся немного.
4674.746,4678.432,Патологи будут очень жаловаться на вас.
4678.452,4679.354,Потому что они получают лунку в кусочки.
4679.374,4679.995,"Но мы все знаем, что это такое."
4685.948,4712.728,"Нет, нет, это не так."
4712.748,4712.969,Это не так.
4712.989,4713.209,Это не так.
4713.229,4713.449,Это не так.
4713.469,4713.69,Это не так.
4713.71,4713.93,Это не так.
4746.023,4767.927,Вы просто стараетесь кормить кусочки.
4767.947,4769.449,"Конечно, вы могли бы увеличить инсизию, но это уничтожает целую цель."
4772.146,4791.142,"Так что, очевидно, если бы это был инфекционный лун, мы бы не хотели это сделать."
4791.162,4792.585,"Так что, в любом случае, это бензиновая ситуация, так что это не важно."
4795.315,4818.833,Ты понравился?
4818.853,4819.855,Да.
4820.813,4841.995,"Спасибо, доктор."
