start,end,text
104.786,107.289,You're looking at the view through the surgical microscope.
122.797,145.834,a small bare hole was placed adjacent to the sinus and then one inch bone flap was elevated using the side cutting drill Duro was exposed
154.893,158.17,and DACOP sutures were placed at the edge of the dura.
201.282,226.783,sodium fluorescein microscopy was used to inspect the parenchyma of the exposed parietal lobe arachnoid knife was used to dissect out a large draining vein in order to preserve it during tumor resection
230.341,236.049,This vein is anterior parietal vein and it drains to superior sagittal sinus.
249.449,260.044,"Using micro bipolar cautery as well as micro suction, transcortical approach was used to expose the superficial pole of the tumor."
267.28,277.425,"After the tumor was identified, a border between the tumor and the brain parenchyma was carefully established using bipolar cautery and microsuction."
424.133,430.11,The tumor was removed in one piece and was sent for pathological evaluation.
479.433,504.478,"Duro was re-approximated, subsequent to which bone flap was also re-approximated and skin was closed."
