start,end,text
61.275,64.838,Lobotectomy and mediastinal lymphotectomy were performed.
65.639,72.647,Three operating pods were used during the single direction video assisted thoracoscopic lobectomy.
73.808,85.106,The mediastinal lymph nodes were dissected firstly before the lobectomy because the pathological result was confirmed by EBUS-TPNA before the neoadjuvant targeted therapy.
85.126,92.278,The left inferior pulmonary ligaments were dissected and the 9th lymph nodes were resected.
92.298,98.348,The next is the dissection of the 10th P lymph nodes while the pulmonary artery was exposed.
105.415,110.788,"The next step was the dissection of subcoronal lymph nodes, seventh lymph nodes."
111.369,117.725,The ebus TBNA to metastatic subcoronal lymph nodes was performed eight weeks ago.
118.466,122.496,It means that it was important to dissect its end block.
123.59,138.231,"Exposure is difficult in the dissection of subcoronal lymph nectomy, so the assistant inserted a forester's forcep into the auxiliary ports to expose the narrow space where the lymph nodes located."
138.271,144.42,And then the pleural cavity should be observed in the stable way.
146.363,152.972,The chief isolated the edge close to the right primary bronchus by a ultrasound scalpel.
153.762,161.955,"The unnecessary injury to the normal organs such as bronchus, esophagus, and artery should be avoided."
161.975,169.827,Then the chief isolated the edge close to the precardium.
169.847,174.815,"At last, the chief isolated the edge close to the right primary bronchus."
175.857,179.803,"In this way, the lymph nodes can be resected and blocked."
246.76,250.024,We finished the dissection of the subcoronal lymph nodes.
250.665,253.89,The following step was the dissection of the fourth lymph nodes.
254.531,265.626,"This LN located in the potential space among the trachea, the left primary bronchus, left pulmonary artery, and aorta."
266.947,271.293,The key of this step was the exposure to the space by the assistant.
271.934,276.16,The injury to the left pulmonary artery should be avoided.
303.258,308.069,We turn to resect the 10th LN after finishing the dissection of the 4th LN.
308.73,312.919,"As you can see, the root of the left pulmonary artery can be observed."
313.581,316.287,The 5th LN is close to the 10th LN.
316.788,322.701,The assistant lifted the LN and the chief dissected it without unnecessary injury.
332.232,337.622,Return to resect the sixth LN after finishing the dissection of the fifth LN.
338.884,342.611,The sixth LN is close to the phrenic nerve aorta.
343.994,349.043,The assistant pulled the lymph nodes and the chief dissected it completely.
365.999,379.164,"After we finished the dissection of the 9th, 10th, 4th, 10th, 5th, 6th lymph nodes, we started to do the lobectomy in the single direction method due to the fused oblique fissure."
379.925,387.079,"For traditional left lobectomy, the following structures are operated in the order pulmonary vein,"
387.43,404.494,oblique fissure pulmonary artery poorly developed fissure bronchus in this case the following structure are operated in this order pulmonary vein bronchus pulmonary artery fuse oblique fissure
405.841,419.405,"The assistant inserted the forester forceps into the auxiliary port to track stumps of the left inferior vein towards the head site, so as to expose the left inferior bronchus."
421.649,427.9,The chief isolated the hessian between the 12 lymph nodes and the left inferior bronchus.
428.74,437.953,The chief dissected the 12 lymph nodes and then isolated the ischium between the left inferior bronchus and the left inferior artery.
439.175,443.461,We should avoid injury to the primary artery.
443.481,449.55,"At last, the chief dissected the bronchus using the endosrete cutting clothes."
472.531,487.974,"The assistant went on to insert a forested forcep into the ulcerary port to lift stump of the left inferior bronchus towards the head side, so as to expose the left inferior artery."
489.957,499.551,"The chief isolated the branches of the left inferior pulmonary artery, including the basal artery and the dorsal artery."
501.607,507.098,The chief dissected the basal artery using the endostrate cutting clothes.
508.641,516.156,"The dorsal artery is quite short, and the chief cut dorsal artery with silk and hemlock."
563.791,565.895,All the structures are dissected.
566.116,570.705,We should remove the 11th LM before cutting fused oblique fissure.
571.827,578.159,The single direction video assisted thoracoscopic lobectomy are operated in this order.
579.422,586.255,"Pulmonary vein broadcast, pulmonary artery, fused oblique fissure."
587.332,604.918,"The cutting of the 11th LM was so important that we should expose the branches of the left superior pulmonary artery, such as A4 plus 5, A1 plus 2C, and then dissected the 11th lymph nodes radically."
671.639,675.168,The last step was the cutting of the fused oblique fissure.
676.091,681.385,The chief cut the fissure with an endosurge cutting stapler and the navel patch.
682.448,688.163,The navel patch was used to prevent the postoperative air leak.
688.143,693.591,The patient was discharged without air leak at the 5th postoperative days.
694.653,701.063,The branches of the left superior pulmonary artery should not be injured accidentally in this procedure.
701.904,706.05,The radical dissection of the 11th lymph nodes should be performed.
756.217,757.94,The specimen was removed.
764.469,770.638,A chest tube was placed through the assistant port.
770.658,774.604,The stumps were illustrated as it is demonstrated here.
