start,end,text
33.216,36.4,Here we find the inferior pulmonary ligament.
38.607,45.054,The inferior pulmonary ligament is stripped superiorly to gain access to the L9 and L8 lymph nodes.
46.735,50.039,"On the left, you can just about see the border of the heart beating away."
50.079,58.187,"And on the right of the screen, you can see the aorta."
60.769,68.277,"Now, the area of the inferior pulmonary ligament is just being dissected and explored further to identify some lymph nodes."
72.813,79.759,"Now we reach the L9 lymph nodes, also known as the pulmonary ligament nodes, which are being dissected here."
80.52,83.483,A part of the node has been removed and is being handed to the assistant.
91.35,93.652,Just some more lymph node dissection there.
93.692,101.419,And you can see another node that's just been dissected out.
101.99,103.474,that is now being taken.
103.534,117.754,There it is being given to the assistant.
120.991,123.514,Here we approach the subcarinal area.
123.554,127.319,On the right of the screen you can see the descending aorta.
128.4,133.706,The subcarinal area is just below the trachea and provides access to a lot of lymph nodes.
135.028,139.573,Now we get to the L10 hilar nodes which are being dissected here.
145.28,150.947,The inferior pulmonary vein is followed back to reach the station 7 nodes which you can now see.
152.243,159.35,It is being dissected using the cadier to lift it up and the Maryland forceps which is allowing for clean cuts of the node.
160.411,162.873,There's a really good view there of the station 7 node.
169.62,177.688,The cadier is being used to hold up the node while the diathermy is used to cut the bottom end of the node.
180.19,181.812,Here the node is freed completely.
182.247,186.795,and is being handed over to the assistant.
186.815,195.149,Here you can see the anterior part of the oblique fissure between the lingular segment of the upper lobe and the lower lobe.
196.511,201.96,Following the fissure upward will lead up to the L11 interlobar nodes.
208.994,212.339,"Here, we come to an L10 hylar node again."
212.379,221.714,"Again, you can see the CADIR is great for grasping it firmly and pulling it up to allow for clean, dry cuts with the Maryland forceps."
223.317,229.046,"There, it's released and again handed over to the assistant."
229.066,233.533,"Following the oblique fissure up, we get to the L11 interlobar node."
233.851,238.276,"which here looks very large and rather malignant, so this was removed."
239.277,242.581,The L11 node is being stripped off the lower lobe bronchus.
243.562,245.905,There is a part of the L11 node that's been removed.
248.087,253.253,"Just behind the node there, just where the Maryland forceps are, is a great view of the lingular artery."
254.194,258.559,"The histology came back for this node, and it did indeed turn out to be malignant."
260.058,265.146,The cadier here is used to apply traction onto the nose to allow for it to be dissected off the bronchus.
265.887,266.889,And there it is separated.
266.909,271.977,Here you can see the lingular artery coming off the basal pulmonary artery.
272.017,279.469,And you can see the lung graspers are being used to retract the lung slightly for good access to dissect the lingular artery.
280.13,286.2,It is being dissected out with the aid of the cadier and the Maryland forceps to create a passage underneath for the stapler.
286.805,289.509,Here you can see a leader catheter being brought in.
290.291,295.82,It is attached to a gold curved tip 1045 stapler brought in by the assistant through the utility port.
296.601,309.242,"Mr. Dunning guides the leader catheter underneath the lingular artery using the cat ear, which is quite nicely being used to thread the leader catheter underneath the lingular artery."
311.566,313.369,This is then followed by the stapler.
316.336,323.805,"As you can see, the leader catheter makes it much easier to guide a junior user of the stapler across this delicate and small vessel."
323.865,327.85,The unique curved tip of the stapler also makes this easier.
327.89,338.503,Having the third arm to the robot is really useful and here you can see the lung graspers operated by the third arm retracting the lung to carefully enable stapling of the vessel.
339.764,343.609,The lingular artery is then divided and here you can see the stump.
345.175,353.064,"Now we reach the lingular vein, which is being dissected using the cat ear and Maryland forceps to create a passage for the stapler."
354.526,361.694,"As you can see, the cat ear is really great for blunt dissection, whilst the Maryland diathermy is great for focused and dry cuts."
367.121,373.528,"Here, Mr. Dunning is just dissecting around the lingular vein, and it looks like he's come across some lymph nodes."
374.116,375.859,These are the L12 lymph nodes.
379.644,383.791,"There's a good view of the L12 lymph node, which has just been grasped by the cat ear."
385.794,386.615,It's now been taken.
390.681,392.865,There's another L12 lymph node there.
392.885,400.917,And it's just being dissected out.
402.719,405.263,"There, it's been removed and it's just being handed to the assistant."
406.064,409.329,"Here, Mr. Dunning gets under the lingular vein with the cadier."
411.292,413.255,And there's the leader catheter again.
413.275,420.747,And it's just being threaded under the lingular vein with the cadier and the Maryland forceps.
423.111,425.354,And it's used to guide the stapler over the vein.
426.696,430.262,"As with the artery, the goal tip, Cavidian TAM45,"
430.529,432.831,is used to divide the lingular vein.
438.837,441.52,And there you can see the stump of the vein and the artery.
441.56,453.232,"It looks like we found some more L11 nodes, which are just being dissected out here."
453.272,459.979,There's one node that's been taken.
462.44,464.725,"Finally, we get to the lingular bronchus."
467.009,473.362,"As previously, blunt dissection with the cadier is used to get under the bronchus and create an opening for the stapler."
475.165,478.973,You can also see the stumps of the artery and the vein on either side of the bronchus.
480.776,482.119,And there's the leader catheter.
483.517,486.481,You can see the leader catheter being passed underneath the bronchus.
487.281,496.072,"This clip really highlights the usefulness of the leader catheter in navigating the stapler under a small structure, which would have otherwise been a lot more difficult."
500.657,504.282,The stapler is now guided over the bronchus with the help of the leader catheter.
504.962,507.045,"It's a gold tip, purple 45."
507.445,511.33,It's now closed.
512.508,517.216,and a quick inflation test is done to check for inflation to the other segments.
518.297,523.205,The lingular bronchus is then divided and you can see the stump of the bronchus there.
524.948,529.335,Now we find some more L12 lymph nodes which are being taken.
536.082,553.388,"The demarcation between the lingular and left upper lobe trisegment was established by inflating the upper lobe and finding the boundary between the non-aerated section, which is the lingular segment as the lingular bronchus has been divided and the aerated sections, which are the segments to be preserved."
554.55,557.314,The lingular segment is then divided using staples.
563.791,570.802,You can see the usefulness of the lung grasper here and the CADIR in manipulating the lung to ensure the staple line is in the correct place.
587.768,588.429,And there it is.
588.65,590.052,There's the lingular segment.
592.394,600.969,A specimen bag is brought in through the utility port and the lingular segment is placed into the bag and is removed all through the utility port.
