start,end,text
22.451,27.456,This minimally invasive technique has already been performed on children with birth defects
27.436,29.979,at a handful of hospitals around the country.
33.724,49.244,"The way it works, instead of making an incision several inches long in the chest, doctors use a five millimeter camera and instruments as small as three millimeters in diameter to make three tiny incisions and essentially do the same procedure."
129.975,135.161,"But since the technique has only been around for the past several years, there is a learning curve."
141.35,149.285,"But with time, I think both operations, whether it's the lung or the esophagus, are just the same as they are open."
