start,end,text
28.735,32.198,"The lateral lymph nodes, showing green fluorescence, were located."
33.219,37.884,"After the standard procedure of TME, the LLND stage started."
38.324,43.409,"Firstly, the peritoneum on the outside of the medial umbilical fold was opened."
54.54,54.76,"Then,"
54.993,61.284,The ureterohypogastric nerve fascia was exposed to establish the medial boundary for nodal dissection.
68.616,77.912,"Under the guidance of ICG fluorescence imaging, it is simple to identify the space between lymph nodes and ureterohypogastric nerve fascia."
82.938,87.868,The ureter and the hypogastric nerve included in it were preserved as a single membrane.
115.928,122.116,"Next, we began to dissect the parietal pelvic fascia to establish the lateral boundary for nodal dissection."
123.037,131.587,"During the nodal dissection, we focused on the internal iliac region and obturator region due to a high frequency of metastasis."
132.409,141.46,"So, we opened the fascia on the medial side of the external iliac vessels instead of the lateral side to spare the external and common iliac region."
142.221,145.665,The external iliac artery and vein were exposed successively.
154.876,181.069,under the guidance of icg fluorescence imaging the lymphatic adipose tissues in a traitor region were separated from the medial aspect of external iliac vessels the umbilical artery was exposed which formed the boundary between obturator nodes and internal iliac nodes
184.998,193.472,"Dissecting along the external iliac vessel caudally, the iliopsos muscle and the obturator internus muscle were exposed successively."
218.495,222.279,"Thus, the lateral boundary of nodal dissection was established."
225.902,230.147,"Next, we turn to the dissection of the vesico-hypogastric fascia."
236.533,246.443,"Through the dissection of the anatomic level between the vesico-hypogastric fascia and obturator lymph nodes, the retzius space was extended cordially."
257.56,267.909,"And so far, the three facial spaces were fully exposed, including uretero-hypogastric nerve fascia, vesico-hypogastric fascia, and pelvic fascia."
268.23,273.935,"The abjurator nodes and internal iliac nodes were enclosed in this region, and divided by the umbilical artery."
276.077,280.541,Then we began to dissect the proximal part of the internal iliac lymph nodes.
281.141,287.247,"There, as a distinct boundary line between the abjurator lymph nodes, and internal iliac lymph nodes,"
287.463,290.407,continued with the vesico-hypogastric fascia.
291.469,296.336,Dissection continued along the visceral branch of the internal iliac artery.
302.124,306.851,The superior vesicle artery was discovered to originate from the umbilical artery.
307.912,310.015,Both of them were preserved carefully.
312.238,315.563,The internal iliac artery and vein were dissected cordially.
327.507,331.373,The proximal part of internal iliac lymph nodes was removed.
334.518,337.723,"Then, the obturator lymph node dissection began."
338.164,341.63,Dissection continued along the internal iliac artery.
345.596,349.262,The obturator artery was isolated and transected at the root.
359.89,372.528,"Dissecting the confluence of the internal iliac artery and the external iliac artery, the proximal part of the obturator nerve was identified and bluntly dissected out of the lymphatic adipose tissues."
373.389,376.854,The obturator vein was isolated and transected at the root.
383.403,386.067,Another obturator vein was also transected.
388.747,393.896,Then the obturator region was dissected along the obturator internus muscle fascia.
394.357,399.085,Obturator vessels were isolated at the level of the obturator foramen entry point.
401.048,404.494,The obturator artery was transected from the distal side.
408.28,412.948,The obturator nerve was bluntly dissected out of the lymphatic adipose tissues.
425.72,431.729,"The obturator vein was also transected from the distal side, with the obturator nerve protected carefully."
431.769,447.593,"Then, the obturator lymph nodes were removed."
454.103,458.451,Then we began to dissect the distal part of internal iliac lymph nodes.
459.653,465.805,It presents a certain degree of challenge due to its deep location and complex anatomical structures.
468.47,477.647,"With dissection near the bladder wall, the inferior vesicle artery and vein were exposed and preserved carefully under the guidance of ICG fluorescence imaging."
480.125,484.27,Dissection continued quarterly to the tendinous arch of pelvic fascia.
499.288,503.533,Then a window was opened to the TME compartment to connect the two spaces.
522.768,529.814,"The distal part of the internal iliac nodes was removed completely, with the inferior vesicle vessels spared."
531.816,535.499,Here showed the preserved vesicle vessels after nodal dissection.
535.759,541.124,"The obturator artery and obturator vein were transected, with the obturator nerve protected well."
541.364,546.849,The umbilical artery and the superior vesicle artery originated from it were both preserved.
547.229,551.273,The inferior vesicle artery and vein were isolated and preserved as well.
557.598,559.501,Here's the final field of view.
