start,end,text
24.26,46.045,"The laparoscopic view shows the cecum and appendix, with visible vessels supplying the appendix and the appendix mesentery. The small bowel is seen ending into the colon."
46.545,71.97,"The surgeon creates a window in the mesentery of the appendix using a conventional method. The blood vessels are separated to one side, with the cecum visible on the opposite side. A stapler is used to divide the mesentery."
72.448,125.902,"The surgeon uses a stapler with a vascular load to divide the appendix vessels, firing three rows of staples on each side and cutting between them. The stapler appears white, and the thin appendix is stapled and divided in one action."
126.402,156.569,The surgeon uses a blue vascular tissue load stapler to divide the appendix at its junction with the cecum. The appendix is then placed into a small retrieval bag for removal.
157.069,180.215,"The surgeon places the appendix into a retrieval bag with metal prongs and a purse string closure, securing the bag before removing it from the abdominal cavity. If bleeding occurs, clips can be applied to control it."
