start,end,text
70.859,128.568,"The surgeon identifies the gonadal vessels on the right side, which are medialized. A sponge is placed to hold the small bowel aside, and the medial to lateral dissection begins. The patient has benign disease and a good body habitus, allowing for a planned transrectal extraction of the specimen using four eight-millimeter ports, avoiding the need for a twelve-millimeter port."
129.068,185.393,"The surgeon dissects around the inferior mesenteric artery (IMA) pedicle, revealing the bifurcation where the left colic artery branches off. The left colic artery is preserved while the superior hemorrhoidal artery is taken. The dissection continues in a medial to lateral direction."
185.893,230.62,"The surgeon places a sponge to protect the retroperitoneum and begins lateral dissection, marking the planned proximal margin on the bowel, which appears normal. The dissection follows the white line to meet the medial dissection plane."
231.12,244.771,"The surgeon demonstrates a portion of the lateral dissection, focusing on separating tissue planes along the lateral aspect of the surgical field."
245.271,342.103,"The surgeon mobilizes the splenic flexure, completing the dissection of pelvic adhesions related to diverticular disease and a prior hysterectomy. The distal margin is marked, and the proximal margin is assessed, with the mesentery taken to the proximal margin while preserving the left colic artery."
342.603,376.741,"The surgeon cleans the distal margin of the colon, preparing it for resection as part of the colectomy procedure."
377.241,415.003,The surgeon checks perfusion using ICG fluorescence at the margin and proceeds to transect the bowel with scissors. The distal margin is then assessed and divided.
415.503,552.686,"The surgeon separates the mesentery from the colon specimen to facilitate transrectal extraction, using instruments to hold open the rectum for easier removal. The surgeon then performs a two-layer end-to-end anastomosis, taking bites approximately five millimeters from the cut edge to invert the posterior lip, while checking ICG for perfusion."
643.271,716.91,"The surgeon begins suturing the anterior inner row of the anastomosis, taking care not to close over the lumen to maintain visibility of the midline for the next stitch. The suture is placed in the midline and extends to the patient's right."
717.41,913.406,"The surgeon transitions to a canal at the near corner, joining two sutures in the midline by alternating between them until the tissue is completely inverted towards the center. The sutures are then tied together, followed by an anterior outer layer using PDS sutures."
913.906,954.384,"The surgeon performs a leak test on the anastomosis, observing no tension and no bubbles. A 19mm proctoscope is successfully passed through the anastomosis."
