start,end,text
66.604,178.753,"The surgeon dissects the hernia sac emerging from the indirect space, encountering sticky tissue during medial dissection towards the pubic bone. The surgeon carefully works laterally to locate the cord structures, avoiding injury. Several peritoneal holes are created during sac reduction, which will be patched using the hernia sac itself."
179.253,267.85,"A small lipoma is visible, displaced during the dissection, and set aside. The surgeon continues dissecting the hernia sac, revealing a hole in the tissue. The edge of the sac is identified, and the chord structures are swept down and away from the surgical field."
268.35,376.497,"The surgeon continues to parietalize the cord structures, working in a challenging space near the femoral and obturator regions. The tissue planes are heavily scarred, complicating the dissection. The pubic tubercle is identified, and the surgeon attempts to parietalize the vas deferens. A hole is created in the peritoneum, and the surrounding fat obscures the femoral vessels, necessitating further dissection to ensure proper mesh placement."
376.997,476.461,"The surgeon revisits the lipoma, amputating it to facilitate further parietalization of the cord structures. The dissection continues over the femoral area, revealing a hemo lock clip amidst scar tissue from a previous lymph node dissection. The removal of the clip provides space for the mesh to lay flat, reducing the risk of hernia recurrence."
476.961,582.673,"The surgeon carefully places a twelve by sixteen mesh into the pocket created during dissection, serially unfolding it to ensure proper fit. The mesh is positioned satisfactorily, and the flap is closed to secure the repair."
