start,end,text
52.555,100.037,"A 4.5 cm incision is made 2 cm to the right of the umbilicus, where an applied medical gel port with a wound protector is placed. The da Vinci SI robot is docked, and robotic arms one and two are inserted into the peritoneal cavity through the single incision, crossing each other. The DaVinci monitor displays the reassignment of arm control, indicating the right hand now controls the robotic arm from the left side and the left hand controls the arm from the right."
100.537,226.678,"The surgeon begins the operation by exposing and visualizing the vascular supply to the sigmoid colon for a medial to lateral dissection. The sigmoidal branches are carefully dissected free from surrounding tissue using monopolar endoshears. The exposed vessel is skeletonized, and a 5mm ligature device is used to seal and divide the largest vessels encountered. The dissection proceeds medially to laterally until reaching the opposite side of the mesosigmoid, creating a window in the mesentery. This window aids in retraction and facilitates traction and counter-traction. A longitudinal incision is made to accommodate the robotic arms along the craniocaudal axis of the operating field."
227.178,310.364,The surgeon continues the dissection around the rectosigmoid junction using a five millimeter ligature device to manage larger vessels. The rectosigmoid junction is prepared for an end-to-end anastomosis by ensuring proper serosal contraposition. A 60mm roticulating automatic endostapler is positioned at the most distal point with intact blood supply to divide the colon.
310.864,414.142,"The surgeon uses a 5mm video scope with a 30-degree lens facing upward to provide a clear view of the surgical field, allowing ample room for robotic arm movements. A second reload of the stapler may be fired to complete the resection, or endoshears may be used to finish the procedure. The anatomy is visualized to localize the ureter, ensuring no limitation in the visual field."
414.642,461.279,"The surgeon confirms adequate mobilization by checking if the descending colon reaches into the pelvis without tension. The colon is exteriorized through the single incision wound protector, and the specimen is transected. The anvil is placed in the distal descending colon extracorporeally. The gel port is reapplied on the wound protector, and the EEA stapled anastomosis is completed using regular laparoscopic instruments through the single port. The anastomotic donuts are checked on the back table, and the stapled line is tested underwater for leaks."
