start,end,text
74.924,106.733,"Three eight-millimeter robotic ports are positioned in an oblique line toward the right pelvis for the right-sided unilateral hernia repair. A twelve-millimeter assistant port is placed laterally in the right lower quadrant. Upon gaining abdominal access, the ovary is identified and suspended away from the operative field, exposing the broad ligament as the entry point into the retroperitoneum. The ureter is identified, and proper stent placement is confirmed."
107.233,130.243,"The surgeon parietalizes the peritoneum of the broad ligament to create the preperitoneal space, ensuring the correct plane is entered by confirming the integrity of the opposite side of the broad ligament."
130.743,168.574,"The surgeon carefully dissects around the retroperitoneal vessels, including the internal iliac vein, with the sacrum visible as a fixation point for the mesh. The contour of the sciatic hernia is revealed, and the contents of the hernia sac are fully reduced."
169.074,216.808,"The surgeon identifies the internal iliac vein and artery, with the sacrum fully dissected as the posteromedial point for mesh fixation. The fibers of the piriformis are visible, serving as the posterolateral fixation point. A hybrid mesh, consisting of a permanent layer and an absorbable layer, is deployed and trimmed to fit the dissection area. The absorbable layer is oriented medially to protect delicate retroperitoneal structures, including the sciatic nerve."
217.308,298.667,"The surgeon interposes absorbable mesh between the ureter and permanent mesh to reduce the risk of ureteral erosion, adhesion, and obstruction. The mesh is sutured to the sacrum using IIO permanent suture and then fixed to the piriformis muscle. After securing the posterior edge, the mesh is trimmed to fit the dissection pocket."
299.167,398.435,"The surgeon fixes the mesh to the external obturator muscle at the anterolateral point and to the levator ani muscles at the anteromedial point. The mesh is then surveyed to ensure proper placement. Finally, the peritoneal defect is closed using a running barbed absorbable suture."
