start,end,text
51.009,99.537,"The surgical team uses three robotic ports and an assistant port, with fenestrated bipolar forceps, a camera, and a permanent cautery spatula positioned to face downwards for optimal visualization of the diaphragm. The diaphragm is inspected, and visible endometrial tissue deposits are removed, including a prominent nodule. The overview reveals marked endometrial deposits and a large fenestrated area with the liver visible beneath."
100.037,161.857,"The surgeon uses bipolar cautery and a spatula to resect abnormal nodular tissue on the diaphragm. The bipolar forceps retract the tissue while the assistant holds a suction catheter visible on the left side of the image, enhancing visibility in the surgical field."
162.357,199.652,"The surgeon completes the resection of the diaphragm using a spatula to gently dissect away from adhesions near the liver. The procedure transitions to a pleurectomy in the costophrenic recess, facilitated by the robotic pelvic position for enhanced access."
200.152,264.39,"The surgeon repairs the diaphragm using a layered Ethibond stitch technique, starting with a continuous running stitch and reinforcing with multiple interrupted stitches. The robotic instruments facilitate precise stitching, and the final view shows the diaphragm with small resected endometrial deposits."
264.89,322.728,"The surgeon introduces a Teflon patch to complete the diaphragm repair, loosely stitching it in place with multiple interrupted stitches. The final appearance of the diaphragm is shown. The robot is undocked and redocked through the same ports for a thoracic approach, with the camera view shifting towards the apex to begin pleurectomy on the anterior chest wall."
323.228,353.234,"The robotic system provides enhanced visualization and precision as the surgeon performs an extensive pleurectomy across the chest wall. A small patch is visible on the anterior chest wall, which is removed before inserting a single chest drain and inflating the lung prior to closure."
