start,end,text
70.021,97.294,"The patient is positioned supine with legs apart in a Trendelenburg position. The robotic SI system is docked over the left hip, utilizing three robotic trocars placed at the umbilicus, epigastrium, and left flank. After dividing the mesentery, the surgeon uses a fluorescence imaging device to assess perfusion. A colotomy is performed using monopolar scissors."
70.021,97.294,"The patient is positioned supine with legs apart in a Trendelenburg position. The robotic SI system is docked over the left hip, utilizing three robotic trocars placed in the umbilicus, epigastrium, and left flank. After dividing the mesentery, perfusion is assessed using indocyanine green (ICG) fluorescence. A colotomy is performed using a monopolar scissor."
97.794,169.35,"The surgeon uses a robotic stapler to transect the colon proximal to the colotomy site. A V-lock suture is employed to close the colotomy with a running trio suture, while the anvil attached to the V-lock remains intact within the colon lumen."
97.794,241.399,"The surgeon uses a robotic stapler to transect the colon proximal to the colotomy site, ensuring the V-lock anchoring the anvil remains intact. A hot scissor is used to cut the staple line between the spike and the suture, allowing the spike to be gently removed from the colon and detached from the handwheel. A hand-to-hand anastomosis is fashioned, and the forefly is employed to assess anastomotic perfusion. A flexible endoscope is used to evaluate the colorectal anastomosis."
169.85,232.05,"The surgeon completes the transaction of the colon using a hot scissor to cut the staple line between the spike and the suture. The spike is gently removed from the colon and detached from the hand-wheel. A hand-to-hand anastomosis is fashioned, and the forefly is used to assess the perfusion of the anastomosis, followed by a higher leak test."
