start,end,text
130.602,193.157,"The surgeon identifies the ileocolic vessels and incises the peritoneum, opening the space between the Girota and Toldt fascia. Dissection proceeds through the vascular plane from medial to lateral, with the left iliac artery and left ureter visible and covered by Girota fascia. The ileocolic vessels are skeletonized at their origin from the superior mesenteric vessels."
193.657,230.452,"The surgeon clips and divides the ileocolic vein, followed by applying clips on the ileocolic artery and dividing the vessel."
230.952,255.36,"The duodenum, pancreas, and Fredae fascia are clearly visible in the surgical field. The surgeon uses a monopolar hook to perform a precise dissection along the anatomical plane."
255.86,330.939,"The surgeon identifies the last ileal loop and staples it. The right branch of the mid-colic artery, which is left-sided due to situs inversus, is clipped and divided. Fomental vessels are sectioned, achieving complete mobilization of the specimen."
331.439,399.345,"The surgeon staples the transverse colon and retargets the robotic platform to facilitate the anastomosis. A 3-0 silk stay suture is placed to ensure proper bowel orientation. A two-centimeter opening is created in the transverse colon and small bowel, followed by a robotic hand-sewn anastomosis using a single-layer barbed-running suture."
