start,end,text
19.011,45.366,"Welcome again to these series of videos where I'm showing you these very exciting wristed instruments. They're called Articential by Livsmed. So I've already posted a diaphragm placation and a lobectomy and I'm very excited to be bringing you a thymectomy. So here's my setup, looking pretty comfortable. I've also got a camera holder as well so I'm sort of able to control the camera too. So let me tell you a bit about this thymectomy patient."
45.866,82.016,"So this patient, as you can see by the axial CT scan in just a second, has a little thymoma. There it is. You can just see it under the sternum there, but much more wackily, she's also got a huge paraesophageal hernia, as you can now see in these images. So I was actually referred to see if I could do both at the same time, but on discussion with the general surgeons and due to previous experience, parasophageal hernia is a far better fix from the abdomen. So I said this person needs a quick and easy thymic removal because thymoma is a tumour. Hi Mel, by the way, she gave us a wave there."
82.516,132.62,"The video shows the initial view of the large paraesophageal hernia. The surgeon performs a line of intercostal blocks using a green needle, injecting bupivacaine with adrenaline. The Articentio Maryland instrument is introduced to begin taking down adhesions."
133.12,196.658,"The surgeon uses a bipolar wristed instrument to begin the thymectomy, carefully removing fat from the lower portion of the sternum and diaphragm. The instrument is positioned through a port in the third intercostal space, utilizing bipolar energy for precise tissue dissection."
197.158,278.413,"The surgeon uses a bipolar instrument to gently dissect and remove tissue from the diaphragm, revealing the diaphragm muscles. The left-sided instrument retracts while the right-sided instrument identifies the plane, lifting the right inferior pole off the diaphragm. The pericardium is visible, and the surgeon uses the Maryland instrument to peel tissue off the pericardium."
278.913,344.834,"The surgeon uses VATS wristed instruments to reach the left inferior pole of the thymus, maneuvering across to the opposite side with ease. The bipolar instrument is used to dissect up the pleura, angling at right angles for precise tissue manipulation."
345.334,404.502,"The surgeon opens the opposite pleura and proceeds to remove the thymus from the pericardium on the right side. The surgical field reveals significant adhesions, including some between the lung and the phrenic nerve. The surgeon carefully navigates towards the right phrenic nerve, pointing out its location amidst the surrounding tissue."
405.002,453.498,"The surgeon works along the superior vena cava (SVC) using a bipolar instrument, leaving a margin around the thymus. There is visible bleeding from the thymus, likely due to vessels from the inferior pole, lateral reamer vein, and artery."
453.998,530.849,"The surgeon uses a bipolar instrument to manage bleeding and proceeds to dissect tissue from the back of the sternum, following the reamer vein. The thymus is seen flopping over the superior vena cava (SVC), complicating the identification of the innominate vein. The surgeon finishes dissecting the opposite inferior pole using wristed instruments, which allow for precise manipulation and access to deeper areas."
531.349,610.104,The surgeon uses wristed instruments to peel tissue off the pericardium and continues to remove tissue from the back of the sternum.
610.604,705.933,"The surgeon uses a subxiphoid temoport to obtain a view of the left phrenic nerve, which is obscured by deep fat and a large parasophageal hernia pushing the heart upwards. The lemur artery and vein are visible at the top of the screen, serving as landmarks for locating the innominate vein."
706.433,802.838,"The surgeon advances into the neck region, following the lemur vein to the left superior pole of the thymus. Using a ligature with a hook attachment, the surgeon identifies the thymic vein branching from the innominate vein. The right superior pole of the thymus is retracted with a wristed instrument, and the thymic vein is carefully dissected off the innominate vein."
803.338,893.752,"The surgeon follows the innominate vein across to the lemur vein, removing thymus tissue from beneath the innominate vein using wristed instruments. The left superior pole is visualized, and the surgeon uses a sub-xiphoid camera to assist in the procedure. A specimen bag is introduced through the sub-xiphoid port."
894.252,953.942,"The surgeon uses 8mm robotic ports in the right chest and a 10mm sub-xiphoid port to remove a type A thymoma. The final result is shown, with a 20 French drain placed. Both lungs are inflated and checked for leaks by bubbling under water for ten minutes before removing the drain."
954.202,987.307,"As you can see, What I've learned in these few cases is to get your two artist central ports relatively close together because they're quite long instruments So if you keep the instruments fairly close together, then you you have a nice comfortable position And my elbows are at right angles at the table up a bit higher than normal and it was absolutely fantastic These are real game changers. So let me know what you think get in contact if you want to get in contact with the company let me know and get yourself a few of these instruments thanks a lot for watching"
