start,end,text
5.861,26.441,"The surgical view is established through a ten millimeter port, followed by two to three five millimeter ports. A fixed liver retractor with a ratcheted grasper is inserted to stabilize the liver during the procedure."
26.941,52.043,"The surgeon uses diathermy scissors to score the peritoneum, carefully mobilizing the colon away from the Gerota's fascia without penetrating it."
52.063,126.382,"The surgeon identifies the salmon pink Gerota's fascia beneath the surgical field, contrasting with the egg yellow mesentery. The dissection continues in the avascular plane, avoiding entry into Gerota's fascia except near the hilum to access the psoas muscle. The duodenum is visible and requires careful mobilization with minimal cautery to prevent injury."
126.882,222.833,"The duodenum has been carefully caucarized using sharp dissection in an a-thermal manner to prevent injury or serosal tears. The surgeon continues the dissection inferiorly to fully mobilize the bowel, ensuring adequate visualization of the inferior vena cava (IVC) for the nephrectomy procedure."
223.333,300.87,"Again, the same answer for the duodenum, isn't it? Yeah. Just enough. Yeah. And if I'm going to have any bleeders, I'll cut them, let the duodenum drop down and then burn the bleeders on the kidney side so there's no thermal injury to the duodenum. Yeah. And if it's anything major, then I will burn it, but I'll cauterize it or alternatively stitch it. if i have to but i think the best solution best best way to approach the duodenum is with the due sense of uh terror and respect and leave it leave it alone enough so that you can see the ibc exactly because that's also the safety in the operation is to ensure that you have the ibc or the aorta actually uh displayed this just looks like a small vein it doesn't i don't think it would be the um gonadal vein is that should um enter the anterior ibc and then you put a fiddle stick. Once you have that space open up, you put a fiddle stick to come in. So use a fixed retractor. This is a laparoscopic peanut, but, um, the best, the best instrument actually is a metal pointer as, um, it can actually hold things without bending. And secondly, it's cheap and reusable. Whereas these fiddle, these, um, laparoscopic peanuts are quite expensive."
301.27,367.824,"The surgeon positions a fixed liver retractor in place, ensuring it remains stable without active assistance. Hemlock clips are used to secure small tissue packets, which are then clipped or cauterized to prevent bleeding, particularly from vessels like the renal or gonadal veins."
368.244,439.458,"The surgeon carefully dissects the renal artery and vein, avoiding the use of right-angle instruments to prevent tearing posterior branches. Hemlocks are applied to fully exposed bundles of tissue to minimize bleeding risks."
439.958,544.078,"The surgeon identifies the renal vein and renal artery, noting the presence of an accessory artery with two branches: a main branch located posteriorly and a smaller branch anteriorly. The surgeon carefully dissects these vessels without using a right-angle instrument, emphasizing gentle handling to avoid avulsion, particularly in older patients with less mobile arteries. Hemolocks are applied to secure the vessels."
544.578,690.298,"The surgeon places two hemlocks on the stay side of the renal artery and vein, ensuring the open lumen of the main artery is visible. Using a 30-degree camera, the surgeon carefully dissects behind the renal vein without using a right angle, applying gold hemlocks to avoid locking on the vein itself. The peritoneum is opened between the liver and kidney, with diathermy used to prevent bleeding. Hemlocks are applied across the top of the adrenal gland, with options to use a harmonic or stapler if available."
690.798,818.795,"The surgeon uses a small clip to secure a specific vessel near the adrenal gland, ensuring small arteries from the renal artery are treated to prevent bleeding. The dissection focuses on freeing the upper pole of the kidney before moving to the lower pole, using natural attachments for efficient retraction. High energy settings are applied for a bloodless dissection, maintaining the correct plane to avoid bleeding from Girota's fascia."
819.295,851.946,"And do you always put a drain up the end? I usually do. To be honest, I think there's no real need for a drain the vast majority of times. I think intellectually we all know you don't need it, but I think we're always scared to not leave a drain. The reality is we'll only have a hundred or two hundred mils of fluid here at worst, and that will easily be absorbed in the peritoneal cavity. But I do tend to do it and especially if there is any if it is even slightly remotely woozy and i'll always leave a drain for partials as well"
