start,end,text
1.502,63.331,"Welcome to another installment of robotic hernia surgery. Today, we're discussing the management of a traumatic suprapubic hernia. This was a woman that was referred to me for an inguinal hernia causing urinary symptoms. But on closer review, it was quite obvious that this was actually a ventral hernia related to her prior emergency orthopedic interventions, which had been done to fixate her broken pelvis. On CT review, what you'll note is a significant amount of orthopedic hardware on the pubis with herniation of the bladder anterior to the pubis and in close proximity to all of that orthopedic hardware. She was evaluated by urology and ortho in advance of seeing me, and I plan to move forward with a robotic repair with them, sort of available should I need them."
63.831,175.501,"The surgeon performs a central retromuscular dissection to reduce the hernia sac, including the bladder, with careful attention to the patient's left side where the bladder is significantly involved. A three-way bladder catheter is placed, and the surgeon attempts to find an areolar plane to minimize the risk of bladder injury."
176.001,275.108,"The surgeon performs lateral dissection on the patient's right side, dissecting to the iliopsoas muscle and identifying the obturator canal. The preperitoneal component of the round ligament is visible. On the left side, the surgeon carefully dissects the bladder from the anterior abdominal wall and pseudosac, encountering orthopedic hardware. The orthopedic team confirms the safety of removing the loose hardware, which is then removed."
275.608,342.626,"The surgeon completes bilateral myopectineal orifice dissection, exposing the hernia and reducing the bladder. The bladder is distended to check for leaks, with none observed. The surgeon begins midline placation, noting the avulsion injury of the rectus muscle off the pubis, before proceeding to transverse placation."
343.126,410.159,"The surgeon performs transverse placation, similar to techniques used for direct hernias, narrowing the space by re-approximating the rectus muscle to the pubis using multiple suture lines. Visible fascia on the pubis is utilized for securing the rectus muscle."
410.659,504.376,"The surgeon places overlapping mid-weight meshes to cover the groins and central portion of the lower abdominal wall. The mesh is fixated using TIS seal and permanent sutures. The flap closure is initiated using three six-inch V-lock sutures, starting from lateral to medial on both sides, with an independent suture line for the central portion."
504.876,528.643,"The surgeon completes the exclusion of the mesh from the viscera and decompresses the preperitoneal space, marking the end of the surgical procedure."
