start,end,text
12.913,81.442,"Okay, today we are doing a nephrectomy for a tumor. The patient has a cirrhosis and a lot of other reasons to the previous surgery when the surgeon tried to do a gallbladder cholecystectomy. I think it's his stomach. I think his colon is very dilated. Effectivement, coagulation un peu merdique, parce que tu as vu combien je dois insister, ça ne coagule pas. On a passé ces plaquettes ou pas? On n'a pas encore passé les plaquettes, Suzanne? OK, super."
81.942,225.167,"Parce que si, effectivement, j'ai beaucoup coagulé, ça ne signe pas. There are still only Osamus girls here. No, it's going to go against the wall. You have to be there. I don't know. That's why right away with the bill. No, no, no, no, no, no, no, no, no, no, no, no, no, no, no, no. I understood the problem. No. Good morning. Mm-hmm. It's the appearance of the gallbladder. Mm-hmm. Mm-hmm. Mm-hmm."
225.667,324.234,"The surgeon identifies the duodenum and notes the presence of a tumor nearby. Adhesions from a previous cholecystectomy are visible, with the gallbladder likely adherent at this level. Coagulation appears ineffective during the procedure."
324.734,429.266,"The surgeon identifies the lower part of the kidney and attempts to coagulate the area using a bipolar device. Despite repeated coagulation attempts, bleeding persists, indicating a coagulation issue."
429.766,551.583,"The surgeon positions the kidney at the level of its lower pole and lifts it to expose the surrounding structures. The vena cava is identified, along with one of the two veins being searched for. The surgeon navigates around the full colon, making a small coagulation cut on it."
552.083,739.337,"The surgeon carefully dissects around the artery using a grasping instrument, identifying two veins nearby. After ensuring no critical structures are involved, the surgeon coagulates the tissue twice and cuts it. The artery is exposed, and a clip is placed to stop the blood flow."
739.837,811.824,"The surgeon attempts to place a clip on the artery. If unsuccessful, they plan to sacrifice a small vein on the left. The clip is positioned and closed around the vessel using a hook to ensure secure placement. The surgeon pre-closes the clip to form a loop, slides it down, and locks it in place, ensuring the vessel is controlled without the clip slipping."
812.264,909.549,"The surgeon cuts a vein using a surgical hook, ensuring contact before sliding down and closing the clip around the vein."
910.049,1097.803,"We're not going to take any risks. It's no use. In addition, I'm taking the plane tonight, so it shouldn't be five this night. No, but it's better because it actually has a problem. Listen, here, I coagulate the bipolar. I have the impression that this or nothing is the same thing. Okay. Okay, this is done. It will be finished in ten minutes, huh? Now I have just to raise the uter. I remember that the patient has a small fucking vein behind. If I remember on the CT scan. Now the uter. I don't need to remove all the uter links. I dissect a small piece of tissue. I coagulate twice. I see that this fucking bleeders is unbelievable. Okay, normally the uter, if it's well down, should be located higher than our instruments. There's a thing that signs underneath. Look, it starts to sign. It's incredible. It's coagulated, it doesn't sign, and then you let go, it signs. Do you want me to sign it for you? No, it's okay. I don't know. We'll see. If we go back just here. It's just there."
1098.303,1260.308,"The surgeon attempts to detach a structure, possibly a vein, and places a clip on it for control. The surgical field includes the kidney and surrounding vasculature, with the surgeon adjusting the position to better visualize the area."
1260.808,1381.238,"The surgeon applies a clip to secure vessels instead of coagulating them, ensuring not to detach the kidney from the lateral wall to prevent rotation. The upper pole of the kidney is approached, with care taken to preserve the adrenal glands, as there is no indication for their removal in this case."
1381.738,1472.277,"The surgeon assesses the area around the tumor, noting the presence of the adrenal gland within the surrounding fat tissue. The tumor is visible at this level, and the adrenal gland appears to be preserved."
1472.777,1580.272,"The surgeon carefully places clips on a small vein due to the patient's coagulopathy, ensuring secure hemostasis. The liver is visible in the surgical field as the surgeon connects tissue sections and adjusts positioning for better visualization."
1580.772,1795.212,"The surgeon releases the kidney from the lateral attachment to the abdominal wall, carefully incising and coagulating to minimize bleeding. Monopolar and bipolar cautery are used to assist in controlling small bleeders. The kidney is repositioned for removal, and an inguinal incision is made to facilitate extraction."
1795.712,1908.626,"The surgeon prepares to place a drain in the surgical field before removing the kidney, ensuring that the gas within the cavity is maintained. Scissors are used in a shaking technique to assist in the process, and a bag is positioned to facilitate the kidney removal."
1909.126,1965.493,"I hope it will go as well tomorrow when I do my demonstration in Barcelona, because they have planned for me a Xanthogranulomate ring. And a partial. Oh, OK. Yes, it's good. I'm going to position it. I position the chain. Yes, here. Show me. It's good. It's good. I'm in. No, no, it's good. OK, on va retirer le rein du... Ah oui, tu veux regarder? Oui, vas-y, c'est bon, tu as raison, regarde si tu sais. Attends, je mets mon doigt ici. OK, attends. OK, oui. Oui, c'est bon. De l'autre côté, c'est bon. On peut éteindre le gaz."
