start,end,text
182.487,229.507,"The surgeon demonstrates the manipulation of the artisanal laparoscopic device in a pegboard exercise, highlighting its seven degrees of freedom compared to the five degrees of a standard laparoscopic instrument. The surgical field shows the narrow male pelvis, with a medial to lateral approach accessing the retrorectal space for dissection between the presacral and mesorectal fascia."
230.007,298.289,"The surgeon identifies and preserves the hypogastric nerve while continuing dissection cranially. The inferior mesenteric artery is located at its origin, and the inferior mesenteric vein is identified below the pancreas, skeletonized, and divided between laparoscopic clips. The inferior mesenteric artery is then skeletonized one centimeter from its origin and divided using a 45mm white load stapler."
298.789,403.557,"The surgeon continues the medial to lateral approach, carefully identifying and preserving the hypogastric nerves and the left ureter. Lateral dissection is performed along the white line of Toldt to mobilize the sigmoid and descending colon. The gastrocolic and splenic ligaments are divided, allowing entry into the omental bursa and mobilization of the splenic flexure."
404.057,636.079,"The surgeon fully mobilizes the left-sided colon and returns to the pelvis to perform total mesorectal excision. Branches of the inferior hypogastric nerves are identified and preserved. Anterior dissection is performed along Denonvilliers fascia using artisanal forceps to hold down the rectum, allowing precise dissection along the nervous fascia with an articulated spatula. Posterior dissection continues, with the rectum held up to provide a clear view of the retrorectal space. The articulated monopolar spatula is maneuvered upwards and sideways to dissect between the mesorectum and the coccygeal and levator ani muscles. Circumferential dissection proceeds laterally until all planes are connected, completing the total mesorectal excision."
636.579,720.782,"The surgeon performs a transaction of the rectum using a 45mm green load stapler in a narrow pelvis with preserved nerves. The transabdominal specimen is extracted, and extraabdominal fluorescence angiography is used to assess bowel perfusion. A double stapled side-to-end anastomosis is created with a 29mm circular stapler, followed by the formation of a defunctioning loop ileostomy. The total mesorectal excision (TME) specimen and distal resection margin are visible."
