start,end,text
10.645,74.015,"During the laparoscopic cholecystectomy and appendectomy, the surgeon applies entromedial traction to the Hartmann's pouch while using a harmonic scalpel to separate the posterior peritoneum above the Rouvière's sulcus. The Teflon jaw of the harmonic is positioned towards the cystic pedicle, creating a posterior window by opening the peritoneum. Entrolateral traction is applied to open the anterior peritoneum at the gallbladder's body where it contacts the liver. The posterior window is formed, followed by peritoneal dissection of the pedicle to facilitate anterior window creation, with stripping performed from top to bottom."
74.515,196.913,"The surgeon uses a Maryland dissector to create a window in Calot's triangle, identifying the cystic artery and duct. Titanium clips are applied to the artery and duct at specified intervals, securing them before cutting between the clips with a harmonic scalpel. The gallbladder is separated from the liver using entromedial and entrolateral traction, ensuring no bleeding or bile leakage, with all clips securely in place."
197.413,200.735,The surgeon introduces a claw forceps to grasp and extract the gallbladder from the surgical field.
200.875,261.606,"The telescope is transferred to the epigastric port, while the umbilical port is used for retracting the appendix and transferring it to the right lateral port. The right lateral port holds the appendix, and the umbilical port is used with the harmonic device. The right anterior axillary line port, previously used for fundus traction in cholecystectomy, now holds the appendix. Through the umbilical port, a Maryland dissector creates a window and coagulates the appendicular artery, followed by dissection with scissors."
262.106,323.146,"The surgeon moves towards the left shoulder for the appendectomy, while the camera person positions near the patient's head. The telescope is placed in the epigastric port. The surgeon ties a knot at the base of the appendix using the umbilical port, then cuts the appendix with scissors. The harmonic device or bipolar may be used to coagulate the base, ensuring the mucosa is sealed before cutting the appendix."
323.646,338.593,"The appendix is extracted through the umbilical port, completing the laparoscopic appendectomy procedure."
