start,end,text
1.675,51.485,"The surgeon uses a laparoscopic camera and three additional ports below the chest to access the surgical site. The artery is elevated, creating a tunnel-like space beneath it to expose the yellow bile duct and associated blood vessels. Clips are applied to the vessels, and the surrounding yellow tissue is cleaned to improve visibility."
51.985,109.472,"Usually it contains the blood vessels and the channels that are inside it. So now, as they say, we are trying to remove the channel in the middle of the yellow tissue. And this channel is important because it connects, as we said, the urine is a storage for the yellow substance. It does not make the yellow substance, it stores the yellow substance in it. Now is the time of need. If we ate things that had fats, the yellow substance starts to come out of the urine. through the small yellow channels that you would like to see in a little while and you go to the main yellow channel and it goes down after that to the twelve to help in the digestion of fat because the fat does not get more digested in the first part of the first part of the first part of the first part of the first part of the first part of the first part of the first part of the"
109.972,157.555,"now we will cut it and separate it and then we will cut it and separate it now we will cut it and separate it now we will cut it and separate it now we will cut it and separate it now we will cut it and separate it now we will cut it and separate it now we will cut it now we will cut it now we will cut it now we will cut it now we will cut it now we will cut it now we will cut it now we will cut it now we will cut it now we will cut it now we will cut it now we will cut it now we will cut it now we will cut it now we will cut it now we will cut it now we will cut it now we will cut it now we will cut it now we will cut it now we will cut it now we will cut it now we will cut it now we will cut it now we will cut it now we will cut it now we will cut it now we will cut it now we will cut it now we will cut it now we will cut it now we will cut it now we will cut it now we He gives clean blood for the channel. This is for the bleeding, and we want to collect it later with the bleeding."
158.055,190.251,"The surgeon carefully separates the gallbladder from the liver bed, detaching it from its resting position within the liver tissue."
190.751,249.668,"After eating something that contains fat No, it starts to feel it after three to four hours When the food moves from the stomach When the part of the stomach is digested and moves to the twelfth That's when the patient starts to feel pain So this is usually three to four hours and sometimes six hours When the food reaches the stomach If the food is very dry, for example Like Eid tomorrow, for example Qoozi, for example or if you ate a fatteer for example now we are separating it from the bed that is in the liver and we dry it so it doesn't get dirty and this made life easier for the patient the patient was the first to open at this area under the right occipital spine ten centimeters now we open four openings"
250.168,295.018,"One at the chest is one centimeter and the other one is half centimeter. At the same time, we will open a slightly larger opening at the bottom of the chest. This means that there are four openings, two of which are one centimeter and two of which are half a centimeter. This means that after the wound was ten centimeters, it became three centimeters distributed. The patient returned to normal life quickly and usually eats from the first day and leaves the hospital the second day after the operation, which we consider the first day."
295.518,324.377,"So it means that she shortened a lot for the patient and returned them to their normal life, which they were late in after this operation due to the length of the wound. By the way, I wanted to tell you that the blood that you see here is magnified ten times as normal. It's not as you think. The blood clot is magnified ten times as normal."
324.877,376.334,"In the opening operations, the patient used to remove more, from the stomach wound to the inside of the operation, and then for us as surgeons, this operation made it easier for us to see everything. This patient now has a little bit of removal, so this tissue helps in... to stop the bleeding we put it in the place of the leather bed to stop the bleeding we put it in the mirror The operation was easier for us because we spent a long time only opening and closing the wound. We finished the operation in twenty minutes. The patient was fine. We checked and there was no bleeding. We removed the open wounds and closed the wound. The patient came back home the next day in the best condition."
