start,end,text
4.023,52.133,"Intestinal malrotation is a rare condition in the adult. The degree of rotation causes different scenarios of presentation, from acute intestinal obstruction to asymptomatic or mild abdominal symptoms. This may result in a delay in diagnosis. During embryological development, the intestines rotate two hundred and seventy degrees counterclockwise around the superior mesenteric artery. Based on the degree of rotation, the two most frequent presentations are the complete common mesentery with a stop in rotation after ninety degrees with a patient usually asymptomatic and the incomplete common mesentery with a stop in rotation after one hundred and eighty degrees due to a very short insertion of the mesentery, the patient is in high risk of mid-gut volvulus or obstructive symptoms."
74.221,114.138,"The surgeon observes that all the small bowel is located on the right side of the abdomen, with the absence of the ascending colon in its usual right position. Fibrous bands are visible, attaching from the second part of the duodenum to the right colon and fixing onto the retroperitoneum. These bands resemble a veil that wraps around the duodenum, causing obstruction. The duodenum is seen fixed in an abnormal position on the retroperitoneum, preventing visualization of the trait angle in its regular location, indicating intestinal malrotation."
126.055,198.027,"The surgeon performs a Ladd's procedure, freeing the Ladd's bands, which appear as red fibrous stocks of peritoneum, to release the trapped duodenum. The mesentery is widened, and a prophylactic appendectomy is conducted. Various energy devices, such as ligature, hook, or bipolar, are used to take down the adhesions, aiming to straighten the duodenum and prevent future obstruction."
198.527,267.418,"The surgeon completes the laborious process of freeing the last fibrous bands, ensuring the bowels are repositioned to confirm the mesentery has been widened. The second portion of the duodenum is moved away from its original position and placed proximal to the left lower quadrant. A prophylactic appendectomy is performed to prevent future misdiagnosis due to the appendix's anomalous position."
267.918,324.996,"Once that surgery was ended, we proceeded with the original scheduled surgery for this case called a cystectomy. Intestinal malrotation can be diagnosed in different scenarios. In this particular case, we decided to perform LAT surgery besides a cholecystectomy because of the patient's unresolved symptoms that were present for many years and that were not related to the presence of gallstones. If this procedure is decided to perform intraoperatively special consideration should be taken in place like for example health status of the patient, any associated disease and relationship of symptoms with intestinal malrotation. This procedure lasted one hundred and twenty minutes and two days after the surgery the patient was discharged without complication and with no symptoms. Six months follow up the patient is still asymptomatic. These films are after the surgery and clearly show where the bowel must be left. Surgeons must be aware of this diagnosis and suspect it whenever they encounter a patient with recurrent abdominal symptoms with no clear diagnosis for a long period of time. Interoperative diagnosis can be made and that procedure be safely done."
