start,end,text
0.571,40.597,"We present a case of a robotic resection of abdominal wall metastasis from colon cancer primary. We have no relevant disclosures. The patient is a fifty-eight year old male diagnosed with an abdominal wall recurrence of colorectal primary after initial laparoscopic sigmoidectomy and adjuvant chemotherapy. Past medical history includes coronary artery disease with stents, chronic obstructive pulmonary disease, and gastroesophageal reflux disease. Past surgical history, laparoscopic sigmoidectomy with end colostomy, total left hepatic lobectomy, and partial right hepatectomy, and a robotic-assisted colostomy closure. Medications include aspirin and ranitidine."
41.097,67.856,"Abdominal wall metastases from colorectal primaries are rare, with a reported incidence of one to two percent in both open and laparoscopic colectomies. Multiple theories have been postulated for their occurrence. These include tumor invasion, lymphatic spread, and cancer cell seeding. Recent literature suggests tumor manipulation during surgery is the predominant factor for tumor seeding. Aerosolization associated with pneumoperitoneum is thought to play a smaller secondary role."
104.25,250.165,"The surgeon identifies a 2.1 by 1.8 cm hypermetabolic lesion in the left rectus musculature, confirmed as adenocarcinoma. The patient is positioned supine for robotic-assisted resection. An optical trocar is placed in the left upper quadrant, with two additional trocars in the supraumbilical region and right lower quadrant. The abdominal wall metastasis is visible at the medial portion of the previous colostomy closure site. Monopolar scissors score the mass, which is excised circumferentially using traction and counter traction. Bipolar grasp elevates the abdomen for anterior dissection, ensuring correct plane and hemostasis. The mass is removed entirely, extracted through a small skin incision at the colostomy closure site using a ring forceps. A remnant of the mass is identified and excised to ensure complete resection."
250.665,378.657,"The surgeon closes the defect in the abdominal wall using a 2-0 barbed suture in a continuous running fashion, taking evenly spaced bites on either side. After reaching the end of the defect, the suture is tightened and the needle is cut off. A second 2-0 barbed suture is used to complete a two-layered closure, ensuring airtight closure and good approximation of the fascial layers. Both needles are extracted through the skin incision site, and the skin incisions are closed with a running monofilament suture, concluding the procedure."
379.157,399.319,"The patient tolerated the procedure well and was recovered in the post-anesthesia care unit. A few hours after surgery, our patient tolerated a regular diet and he was discharged the following day. He was seen for follow-up two weeks later where his incisions were well healed and he had met all postoperative milestones. He was subsequently referred to the medical oncologist for further adjuvant chemotherapy."
