start,end,text
134.157,145.845,"The video shows the port sites for the robotic approach to median arcuate ligament release. The surgical team joins the operation after a diagnostic laparoscopy, with all ports placed and the robot docked, ready for instrument targeting."
146.345,187.739,"The surgeon performs a laparoscopic intraoperative ultrasound to identify the anatomy and proximity between the celiac artery and the superior mesenteric artery (SMA). The operation begins with the opening of the pars flaccida using monopolar cautery. The peritoneum overlying the cruciate diaphragm is incised with the same instrument, and the muscle fibers are separated to expose the anterior surface of the aorta."
188.239,237.232,"The surgeon performs a dissection to identify the anterior surface of the aorta, revealing robust crura and fibrous structures decussating across the surface. The assistant uses a suction device to provide posterior and caudal traction, aiding in the straightening of the celiac axis. Numerous nerve fibers, including parts of the celiac plexus, are identified and carefully teased out within this plane."
237.697,278.17,"The surgical team injects indocyanine green, and the aorta is seen fluorescing under the camera. However, there is no fluorescent signal from the celiac artery, indicating that additional tissue overlying the aorta must be divided to complete the release."
278.67,343.568,"The surgeon meticulously dissects and divides neural and inflammatory tissue overlying the celiac plexus, focusing on decussating fibers crossing the anterior surface of the celiac artery. The dissection reveals the base of the celiac artery at its origin from the aorta, with further dissection along the celiac artery uncovering additional nerve tissue and signs of chronic inflammation."
344.068,381.847,"The surgeon re-injects endocyanine green, causing the liver to fluoresce strongly as the dye collects and is excreted. The vasculature, including the aorta and celiac artery down to the trifurcation, is visible under fluorescence, indicating the division of the median arcuate ligament. An intraoperative ultrasound confirms the celiac artery is uncovered and has a straighter course from the aorta, visible at the top of the ultrasound screen."
