start,end,text
1.441,46.771,"So this is a elderly lady who presented with a colocutaneous fistula secondary to diverticulitis. She had it for multiple years and we had a battle of getting the sigmoid out, but we were able to do it robotically. because the specimens had a small amount of size mismatch and that we're getting comfortable with hand-sewn anastomosis, we decided to perform it this way."
47.271,76.169,"The surgeon aligns the resected ends of the bowel, resembling two rosebuds, using interrupted sutures to create a tension-free anastomosis."
76.669,121.553,"The surgeon performs an indocyanine green test to assess the quality of the anastomosis. Two 2-0 Vicryl sutures are used in the center, followed by a transition stitch at the corner, ensuring durability during the procedure."
122.053,209.35,"The surgeon uses a hand-sewn technique to deliver and pull up on the suture with the left hand, carefully walking it up and setting it with the needle. At the corner, a locking stitch is placed to prevent a purse string effect, followed by another stitch before starting from the opposite side. The needle is set with small motions to maintain efficient movement."
209.85,309.106,"The surgeon performs a transition stitch using a loaded needle, ensuring proper tension and loop setting by utilizing the top of the curve on the front side of the needle. The needle tip is used to set the suture, meeting the last suture with the first from the corner, while taking full thickness bites."
309.606,374.581,"The surgeon ties off the suture line, ensuring it sits smoothly, and places additional lumbers to relieve tension from the staple line. The procedure involves extensive sewing and the use of slip knots."
375.081,460.105,"The surgeon closes the remaining part of the jejunostomy site that was not addressed by the tinea, using sutures to secure the corner. A leak test is performed to ensure the integrity of the closure."
