start,end,text
161.527,191.918,"The surgeon prepares to inflate the abdomen for the procedure, discussing the placement of trocars along the costal margin, with adjustments based on the patient's body habitus to minimize instrument clashing."
192.418,217.771,"The surgeon identifies the eleventh and twelfth ribs and locates the rectus muscle. A visible scar is present in the suprapubic region, likely from a previous surgical procedure."
610.509,652.851,"The surgical team adjusts the patient's position on the operating table, turning it slightly. The setup includes four robotic ports and one assistant port, with an air seal port used for larger instruments requiring a twelve millimeter size."
653.351,706.845,"The surgeon uses an air seal trocar for suctioning. The patient's eleventh rib is depressed towards the abdomen, obscuring the view of the upper pole of the kidney and adrenal gland. The surgical team plans to locate the renal vein by dissecting the descending colon, spleen, and pancreas."
707.345,744.179,"The surgeon rolls the surrounding tissues away to expose the upper pole of the kidney and the adrenal gland. The dissection proceeds to locate the renal vein, revealing vascular abnormalities including a short, wide adrenal vein with two branches extending to the adrenal gland."
744.679,813.956,"The surgeon identifies a branch of the renal artery supplying the adrenal gland, preparing to clip and cut it to prevent vascular dissemination. The renal vein is dissected and clamped to control catecholamine release and avoid hypertension during adrenal manipulation."
814.156,942.252,"The surgeon identifies congenital adhesions between the colon, spleen, and the posterior upper part of the kidney. Using surgical instruments, the adhesions are carefully dissected to medialize the colon, aiming for a wide exposure of the surgical field. The splenicolic ligament is visible, with the spleen seen in the distance, positioned high up in the abdominal cavity."
942.752,1004.749,"The surgeon carefully dissects through the abdominal cavity, isolating the colon and the upper pole of the kidney. Despite the patient's imperfect body habitus, there are no additional adhesions from previous surgeries visible, allowing for cautious exploration of the deeper abdominal structures."
1135.716,1172.363,"The surgical team approaches the diaphragm, upper portion of the kidney, and spleen, adjusting the position of the instruments to maintain visibility on the monitor."
1276.69,1330.483,"The surgeon mobilizes the colon to drop it, creating more space for better visualization of the kidney hilum and renal vein. The kidney is exposed with minimal surrounding fat tissue, indicating a lean anatomical structure."
1381.481,1457.786,The surgeon identifies the colon and maintains a distance from it while separating the spleen from accessory splenic tissue.
1458.286,1505.011,The surgeon identifies the spleen and a round structure that may be an extension of the spleen. A segment of Gerta's fascia is left intact to serve as a protective buttress for the delicate splenic tissue.
1670.44,1705.603,The pancreas comes into view as the camera angle is adjusted.
1751.199,1782.318,"The surgeon carefully dissects around the end of the spleen, ensuring that the stomach does not slide down into the surgical field. An NG tube is kept inside to prevent accidental cutting of the stomach during this dissection."
1843.806,1924.674,"The surgeon rotates the spleen to free it from its attachments, revealing the adrenal mass situated medially. The rib is visible but becomes less of an issue as the procedure progresses."
1986.722,2051.101,"The surgeon identifies the mesocolon and the mass, working to mobilize the colon medially to create more space for accessing the hilum. The colon is visibly positioned in front of the surgical field, obstructing access to deeper structures."
2052.461,2118.683,"The surgeon identifies the duodenum and notes its proximity to the hilum, while creating additional space for surgical maneuvering to prevent potential complications such as excessive bleeding."
2119.183,2148.251,"The surgeon identifies the large splenic artery, which is visible and runs towards the spleen, marking the upper boundary of the dissection area."
2148.751,2188.967,The surgeon carefully maintains a layer of Gerota's fascia around the adrenal gland to protect vital structures during dissection. The search for the renal vein continues in the surrounding area.
2189.467,2271.34,The surgeon considers identifying the gonadal vein to follow it cranially for clearer anatomical orientation. The forearm is used as a traction device to assist in mobilizing the colon slightly.
2271.84,2312.807,"The surgeon uses a forearm device to elevate and move the kidney, while employing the TIRTI-UP technique to manipulate the surrounding tissue."
2313.307,2388.318,"The surgeon carefully advances towards the renal hilum, aiming to locate the renal vein during the adrenalectomy procedure."
2388.818,2444.316,"The surgeon identifies the renal vein near the renal hilum, noting vascular abnormalities around the area. The adrenal mass is visible adjacent to the vein, and the surgeon prepares to dissect further while using a suction device for better visualization."
2444.816,2472.695,"The surgeon uses scissors to explore the surgical field, attempting to locate the adrenal vein, which is described as having a broad and short origin before bifurcating."
2473.195,2508.624,"The surgeon identifies a vessel that appears to be the adrenal vein, noting its unexpected length. The surgical field is adjusted to create more space around the vein."
2509.124,2537.079,"The surgeon identifies the gonadal vein descending and the renal vein in the surgical field. On the medial side of the adrenal gland, lymphatic tissue is visible, and gentle downward pressure is applied to enhance exposure."
2537.579,2567.461,"The surgeon identifies the adrenal vein, noting its length is greater than expected based on preoperative imaging. The surgeon assesses the possibility of accessing beneath the vein."
2684.572,2748.029,"The surgeon identifies the adrenal vein, noting the presence of adhesions along its path. The vein is carefully manipulated, with attention to a small branch visible nearby. The surgeon exercises caution due to the potential presence of other large vessels that could lead to hypertension during the procedure."
2748.529,2817.809,"The surgeon applies Hemlock clips to secure vessels near the renal wing, adjusting the orientation of the clips with the belly facing upwards."
2818.309,2862.478,"The surgeon observes a large renal vein without any visible bifurcation, noting the absence of branching in the vein structure."
2862.978,2896.531,"The surgeon begins to separate the adrenal gland from the upper pole of the kidney, identifying a renal artery branch visible in the surgical field."
2897.031,2937.809,"The surgeon encounters difficulty maneuvering the scissors near the splenic artery, which is visually close to the surgical field."
2938.309,2989.875,"The surgeon identifies the upper pole of the kidney and begins to tackle the adrenal gland from this side, searching for a suitable dissection plane to proceed with the adrenalectomy."
2990.375,3067.279,"The surgeon identifies the kidney and begins mobilizing the perirenal fat along with the adrenal gland, ensuring a safe distance from the mass. The fat appears sticky during manipulation."
3067.779,3151.855,"The surgeon identifies small bleeders within the fat between the kidney and adrenal gland, using clips or cautery to manage them. The upper part of the kidney is visible, with adhesions and a potential vessel present."
3152.355,3198.345,"The surgeon identifies the renal vein and works to release the mass from its superior aspect, which is in close proximity. A small clip is applied below the bipolar instrument to secure the area."
3237.325,3269.046,"The surgeon identifies the renal artery, visually confirming its location within the surgical field."
3269.546,3309.141,"The surgeon identifies a branch of the renal artery extending towards the adrenal gland, noting its proximity to the surgical field. The team discusses the availability of small or medium clips for securing vessels."
3372.163,3424.218,"The surgeon applies a clip to a branch near the renal artery using a clip-applier, followed by suction to clear the area."
3440.919,3497.239,"The surgeon attempts to reach the psoas muscle to confirm access to the posterior surface, navigating the complex vascular anatomy near the adrenal gland. A branch of the renal artery is visible, and a large renal vein has been clipped."
3497.739,3545.989,"The surgeon reaches the surface of the kidney and performs further dissection in the area, requesting assistance to gently lift the screen for better visibility."
3608.451,3641.818,"The surgeon mobilizes the inferior and medial aspects of the adrenal gland, preparing to isolate it from surrounding tissues."
3641.938,3704.446,"The surgeon identifies small arteries around the adrenal gland, applying clips to prevent bleeding. The adrenal gland is carefully maneuvered to respect surrounding vascular structures, ensuring minimal disruption."
3762.891,3788.882,"The surgeon identifies small vessels near the adrenal gland and applies a medium clip to secure them, demonstrating a strategic approach by addressing easier sections before moving to more challenging areas."
3885.765,3937.83,"The surgeon identifies small lymphatic and vascular structures near the adrenal gland, which require careful management to prevent complications. The dissection progresses towards the psoas muscle, with the surgeon cutting through the surrounding fat tissue."
3938.311,4001.626,"The surgeon carefully navigates around large vessels from the side abdominal wall, identifying lymphatics near the adrenal gland. The artery and vein are visible extending from the Achilles side to the adrenal side, with consideration given to preserving these structures."
4002.126,4072.521,"The surgeon attempts to use the fourth arm of the robotic system but finds it obstructive. They proceed with caution due to the presence of vessels near the pancreas, preparing the site and applying a medium-sized clip."
4073.021,4118.215,"The surgeon identifies large vessels in the surgical field and prepares to secure them using two large clips, placing one above and one below the vessels."
4164.703,4198.749,"The surgeon approaches from the top and carefully maneuvers downwards, handling the vessels with precision. Additional adjustments are made to ensure the vessels are adequately managed, indicating the need for further intervention due to their size."
4199.249,4233.881,"The surgeon inspects the lateral side of the adrenal gland, which appears clean and free from surrounding tissue."
4279.999,4300.797,"The surgeon uses a suction device to clear the surgical field, removing fluids and debris for better visibility."
4301.297,4358.103,"The surgeon identifies medium-sized vessels in the surgical field and requests a clip to secure them, followed by suction to clear the area."
4412.293,4450.21,"The surgeon follows the contours of the truss muscle, while suction is used to maintain a clear view by cleaning the lens."
4450.59,4498.281,"The surgeon identifies a small vessel and uses cautery to prevent bleeding, ensuring no residual bleeding is present. A larger vessel is also noted, and the surgeon prepares to address it."
4513.034,4561.879,"The surgeon identifies the spleen and the splenic artery, noting minimal blood loss in the surgical field."
4600.967,4673.587,"The assistant carefully lifts the rib cage slightly, ensuring the tip of the instrument does not poke the spleen, while the surgeon adjusts the position for better access."
4674.087,4714.687,"The surgeon identifies a tough bleeder from the side and prepares to address it, with an assistant positioned directly in front of the surgical field."
4832.473,4877.181,"The surgeon identifies multiple vascular structures, including a large artery near the adrenal gland. One artery is preserved for later assessment to confirm its connection to the adrenal gland, while another artery is taken."
4938.206,4985.323,"The surgeon identifies the renal artery and renal vein, pointing them out in the surgical field."
4985.823,5058.075,"The surgeon identifies the healthy part of the adrenal gland, considering the possibility of a partial adrenalectomy. The spleen is lifted slightly to improve access, although the scissors are moving with difficulty due to spatial constraints."
