start,end,text
51.877,60.244,"Images display the altered contour of the patient's abdominal wall due to the presence of a large, left-sided, incarcerated Spigelian hernia."
88.817,96.941,"The surgeon establishes pneumoperitoneum using a Veress needle in the left upper quadrant, followed by the insertion of a 12mm trocar with the OptiView technique."
97.441,103.503,"An eight millimeter trocar is placed in the right upper quadrant, followed by the placement of two additional trocars in the right mid abdomen."
104.003,113.527,"The surgeon performs an extended lysis of adhesions to expose the left Spigalian hernia defect, carefully separating and clearing adhesions to improve visibility of the anatomical area."
114.027,118.428,"The sigmoid colon is visibly adherent to the hernia sac, preventing easy reduction of the herniated tissue."
118.928,121.889,"The surgeon performs a transabdominal preperitoneal repair, accessing the abdominal cavity to address the left-sided Spigalian hernia."
122.389,128.15,"The surgeon incises the peritoneum in the left lower quadrant, entering the preperitoneal plane to continue the surgical repair."
128.65,143.892,The surgeon divides the preperitoneal attachments of the hernia sac and successfully reduces the entire hernia sac.
144.392,148.229,A large abdominal aortic aneurysm is visibly pulsating in the foreground of the surgical field.
161.592,170.994,"An assistant port is used to retract the redundant hernia sac and its contents, facilitating the division of the most ventral attachments within the surgical field."
171.494,189.367,"The surgeon develops the pre-peritoneal space, expanding it to accommodate the anticipated size of the mesh implant."
189.867,201.532,"The surgeon carefully dissects the preperitoneal space, ensuring the identification and protection of the spermatic cord and inferior epigastric vessels."
202.032,226.972,"Following the partial closure of the defect with an O V-lock suture, the surgeon makes a stab incision at the center of the defect. A seven French flat JP drain is then placed in the space previously occupied by the hernia sac, situated between the external and internal oblique muscles."
227.472,230.195,The surgical defect is measured to be three by five centimeters.
230.695,243.665,The surgeon completes the transverse closure of the defect using an OV-lock suture. A fifteen-centimeter circular piece of Ventralite ST echo mesh is selected and prepared to reinforce the repair.
244.165,250.193,"The surgeon introduces and unrolls the Ventralite ST echo mesh into the preperitoneal space. A suture passer is used to pull up on the central cord of the mesh, positioning it for reinforcement of the defect."
250.693,259.544,"The surgeon inflates the structural mesh balloon, expanding the preperitoneal space to accommodate the mesh circumferentially."
260.044,264.019,"The surgeon uses TuoVigril sutures to secure the mesh in multiple locations, ensuring it is firmly anchored within the preperitoneal space."
264.519,280.244,"The surgeon carefully places sutures, avoiding the triangle of pain lateral to the spermatic cord, and ensures the sutures follow the anticipated trajectory of the nerves without impinging on them."
280.744,285.986,"The surgeon removes the positioning balloon from the surgical site, revealing the underlying mesh and repaired area."
286.486,296.345,"The mesh is positioned flat against the abdominal wall, with no visible redundancies or folds, indicating proper placement."
296.845,317.94,"The surgeon closes the peritoneal flap using a V-lock suture, ensuring the flap is securely sealed over the mesh."
318.44,326.676,"The surgeon over-sews any peritoneal defects in the closure, completing the repair of the surgical site."
