start,end,text
32.58,41.506,"A trocar is placed at the umbilicus for diagnostic laparoscopy, followed by the placement of three robotic operating arms at the same level."
42.006,48.69,"An airflow device is positioned along the anterior axillary line, cephalad at the umbilicus near the costal margin, as part of the surgical setup."
49.19,54.694,"The surgeon uses a cut-down technique to place an applied port, completing the setup for the robotic-assisted pancreaticoduodenectomy."
55.194,62.121,"The surgeon positions a port caudal to the level of the umbilicus, between the umbilicus and the midclavicular line on the right side."
62.361,67.607,"An assistant works through one of the trocars, which is ultimately used for tissue extraction during the pancreaticoduodenectomy procedure."
68.107,75.793,"The surgeon begins the operation by taking down the falciform ligament, which is not routinely done unless it obstructs the surgical field."
75.953,80.593,"The surgeon uses a reinforcement material to cover the biliary and pancreatic anastomosis, ensuring secure closure and protection of these surgical connections."
80.693,89.135,"The surgeon opens the gastro-hepatic omentum in a stellate fashion and carries the dissection down to the common hepatic artery, where an enlarged lymph node is identified and removed."
89.635,104.017,"The surgeon clips the right gastric artery twice and divides it, followed by clipping and dividing the gastroduodenal artery. Subsequently, a Coker maneuver is performed to mobilize the duodenum."
104.517,111.04,"The surgeon initiates the Coker maneuver near the bile duct, revealing the inferior vena cava in the surgical field."
111.54,124.28,"The surgeon frees the duodenum from the inferior vena cava, proceeding in a caudal direction, until the left renal vein is clearly visualized."
124.78,136.734,"The surgeon dissects and takes down the ligament of Treitz, advancing the jejunum under the root of the mesentery before dividing the jejunum."
137.234,151.327,"The surgeon opens the gastrocolic omentum and lifts the stomach ventrally. Dissection proceeds through the gastroepiploic artery and vein, followed by division of the duodenum."
151.827,173.392,"The surgeon dissects along the inferior border of the pancreas to identify the pyramesenteric vein. The pancreas is lifted off the pyramesenteric vein and portal vein, with division performed using a hook cautery, vessel sealer, or scissors with energy."
178.715,197.984,"The surgeon opens the mesentery for the transsection of the jejunum, dividing the mesentery as the dissection progresses toward the area where the superior mesenteric vein passes beneath the pancreas."
198.484,215.476,"The surgeon performs dissection along the superior mesenteric artery, skeletonizing it, while mobilizing the portal vein away from the artery. This creates a clean surgical field for lymphadenectomy."
215.976,229.02,"The surgeon continues the dissection to free the gallbladder, carefully dissecting across the common hepatic duct to remove the gallbladder en bloc with the specimen."
229.52,252.328,"The surgeon clips the cystic artery twice proximally and once distally, followed by clipping the cystic duct, securing these structures for subsequent removal."
252.828,268.591,"The surgeon continues dissection along the common hepatic duct, identifying and clipping a notably large branch from the portal vein."
269.091,272.812,"A stent is visible within the bile duct, indicating its placement for maintaining ductal patency during the procedure."
273.312,279.405,"The surgeon places the specimen into an extraction bag and removes it through the port site, completing the specimen retrieval process."
279.905,293.017,"After the specimen is removed and sent to pathology, the surgeon advances the bowel under the root of the mesentery and constructs the bilioenteric anastomosis using a running 3-0 B-lock suture."
293.517,331.479,"The surgeon ties a knot at the nine o'clock position on the bile duct, running a suture from inside out of the duct to outside in on the bowel. The suture is carried over to the three o'clock position on the duct, and another suture is started at nine o'clock, going outside in on the duct and inside out on the bowel. The sutures are positioned across from each other and tied, forming a bilioenteric anastomosis."
331.979,386.904,"The surgeon constructs a two-layer pancreatic jejunosomy, bringing the full thickness of the pancreas into two seromuscular purchases of the bowel, creating a small valley for the gland. A duct-to-mucosa anastomosis is formed using interrupted sutures, with four or five sutures placed outside-in on the bowel and inside-out on the duct, tied as they are placed. The second layer is completed along the ventral aspect of the pancreas using a running V-lock suture."
387.404,415.253,"The surgeon completes the anastomosis between the pancreatic duct and the enterotomy, running the ventral layer of the two-layer anastomosis using three OV-lock sutures. The corner sutures, connecting the posterior and ventral layers, are tied securely."
415.753,429.919,"The surgeon uses sutures to invert the staple line on the small bowel, followed by reconstructing the ligament of Treitz with several interrupted V-lock sutures."
430.419,495.063,"The surgeon identifies the small bowel and the afferent and efferent limbs for the duodenal jejunostomy. The small bowel and duodenum are opened, and the staple line on the duodenum is excised during the anastomosis. The posterior layer is constructed with sutures placed inside out on the duodenum and outside in on the small bowel, running until reaching three o'clock on the duodenum. The staple line is removed, ensuring the antrum appears pink. The ventral layer reconstruction is a one-layer anastomosis, starting at nine o'clock and sewing to three o'clock on the duodenum, with sutures tied across from each other. A drain is placed under the bile duct, and the anastomosis is wrapped with the falciform ligament."
