start,end,text
13.615,19.738,"The surgeon safely inserts an optical trocar into the abdominal cavity, cleans the scope, and proceeds to place additional trocars for the robotic sleeve gastrectomy."
20.238,23.07,"The DaVinci robotic system is brought into position for docking, preparing for the robotic sleeve gastrectomy procedure."
23.57,27.494,The surgeon sits at the console to begin the robotic sleeve gastrectomy procedure using the DaVinci system.
36.581,39.523,"The robotic system is positioned to begin the sleeve gastrectomy procedure, with the surgical team preparing to manipulate the robotic arms for precise dissection and tissue removal."
39.903,42.085,The surgeon positions a 36 French bougie inside the stomach to guide the sleeve gastrectomy procedure.
42.105,47.749,"The surgeon uses a bipolar vessel sealer to access the lesser sac, preparing the area for further dissection during the robotic sleeve gastrectomy."
48.249,58.98,"The surgeon begins the robotic sleeve gastrectomy by creating a window at the inferior portion of the stomach, preparing to work distally along the gastric tissue."
59.48,66.48,"The surgeon continues the dissection, advancing between four and six centimeters from the pylorus, using robotic instruments to precisely manipulate the tissue."
68.52,70.001,"The surgeon points out the pylorus, indicating its location in the surgical field."
71.941,74.322,"The surgeon positions the dissection approximately six centimeters from the pylorus, focusing on the inferior portion of the stomach."
74.822,77.823,The surgeon identifies the insessura as the main anatomical landmark during the gastrectomy procedure.
91.606,97.489,The surgeon uses a bipolar vessel sealer to dissect the greater omentum from the greater curvature of the stomach.
97.989,101.671,"The surgeon mobilizes a section of the stomach in preparation for creating the sleeve, ensuring adequate separation from surrounding tissues."
114.217,117.398,"The surgeon continues to mobilize the stomach, ensuring complete separation from surrounding structures to facilitate the gastrectomy procedure."
122.442,130.091,"The surgeon continues to mobilize the stomach, ensuring thorough separation of tissues to prevent the formation of a posterior pouch at the top of the stomach."
130.111,136.879,"The surgeon exposes the left diaphragm, improving visibility beyond the short gastric vessels."
137.379,140.262,"The surgeon has fully exposed the left diaphragm, revealing its anatomical structure adjacent to the mobilized stomach."
140.562,142.8,"The surgeon has completed the dissection of the posterior attachments of the stomach, ensuring full mobilization of the organ."
145.422,149.305,"The surgeon positions the bougie along the stomach to guide the creation of the gastric sleeve, preparing for the gastrectomy procedure."
149.725,152.968,"The surgeon begins stapling the stomach from the selected spot, moving upwards, with the left diaphragm fully exposed in the background."
152.988,155.63,"The surgeon prepares to use a blue staple load, likely positioning it for stapling along the stomach or sleeve during the gastrectomy procedure."
158.533,167.921,"The surgeon clamps the stapler onto the stomach tissue, allowing time for edema to reduce before engaging the stapler to create a staple line."
168.421,175.134,"The surgeon prepares to complete the sleeve gastrectomy using blue stapler loads, ensuring the bougie is in position to guide the stapling process."
175.634,179.919,The surgeon applies compression to the tissue before firing the stapler to secure the staple line.
190.609,196.424,"The surgeon uses a white stapler at the top of the stomach, ensuring no excess pouching is left in the tissue."
196.924,198.324,"The surgeon approaches the diaphragm during the gastrectomy procedure, indicating proximity to this anatomical structure."
198.384,201.205,"The surgeon observes the formation of the gastric sleeve, noting its well-formed appearance after stapling."
207.006,209.007,"The surgeon exposes the hiatus, the opening in the diaphragm through which the esophagus passes, during the gastrectomy procedure."
211.267,212.788,"The surgeon carefully trims the gastric tissue to avoid leaving excess tissue, known as a 'dog ear,' ensuring a smooth and even formation of the sleeve during the gastrectomy."
227.131,231.312,The surgical team adjusts the operating table to a fifteen-degree angle in preparation for performing a leak test.
232.812,233.832,"The surgeon removes the bougie from the gastric sleeve, ensuring the sleeve maintains its shape without excess tissue or 'dog ear' formation."
236.253,239.613,The surgeon applies hemostatic measures at the top of the surgical site to control minor bleeding.
240.433,242.914,"The surgeon applies fibrin sealant to the surgical site, ensuring coverage over the area to promote hemostasis and tissue adhesion."
255.456,260.618,The surgeon removes the trocar and uses a Kelly clamp to dilate the hole created by the trocar insertion.
