start,end,text
0.723,3.984,"Hello, everyone. This is Roxanne Liu from Oakland, California."
0.723,3.984,"Hello, everyone. This is Roxanne Liu from Oakland, California."
4.484,10.187,This video is a demonstration of the precision of robotic surgery.
4.484,10.187,This video is a demonstration of the precision of robotic surgery.
10.687,17.27,"The video shows a patient with a small left direct inguinal hernia, with the patient's thin physique clearly visible."
10.687,17.27,"The video shows a patient with a small left direct inguinal hernia, highlighting the patient's extremely thin physique."
17.29,28.534,"I find that in these patients who are very thin with very small hernias, there is essentially no room for error."
17.29,28.534,"I find that in these patients who are very thin with very small hernias, there is essentially no room for error."
29.034,51.254,"The surgeon carefully handles the extremely thin peritoneum to avoid tearing, as there is no redundant tissue available to patch any defects."
29.034,37.722,"The surgeon carefully manipulates the extremely thin peritoneum, using gentle techniques to avoid tearing the delicate tissue."
38.222,51.254,"And once the peritoneum is torn, there isn't any redundant tissue to patch the defect or make up for the loss of the peritoneum."
51.754,56.818,So this surgery can be quite challenging for me laparoscopically.
51.754,56.818,So this surgery can be quite challenging for me laparoscopically.
57.318,78.072,"The surgeon enters the retro rectus space, carefully developing tissue planes in a thin patient with minimal fat, relying on areolar tissue for cushioning."
57.318,78.072,"The surgeon enters the retrorectus space, navigating the challenging tissue planes with minimal fat, relying on areolar tissue for cushioning."
78.572,94.797,"I find that in patients who are very thin with very thin peritoneum, it's usually a little better to go into the retroactive space so that the posterior layer is much more robust since it contains the attenuated posterior rectus sheath and the peritoneum."
78.572,94.797,"I find that in patients who are very thin with very thin peritoneum, it's usually a little better to go into the retroactive space so that the posterior layer is much more robust since it contains the attenuated posterior rectus sheath and the peritoneum."
95.297,109.3,Here I'm just going down the natural areolar plane and this is just beautiful anatomy. This is why I love doing inguinal hernias. So I don't like getting into holes. I'm going to work broadly.
95.297,105.708,"The surgeon navigates down the natural areolar plane, revealing the intricate anatomy associated with inguinal hernias."
106.208,114.401,"The surgeon uses broad dissection techniques with good retraction to follow the areolar tissue planes, avoiding entry into holes within the surgical field."
109.8,121.903,"The surgeon uses good retraction to follow the areolar tissue, staying on the peritoneum. As the procedure progresses, the peritoneum becomes visibly thin, requiring careful handling."
114.901,121.903,"The surgeon proceeds along the peritoneum, which becomes visibly thin as the dissection continues."
122.403,139.965,"Under ten times magnification, the surgeon precisely cauterizes tiny blood vessels to maintain hemostasis, allowing clear visualization of the correct anatomical plane during the small bowel resection."
122.403,130.985,"And remember this is under ten times magnification, so we're working under extreme precision."
131.485,139.965,"The surgeon cauterizes tiny blood vessels to maintain hemostasis, allowing for clear visualization of the correct anatomical plane."
140.465,157.67,"The surgeon navigates a narrow gap between the peritoneum and the transversus abdominis muscle, working within a small band of areolar tissue."
140.465,157.67,"The surgeon navigates a narrow gap between the peritoneum and the transversus abdominis muscle, working within a small band of areolar tissue."
158.17,167.656,"The surgeon approaches the internal ring, carefully avoiding injury to the inferior epigastric vessels, which are visible in the surgical field."
158.17,167.656,"The surgeon approaches the internal ring, carefully maneuvering to avoid injury to the inferior epigastric vessels, with visible attention to maintaining a safe distance from these structures."
168.156,183.505,"The surgeon navigates the thin peritoneum, carefully avoiding creating holes, while approaching the space of Retzius. The visual field shows the option to proceed either behind or in front of a visible patch of fat."
168.156,175.881,"The surgeon carefully navigates the thin peritoneum, taking precautions to avoid creating a perforation while maintaining the integrity of the tissue."
176.381,191.182,"The surgeon approaches the space of Retzius, choosing to navigate anterior to a visible patch of fat to facilitate direct access to Cooper's ligament."
183.565,199.951,"The surgeon navigates anteriorly through the areolar tissue to approach Cooper's ligament, preparing to cross the midline for mesh placement."
191.682,199.951,"The surgeon navigates through the areolar tissue, preparing to cross the midline to position the mesh across it."
200.451,220.753,"The surgeon identifies the pubic symphysis and crosses the midline towards the right groin, working broadly to avoid confined spaces. The left hand is used for retraction to carefully navigate around critical structures in the area."
200.451,211.417,"The surgeon identifies the pubic symphysis and crosses the midline towards the right groin, opting to work broadly rather than in a confined space."
211.917,224.656,"The surgeon carefully navigates around critical structures, using the left hand for retraction, and confirms the presence of a direct hernia in the surgical field."
221.253,235.624,"And just confirm that there's a direct hernia. The indentation is not very deep, but there's actually, on physical exam, the patient does have a small inguinal hernia."
224.876,235.624,"The indentation is not very deep, but there's actually, on physical exam, the patient does have a small inguinal hernia."
236.124,248.072,The surgeon identifies a branch off the inferior epigastric artery and carefully maneuvers to preserve it while working around the surrounding fat tissue.
236.124,248.072,"The surgeon identifies a branch of the inferior epigastric artery and carefully preserves it while maneuvering around a patch of fat, avoiding injury to the large vascular structure."
248.572,261.935,"The surgeon carefully pulls tissue away from the underlying critical structures, including the vertebrae gastrics and the external iliac vein, ensuring these areas are not damaged during the procedure."
248.572,261.935,"The surgeon carefully retracts tissue away from underlying critical structures, including the vertebrae gastrics and the external iliac vein, ensuring these areas are not disturbed during the procedure."
262.435,277.64,"The surgeon carefully dissects through the areolar tissue, maintaining hemostasis to clearly visualize the anatomical structures in the surgical field."
262.435,277.64,"The surgeon carefully dissects tissue while maintaining hemostasis, revealing the detailed anatomy of the surgical area."
278.14,290.31,"The surgeon carefully dissects and takes down the peritoneum at the internal ring, revealing a small indentation. The intra-abdominal view confirms the anatomical location and structure."
278.14,290.31,"The surgeon carefully dissects and takes down the peritoneum at the internal ring, revealing a small indentation. The intra-abdominal view confirms the presence of this anatomical feature."
290.33,307.148,"The surgeon uses effective retraction to facilitate precise dissection of the tissue, ensuring clear visibility and careful manipulation of anatomical structures."
290.33,313.692,"The surgeon uses good retraction to aid in precise dissection, revealing a tubular structure unexpectedly during the procedure."
307.648,328.097,"The surgeon identifies a tubular structure emerging laterally from the internal ring, noting the unexpected lateral travel of the patient's vas. The transverse salus sling is preserved during the procedure."
314.192,328.097,The surgeon observes the patient's vas deferens traveling laterally as it emerges from the internal ring and successfully preserves the transverse salus sling during the procedure.
328.597,347.955,"The surgeon carefully dissects along the peritoneum, preserving the transverse salus sling despite the lateral position of the vas. The dissection remains precise, maintaining close proximity to the peritoneum."
328.597,347.955,"The surgeon carefully dissects along the peritoneum, preserving the transverse salus sling despite the lateral position of the vas deferens, maintaining close proximity to the peritoneum throughout the procedure."
348.455,362.963,"The surgeon carefully dissects in front of the external iliac artery, with the external iliac vein visible medial to the artery."
348.455,362.963,"The surgeon dissects in front of the external iliac artery, with the external iliac vein visible medial to the artery."
363.463,387.556,"The surgeon carefully dissects along the thin peritoneum, with the bowel positioned closely against it. Cautery is used to maintain hemostasis while avoiding thermal injury to the bowel due to the minimal margin for error."
363.463,387.556,"The surgeon carefully dissects along the thin peritoneum, using cautery to maintain hemostasis while avoiding thermal injury to the bowel, which is positioned closely against the peritoneum."
388.056,412.84,"The surgeon uses cautery to coagulate small vessels in the surgical field to prevent bleeding, ensuring a clear view for dissection. The tissue remains unstained by blood, facilitating precise dissection."
388.056,412.84,"The surgeon uses cautery to coagulate small vessels to prevent bleeding, ensuring a clear surgical field. The area remains unstained by blood, facilitating easier dissection."
413.34,448.089,"The surgeon maintains a fascial layer on the posterior tissue to prevent mesh contact with bare nerves. A notable gap is visible between the vas deferens and the external iliac artery. The transverse salus sling is being pulled, and the dissection continues into the space of Retzius, following the areolar tissue into the retropubic space."
413.34,427.495,The surgeon carefully maintains a fascial layer on the posterior tissue to prevent the mesh from directly contacting exposed nerves.
427.995,441.145,"The surgeon observes a significant gap between the vas deferens and the external iliac artery, which is unusual. The transverse salus sling is being pulled to maintain tension during the dissection."
441.645,458.965,"The surgeon navigates back into the space of Retzius, following the areolar tissue resembling cotton candy down into the retropubic space, aiming to reach two centimeters deep to ensure the mesh sits vertically."
448.129,471.551,"The surgeon aims to position the mesh vertically by dissecting two centimeters deep. A large vein is visible anterior to the prostate, along with the pelvic floor muscle."
459.465,478.214,"The video shows a detailed view of the surgical field with a large vein located anterior to the prostate, the pelvic floor muscle, and a prominent coronamortis artery."
472.051,500.6,"The surgeon identifies a large coronamortis artery and continues to peel back the peritoneum and bladder, creating a clear landing zone for the placement of an extra-large 3D Max mesh."
478.714,500.6,The surgeon carefully peels back the peritoneum and bladder to create a clear landing zone for the placement of an extra-large 3D Max mesh.
501.1,539.985,"The surgeon encounters difficulty as the bowel is positioned closely against the peritoneum. A small vessel is cauterized, but bleeding occurs, staining the tissue in the dissection area, complicating the procedure."
501.1,520.825,"The surgeon encounters difficulty in dissection as the bowel is closely adhered to the peritoneum. A small vessel is cauterized, and over time, blood begins to stain the tissue at the dissection site, complicating the procedure."
521.325,539.985,"The surgeon observes increased bleeding from a small vessel, indicating it may have been inadvertently torn during the procedure."
540.485,579.209,"The surgeon carefully pulls the bladder away from the side wall and external iliac vein, creating sufficient space for the mesh to sit vertically without the bladder underneath it."
540.485,560.999,"The surgeon carefully pulls tissue away from the external iliac vein and attempts to separate the bladder from the side wall, ensuring these critical structures are not damaged during the procedure."
561.499,579.209,"The surgeon develops space for the mesh to sit vertically, ensuring the bladder is peeled away from the external iliac vein to prevent it from sitting underneath the mesh."
579.709,616.393,"The surgeon carefully pulls tissue away to avoid damaging the coronamortis artery and obturator nerve, completing the dissection. The mesh is positioned to emerge from the pelvis, resting on a prepared landing zone without peritoneum beneath it."
579.709,595.705,"The surgeon carefully pulls tissue away to avoid damaging the coronamortis and the obturator nerve, indicating that the dissection is nearing completion."
595.725,616.393,"The surgeon envisions the placement of the mesh emerging from the pelvis, positioned on a clear landing zone with no peritoneum visible beneath it."
616.893,652.917,"The surgeon lifts the peritoneum, inadvertently pinching a small section of bowel, while using a fenestrated bipolar device. The area becomes more challenging to dissect due to bleeding, but the surgeon finds a new plane once the bleeding stops. Good tension applied with the left hand aids in creating distance between the peritoneum and the underlying structures."
616.893,630.39,"The surgeon lifts the peritoneum and inadvertently pinches a small section of bowel, using a fenestrated bipolar instrument to manage the situation."
630.89,652.917,"The surgeon encounters a challenging dissection area due to bleeding but identifies a new plane once the bleeding stops. Using the left hand to apply tension, the surgeon creates distance between the peritoneum and the structures on the far side."
653.417,719.633,"The surgeon uses short bursts of cautery to further dissect the vas deferens from the peritoneum, ensuring the mesh can cross the midline. The dissection progresses medially to accommodate the tall dimensions of the extra-large mesh."
653.417,671.801,"The surgeon uses short, quick bursts of cautery to further dissect and separate the vas from surrounding tissues."
672.301,719.633,"The surgeon completes the dissection, ensuring the vas deferens is separated from the peritoneum. The mesh is positioned to cross the midline, with attention to both the inferior posterior and upper parts of the mesh."
720.133,838.284,"The surgeon examines the surgical field, identifying the arterial coronamortis and noting its proximity to the obturator space. The vas deferens and testicular vessels are observed laterally, with the transversalis sling pulling them. The surgeon inspects the complex tissue layers, identifying the genital branch of the genitofemoral nerve and searching for the lateral femoral cutaneous and femoral branches. The testicular vessel bundle is explored, revealing the main vein, artery, and possibly a nerve. The external iliac artery is also visible, with the vas and testicular vessels running into the internal ring."
720.133,742.617,"The surgeon examines the anatomical structures, focusing on the arterial coronamortis, a vessel located near the obturator space, highlighting its importance to avoid injury during the procedure."
743.117,786.922,"The surgeon observes the lateral vas deferens and tessitra vessels, which are pulled laterally by the transversator sling, yet remain attached to medial fatty tissue. The complex anatomy includes the probable genital branch of the genitofemoral nerve, while the lateral femoral cutaneous and femoral branches are being searched for but not clearly identified."
787.422,817.326,"The surgeon performs additional dissection to ensure adequate space for the corner of the mesh. Within the bundle of testicular vessels, various small structures are visible, including the main vein and artery medially, along with other structures that may include a nerve."
817.826,838.284,"The external iliac artery is visible, with the transverse salus sling tugging on it. The vas deferens and testicular vessels are observed running within the sling into the internal ring."
