start,end,text
22.937,46.959,The surgeon makes an incision on the peritoneum just above the deep ring in a case of indirect inguinal hernia.
69.565,84.945,"The surgeon divides the layers of the transversalis fascia, creating the preperitoneal or extraperitoneal space."
85.445,100.733,"The surgeon uses electrocautery, indicated by a green line on the right-hand side of the screen, to divide loose areolar tissue."
101.233,114.698,"The surgeon maintains a precise dissection plane using a small energy source, ensuring controlled division of tissue layers."
123.147,137.632,"The surgeon creates a dissection plane using sharp scissors or electrocautery, focusing on precise division rather than blunt dissection."
138.132,157.032,"The surgeon creates the lateral space first, followed by the medial space, before proceeding to dissect the central zone, visually organizing the surgical field into distinct areas for dissection."
157.532,178.911,"The surgical field displays an indirect hernia with the hernia sac extending into the scrotum through the deep ring. An arrow on the screen points towards the inferior epigastric vessels, located at the twelve o'clock position."
179.411,197.756,"The surgeon performs medial dissection using a robotic approach, emphasizing horizontal dissection techniques rather than vertical tunneling."
198.256,218.734,"The surgeon approaches the Cooper's ligament area, performing dissection to expose the pubic region from within."
219.234,236.455,"The surgeon performs sharp dissection using short bursts of cautery, creating clear tissue planes with minimal blood loss."
253.551,257.633,"The surgeon displays anatomical landmarks relevant to the indirect hernia repair, including the Cooper's ligament area and the inferior epigastric vessels, visible at the twelve o'clock position on the screen."
258.133,267.377,"The surgeon approaches the lateral pelvic wall, where fascia and fat visibly cover the underlying vessels, preparing to address this area last in the dissection sequence."
267.877,289.48,"The surgeon liberates the sac from the cord structures, carefully pushing down the vas deferens, surrounding vessels, pampiniform plexus, and gonadal vessels."
289.98,299.824,"The surgeon selects an area midway between the point where the sac enters the deep ring and the opening in the peritoneum, preparing for further dissection."
299.864,309.148,"The surgeon begins dissecting directly onto the sac, progressively exposing and isolating it from surrounding tissues until the sac is completely visible and separated."
309.648,326.501,"The surgeon identifies essential anatomical structures, focusing on the vas deferens while avoiding dissection into the scrotum, choosing to leave the distal part of the sac intact."
327.001,359.079,"The surgeon divides the hernia sac, leaving the distal part intact with the patient's body, and proceeds to dissect the entire sac at the peritoneal reflection."
359.579,368.506,"The surgeon approaches the peritoneal reflection, where the defect in the peritoneum is visible, marking the initiation point of the hernia."
369.006,390.919,"The surgeon uses electrocautery with minimal charring visible on the tissue, applying extremely short bursts of current to achieve precise dissection."
391.419,407.27,The surgeon uses the left hand to apply traction while pointing towards the external iliac vein located medially. The fibro fatty tissue surrounding the vasculature is being dissected.
456.805,470.573,"The surgeon identifies femoral nodes within the femoral canal, opting not to dissect them, while continuing with the rest of the dissection procedure."
471.073,498.885,"The surgeon performs dissection above the obturator foramen, focusing on the lateral compartment. The presence of abundant adipose tissue is noted, which aids in preventing nerve injuries. No attempts are made to identify or visualize the nerves during this dissection."
499.385,516.653,"The surgeon measures the distance from the deep inguinal ring to the peritoneal reflection, ensuring it is at least seven to eight centimeters to prevent the mesh from folding when the patient walks."
538.383,563.489,"The surgeon makes an incision lower than the typical laparoscopic approach, utilizing the robotic platform to raise a superior flap. The dissection in the medial compartment is shown to be performed with ease."
563.989,595.367,"The surgeon points out small branches to the rectus abdominis muscle. A three-dimensional large mesh by Bard BD is placed over the surgical site, with the incision visible in the middle third of the screen."
628.684,673.848,"The surgeon places a mesh within the surgical field, assessing the need for further dissection. The dissection focuses on the triangle of doom, defined by the vas deferens medially, gonadal vessels laterally, and the reflected peritoneum forming the base. The iliac vessels are visible within the triangle."
674.348,700.973,"The surgeon adjusts the mesh at the lateral angle, ensuring it sits beautifully within the surgical space. The mesh configuration appears to facilitate adequate scar plate formation."
701.473,738.47,"The surgeon places a mesh in the groin area, ensuring it conforms to the anatomical shape with medial overlap. The mesh is evaluated for proper placement while distracting tissues are assessed."
759.197,786.633,"The surgeon dissects the opposite side, revealing the transversalis fascia with its two distinct layers. Visible sutures are used for fixation and closure of the peritoneum, demonstrating the sequential approach to dissection and closure."
787.133,829.725,"The surgeon performs sharp dissection to clear fibro-fatty tissue in the extraperitoneal space, creating a pouch while connecting both sides. The magnified view reveals small capillaries prominently."
854.59,877.809,"The surgeon strips the transversalis fascia from the peritoneum, leaving tissue towards the groin to protect the nerves. The deep ring aspect is cleared, revealing a small developing indirect hernia."
878.309,913.345,"The surgeon uses a robotic instrument to clear fat from the lateral pelvic wall, creating horizontal space for better access. The robotic approach requires careful spatial management to avoid deep tunnels, which can complicate dissection and bleeding control."
913.845,935.839,"The surgeon creates horizontal zones in the surgical field, revealing the medial attachments that require further clearance before connecting the mesh to the opposite side."
936.339,961.156,"The surgeon encounters fibro fatty tissue at the cupous ligament area, revealing a sliding fascia that requires removal. A small accessory obturator vessel is visible but does not hinder the dissection process."
1021.535,1039.603,"The surgeon performs dissection around the gonadal vessels, which are clearly visible in the surgical field."
1055.73,1074.76,"The surgeon identifies and displays anatomical landmarks while preparing the surgical bed for mesh placement. Using articulation, a superior flap is created, mirroring the technique used on the opposite side."
1075.26,1111.454,"The surgeon uses robotic instruments to divide the fascia transversalis, creating a flap. The dissection progresses medially to connect two compartments, reinforcing the groin area."
1111.954,1150.368,"The surgeon enters the opposite side groin through an aperture, performing dissection to connect two spaces and create a stable area with ridges for mesh placement. The dissection ensures the mesh will sit perfectly without movement, requiring a minimum extension of two to three centimeters."
1150.868,1182.467,The surgeon places a Bard 3D Max large soft mesh into the left groin area of a young patient with a small hernia. The mesh is inserted effortlessly into the prepared space.
1182.967,1236.125,"The surgeon pushes the mesh into the groin area, allowing it to conform to the anatomical shape. The mesh is positioned to meet the counterpart on the opposite side, preparing for suturing. Distraction forces are applied to the peritoneum, indicating additional lateral dissection is required for optimal mesh placement. The surgeon replaces the right-sided monopolar cautery scissor with a mega suture cut instrument, enhancing the view of the surgical field."
1236.625,1279.635,"The surgeon uses a needle holder with an integrated scissor to pass a suture through Cooper's ligament, performing ergonomic adjustments for optimal suturing technique in the groin area."
1280.135,1319.589,"The surgeon uses an instrument to pull out the extra thread, keeping the tail short for quick adjustments. The fixation is applied at the upper neurotic part of the muscle, avoiding the fleshy belly to minimize potential pain points."
1320.089,1337.256,"The surgeon places loose sutures to secure the mesh in position, ensuring it is oriented correctly without being watertight. The mesh is fixed on the opposite side to maintain its placement."
1337.756,1378.397,"The surgeon secures the middle end of the mesh with sutures that are not watertight, ensuring the mesh remains stable. The mesh provides lateral coverage in the groin area, with minimal medial overlap, suitable for the patient's bilateral indirect hernias."
1378.897,1425.015,"The surgeon applies a three-point fixation technique with two sutures medially and one laterally to secure the mesh. A barbed suture from Quill is used for the closure of the peritoneum, providing a snug fit."
1487.423,1549.364,"The surgeon repeats the suturing steps on the opposite side, employing backhand suturing techniques. The Quill suture is used, featuring a large loop at the end of the tail, facilitating easy feeding of the free end."
1549.864,1576.728,"The surgeon reaches the middle edge of the incision using a barbed suture with memory, taking a few more bites to complete the closure of the peritoneum."
1606.982,1637.735,"The surgeon closes the hernia sac and a small opening created during flap formation, using sutures to ensure all defects are closed. The needle is withdrawn, marking the completion of the surgery."
