start,end,text
6.901,11.844,"The surgeon completes a general exploration of the abdomen, with no visible evidence of mucin present."
6.901,11.844,"The surgeon completes a general exploration of the abdomen, revealing no visible evidence of mucin."
12.344,20.91,"The surgeon visually inspects the base of the appendix at its junction with the cecum, noting its normal appearance before proceeding with the appendectomy."
12.344,20.91,"The surgeon visually inspects the base of the appendix at its junction with the cecum, noting its normal appearance before proceeding with the appendectomy."
21.41,26.715,"The surgeon carefully maneuvers instruments around the mucocille of the appendix, avoiding direct contact to prevent rupture."
21.41,26.715,"The surgeon carefully maneuvers instruments to avoid direct contact with the mucocille of the appendix, minimizing the risk of rupture during the laparoscopic appendectomy."
27.215,36.559,The surgeon uses their left hand to grasp the mesentery for manipulation during the laparoscopic appendectomy procedure.
27.215,36.559,The surgeon uses their left hand to grasp the mesentery for manipulation during the laparoscopic appendectomy procedure.
37.059,50.585,"The surgeon carefully retracts the mesentery back to the base of the cecum, removing a portion of the mesentery from the cecum, taking more tissue than typically done in a standard appendectomy."
37.059,50.585,"The surgeon carefully dissects the mesentery back to the base of the cecum, removing additional mesentery tissue from the cecum compared to a standard appendectomy."
68.509,89.129,"The surgeon carefully approaches the appendix, ensuring distance from the ileocecal valve, and performs a partial cecectomy along with the removal of the appendix."
68.509,86.227,"The surgeon carefully approaches the area, ensuring distance from the ileocecal valve, and performs a partial cecectomy along with the removal of the appendix."
89.629,101.497,"The surgeon places the appendix into a specimen bag for removal, using an upsized trocar to safely extract it without rupture."
89.629,101.497,"The surgeon places the appendix into a specimen bag for removal, preparing to upsize the trocar to prevent rupture during extraction."
