start,end,text
81.594,91.959,"The surgeon begins the procedure by dividing the falciform ligament, extending the dissection up to the hepatic veins, which are exposed extrahepatically."
92.459,106.332,"The surgeon exposes the middle and left hepatic veins, along with the extrahepatic portion of the right hepatic vein, using robotic assistance."
106.832,116.096,The surgeon uses intraoperative liver ultrasound to visualize the hydatid cyst and its proximity to the middle hepatic vein.
116.596,125.597,"The surgeon marks the parenchymal transection plane on the liver, aiming to preserve the middle hepatic vein during the hepatectomy."
133.963,148.462,"Hypertonic saline-soaked gauze is applied over the liver cyst, demonstrating a precautionary measure in case of cyst rupture."
148.962,155.886,"The surgeon initiates inflow control by performing a cholecystectomy, identifying the cystic artery and cystic duct for ligation and removal."
156.386,169.536,"The surgeon clips the cystic artery and duct with Hem-o-lok clips after obtaining the critical view, then divides these structures. The gallbladder is carefully dissected from the cystic plate and removed from the patient."
170.036,181.763,"The surgeon exposes the right liver hilum, using the cystic duct to retract the bile duct medially, thereby revealing the inflow to the right liver."
182.263,187.607,"The surgeon circumferentially dissects and encircles the right hepatic artery, carefully separating it from surrounding tissues."
188.107,193.963,"The surgeon occludes the right hepatic artery with a bulldog clamp prior to its division, ensuring control over blood flow in the area."
194.463,201.945,"The surgeon uses intraoperative liver ultrasound with Doppler to assess the patency of the left hepatic artery, visualizing blood flow within the vessel."
202.445,212.747,"The surgeon clips and divides the right hepatic artery, revealing the underlying right portal vein."
213.247,216.573,"The surgeon circumferentially dissects the right portal vein, revealing its structure and surrounding tissue within the surgical field."
217.073,232.023,"The surgeon circumferentially dissects, clips, and divides branches to the caudate lobe and segment six, exposing and gaining control of the right portal vein."
232.523,239.462,"The bifurcation of the right and left portal veins is visualized prior to the division of the right portal vein, showing the anatomical junction between these major vascular structures."
239.962,248.587,The surgeon divides the right portal vein using a silk tie and secures it with three Hemlock clips before completing the division.
249.087,256.392,"The surgeon completes inflow control for the right hepatectomy by ensuring the right portal vein and right hepatic artery are clipped and divided, securing the vascular structures involved in the procedure."
256.892,264.396,"The surgeon encounters difficulty in fully mobilizing the right hemiliver due to the invasive hydatid cyst and its involvement with the diaphragm, which is visually evident in the surgical field."
264.896,268.308,"The surgeon divides the hepatorenal ligament, separating it from surrounding structures."
268.808,275.494,"The surgeon utilizes an interior approach to perform retrohepatic caval dissection, accessing the area behind the liver."
275.994,292.119,"The retrohepatic cava is exposed, and the surgeon circumferentially dissects the short hepatic branches, using hemlock clips for clipping or a robotic vessel sealer for dividing these vessels."
292.619,307.542,"The surgeon controls larger short hepatic vein branches using hemlock clips and divides them, while smaller hepatic vein branches are safely divided with the robotic vessel sealer."
308.042,318.36,"The surgeon places hypertonic saline-soaked gauze in the retroperitoneum, preparing for potential spillage of cystic contents."
318.86,332.127,"Endocyanin green is administered, highlighting the demarcation between the right and left hemi-livers. This visual cue is used to guide the completion of the planned parenchymal transection line."
332.627,337.751,"The surgeon begins the parenchymal transection using a laparoscopic CUSA device, visibly separating liver tissue along the planned transection line."
338.251,351.16,"The surgeon uses the laparoscopic CUSA to dissect intraparenchymal vascular and biliary structures, which are then clipped with hemlock clips or divided using the robotic vessel sealer."
351.66,364.145,"The bedside surgeon operates the laparoscopic CUSA device through the assist port, positioned adjacent to the robotic camera port."
364.645,375.296,"The surgeon performs a precise dissection between the echinococcal cyst and the middle hepatic vein, utilizing the laparoscopic CUSA for careful separation of these structures."
375.796,379.339,"The surgeon divides the right bile duct intraparenchymally, following the demarcation line established by the administration of endocyanin green."
379.839,393.692,"The surgeon encircles the hepatic duct bifurcation and uses an ICG cholangiogram to visually confirm its location, ensuring the confluence and left hepatic duct are not inadvertently injured."
394.192,404.352,"The surgeon applies three hemlock clips to the right bile duct and then divides it, completing the division of the right bile duct."
404.852,420.038,"The surgeon performs parenchymal transection along the lateral border of the retro-hepatic inferior vena cava, progressing until the right hepatic vein is visualized. The vein is then circumferentially dissected and controlled."
420.538,431.432,"The surgeon uses a robotic stapler to staple the right hepatic vein, completing the parenchymal transection."
431.932,448.575,"After the liver is divided, the surgeon places hypertonic saline-soaked gauze around the surgical field to mitigate the risk of cyst spillage during the diaphragm resection and liver mobilization."
449.075,461.73,Hypertonic saline-soaked gauze is placed around the liver in the retroperitoneum and along the cut surface of the left liver.
462.23,469.574,"The surgeon opens the diaphragm, revealing the right hemithorax and providing access to the thoracic cavity."
481.521,489.911,"The surgeon releases the diaphragm, allowing for the complete mobilization of the right liver, which is visibly freed from surrounding structures."
490.411,497.176,"The surgeon divides the right triangular ligament, a step that was previously not possible, facilitating further mobilization of the liver."
497.676,507.792,"The surgeon approaches and completes the resection of the posterior aspect of the diaphragm, with the right hemithorax exposed."
508.292,521.495,The hydatid cyst is visible at the base of the right lung. A small wedge resection of the right lung is performed using a robotic stapler.
521.995,528.117,"The surgeon completes the final resection of the en bloc specimen, visually confirming the removal of the targeted tissue."
528.617,535.702,"The surgeon places the specimen, with the cyst positioned first, into a large endobag and removes it through the fan and steel port."
536.202,545.53,"An ultrasound is performed, showing the patency of the left hepatic artery and left portal vein. The surgeon then begins the reconstruction of the diaphragm."
546.03,557.08,"The thoracic team performs an interrupted zero-ethabon suture reconstruction of the diaphragm, ensuring there is no tension in the repaired area."
557.58,563.382,"The completed diaphragm reconstruction is visible, showing the sutured area without tension."
563.882,569.945,"Pledgets are applied to the diaphragm during reconstruction to prevent tearing, ensuring the integrity of the tissue as sutures are placed."
