start,end,text
37.082,56.546,"The surgeon begins the procedure by inserting a trocar at Palmer's Point in the left upper quadrant, just beneath the rib cage. The camera port is placed laterally to provide a comprehensive view, followed by the placement of an eight-millimeter trocar in the left lower quadrant."
63.418,69.599,"The surgeon uses robotic scissors to perform dissection, with the instrument visibly maneuvering through the tissue layers."
75.181,86.965,"The surgeon applies traction and counter traction while manipulating tissues, carefully preserving the peritoneum without creating holes."
87.465,89.245,"The surgeon scores the edges of the fascia, creating visible incisions along the tissue to facilitate further manipulation."
141.084,144.807,"The surgeon cinches down the sutures gradually, visibly closing a large tissue defect."
144.827,147.028,"The surgical defect is visibly closed, with the tissue edges approximated smoothly."
147.528,159.352,"The surgeon uses the tips of the needle driver to advance the suture, minimizing direct handling of the suture itself."
167.395,175.738,"The surgeon re-approximates the defect and adds an additional row of sutures to close the repair, using a technique that involves careful placement and tightening of the sutures."
176.238,184.141,The assistant palpates the defect to ensure no fat or tissue is trapped before closure.
184.641,192.744,"The assistant carefully checks the suture placement to ensure that the skin is not inadvertently caught or back-walled, particularly in patients with thin tissue layers."
193.244,198.127,"The surgeon pulls and withdraws the suture using the needle driver, demonstrating a technique to advance the suture without excessive handling."
198.267,202.952,"The hernia defect is visibly closed, with measurements taken to ensure proper closure."
203.412,208.017,The surgeon prepares a custom-cut piece of polypropylene mesh for placement over the closed hernia defect.
212.882,215.124,"The surgeon creates a pocket in the tissue, ensuring it is just large enough to accommodate the custom-cut polypropylene mesh."
215.624,240.653,The surgeon uses a double-arm PDS suture to secure the polypropylene mesh in place over the closed hernia defect.
241.153,272.325,"The surgeon uses a double-arm suture to secure the mesh in place and re-approximate the peritoneum. The suture is applied around the mesh, and then tied to itself, with the second arm used to further re-approximate the peritoneum."
292.571,299.754,"A small defect is visible in the tissue, left behind after the creation of the pocket for the mesh."
300.254,308.338,"The surgeon re-approximates the peritoneum, addressing a portion of incarcerated omentum left behind."
308.378,325.667,"A small defect is visible with a portion of omentum dangling below. The surgeon uses this omentum to close the defect and cover the mesh completely, ensuring no contact with the uncoated mesh."
343.869,355.778,"The surgeon visually inspects the surgical site to confirm that the mesh is completely covered by peritoneum and omentum, ensuring the defect is closed and the hernia repair is complete."
