start,end,text
20.517,42.104,"The surgeon visually inspects the bowel, identifying and marking areas with visible strictures, potentially indicating diseased sections for future strictureplasty or resection."
22.891,27.376,"The surgeon runs the bowel, visually inspecting and marking areas that appear diseased, likely characterized by fibrous stenosis or other abnormalities."
27.416,28.497,"The surgeon identifies a visible stricture in the small bowel, characterized by a narrowed segment of the intestine."
28.538,31.582,"The surgeon marks both sides of the bowel stricture, preparing for a potential strictureplasty procedure."
32.082,34.674,The surgeon identifies another area of the bowel that appears diseased and marks it for potential intervention.
35.174,41.719,"The surgeon runs the bowel, visually inspecting it to assess areas for potential strictureplasties or resections, marking sections that appear diseased."
41.739,52.864,"The surgeon examines the colon and small intestine, which appear relatively normal, but notes a tight stricture at the ileocecal valve that was previously impassable by endoscopy."
42.604,61.574,"The surgeon observes the colon and small intestine, noting their relatively normal appearance. However, a tight stricture is identified at the ileocecal valve, which was previously inaccessible via endoscopy and confirmed by MRI findings. The surgical plan includes performing an ileocolic resection."
62.074,80.328,"The surgeon identifies a Meckel's diverticulum in the area of the Crohn's disease stricture. The mesentery is being mobilized adjacent to the strictures, with visible tissue manipulation."
62.111,68.617,The surgeon identifies a Meckel's diverticulum located near the area of the stricture caused by Crohn's disease in the small intestine.
77.204,80.362,"The surgeon is mobilizing the mesentery of the small intestine, carefully separating it from surrounding tissues to facilitate the resection."
80.828,101.378,"The surgeon mobilizes the Meckel's diverticulum to tent the ileocolic pedicle, initiating a medial to lateral dissection for the Crohn's resection."
80.862,89.445,"The surgeon manipulates the Meckel's diverticulum to tent the ileocolic pedicle, initiating a medial to lateral dissection."
89.945,98.148,"The surgeon performs a Crohn's disease resection using a medial to lateral approach, similar to the technique used for right-sided cancer resections."
101.878,123.116,"The surgeon thins out the ileocolic pedicle, performing a mesenteric resection to isolate the artery and vein. The artery and vein are taken separately in this procedure."
113.733,116.754,"The surgeon thins out the iliocolic pedicle, carefully manipulating the tissue to refine the structure during the resection process."
121.734,133.674,The surgeon isolates and takes the vein separately from the artery during the procedure.
123.136,152.333,"The surgeon identifies the artery after previously isolating the vein. The bowel is visually inspected, confirming no other areas of disease. The planned procedure involves an ileocolic resection and a resection near the Meckel's diverticulum and stricture, located approximately two feet from the ileocolic anastomosis."
152.833,190.174,"The surgeon takes the colon mesentery while preserving the right colic vessels, approaching the junction of the ascending colon and cecum. The lateral mobilization is performed, joining the previously completed medial dissection."
152.89,174.781,"The surgeon dissects the colon mesentery while preserving the right colic vessels, approaching the junction of the ascending colon and the cecum."
175.281,177.124,"The surgeon performs lateral mobilization of the bowel, carefully separating the tissue from surrounding structures to facilitate the ileocolic resection."
177.144,190.228,"The surgeon joins the previously completed medial dissection, connecting it to the lateral mobilization of the bowel."
204.579,212.206,"The surgeon performs an intracorporeal anastomosis without mobilizing the hepatic flexure, demonstrating that sufficient bowel length can be achieved for the anastomosis without additional mobilization."
212.672,258.848,"The surgeon completes the dissection of the terminal ileum mesentery, marking the division site with cautery under white light. The stapling is performed through the suprapubic port, which is used for specimen extraction, minimizing incision size to reduce hernia risk."
212.706,222.57,"The surgeon completes the dissection of the terminal ileum mesentery, ensuring the mesentery is fully separated from surrounding tissues."
223.07,224.291,"The surgeon assesses the perfusion of the bowel segments following the ileocolic resection, ensuring adequate blood flow to the anastomosis site."
224.311,236.117,"The surgeon marks the intended division site on the bowel using cautery, providing a visible reference point with white light after the ICG washout."
236.617,243.08,"The surgeon uses a stapler through the suprapubic port to perform the stapling, preparing for specimen extraction from the same port."
259.348,326.122,"The surgeon staples the small bowel and aligns the isoparasaltic ileocolic anastomosis. A colotomy and enterotomy are performed, followed by the insertion of a stapler through the suprapubic port. The initial staple load is adjusted with a second stapler to extend the anastomosis by an additional centimeter to centimeter and a half."
259.378,269.384,"The surgeon uses a stapler to transect the small bowel, completing the division of the intestinal segment."
269.884,278.068,"The surgeon lines up the isoparasaltic ileocolic anastomosis and creates a colotomy, preparing the bowel for connection."
278.088,287.168,"The surgeon performs an enterotomy, creating an opening in the small bowel."
287.668,292.65,The surgeon reintroduces the stapler through the suprapubic port to continue the stapling process on the small bowel.
301.813,307.255,"The surgeon assesses the first firing of the stapler, noting that the small bowel has been pushed away during the stapling process."
307.755,326.153,The surgeon applies an additional staple load to extend the anastomosis by approximately one to one and a half centimeters.
326.622,393.99,"The surgeon begins suturing the common channel closed, starting at the near corner to ensure complete closure. The suturing is performed in a two-layer fashion, extending towards the far corner and then imbricating the entire section back down."
326.653,329.855,"The surgeon sutures the common channel closed, using precise stitching to secure the tissue."
330.355,335.317,"The surgeon begins suturing at the near corner of the anastomosis to ensure the closure is secure, focusing on the precise alignment of the tissue edges."
335.397,339.219,"The surgeon performs a two-layer suturing technique around the corner of the anastomosis, ensuring secure closure of the tissue layers."
339.379,394.021,"The surgeon sutures towards the far corner and imbricates the tissue, folding it back down to ensure secure closure."
394.49,494.849,"The surgeon performs a small bowel resection, taking the mesentery to the Meckel's diverticulum back to the bowel wall, identifying the distal margin. A window into the true small bowel mesentery is visible as the surgeon moves proximally towards the area of disease. The Meckel's diverticulum, which appears scarred and abnormally thickened, is resected due to its potential involvement in obstructions."
394.521,397.583,"The surgeon begins the small bowel resection, focusing on the targeted section of the bowel for removal."
397.923,411.072,"The surgeon sutures the mesentery to the Meckel's diverticulum back to the bowel wall, establishing the distal margin of the resection."
411.572,421.323,"The surgeon continues to dissect the mesentery attached to the Meckel's diverticulum, separating it from the bowel wall."
421.823,431.898,"The surgeon creates a window into the true small bowel mesentery, revealing the underlying structures and tissues for further dissection."
432.398,437.841,"The surgeon moves proximally towards the area of diseased small bowel, preparing for further resection."
444.846,453.311,"The surgeon observes the small bowel segment with abnormal thickening and scarring to the retroperitoneum, deciding to proceed with resection of this area."
465.162,494.883,"The surgeon proceeds with dividing the small bowel for the second resection, using surgical instruments to carefully separate the bowel segment."
495.349,574.737,"The surgeon lines up a side-to-side antiparastaltic anastomosis, creating otomies in the small bowel. A stapler is used to form a wide anastomosis, followed by suturing the common channel closed using a baseball stitch technique, starting at the near corner and running out and around with a transition stitch over the top."
495.383,503.229,"The surgeon aligns the small bowel segments for a side-to-side antiparastaltic anastomosis, preparing to join the resected sections."
503.729,519.162,"The surgeon creates incisions, known as enterotomies, in the bowel to facilitate the resection process."
519.662,531.525,"The surgeon prepares to use a surgical stapler to join the resected sections of the small bowel, aligning the tissue for an antiparastaltic anastomosis."
532.025,542.37,"The surgeon creates a wide anastomosis for the small bowel, ensuring a broad connection between the resected segments."
542.87,545.731,"The surgeon closes the common channel of the small bowel anastomosis using sutures, completing the connection between the resected bowel segments."
546.231,553.375,"The surgeon begins a baseball stitch at the near corner of the anastomosis, running the suture out and around to secure the tissue edges."
553.875,567.832,"The surgeon places a transition stitch over the top of the anastomosis site, completing the closure of the surgical area."
568.332,574.777,"The surgeon performs an inverting Lembert suture technique to secure the bowel anastomosis, folding the edges inward to reinforce the closure."
615.155,650.669,"The surgeon provides a final view of the completed anastomosis, including the iliacolic anastomosis, which is separated by approximately two feet from the other anastomosis. The surgical field shows no other visible disease, and the omentum is used to cover the area. Specimens are extracted through the Fann and Steele suprapubic port site."
616.588,626.915,"The surgeon visually inspects the completed anastomosis, observing the connection between the resected bowel segments."
627.415,629.536,"The surgeon displays the ileocolic anastomosis, showing the connection between the ileum and colon following resection."
640.12,642.021,"The surgeon drapes the omentum over the ileocolic anastomosis, ensuring it is fully covered."
642.521,648.004,The surgeon extracts the resected bowel specimens through the Fann and Steele Superpubic Ports site.
