start,end,text
0.574,11.007,"Hello, I'm sharing a transverse colectomy for a mid-transverse colon cancer directly over the middle colics."
11.507,19.877,There are a lot of ways to address these. I think conventional teaching was always to do an extended right or maybe even extended left.
20.377,32.233,"I'm a big fan of the transverse colectomy, and this has been talked about a lot recently, and there's a lot of very good data proving that from an oncologic standpoint, it's pretty adequate."
32.733,36.185,"The surgeon begins the procedure by making an incision to open the peritoneum, exposing the underlying structures for the transverse colectomy."
36.685,48.308,"The surgeon dissects over the middle colic vessels, moving towards the bowel wall while ensuring a ten-centimeter margin, indicating a focus on maintaining good blood supply in this area."
48.348,52.068,So this is just to mark things so I don't lose my trajectory.
52.088,59.41,"The surgeon navigates over the ligament of Treitz towards the planned colon margin, maintaining alignment with the previously marked trajectory."
59.91,87.344,"The surgeon marks the distal colon margin approximately ten centimeters from the planned resection site for visual reference. The surgeon then proceeds to open the tissue over the middle colic pedicle, elevating the area for better access."
87.844,95.368,"I think, for me, the region of the middle colic vessels during your dissection can be a little bit daunting to get to."
95.428,105.763,The surgeon creates a window to the right of the middle colic vessels and proceeds towards the bowel wall within the previously created leaflet.
106.263,113.55,"The surgeon exposes the anterior surface of the superior mesenteric vein (SMV) during a right colon procedure, allowing for clear identification and tracing of the vessels encountered."
113.61,142.373,The surgeon observes pulsations in the wad of tissue and opens over the area where the superior mesenteric vein (SMV) enters the middle colic pedicle.
142.873,145.394,"The surgeon visually identifies the middle colic artery and vein, which are positioned together within the surgical field."
145.414,153.859,"The surgeon creates a window around the middle colic vessels, carefully dissecting the surrounding tissue to expose the area."
154.359,161.743,The surgeon releases the tension on the tissue and proceeds to transect the targeted structure.
162.243,170.642,"The surgeon accesses the lesser sac and proceeds to detach tissue from the base of the pancreas, utilizing the created window for clear visualization."
171.142,172.964,The surgeon visually identifies the stomach in the surgical field.
173.464,178.727,You can see how close you are when you do the dissection in the manner that I did.
179.227,193.257,"The surgeon follows the root of the mesentery up to the scored area, extending the dissection towards the distal colon margin."
193.757,199.577,And you can see how that's helpful to just follow that along.
200.077,231.325,"The surgeon divides the omentum at the planned proximal and distal margins, splitting it vertically. The surgeon then enters the lesser sac through the gastrocolic omentum to detach residual attachments to the transverse colon."
231.825,253.725,"The surgeon addresses adhesions between the hepatic flexure and the gallbladder, ensuring there is sufficient redundant distal colon for anastomosis despite tension from the flexures."
254.225,270.311,"The surgeon uses ICG fluorescence to assess the perfusion of the distal colon margin, ensuring it is well-perfused before proceeding with the division."
270.811,289.663,"The surgeon cauterizes the bowel margin on the right side, initially marking it for resection. Indocyanine green (ICG) imaging reveals that the well-perfused margin is actually located more proximally."
290.163,291.805,The surgeon prepares to retrieve the resected colon specimen from the pelvic cavity.
291.825,297.791,"The surgeon inspects the dissection site, observing how the two ends of the colon align closely for anastomosis."
297.851,309.655,"The surgeon aligns the two bowel ends using threo silk sutures and proceeds to perform a sewn end-to-end anastomosis, joining the bowel segments together."
310.155,319.718,I was happy with my port placement. I wish that I would have put my arm number two left hand a little bit lower. I felt like it was a little bit close.
320.218,327.42,I have the patient basically laying completely flat for this procedure.
327.92,336.403,"The surgeon begins the anastomosis by sewing the two staple lines together, a standard technique used in colectomies."
336.463,352.087,This is a two OPDS.
352.587,359.61,"The surgeon ties the threostase suture to secure the sewn end-to-end anastomosis, completing the connection between the two bowel segments."
360.11,362.692,"The surgeon has created colotomies, which are incisions in the colon, as part of the colectomy procedure."
363.192,364.412,The surgeon checks the fluorescence of the tissue using indocyanine green (ICG) imaging to assess perfusion.
364.432,378.959,"The surgeon sutures the common channel closed, using a technique consistent with previous colectomy procedures, as the two staple lines are sewn together."
379.459,394.033,So out to the far corner first.
394.533,410.866,I think for most of us who still feel that an extended right or left is the better oncologic operation for a transverse colon cancer need to accept that that's not necessarily correct.
411.366,422.661,It's been shown over and over again in multiple meta-analyses. that the oncologic outcome with even what you see me do here is more than adequate.
423.161,439.126,"In this case, there were twenty-seven lymph nodes that were all negative and I feel like I've offered the patient an adequate oncologic surgery."
439.626,465.973,I think the benefit of keeping the entire right colon because otherwise this would have been an extended right for me is paramount to an older patient where bowel function can be compromised.
466.473,471.83,"The surgeon extracts the specimen through a small Pfannenstiel incision, which is located in the lower abdomen."
472.33,473.654,This patient did very well.
473.674,524.94,This was a morning of postoperative day one discharge.
525.44,552.178,"The surgeon brings two sutures towards the midline to tie them together, completing the closure of the surgical site."
552.678,565.023,"The surgeon sews the last anterior outer layer using two PDS sutures, completing the closure of the surgical site."
565.523,566.243,I hope you enjoyed.
