start,end,text
11.953,23.118,"The surgeon observes incarcerated omentum within the hernia sac, displaying signs of fat necrosis and erythema on the overlying skin."
27.305,38.134,"The video shows the previously placed mesh from a right inguinal hernia repair in good position. A small left inguinal hernia is also visible, though it appears asymptomatic."
38.634,50.013,"The surgeon places robotic ports a few centimeters below the umbilicus on the right, middle, and left, and proceeds to dock the robotic system."
50.513,57.176,"The surgeon reduces the hernia contents, with the omentum visibly breaking during the process."
57.576,62.678,"The surgeon observes a significant amount of necrotic omental tissue within the hernia sac, which will require further debridement."
63.178,75.784,"The surgeon begins creating a flap just above the level of the umbilicus to perform a Transabdominal Preperitoneal (TAPP) hernia repair, avoiding the retro rectus approach."
107.297,127.102,"The surgeon dissects above the preperitoneal midline fat, aiming to reach the anterior abdominal wall and posterior sheath. The peritoneum appears intact, facilitating the dissection process."
148.396,171.311,"The surgeon continues the preperitoneal dissection, moving cephalad while widening the dissected space to prevent tearing of the flap by the lateral edges as the right and left arms of the instruments navigate the area."
171.811,186.465,"The surgeon observes the hernia defect and instructs the bedside assistant to apply pressure on it. The tissue appears necrotic and fibrotic, preventing further protrusion. The video does not show the debridement process from the intra-abdominal location."
186.965,201.941,"The surgeon dissects the left and right sides of the hernia defect, aiming to elevate the tissue towards the subxiphoid area, creating a volcano-like appearance."
201.981,225.666,"The surgeon identifies the mediastinal tube incisional hernia, achieving the 'volcano sign' by dissecting around the hernia defect."
226.166,256.175,"The surgeon attempts to reduce the hernia sac, but due to extensive scarring and fat necrosis, the sac is amputated, leaving a small defect the size of the hernia neck. This defect is visible and will be closed later in the procedure."
256.675,299.317,"The surgeon observes omentum and necrotic fat descending with the hernia sac. They aim to create cephalic coverage of approximately four to five centimeters for mesh placement. The xiphoid process is identified, and the surgeon attempts to create space beneath it for the mesh, discovering a previously unnoticed xiphoid defect."
299.817,321.404,"The surgeon has uncovered and reduced necrotic fat from a defect in the hernia site. To prevent the development of an asymptomatic hernia, the surgeon extends the flap superiorly and prepares to use a larger mesh for repair."
321.904,338.235,"The surgeon performs a subxiphoid dissection, revealing the split xiphoid bone, which was affected during the sternotomy and either left unclosed or reopened post-surgery."
338.355,378.794,"The surgeon identifies small defects on the left and right of the xiphoid, resembling a Morgagni hernia. The fat is reduced from the right side defect during the subxiphoid dissection, which is extended across the midline. A similar defect is visible on the left side, and the surgeon plans to cover these areas with mesh."
379.294,419.981,"The surgeon carefully dissects along the peritoneum, ensuring no muscle is posterior to the dissection. Due to the patient's anticoagulation, meticulous hemostasis is maintained. The surgeon creates additional space superiorly underneath the diaphragm for the mesh placement."
420.481,440.209,The surgeon selects a 15 by 15 cm mesh for the hernia repair but realizes a larger mesh is needed due to the uncovered xiphoid defect and additional space requirements.
440.709,468.415,"The surgeon performs central cephalad dissection, measuring the pocket for mesh placement. A Versatex mesh is cut to dimensions of twenty by seventeen centimeters for use in the repair."
468.915,498.402,"The surgeon attempts to close the subxiphoid or xiphoid sternal defect, ensuring the mesh can sit beneath it with adequate tissue coverage. The needle is maneuvered along the periosteum of the bone and connective tissue without penetrating the bone."
498.902,533.944,"The surgeon positions the mesh over the defect, ensuring it covers the area adequately to prevent eventration into the defect during the early post-operative period. The mesh is placed to integrate with surrounding tissue, providing coverage over the open bone area."
534.444,546.813,"The surgeon decides to use a single large piece of Versatex mesh instead of two separate pieces, preparing to place it over the hernia defect."
547.313,590.374,"The surgeon closes the epigastric incisional defect in a transverse orientation, with the tissue edges coming together easily due to the small size of the defect."
590.874,609.773,"The surgeon runs the needle back through the tissue for additional security, displaying the twenty by seventeen Versatex mesh being used in the procedure."
610.273,644.294,"The surgeon uses a trio silk suture at the cranial aspect of the mesh to secure it beneath the sternum against the diaphragm, preventing it from sliding out. Another suture is placed at the distal aspect of the mesh, with additional cardinal sutures applied."
644.794,683.327,"The surgeon closes the large wide mouth flaps in the middle, moving towards the patient's right side. Meticulous hemostasis is achieved to prevent bleeding, especially since the patient is anticoagulated."
683.827,720.281,"The surgeon completes the closure of the left side of the flap using a nine-inch, 3-0 V-Loc suture, running it down to close the defect where the hernia sac was amputated. Small peritoneal rents are also closed using Vicryl sutures."
