start,end,text
23.885,41.488,"The surgeon begins the procedure by moving medially towards the pubic tubercle, initiating the dissection in the typical starting location for this type of hernia repair."
41.988,50.314,"Scar tissue is visible anterior to the bladder, likely due to previous surgical procedures."
66.604,86.209,"The surgeon begins dissecting the hernia sac emerging from the indirect inguinal space, carefully separating it from surrounding tissues."
86.709,88.61,"The surgeon continues dissection medially towards the pubic tubercle, navigating through scarred tissue planes due to the patient's previous robotic prostatectomy."
88.63,99.136,"The surgeon encounters sticky tissue during the medial dissection, making it challenging to locate the pubic bone."
99.636,129.984,"The surgeon continues dissection by moving laterally, carefully navigating the surgical field."
130.484,152.537,"The surgeon carefully navigates the surgical field to locate the cord structures, ensuring they are not injured during the hernia repair procedure."
153.037,178.753,"The surgeon creates several peritoneal holes during the reduction of the hernia sac, which are later patched using the hernia sac itself to cover the defects."
179.253,187.18,A small lipoma is visible as it is brought down during the dissection process.
187.68,208.284,"The surgeon sets aside a structure temporarily and continues dissecting the hernia sac, focusing on separating it from surrounding tissues."
208.784,209.825,A visible hole is present in the peritoneum during the hernia sac dissection.
209.845,234.345,The surgeon begins to visualize the edge of the hernia sac during the dissection process.
234.845,267.85,The surgeon identifies the edge of the hernia sac and sweeps the chord structures down and away from the surgical field.
268.35,270.911,"The surgeon continues to parietalize the cord structures, carefully separating them from the surrounding tissue."
299.555,328.856,"The surgeon identifies the pubic tubercle, a bony landmark, during the hernia repair procedure."
329.356,332.358,"The surgeon continues to parietalize the vas, carefully separating it from surrounding tissues in the surgical field."
332.378,338.261,"The surgeon creates an additional opening in the peritoneum at the specified location, revealing underlying anatomical structures."
338.281,348.066,"The surgeon encounters a section of tissue that is firmly adhered, requiring careful manipulation to separate it from surrounding structures."
348.387,353.453,"The surgeon is unable to visualize the femoral vessels, which are obscured by a layer of adipose tissue."
353.953,376.497,"The surgeon continues to dissect the area around the pubic tubercle to ensure proper placement of the mesh, aiming to reduce the risk of hernia recurrence."
376.997,384.493,"The surgeon returns to work on the lipoma, attempting to dissect it further to achieve better positioning."
384.993,393.116,"The surgeon amputates the lipoma, visibly severing its blood supply, which is typically preserved."
393.616,396.737,"The surgeon performs further parietalization of the cord structures, manipulating them to achieve better positioning within the surgical field."
396.757,416.753,"The surgeon attempts to locate a dissection plane over the femoral region, navigating through the surrounding adipose tissue."
451.433,455.034,The surgeon identifies a hemo lock clip within the surgical field.
458.695,476.461,"The surgeon clears obstructive tissue from the surgical field, creating sufficient space for the mesh to be laid flat, which is intended to decrease the risk of hernia recurrence."
519.589,553.563,The surgeon places the mesh into the prepared pocket and carefully unfolds it in a sequential manner.
555.465,582.673,"The surgeon proceeds to close the flap over the area where the mesh has been placed, ensuring it is securely positioned."
630.373,644.239,The surgeon manipulates loose redundant tissue to create a flap patch over the visible defects in the surgical field.
