start,end,text
1.283,14.79,"The surgeon carefully dissects along the left recurrent laryngeal nerve, ensuring precise separation of the nerve from surrounding tissues."
15.29,24.354,This is the most difficult and the most dangerous procedure in the whole esophagectomy procedure.
24.854,39.645,"The surgeon approaches the dissection through the space between the esophagus and trachea, utilizing the pre-esophageal approach to access the surgical site."
40.145,51.033,"In the past, I like to do the literal esophageal, like this one. But recently, I changed the procedure to the pre-esophageal approach."
51.053,70.538,"The surgeon divides the soft tissue between the esophagus and trachea, utilizing the pre-esophageal approach to access the surgical area."
71.038,77.859,"The surgeon exposes the left main bronchus, clearly visible in the surgical field."
78.359,85.84,"The surgeon carefully controls small vascular branches in the surgical field, using precise techniques to manage these vessels during the esophagectomy."
86.34,99.197,"The surgeon navigates the surgical field, aiming to reach as high as possible on the right side, focusing on the pre-esophageal approach between the esophagus and trachea."
99.697,112.208,"It's cause, and then, using the thoracoscope, this procedure is very, very difficult, but using robot, yes, very easy."
112.708,121.344,"The surgeon points out a visible knob, which may be the recurrent laryngeal nerve or a sympathetic nerve, located near the esophagus."
121.844,129.07,"The surgeon navigates the surgical field towards the neck, following the right side approach, with visible anatomical landmarks guiding the dissection."
129.57,155.617,"The surgical field shows a structure that may be the thyroid gland, located in the upper region of the neck."
156.117,168.993,Okay.
169.493,185.21,"The surgeon identifies a bleeding vessel, pointing it out within the surgical field."
185.71,211.636,"When I use the robotic device, I like to use the two types of the procedure in left-hand, the middle-hand, right-hand seizure. And middle-hand user are connected to the bipolar coagulation, right-hand monopolar coagulation. I like to use both the coagulation in the same time. And this is a two-sword mastery."
212.136,219.616,I guess Miyamoto Musashi. And then needle driver.
220.116,266.243,"The surgeon uses the robotic arm to suture the surface of the esophagus to the thoracic wall, securing it to the chest wall."
266.743,332.663,"The surgeon performs robotic suturing, tying, and tagging at two or three points within the surgical field, demonstrating the ease of these procedures with robotic assistance."
333.163,379.71,Where is another point? This one? This one? Ok.
380.21,407.14,Okay. How's it going? Okay.
407.64,415.986,And the first step in the left side is to find the recurrence range of love. Like this right side. This is most important.
416.486,436.17,"And usually, here is a gauze. I cannot find my gauze. Ah, here. Usually, I like to use gauze. Like this one."
436.67,465.935,instead suction because suction is some assistant surgeons who can do the suction well but some people cannot do it so I try to always try to establish the solo surgery not dependent on the assistant surgeon
466.435,478.839,Where is it? Maybe this one? I don't know. This is not easy. Okay.
479.339,515.517,"The surgeon uses the third arm to dissect and mobilize tissue around the trachea, holding the left side of the trachea in the posterior membrane without affecting ventilation."
516.017,555.918,"The surgeon uses a Maryland dissector to create space and divide tissue, progressing upwards towards a holding point."
556.418,580.983,"During the dissection in the upper area, the surgeon carefully navigates near the trachea, where the nerve is closely situated. The surgeon is cautious to avoid the recurrent laryngeal nerve, which is not currently visible."
581.483,623.845,"The surgeon controls small branches of tissue, attempting to identify the recurrent laryngeal nerve and associated nodes. The surgeon points out a structure believed to be the recurrent laryngeal nerve."
624.345,654.503,"The surgeon examines two visible knobs, attempting to differentiate between the recurrent laryngeal nerve and another syn-passing knob, highlighting the importance of accurate identification during the procedure."
655.003,673.876,"And in the middle, mid-position of dissection, usually we cannot find out which one is which one. Right here, we don't know which one is which one."
674.376,717.89,"The surgeon cuts the nodal tissue, following the knob to the distal area to identify the recurrent rhizome. The recurrent portion of the knob is visible, along with the symposium extending to the specified area."
718.39,779.418,"The surgeon identifies the bronchiolatory region, noting the importance of preserving the left bronchial artery to prevent ischemia in the airway. Careful control of lymph nodes is emphasized in this area."
779.918,805.76,"The surgeon exposes the pulmonary artery, which is surrounded by a significant amount of blood, indicating active bleeding in the surgical field."
806.26,840.449,"The surgeon aims to remove all lymph nodes surrounding the pulmonary artery and main bronchus, focusing on the anatomical area visible in the surgical field."
840.949,877.537,"Yes. Yes. Yes. Yes. This is a lymph node and one of the TBR in Japanese system, but in AJ system, tan air, maybe."
878.037,907.795,"Following the removal of lymph nodes, the surgeon demonstrates the preserved vessels and knob, ensuring no damage to the pulmonary artery. The procedure progresses to the upper area with the trachea being held."
908.295,982.832,"The surgeon performs node dissection along the left recurrent laryngeal nerve, carefully removing only the lymphatic tissue between the esophagus and the nerve while preserving the perineural tissue to avoid ischemia."
983.332,1049.179,Cause energy. Okay. Okay.
1049.679,1057.282,What's the problem? Where is the bleeder? I don't know.
1057.782,1100.73,"The surgeon navigates around the recurrent laryngeal nerve, encountering multiple small branches. The complexity of controlling these branches is visible, as the energy device is challenging to use in this area."
1101.23,1127.026,Maybe not. Which one? Maybe this one. We must check the distance between nerve and breather. OK? OK. Got it.
1127.526,1180.11,"The surgeon demonstrates the use of an energy device, maintaining a safe distance of three to five millimeters from the visible nerve to prevent damage, as the nerve is clearly identifiable in the surgical field."
1180.61,1249.107,"The surgeon identifies the thyroid gland in the surgical field, indicating the procedure has reached the neck region. The entire tissue below the thyroid is to be removed, and the left cervical parasympathetic lymph node is visible nearby."
1249.607,1315.943,"The surgeon removes additional lymphatic and fatty tissue in the lower neck, carefully controlling vascular branches during the process."
1316.443,1335.465,"The surgeon cuts a specific tissue or structure in the surgical field, using an instrument to make the incision."
1335.965,1413.027,"The finalized view after the left recurrent laryngeal lymph node dissection shows the aortic arch, recurrent laryngeal nerve, sympathetic nerve, and thyroid gland. The surrounding tissue around the thyroid gland and recurrent laryngeal nerve has been removed, revealing the left hilum and other anatomical structures."
