start,end,text
0.451,12.679,Single incision laparoscopic colectomies have been performed and several reports have been published. These reports state that technical challenges make these a more difficult operation when compared to multiple port laparoscopic colectomy.
13.179,20.423,Robotic assistance to seals with instrument crossing and harp control reassignment can facilitate the technical performance of the procedure.
20.803,32.915,This is a case of a forty nine years old male admitted to the hospital with recurrent sigmoid diverticulitis with perforation. The CT scan that was performed confirmed the area of perforation in the sigmoid colon.
33.415,39.601,"The patient was treated with bowel rest, IV fluid and IV antibiotics with resolution of the acute event."
39.601,45.767,"The colonoscopy reveals the presence of sigmoid diverticulosis with visible mild inflammation, but no other pathological findings are observed."
45.767,52.055,The patient was seen in the office and scheduled for a robotic assisted single incision laparoscopic sigmoid colectomy.
52.555,57.997,"The surgeon performs a 4.5 cm incision located 2 cm to the right of the umbilicus, preparing the site for robotic-assisted laparoscopic access."
58.497,66.759,"The surgeon places the applied medical gel port with a wound protector into the incision on the right side of the umbilicus, and docks the da Vinci SI robot onto the patient for the robotic-assisted laparoscopic procedure."
67.259,78.872,"Both robotic arms are inserted into the peritoneal cavity through the single incision, crossing each other as the surgeon prepares to reassign arm control for the procedure."
79.372,100.037,"The DaVinci monitor displays flipped indicators for robotic arms one and two, showing that the surgeon's right hand controls the robotic arm on the left side, while the left hand controls the arm on the right side."
100.537,142.305,"The surgeon begins the operation by exposing and visualizing the vascular supply to the sigmoid colon. Using monopolar endoshears, the sigmoidal branches are carefully dissected free from the surrounding tissue in a medial to lateral approach."
142.805,156.399,"The surgeon exposes and carefully skeletonizes the vessel, removing surrounding tissue to clearly delineate its structure."
156.899,172.323,The surgeon uses a five millimeter ligature device to seal and divide the largest vessels encountered during the dissection of the sigmoid colon.
172.823,189.172,"The surgeon continues the medial to lateral dissection of the mesosigmoid, creating an opening through the tissue to expose the opposite side."
189.672,203.751,"The surgeon utilizes the window created in the mesentery as a point of retraction, enhancing exposure and facilitating traction and counter-traction during the dissection of the sigmoid colon."
204.251,226.678,The surgeon makes a longitudinal incision along the craniocaudal axis of the operating field to enhance maneuverability and accommodate the robotic arms during the colectomy procedure.
227.178,234.95,"The surgeon continues the dissection around the rectosigmoid junction, following the previously established technique, with visible manipulation of the surrounding tissue."
235.45,251.973,"The surgeon uses a five millimeter ligature device to seal and divide larger vessels encountered during the dissection, which cannot be safely coagulated with monopolar energy."
252.473,269.748,"The surgeon performs dissection around the rectosigmoid junction, enhancing serosal contraposition between the distal descending colon and the rectal stump in preparation for an end-to-end anastomosis."
270.248,284.515,"The surgeon uses a 60mm roticulating automatic endostapler to divide the colon at the prepared retosigmoid junction, ensuring precise separation of the tissue."
285.015,310.364,"The surgeon positions the stapler at the most distal point of the colon where the blood supply remains intact, ensuring a healthy and well-vascularized site for the upcoming anastomosis."
310.864,335.172,"The surgeon prepares to fire a second reload of the stapler to complete the resection at the rectosigmoid junction, ensuring the colon is adequately divided."
335.672,363.213,"The surgeon uses under shears to complete the resection of the colon, ensuring precise cutting and separation of the remaining tissue."
363.713,397.594,"The surgeon uses a 5mm video scope with 30-degree lenses, positioned facing upward to optimize the visual field and accommodate robotic arm movements during the procedure."
398.094,414.142,"The surgeon visualizes the anatomy to localize the ureter, a step common in both multiple port laparoscopic and open colectomy procedures."
414.642,421.967,"The surgeon checks the mobilization of the descending colon by ensuring it reaches into the pelvis without tension, indicating sufficient length for the procedure."
422.467,432.153,"The surgeon exteriorizes the colon through the single incision wound protector, transects the specimen, and places the anvil in the distal descending colon extracorporeally."
432.653,445.688,"The surgeon reapplies the gel port on the wound protector and completes the EEA stapled anastomosis using regular laparoscopic instruments through the single port, without re-docking the robotic system."
446.188,455.177,The surgeon inspects the anastomotic donuts on the back table and performs an underwater leak test on the stapled line to ensure the integrity of the anastomosis.
455.677,461.279,The patient had an uncomplicated post-operative course and was discharged to home on post-op day number two.
461.779,477.904,"In conclusion, robotic-assisted single-incision laparoscopic semoecolectomy is a technically feasible procedure. The DaVinci robot greatly helped in overcoming the technical challenges of single-incision laparoscopic surgery due to internal instrument collision and external surgeon's arm interference."
478.224,478.564,Thank you.
