start,end,text
3.873,11.836,The surgical field shows a midline incisional hernia repair with an ileal conduit visible on the right side.
12.336,18.419,"The surgeon uses an ETEP approach, placing ports in the left abdomen and crossing over to the surgical site."
18.579,25.582,"The surgeon dissects around the stoma, carefully maneuvering around the visible tissue structures."
41.505,43.586,"The surgeon completes the dissection around the stoma, revealing the surrounding tissue and anatomical structures."
43.607,45.848,"The surgeon navigates the right retrorectus space, revealing the anatomical area adjacent to the rectus muscle."
48.19,54.374,"The video shows a measurement of four centimeters between the right edge of the defect and the stoma, highlighting the limited space available for surgical maneuvers."
54.874,59.578,"The surgeon measures the midline defect, which is approximately eight centimeters by eleven centimeters in size."
59.818,65.103,"The video shows a single large hernia, visually identifiable within the surgical field."
65.603,73.446,"The surgeon provides a view of the ileal conduit, highlighting its position relative to the surgical field."
73.946,76.327,"The surgeon sutures the anterior defect, bringing the edges of the tissue together."
81.849,88.492,"The surgeon leaves approximately one centimeter of the posterior rectus sheath intact, noting that the anterior rectus sheath may retract, as observed in this case."
88.552,91.818,"The posterior rectus sheath is visible, providing a clear view of the fascia beneath it."
97.52,108.425,"The surgeon lays out sutures and progressively tensions them to close the anterior defect, using a twenty-four inch OV lock suture."
108.445,118.847,"The surgeon takes small bites of the hernia sac, aiming to reduce the size of the seroma and transform it into a multi-loculated seroma."
130.791,147.337,"The surgeon carefully takes bites of the ipsilateral edge, ensuring that the fascia is visible and avoiding blind grabs of the muscle tissue."
147.577,154.628,The surgeon peels back the muscle to expose the fascia and ensures the linea alba is encircled.
155.128,157.449,"The surgeon takes solid bites of tissue, likely referring to suturing or grasping techniques during the procedure."
157.949,161.591,"The surgeon progressively tensions the defect, visually drawing the tissue edges closer together."
171.754,173.615,"The surgeon completes the closure of the defect, ensuring the tissue edges are securely approximated."
174.115,177.677,The surgeon leaves approximately five centimeters of tissue cephalad to ensure a good overlap during the defect closure.
178.177,185.092,"The surgeon runs the suture back along the defect to lock it in place, ensuring the closure is secure."
197.48,201.102,A parietine mesh measuring nineteen by thirty centimeters is displayed.
201.122,202.744,The camera provides a view looking down into the pelvic region.
203.244,212.897,The surgeon performs a lower right one-third transversus abdominis release (TAR) to assist in closing a large posterior gap.
213.397,214.659,"The camera view is oriented cephalad, providing a perspective looking upwards from the pelvis."
215.159,218.182,"The surgeon presses the parietine mesh against the stoma, ensuring it is securely positioned over the surgical site."
218.682,224.067,"The surgeon plans to slit the parietine mesh and wrap it around the stoma, preparing to secure it in place."
224.108,231.695,"The surgeon positions the mesh to achieve more than four centimeters of overlap both cephalad and caudal to the stoma, ensuring adequate coverage."
231.815,234.022,"The surgeon measures approximately four centimeters at the stoma, ensuring adequate mesh overlap."
234.522,247.989,"The surgeon sutures the mesh down to the posterior rectus sheath due to insufficient overlap around the stoma, ensuring secure placement despite the limited mesh coverage."
248.009,257.218,"The surgeon sutures the mesh around the stoma, ensuring it is securely attached due to inadequate overlap."
257.718,260.881,"The surgeon demonstrates how the mesh is tucked beyond the tar point, showing its positioning relative to the surrounding anatomical landmarks."
261.381,265.005,"The surgeon holds a 3-0 Vicryl suture, preparing to use it in the procedure."
265.505,277.155,"The surgeon fixates the mesh at multiple points to prevent shifting, securing it in place over the surgical site."
323.243,327.425,The surgeon places a 19 French round Jackson-Pratt (JP) drain at the conclusion of the procedure.
