start,end,text
1169.868,1180.235,And I really didn't want to take another forty-five minutes to an hour to develop a big pre-peritoneal pocket to put in a piece of mesh at this time.
1180.295,1184.718,I just didn't think that that was the wisest thing to do.
1185.218,1203.533,"So I felt like this looked pretty good. And we'll keep our fingers crossed that it holds, but if it doesn't, it'll be a nice repair. That concludes the video. I hope you enjoyed."
1185.218,1191.642,So I felt like this looked pretty good.
1192.142,1201.258,"And we'll keep our fingers crossed that it holds, but if it doesn't, it'll be a nice repair."
1201.758,1202.778,That concludes the video.
1202.819,1203.533,I hope you enjoyed.
