start,end,text
0.611,6.237,"Hello, I am sharing a right colectomy for a hepatic flexure cancer."
0.611,6.237,"Hello, I am sharing a right colectomy for a hepatic flexure cancer."
6.737,22.691,"Adhesions are visible in the upper midline and epigastrium, resulting from a previous large right subcostal incision that crossed the midline."
6.737,22.691,This patient had previously had an open cholecystectomy back in the day and hence these adhesions to the upper midline and the epigastrium due to a large right subcostal incision that crossed the midline.
23.191,28.444,"The surgeon carefully dissects and removes adhesions, revealing the colon that is drawn up into these fibrous bands."
23.191,24.592,"The surgeon carefully dissects and removes adhesions in the upper midline and epigastrium, which are remnants from a previous open cholecystectomy."
24.632,28.444,"The colon is visibly drawn up into the adhesions located in the upper midline and epigastrium, resulting from a previous large right subcostal incision."
28.944,41.148,"I have this part sped up a lot just because it's not really the meat and potatoes of the case. If you're interested in seeing it a little bit in more detail, you can slow this down in YouTube."
28.944,34.706,I have this part sped up a lot just because it's not really the meat and potatoes of the case.
34.786,41.148,"If you're interested in seeing it a little bit in more detail, you can slow this down in YouTube."
41.648,57.675,"The surgeon carefully dissects and removes adhesions to allow the transverse colon to be reflected over the liver, facilitating the exposure of the mesentery for a medial to lateral dissection."
41.648,50.631,"The surgeon removes adhesions to allow the transverse colon to be reflected over the liver, exposing the mesentery for the medial to lateral dissection."
50.691,57.675,So that's why I'm taking my time to do this.
58.175,68.882,"The surgeon explores the space above the liver edge, searching for a tattoo marking on the colon but does not find it."
58.175,60.757,I'm also trying to find my tattoo.
60.937,64.439,"The surgeon breaks into the space above the liver edge, revealing the anatomical area for further dissection."
64.939,66.78,I was hopeful I was going to see a tattoo.
66.86,68.882,I don't see a tattoo.
69.382,80.689,"I know that the lesion is at the hepatic flexure, so I'm assuming that the tattoo is in the retroperitoneum."
69.382,80.689,"I know that the lesion is at the hepatic flexure, so I'm assuming that the tattoo is in the retroperitoneum."
81.189,91.795,"The surgeon completes the dissection of adhesions near the right subcostal incision, focusing on the area adjacent to the liver edge."
81.189,85.65,"The surgeon encounters adhesions at the right subcostal incision site, manipulating the tissue to address these attachments."
86.15,91.795,"The surgeon completes the dissection of adhesions at the liver edge, clearing the tissue from the surrounding area."
92.295,98.961,"The surgeon reflects the omentum upwards, working to restore the anatomical orientation of the surgical field."
92.295,95.138,"The surgeon reflects the omentum upwards, revealing the underlying structures in the abdominal cavity."
95.418,98.961,I'm just trying to restore a little bit more anatomy.
99.461,109.005,At this point I slowed the video down to the normal speed that I show my videos from.
99.461,109.005,At this point I slowed the video down to the normal speed that I show my videos from.
109.505,127.992,"The surgeon continues to search for the tattoo while splaying the omentum upwards to visualize the iliocolic pedicle. The iliocolic pedicle is visible, and the surgeon begins the medial to lateral dissection."
109.505,123.55,"The surgeon continues to splay the omentum upwards to visualize the iliocolic pedicle, while searching for the tattoo marking."
124.05,127.992,"The surgeon begins the medial to lateral dissection, carefully separating tissue layers to progress the colectomy procedure."
128.492,139.673,This was a gentleman of more advanced age. I did not feel the need to do a CME on them.
128.492,132.613,This was a gentleman of more advanced age.
133.113,139.673,I did not feel the need to do a CME on them.
140.173,151.981,"The surgeon performs a medial to lateral dissection, preparing to isolate the iliocolic vessels approximately one centimeter from their origin."
140.173,142.975,"The surgeon performs a medial to lateral dissection, manipulating the tissue to expose the iliocolic pedicle."
143.015,151.981,"The surgeon isolates the iliocolic vessels approximately one centimeter from their takeoff, preparing for further dissection."
152.382,172.956,"The surgeon marks the anticipated path of the superior mesenteric vessels to ensure complete mesenteric removal, preparing to take the middle colic vessel due to a hepatic flexure lesion."
152.382,158.166,The surgeon marks the anticipated path of the superior mesenteric vessels on the mesentery to ensure adequate dissection during the procedure.
158.666,165.15,The surgeon plans to ligate the middle colic vessel due to the presence of a lesion at the hepatic flexure.
165.551,168.533,And I don't want to lose my bearings
169.033,172.956,and by accident skimp on the mesentery.
173.456,180.562,Obviously when you do a complete mesocolic excision it's a lot easier to follow that pathway because you're right on top of the blue of the vein.
173.456,180.562,"During the complete mesocolic excision, the surgeon follows the pathway closely, revealing the blue hue of the vein beneath the mesentery."
181.062,192.59,"The surgeon isolates the iliocolic vein and proceeds to take it, followed by isolating the iliocolic artery. An anatomical variation is visible during this process."
181.062,183.103,"The surgeon proceeds to isolate and take the iliocolic vein, carefully dissecting around the vessel to ensure clear visualization and control."
183.123,188.867,"The surgeon isolates the artery, preparing to address the middle colic vessel due to the hepatic flexure lesion."
188.907,192.59,You'll see an anatomic variation here.
193.09,205.196,"The surgeon identifies a vessel branching from the iliocolic, which is revealed to be the right colic artery, visible in the surgical field."
193.09,196.613,"A vessel is visible branching off from the iliocolic vein, highlighted against the surrounding tissue."
196.653,201.534,You'll see it a little bit better in just a second.
202.034,202.674,"The surgeon visually identifies the iliocolic vein, which is isolated and ready for further manipulation."
202.754,205.196,"The surgeon identifies the right colic artery, highlighting its anatomical position and relation to surrounding structures."
205.696,223.795,"The surgeon identifies the right colic vessel branching off from the ileocolic vessel, with a clear view of the bifurcation. A surgical window is created just above this bifurcation."
205.696,211.478,The right colic artery is visually identified branching off from the ileocolic artery.
211.978,215.88,The video shows a clear view of the right colic vessel branching off from the ileocolic artery.
216.38,218.301,So I'm going to go ahead.
218.401,223.795,"The surgeon creates a surgical window just above the bifurcation of the right colic artery, visible in the operative field."
224.295,235.679,"rather than going down closer to the superior mesenteric vessels, and then I secondarily take that right colic. I just felt a little bit safer doing it that way."
224.295,232.538,"The surgeon approaches the right colic artery, opting to dissect it away from the superior mesenteric vessels before taking the right colic artery."
233.038,235.679,I just felt a little bit safer doing it that way.
236.179,266.963,"The surgeon identifies the tattoo marking on the retroperitoneal surface, indicating the absence of the right colic vessels. The focus shifts to the middle colic vessels branching from the superior mesenteric vessels."
236.179,252.389,"The surgeon identifies the tattoo marking on the retroperitoneal area, indicating the absence of the right colic vessels. The next visible vessels to be encountered are the middle colic vessels branching from the superior mesenteric vessels."
252.889,266.963,"The surgeon identifies and prepares to dissect the middle colic vessels, which are located off the superior mesenteric vessels."
267.463,284.711,"The surgeon performs medial to lateral dissection, carefully separating tissue layers to facilitate subsequent lateral dissection in the colectomy procedure."
267.463,270.246,"The surgeon performs medial to lateral dissection, carefully separating tissue layers in the abdominal cavity during the colectomy procedure."
270.306,284.711,This facilitates later in the case when you do your lateral dissection.
285.211,303.663,"The surgeon elevates the transverse colon to locate the root of the middle colic vessels, marking the mesentery at the planned distal transection margin, positioned just left of the middle colic vessels."
285.211,291.656,"The surgeon elevates the transverse colon to locate the root of the middle colic vessels, revealing the anatomical structures for further dissection."
292.156,303.663,"The surgeon marks the mesentery at the planned distal transection margin, located just to the left of the middle colic vessels."
304.163,334.179,"The surgeon thins out the mesentery at the root of the middle colic vessels, encountering thicker tissue. Upon finding a suitable plane, the middle colic artery is identified and partially dissected, with further dissection needed to complete the process."
304.163,311.467,"The surgeon thins out the mesentery at the root of the middle colic vessels, carefully manipulating the tissue to enhance visibility and access for further dissection."
311.967,321.613,I usually like to really thin this out the way that you saw me do for the iliocolic.
322.113,328.056,The surgeon identifies a thicker tissue area and proceeds to dissect along a newly found plane in the mesentery near the middle colic vessels.
328.356,330.517,"The surgeon identifies the middle colic artery during the dissection of the transverse colon, highlighting its location within the surgical field."
330.657,334.179,"The surgeon continues to thin out the mesentery at the root of the middle colic vessels, progressing towards the planned distal transection margin."
334.679,357.124,"The surgeon identifies and takes a branch of the loop of Henle, followed by the visualization of the middle colic vein within the surgical field."
334.679,346.797,"The surgeon excises a branch of the loop of Henle, visible within the surgical field."
347.297,357.124,"The surgeon identifies the middle colic vein, visually distinguishing it from surrounding structures."
357.624,394.891,"The surgeon approaches the back of the stomach from a medial position, taking down the mesogastrium using an inferior approach."
357.624,360.846,"The surgeon advances through the tissue plane, continuing the dissection process."
360.886,363.347,"The surgeon identifies the posterior aspect of the stomach, visible in the surgical field."
363.847,367.65,"The surgeon operates from a medial position, continuing the dissection process."
368.15,394.891,"The surgeon takes down the mesogastrium from an inferior approach, carefully separating it from surrounding structures."
395.391,425.627,"The surgeon places a sponge to protect the duodenum and proceeds to dissect over the top, completing the distal margin mesentery. The proximity of the stomach is visible due to adhesions from a previous cholecystectomy."
395.391,403.501,The surgeon places a sponge to protect the duodenum and proceeds to maneuver over the top of the structure.
404.001,407.966,"The surgeon completes the dissection of the distal margin mesentery, ensuring the area is fully separated from surrounding tissues."
408.006,425.627,"The surgeon demonstrates the proximity of the stomach to the adhesions resulting from a previous cholecystectomy, highlighting the close anatomical relationship between these structures."
426.127,454.794,"The surgeon splits the omentum at the level of the planned transection, revealing the stomach and attempting to access the previously dissected plane."
426.127,442.463,"The surgeon splits the omentum at the level of the planned transection, visually separating the tissue layers in preparation for further dissection."
442.963,454.794,"The surgeon identifies the stomach and attempts to enter the previously dissected plane, maneuvering carefully around the visible anatomical structures."
455.294,485.287,"The surgeon identifies the area lateral to the previously dissected stomach, continuing to take down the mucogastrium and gastrohepatic omentum. The dissection progresses towards the gastroomental vessels."
455.294,461.337,"The surgeon locates the area previously dissected from the stomach, moving slightly further lateral to continue the dissection."
461.377,465.419,"The surgeon continues to dissect and remove the mucogastrium and gastrohepatic omentum, carefully separating these tissues from the surrounding structures."
465.919,475.084,"The surgeon prepares to transect the gastropomental vessels, which are visible near the stomach and adhesions from a prior cholecystectomy."
475.584,485.287,That's coming up shortly.
485.787,508.957,"The surgeon identifies a vessel and continues to take it down, having previously dissected the hepatic flexure at the start of the case, which is already visible as taken."
485.787,493.19,"The surgeon identifies a vessel adjacent to the stomach, preparing to dissect within the previously established plane."
493.69,495.211,"The surgeon continues to dissect and remove the remaining mucogastrium and gastrohepatic omentum from the stomach, progressing laterally."
495.251,508.957,"The hepatic flexure appears partially dissected, as indicated by the visible separation of tissue, which was performed earlier in the procedure while searching for the tattoo."
509.457,533.993,"The surgeon completes the lateral dissection, addressing adhesions around the appendix resulting from a previous open appendectomy."
509.457,518.221,"The surgeon completes the lateral dissection, focusing on separating the tissue layers along the lateral aspect of the colon."
518.721,533.993,"The surgeon encounters adhesions around the appendix, which are remnants from a previous open appendectomy performed years ago."
534.493,581.317,"The surgeon attempts to free up the terminal ileum (TI) to achieve full lateral mobilization, aiming to reach the distal transverse colon for the planned anastomosis."
534.493,539.437,"The surgeon attempts to free up the terminal ileum (TI) to achieve full lateral mobilization, manipulating the tissue to separate it from surrounding structures."
539.937,581.317,"The surgeon positions the mobilized transverse colon and distal transverse colon in preparation for anastomosis, ensuring alignment for the upcoming surgical connection."
581.817,616.099,The surgeon identifies sutures from a prior appendectomy and proceeds to complete the dissection of lateral attachments to fully mobilize the colon.
581.817,592.012,"The video shows sutures from a previous appendectomy, visible around the appendix area."
592.512,616.099,"The surgeon completes the dissection of lateral attachments to fully mobilize the colon, ensuring it is free from surrounding tissues."
616.599,634.992,"The surgeon carefully dissects the terminal ileal attachments from the retroperitoneum, ensuring the ureter is not inadvertently included in the dissection. The ureter is visible in the surgical field."
616.599,621.563,"The surgeon addresses the terminal ileal attachments to the retroperitoneum, working to free these structures."
622.063,627.807,The surgeon carefully dissects tissue to ensure the ureter is not inadvertently included in the mobilization process.
628.307,629.068,"The ureter is visible in the surgical field, clearly identified and separated from surrounding tissues."
629.168,630.769,I'm always paranoid about the ureter.
631.009,634.992,I think we should always all be paranoid about the ureter.
635.492,657.092,"The surgeon completes the dissection, fully freeing the colon from its attachments. The small bowel mesentery is then taken, indicating the next step in the procedure."
635.492,639.215,"The surgeon completes the dissection of the terminal ileal attachments to the retroperitoneum, ensuring the ureter is not involved in the process."
639.715,642.017,"The surgeon has completed the dissection, and the colon is now visibly free from surrounding tissues."
642.517,657.092,"The surgeon begins to take the small bowel mesentery, preparing to separate it from surrounding structures."
657.592,687.328,"The surgeon checks the perfusion of the bowel and prepares to staple from the suprapubic port, which is upsized for specimen extraction. The small bowel is divided, minimizing incision size to reduce hernia risk."
657.592,676.629,"The surgeon checks the perfusion of the colon and prepares to staple from the suprapubic port, which is upsized for specimen extraction, minimizing the risk of hernia at the incision site."
677.129,687.328,"The surgeon divides the small bowel, completing the separation process."
687.828,715.51,"The surgeon places the resected specimen above the liver and aligns the bowel segments for an isoparastaltic anastomosis. The anastomosis is performed using sutures, avoiding the use of staplers, while the two ends of the bowel remain stapled."
687.828,713.629,"The surgeon temporarily places the specimen above the liver and aligns the bowel for an isoparastaltic anastomosis. The anastomosis is performed using a fully sewn technique, avoiding the use of staplers."
714.129,715.51,too worried about doing that.
715.65,752.495,"The surgeon aligns the bowel segments for an open anastomosis and begins sewing the outer back row of sutures, demonstrating the technique in real-time."
715.65,726.616,"I just don't like staplers to actually construct the anastomosis, although I don't mind a linear stapler nearly as much as I mind a EEA stapler."
726.676,730.058,"The surgeon prepares to perform a hand-sewn anastomosis, aligning the bowel ends for suturing without the use of staplers."
730.098,732.419,This is actually how I do it in an open fashion.
732.639,735.721,"The surgeon aligns the bowel segments in preparation for an isoparastaltic anastomosis, ensuring proper orientation for the upcoming surgical connection."
736.221,738.483,"The surgeon begins sewing the back row of the anastomosis on the bowel, using sutures to connect the tissue edges."
738.503,743.832,"The surgeon is sewing the outer back row of the bowel anastomosis, aligning the tissue edges for secure closure."
744.332,748.093,I left this unedited for anybody who wants to just see the whole thing.
748.133,752.495,It did make the video a lot longer than my normal videos.
752.995,784.373,And it obviously took longer than if I were to staple in anastomosis and then sew the closure. This definitely took a little bit longer.
752.995,762.258,And it obviously took longer than if I were to staple in anastomosis and then sew the closure.
762.318,784.373,This definitely took a little bit longer.
784.873,813.962,"The surgeon performs a colotomy and enterotomy, creating openings in the colon and small intestine respectively."
784.873,813.962,"The surgeon performs a colotomy and enterotomy, making incisions into the colon and intestine."
814.462,860.604,"The surgeon begins sewing the inner row of a two-layer colorectal anastomosis, extending the suture to the far corner to join the posterior staple lines and form the posterior outer row."
814.462,816.184,"The surgeon begins suturing the inner row of the anastomosis, carefully placing stitches to secure the tissue layers together."
816.204,824.493,"The surgeon begins sewing towards the far corner of the surgical site, using precise suturing techniques to secure the tissue."
824.553,860.604,The surgeon joins the posterior staple lines to form the posterior row of the outer layer in a two-layer colorectal anastomosis.
861.104,876.473,"For all of my extracorporeal anastomosis, ileostomy closures, if I'm ever doing an open case, this is exactly how I construct my bowel anastomosis. I will always do a hand sewn."
861.104,873.491,"For all of my extracorporeal anastomosis, ileostomy closures, if I'm ever doing an open case, this is exactly how I construct my bowel anastomosis."
873.571,876.473,I will always do a hand sewn.
876.973,930.554,The surgeon begins the second inner suture in the opposite direction to ensure complete closure of the mucosal edges during the hand-sewn bowel anastomosis.
876.973,891.462,I don't tend to use V-lock when I'm open just because I find it harder to work with in an open fashion due to how short the suture feels.
891.962,895.787,"The surgeon begins the second inner suture of the colorectal anastomosis, sewing in the opposite direction to complete the inner layer."
895.807,930.554,"The surgeon revisits the suture line to ensure complete closure of the mucosal edges, visually confirming the integrity of the anastomosis."
931.054,986.353,The surgeon checks the ICG fluorescence to assess tissue perfusion as they continue sewing to complete the anterior inner row of the anastomosis.
931.054,933.716,The surgeon checks the fluorescence of the tissue using indocyanine green (ICG) imaging as they maneuver around the corner of the bowel during the colectomy procedure.
933.736,935.937,I just see no reason not to.
935.957,940.16,I like what I saw.
940.18,986.353,The surgeon begins to suture over the top to complete the anterior inner row of the anastomosis.
986.853,1018.473,"The surgeon uses the original suture to adjust the position of the knots, moving them away from the corner of the anastomosis site."
986.853,1018.473,"The surgeon uses the original suture to adjust the position of the knots, moving them away from the corner of the anastomosis."
1018.973,1043.294,"The surgeon completes the suturing of the common channel in the colorectal anastomosis, finalizing the inner row of the bowel connection."
1018.973,1043.294,"The surgeon completes the suturing of the common channel, finalizing the anastomosis in the colectomy procedure."
1043.794,1071.719,"The surgeon joins two sutures and then uses the original suture to sew the anterior portion of the back row, completing the anastomosis."
1043.794,1052.534,"The surgeon joins two sutures to secure the anastomosis, ensuring the connection between the tissue layers is maintained."
1053.034,1071.719,"The surgeon uses the original suture to sew the back row anteriorly, completing the inner row of the anastomosis."
1072.219,1097.553,"This patient did very well, actually had bowel function starting on day zero. It was a T three and zero zero of forty nine lymph nodes. And I was very pleased with how things worked out."
1072.219,1080.596,"This patient did very well, actually had bowel function starting on day zero."
1081.096,1090.626,It was a T three and zero zero of forty nine lymph nodes.
1091.126,1097.553,And I was very pleased with how things worked out.
1098.053,1124.158,"It's always, you know, kind of. frustrating or defeating when you first put the camera in and you see all the adhesions and the amount of work that you need to do. This certainly wasn't, you know, as bad as some other cases get, but it does, you know, add about an hour on to your surgeries and that can be frustrating. So I was pleased in the end how this worked itself out. So we'll go ahead and cover that with some momentum."
1098.053,1100.479,"It's always, you know, kind of."
1100.979,1107.364,frustrating or defeating when you first put the camera in and you see all the adhesions and the amount of work that you need to do.
1107.864,1116.851,"This certainly wasn't, you know, as bad as some other cases get, but it does, you know, add about an hour on to your surgeries and that can be frustrating."
1116.911,1120.574,So I was pleased in the end how this worked itself out.
1120.994,1124.158,"The surgeon places omentum over the surgical area, covering it as part of the procedure."
1124.658,1163.438,"And then I elected to just primarily close this hernia so that he wouldn't run into any trouble during the healing phase. Told him that I would expect that there's about a fifty percent recurrence in the first two years with this type of closure alone without mesh. And he said that if he, you know, ever has any symptoms of the hernia that he'll come back and let me fix it. Um, you could absolutely make an argument to do a preperitoneal mesh repair at the time of a colectomy. I absolutely have no concerns with that."
1124.658,1134.411,"The surgeon closes the hernia primarily, ensuring the tissue is securely sutured to prevent complications during the healing phase."
1134.911,1144.646,Told him that I would expect that there's about a fifty percent recurrence in the first two years with this type of closure alone without mesh.
1145.146,1151.27,"And he said that if he, you know, ever has any symptoms of the hernia that he'll come back and let me fix it."
1151.751,1160.376,"Um, you could absolutely make an argument to do a preperitoneal mesh repair at the time of a colectomy."
1160.476,1163.438,I absolutely have no concerns with that.
1163.678,1184.718,"I just, uh, older gentlemen longer than normal surgery. And I really didn't want to take another forty-five minutes to an hour to develop a big pre-peritoneal pocket to put in a piece of mesh at this time. I just didn't think that that was the wisest thing to do."
1163.678,1169.368,"I just, uh, older gentlemen longer than normal surgery."
