start,end,text
124.593,128.838,"The surgeon reclines the descending colon and incises the Geroidus fascia, exposing the underlying structures."
129.338,135.631,"The surgeon identifies and frees the renal artery and vein, carefully dissecting these vascular structures from surrounding tissues."
136.131,142.519,"The surgeon exposes and mobilizes the kidney capsule on all sides, leaving the kidney attached only by its artery, vein, and ureter."
153.53,158.85,"The surgeon clips the gonadal and adrenal veins as needed, using robotic assistance for precise control."
159.35,170.476,"The surgeon preserves the fatty tissue within the golden triangle, located between the ureter, the lower pole of the kidney, and the hilum, to protect the vascular supply to the proximal ureter."
178.28,184.791,"Bulldog clamps and sutures are positioned intracorporeally to minimize ischemia during the procedure, with the kidney visible and mobilized except for its attachment by the artery, vein, and ureter."
185.291,201.536,"The surgeon inserts a Fogarty catheter transcutaneously using the Seldinger technique, which involves threading the catheter through a needle puncture site."
202.036,211.878,"Bulldog clamps are placed on the renal artery and renal vein, initiating ischemia in the kidney region."
212.378,222.658,"The surgeon incises the renal artery and vein, creating visible openings in these vascular structures."
223.158,237.909,"The surgeon inserts the Fogarty catheter into the renal artery and inflates it with saline, ensuring it blocks the arterial lumen without rupturing the intima."
238.409,244.653,"The surgeon injects a four-degree sodium chloride solution into the renal artery, initiating cold ischemia."
245.153,255.505,"The surgeon inspects the kidney, which visibly decolors rapidly. Clear effluent is observed exiting the renal vein, indicating successful cold ischemia."
256.005,259.749,"The surgeon begins tumor enucleation on the kidney, carefully separating the tumor from surrounding renal tissue."
260.249,262.952,The surgeon uses a 3D model to visually locate surrounding arteries and veins in the surgical field.
263.412,275.463,"The surgeon performs dissection in a completely bloodless field, indicating effective vascular control and cold ischemia."
275.963,280.847,The surgeon inspects the tumor specimen to ensure complete resection before placing it into an endo bag for removal.
281.347,291.556,"The surgeon inspects the tumor bed and uses a Proline 5-0 suture to selectively close any significant leaking vessels. Additionally, the opened urinary collecting system is sutured with a running PDS 5-0 suture."
292.056,298.183,"The surgeon performs an internal urinography using a Monocryl-Three-Zero suture, following the previous steps of tumor enucleation and inspection."
298.683,302.645,"Following rhinoraphy, the cooling perfusion is halted, and the re-warming ischemia process begins."
303.145,316.873,"The surgeon closes the incision on the renal artery and vein using a running GORE-TEX®-SixZero® suture, ensuring precise approximation of the vessel edges."
317.373,322.256,"The surgeon removes the Bulldog clamps from the renal vein and artery in sequence, restoring blood flow to these vessels."
322.756,332.211,"The surgeon assesses kidney perfusion by administering intravenous indocyanine green and utilizing near-infrared fluorescence imaging, which visually highlights the perfusion status of the kidney tissue."
332.711,337.814,The surgeon applies additional external rhinography sutures and may use hemostatic agents to ensure proper closure and control bleeding.
338.314,341.675,The surgeon closes Girota's fascia and places one abdominal drain in the surgical site.
342.175,345.837,"The surgeon extracts the specimen from the surgical site and proceeds to close the wounds in layers, ensuring proper closure of each tissue layer."
346.337,354.88,"The surgeon clamps the proximal ureter and its vascular sheath to minimize venous backflow, enhancing visibility for the tumor enucleation procedure."
355.38,367.551,"The surgeon clamps the ureter, which assists in tumor nucleation and helps recognize the collecting system by inducing temporary hydronephrosis."
