start,end,text
20.648,22.889,"The surgeon employs a three-port technique for the laparoscopic repair of the Morgagni hernia, setting up the surgical field for the procedure."
23.029,34.097,"During the laparoscopic procedure, the surgeon explores the abdomen and identifies an anterior diaphragmatic defect. The herniated greater omentum is grasped with forceps and repositioned entirely into the abdominal cavity."
34.597,40.54,"The surgeon dissects and excises the hernia sac from the thoracic region, removing it from the surrounding tissue."
94.077,98.903,"Following the excision of the hernia sac, the surgeon visually assesses the dimensions of the defect in the thoracic region."
99.403,119.454,The surgeon removes the excised hernia sac from the surgical field using an endobag.
122.475,128.458,"The surgeon repairs the hernia defect using interrupted non-absorbable sutures, closing the visible opening in the tissue."
128.958,134.201,The surgeon places X-shaped stitches and U-shaped mattress interrupted sutures to secure the repaired hernia defect.
182.804,195.02,"The surgeon performs a mesh repair technique using a tailored composite polypropylene mesh, securing it in place with absorbable fixation devices."
