start,end,text
38.693,46.22,"The surgeon identifies the ureter, a challenging procedure requiring careful examination and manipulation of the surrounding anatomical structures."
46.72,56.791,"The surgeon injects indocyanine green (ICG) through the pilostomy, enhancing the visualization of the ureter under fluorescence imaging."
57.291,63.212,"The surgeon isolates and dissects the distal part of the ureter, followed by spatulation of the ureteral end."
63.232,77.356,"The surgeon performs a transversal incision on the bladder, creating an opening in the bladder wall."
77.856,86.14,"Following the placement of the first stitch in the anastomosis, the surgeon positions a double J stent within the ureter."
86.64,101.927,"The surgeon secures the ureter to the bladder using 4-0 PDS single sutures, completing the ureterovesical anastomosis."
102.427,108.91,"The surgeon uses a 4-0 PDS running suture to close the bladder, following the completion of the anastomosis and stent placement."
109.41,113.292,"Adipose tissue is placed over the anastomosis site, providing coverage and protection for the surgical area."
113.792,116.805,"The surgeon performs a bladder seal test, confirming no leakage at the site of the bladder closure."
131.829,143.132,"The surgeon identifies the ureter, visually distinguishing it from surrounding tissues."
143.632,155.06,"Indocyanine green dye is injected through the pyelostomy, likely visualizing the renal structures and confirming the patency of the urinary tract."
155.56,169.188,"The surgeon identifies the ureter as sclerotic and malasic, leading to its resection up to the pelvis."
169.688,180.073,"Due to the insufficient length of the ureter, the surgeon harvests a Boari flap along with the bladder mucosa."
180.573,192.124,"The surgeon secures tense and free single stitches at the site of the raft pelvis to bladder anastomosis, ensuring the stability of the buaric-asati flap."
192.624,204.575,The surgeon positions a double J ureteral stent within the ureter.
205.075,216.627,"The surgeon uses a PDS-SWC suture to close the bladder, carefully stitching the bladder tissue to ensure proper closure."
217.127,229.352,"The surgeon closes the dissected distal ureter at the ureterovesical junction, followed by a bladder seal test that confirms no urinary leakage."
255.429,263.054,"The pyelography image reveals a visible junctal stricture, indicating a narrowing at the junction of the ureter and renal pelvis."
263.554,277.742,"The surgeon isolates the native ureter, preparing it for further surgical manipulation."
278.242,316.425,"The surgeon identifies and isolates the graft ureter, performing a caudocranial dissection up to the renal pelvis, carefully separating the surrounding tissues."
316.925,346.578,"Saline solution is injected into the renal pelvis through the pulostomy. The native ureter is dissected up to the renal pelvis, followed by an incision into the graft renal pelvis. A double J stent is removed from the native ureter."
347.078,354.821,"The surgeon positions a double J ureteral stent within the native ureter, ensuring proper placement for urinary drainage."
355.321,362.904,"The surgeon secures the anastomosis using PDS 4-0 single stitches around the double J stent, ensuring the connection is stable."
363.404,379.73,"The surgeon injects venous ICG, which highlights the native ureter and the graft ureter, making them visually distinct."
