start,end,text
0.557,18.545,"Hello, this is a forty-year-old female who had a laparoscopic gastric bypass ten years ago, who presented with a few days of crampy abdominal pain, who was found to have an interception at the JJ."
19.045,25.73,"Upon entering the abdominal cavity, the surgeon observes that the small bowel limbs are not dilated and there are no visible signs of ischemia."
26.23,33.374,"The surgeon locates the jejunojejunostomy (JJ) and begins to run the small bowel limbs, inspecting them for any abnormalities."
33.874,40.779,"The surgeon observes the Roux limb, noting its retrocholic and retrogastric positioning, and confirms that it is fairly short with no visible signs of obstruction."
41.279,66.025,"The surgeon runs the biliopancreatic limb, observing no obstruction up to the ligament of Treitz."
66.525,80.679,"The surgeon evaluates the gastric pouch, finding no abnormalities, and inspects Peterson's defect and the jejunojejunostomy (JJ) for signs of internal hernias, confirming none are present."
81.179,85.644,"The surgeon inspects the common channel from the jejunojejunostomy (JJ) to the terminal ileum, observing no abnormalities or obstructions in the small bowel."
86.144,89.748,So the question now is what do we do with this JJ?
90.248,96.511,"The surgeon observes laxity in the common channel, which appears to be extending retrograde into the jejunojejunostomy (JJ)."
97.011,100.253,"Contrast is observed traveling up the biliopancreatic limb, indicating patency and flow within this segment."
100.753,111.019,"So the question is whether we do a plication or we let it be, or even more aggressively a JJ resection with the new anastomosis."
111.519,115.067,And we elected for a plication of the
115.567,120.853,common channel to the biliopancreatic limb where it looked the most laxity.
121.353,126.64,"The surgeon places two permanent sutures along the bowel, ensuring alignment to prevent any kinks in the tissue."
127.14,147.669,And hopefully this will prevent further interception and reduce her symptoms.
148.169,152.97,The patient is one month out from surgery with no recurrence of her severe symptoms.
153.47,166.053,I'm interested to see who would do a placation in this patient or simply let it be since it's self-reduced or who would actually perform a JJ resection on this patient.
166.553,169.314,Thank you for watching and I'll look forward to the comments.
