start,end,text
31.684,34.428,"India ink is visibly injected near the tumor site in the sigmoid colon, marking the area for surgical reference."
34.928,38.733,"The surgeon initiates medial retroperitoneal dissection of the mesocolon, using laparoscopic instruments to carefully separate the mesocolon from the retroperitoneal structures."
39.233,43.959,"The surgeon inserts an electric scalpel through the five millimeter port located in the right lower quadrant, preparing for further dissection."
44.459,48.845,"Three ports are equipped with 3.5 millimeter forceps, positioned at the right and left lateral and left lower quadrants."
49.345,65.265,"The surgeon continues the cranial dissection of the mesocolon, advancing the surgical field towards the upper regions of the abdomen."
65.765,79.449,The surgeon exposes the root of the inferior mesenteric artery and cuts it using an ultrasonic device after applying clips.
79.949,83.01,"The surgeon continues lateral retroperitoneal dissection of the mesocolon, advancing the separation of tissue layers in the surgical field."
83.51,106.606,"The surgeon identifies and preserves the left ureter and gonadal vessels, ensuring these structures remain intact during the procedure."
107.106,113.313,"The surgeon clips and cuts the inferior mesenteric vein and left colic artery, completing the vascular control in the surgical field."
113.813,137.791,"The surgeon separates the lateral attachment by dissecting the taut fusion fascia, progressing towards the median dissection plane."
138.291,140.794,"The surgeon dissects the retrolectal space, carefully separating the tissue layers in this region."
141.294,157.369,"The surgeon identifies and preserves the bilateral hypogastric nerves during the dissection, ensuring these structures remain intact within the surgical field."
157.869,173.046,"The surgeon dissects the retroperitoneum on both the right and left sides of the upper rectum, carefully separating these areas from surrounding tissues."
173.546,214.069,"The surgeon dissects the mesocolon, revealing the colonic walls along the cut line of the distal cone."
234.425,238.906,"The surgeon places an intestinal clip at the oral side of the colonic cut line, securing the tissue in preparation for further surgical steps."
239.406,261.236,"The surgeon adjusts the angle of the intestinal clip using an angle adjuster, and modifies the angle of the N-linear stapler, preparing for precise stapling along the colonic cut line."
263.588,269.97,"The surgeon extracts the specimen through a small skin incision at the umbilicus, which measures up to thirty-five millimeters in size."
270.41,279.792,"The surgeon performs an anastomosis using a double stapling technique, joining the two ends of the colon with precision."
280.292,285.454,The surgeon places a nine-inch French drain into the pelvis through a five-millimeter incision located in the right lower quadrant.
