start,end,text
29.6,36.221,"The surgeon attempts to elevate the sigmoid mesentery, but the small bowel obstructs the view, making visualization challenging."
36.301,43.345,"The surgeon initiates a lateral dissection of the sigmoid colon, beginning the process of separating the mesentery from surrounding tissues."
43.845,56.839,"The surgeon uncovers an abscess near the left pelvic side wall during the dissection, presenting a visual challenge in the surgical field."
57.339,59.381,"The surgeon scores the bowel, making precise incisions along its surface."
86.91,92.89,"The surgeon performs a lateral to medial dissection of the bowel, carefully separating the tissue layers."
93.39,106.439,"The surgeon works down the left pelvic side wall, encountering dense adhesions that make the tissue appear tightly adhered."
106.939,132.06,"The surgeon attempts to dissect distally, working to separate the left dome of the bladder from surrounding tissues."
134.14,156.708,"The surgeon attempts to gain mobility by carefully dissecting and freeing adhesions along the left pelvic side wall, progressing from lateral to medial."
157.208,163.194,"The surgeon applies significant traction to the tissue, attempting to bluntly separate and open the adhered structures."
163.674,169.7,"The surgeon inadvertently enters a chronic abscess cavity while working in the surgical field, revealing the unexpected presence of the cavity."
194.406,204.473,"The surgeon attempts to gain better access to the surgical area by approaching through the mesentery, aiming to increase mobility for further dissection."
204.794,220.549,The surgeon identifies an inadvertent window created in the mesentery and utilizes it to proceed with the dissection.
221.049,260.303,"The surgeon proceeds to dissect down towards the upper rectum, navigating through the surgical field with visible tissue manipulation."
260.803,285.69,The surgeon selects the margin on the left side of the rectum and uses it to assist in separating the mesentery from the adjacent sidewall.
290.864,293.346,"The surgeon uses an instrument to cut through the abscess cavity, visibly separating the infected tissue."
293.366,318.758,The surgeon carefully manipulates the tissue to avoid inadvertently pulling the ureter or iliac vessels off the sidewall while side biting.
319.258,330.667,"The surgeon skives into the rectal mesentery, carefully separating it from surrounding tissues."
331.167,338.693,"The surgeon has completely cleared the upper rectum, visibly separating it from the adjacent cavity."
339.193,341.855,"The surgeon uses a surgical stapler to secure the proximal bowel, ensuring closure of the bowel segment."
351.192,354.395,"The surgeon identifies the proximal margin of the bowel, marking the boundary for resection."
354.435,361.96,"The surgeon observes the bowel, noting that the scoring on the serosal surface was made far proximal to the current location."
362.46,371.346,"The surgeon staples the distal section of the bowel, completing the transection of the bowel segment."
371.846,375.794,"The surgeon prepares to perform a sewn anastomosis, aligning the bowel ends for suturing to create a continuous passage after resection."
431.559,441.528,"The surgical specimen is extracted through a fan and steel incision, which is visually observed to cause minimal discomfort to the patient."
442.028,451.692,The surgeon sews the inner layer of the bowel after completing the colotomy and proctotomy.
453.658,477.819,"The surgeon places the second inner layer suture, moving towards the patient's right side."
513.088,541.38,"The surgeon ties two sutures together, completing the inner layer closure after the colotomy and proctotomy."
541.88,550.385,"The surgeon begins the outer row of Tuo PDS sutures to imbricate the previously sewn inner layer, ensuring secure closure of the colotomy and proctotomy sites."
