start,end,text
17.777,22.54,"The surgeon creates a flap in the tissue, preparing the area for further hernia repair steps."
68.458,88.393,"The surgeon begins lateral dissection in the area of the hernia repair, using robotic instruments to carefully separate tissue layers."
88.893,105.432,"The surgeon searches for the cord structures, which begin to come into view."
105.932,114.256,"The surgeon gently sweeps the chord structures downward, noting the absence of an indirect hernia sac in the surgical field."
114.756,131.635,The surgeon identifies the vas deferens and continues to follow the dissection plane with the peritoneum already retracted.
132.135,147.086,"The surgeon dissects on the medial surface of the direct hernia, creating space before proceeding to reduce the hernia."
160.181,179.055,"The surgeon dissects past the midline to the contralateral side, creating space for mesh placement in the area of the direct hernia."
179.555,206.363,"The surgeon carefully removes residual fat from the vessels and the pubic sidewall, ensuring a flat surface for mesh placement."
206.863,234.646,"The surgeon approaches the operator space, revealing a visible fat plug commonly found in this area during hernia procedures."
235.146,250.984,"The surgeon begins parietalizing the cord structures, separating them from surrounding tissues to facilitate mesh placement."
251.484,286.597,"The surgeon checks for a lipoma and reduces it, ensuring it is positioned back far enough to be left on the parietal surface of the mesh."
287.097,295.163,"The surgeon imbricates the hernia sac using a suture, preparing it for secure closure."
352.163,400.101,"The surgeon places a 16x12 anatomic mesh more medially to ensure coverage over the direct hernia site. The mesh is positioned to sit flat, covering the obturator and femoral spaces."
400.601,427.958,"The surgeon secures the mesh medially over the direct hernia defect, ensuring it is positioned to prevent potential migration into the defect before healing."
428.458,469.573,The surgeon identifies a lipoma extending beyond the mesh and proceeds to close the flap over the surgical site.
470.073,495.561,"The surgeon examines the dissected space and places an angiocath into the flap, connecting it to a suction device for drainage."
496.061,501.918,"The surgeon evacuates gas from the surgical site, allowing for inspection to confirm that the mesh is positioned flat and covers the necessary anatomical spaces."
