start,end,text
56.106,70.413,An additional 5mm port is placed in the patient's left upper quadrant to aid in the manipulation of the massively distended gallbladder.
109.52,113.841,"The surgeon initiates a medial-first dissection of the gallbladder using robotic instruments, focusing on the area closest to the liver."
126.965,134.594,"The surgeon uses robotic instruments to dissect the gallbladder from the cystic plate laterally, following a medial dissection approach."
135.094,138.777,"The surgeon continues to mobilize the gallbladder, detaching it from the cystic plate using lateral dissection techniques."
143.399,156.168,"The surgeon fully mobilizes the gallbladder, ensuring it is detached from surrounding structures, while the surgical team prepares the necessary setup in the operating room."
156.188,166.873,"The surgeon mobilizes the artery to enhance the critical view of the surgical field, facilitating better visualization of the anatomical structures."
167.373,176.92,"The surgeon continues to dissect the gallbladder from the liver, progressing towards complete separation of the gallbladder from the liver tissue."
179.442,187.048,"The surgeon continues the dissection of the gallbladder, moving from medial to lateral across the liver bed."
187.548,193.684,"The surgeon completes the dissection of the gallbladder from the liver on the lateral side, finalizing its mobilization."
194.184,198.488,"The gallbladder is fully dissociated from the liver, indicating the completion of its dissection from the liver bed."
198.988,202.49,"The surgeon tidies up the dissection area around the gallbladder, ensuring clean separation from the liver without extending the dissection too low."
206.973,223.496,"The surgeon clips and transects the cystic artery, then prepares to externalize the gallbladder through a small mini laparotomy incision."
239.743,251.522,"The surgeon fillets the gallbladder open, tracing it down to the cystic duct orifice, where the gallbladder is transected."
252.022,254.023,The surgeon removes the gallbladder specimen through the small mini laparotomy incision.
254.523,263.568,"The surgeon completes the procedure with a standard closure of the incision site in layers using a small bite technique, ensuring no spillage from the surgical site."
