start,end,text
8.967,29.287,"Our patient is a fortieth year old female who has a past surgical history significant for laparoscopic parasophageal hernia repair in two thousand nineteen, who was referred to me with a six month history of progressively increasing chronic nausea, vomiting, PO, intolerance associated in the postprandial period."
29.787,36.073,"Past medical history significant for chronic back pain, requiring narcotics, also chronic constipation."
36.113,40.157,She also had a lap cholecystectomy in the remote past.
40.657,52.869,"As far as the workup, she underwent a CT chest, the abdomen and pelvis, demonstrating no recurrent hiatal hernia. It did show some gastric distension. It was otherwise unremarkable."
53.369,67.425,"She also underwent an EGD, which did not reveal a structuring at the level of the Nissen fundoplication. However, it was tortuous and it also showed some retained gastric content."
67.925,73.642,"Gastric emptying study was performed, which was grossly abnormal."
74.142,88.888,"So my initial thoughts were to treat this conservatively, that this may involve some vagal nerve palsy sustained during the laparoscopic PEH repair. Many of these recover with conservative management alone."
89.388,101.294,"She was being treated with prokinetics such as Reglan. However, she was hesitant to continue to take that for fear of interaction with her other medications she was on."
101.794,107.739,I watched her for approximately three to four months. Her symptoms did not get any better.
108.239,134.675,"So we reviewed the surgical options, which include pyloroplasty, pyloroplasty with gastric pacing, and gastric bypass. She didn't want to go with a maximally invasive gastric bypass. I told her if she wanted gastric pacing, I would have to refer her to a center that specializes in this. So at the end, she decided for the pyloroplasty alone."
135.175,142.85,"The surgical team utilizes four robotic ports, with the camera positioned at the supraumbilical space for visualization during the jejunostomy procedure."
143.35,161.603,"The laparoscopic view shows a left-handed instrument positioned in the right mid quadrant, with two additional instruments in the left mid and left upper quadrants. A 5mm trocar in the right upper quadrant is utilized for the liver retractor."
162.103,175.01,"The surgical team performs lysis of adhesions to create sufficient space distal to the vein of Mayo, an anatomical landmark near the pylorus. No gross abnormalities are observed in the surgical field."
175.51,184.618,"The surgeon begins a five-centimeter myotomy, starting two and a half centimeters proximal to the vein of Mayo, which serves as an anatomical landmark near the pylorus."
185.118,204.385,"The surgeon marks the area with cautery, two and a half centimeters distal to the previously identified anatomical landmark, preparing for the next step in the procedure."
204.885,222.5,"The surgeon places two anchoring sutures to delineate the vein of Mayo at the level of the pylorus, marking the anatomical landmark and providing critical support for the procedure."
222.52,240.902,"The surgeon uses anchoring stitches to manipulate and position the bowel, facilitating optimal alignment for gastrointestinal tract procedures."
241.402,286.716,"The surgeon performs a gastroduodenotomy using scissors and cautery, with Dr. Lee opening the gastric lumen using force bipolar. Care is taken to avoid injury to the back wall of the pylorus. The myotomy is extended distally by performing a duodenotomy, revealing a change in the thickness of the GI tract wall from the pylorus to the duodenum, completing the five-centimeter gastroduodenostomy."
287.216,320.432,"The surgeon uses a 3-0 V-lock absorbable suture to perform a pyloroplasty, starting at the superior edge marked by an anchoring stitch. The fourth arm is used to elevate and retract the cephalad portion of the pylorus, as the closure is performed transversely with small bites of mucosa and large bites of serosa."
320.932,361.644,The surgical team changes optics to a thirty-degree angle scope for a clearer view of the operative site. The surgeon cinches each suture with every pass while advising Dr. Lee to carefully grasp the GI tract with a force bipolar to avoid tissue injury.
362.144,395.08,The surgeon identifies a dog ear at the inferior aspect of the pyloroplasty and instructs Dr. Lee to dunk the inferior edge to obliterate it. Dr. Lee uses the fourth arm to achieve adequate exposure and retract the tissue throughout the procedure.
395.58,427.647,"The surgeon performs an over-sewing of the pyloroplasty using interrupted thoracovacral sutures, reinforcing the previous closure."
428.147,453.581,"familiarity with the console, familiarity with where to put the camera, how to utilize the instruments, as well as the fourth arm effectively, and appreciably being able to complete this case skin to skin. I'm still fascinated by the fact that junior residents can conduct such cases of high complexity such as this."
454.081,488.072,"I initially learned how to do these cases laparoscopically as a fourth year resident training under Doctor Swanstrom. Ironically, my first one that I helped leaked. So in a belt and suspenders with suspenders over suspenders, we decided to take some momentum, a pedicle of momentum and again, reinforce the pyloroplasty."
488.572,515.468,"It's amazing how much pride I have in residents who have been able to progress and perform complex cases such as this or any of the other approaches that I offer in practice. So again, Dr. Lee wants to do colorectal fellowship, and if I was a program director in that space, I would hire her in a second."
515.968,534.618,"So we kept the patient NPO after midnight and performed a upper GI study which showed no leak, advanced her to clears and then to full liquids and she was discharged on post-op day two. She's currently four weeks out now. She's tolerating a regular diet. Her preoperative symptoms are largely gone."
