start,end,text
1.094,5.058,This is how I perform a robotic sleeve gastrectomy with a hiatal hernia.
1.094,5.058,This is how I perform a robotic sleeve gastrectomy with a hiatal hernia.
5.558,21.34,"The surgeon places a twelve millimeter trocar approximately fifteen centimeters below the rib edge, along with three eight millimeter trocars and a five millimeter incision for a Nathanson retractor to elevate the liver, creating space for the robotic sleeve gastrectomy procedure."
5.558,21.34,"The surgeon places a twelve millimeter trocar approximately fifteen centimeters below the rib edge, followed by three eight millimeter trocars and a five millimeter incision for a Nathanson retractor, which is used to elevate the liver and provide space for the operation."
21.84,34.771,The video shows a sped-up sequence where the surgeon identifies the anatomical structures and proceeds to separate the blood supply from the greater curvature of the stomach.
21.84,34.771,"The video shows the surgeon identifying the anatomical structures and separating the blood supply from the greater curvature of the stomach, a crucial step in the procedure."
35.271,37.173,We have a very special robotic tool to do this.
35.271,47.902,"The surgeon uses a robotic vessel sealer to isolate, cut, and separate the blood vessels around the stomach, minimizing bleeding during the procedure."
37.193,47.902,"The robotic vessel sealer is used to isolate, cut, and separate the vessels around the stomach, minimizing bleeding during the procedure."
48.402,53.246,This video obviously is sped up to show all the steps of the video.
48.402,53.246,This video obviously is sped up to show all the steps of the video.
53.746,57.329,"The surgeon advances towards the spleen, approaching the angle of His, with visible anatomical landmarks guiding the progression."
53.746,62.593,"The surgical team carefully advances towards the spleen and the angle of His, ensuring that only necessary tissue is manipulated during the procedure."
57.829,62.593,"And again, we're being very careful to damage only the tissue that we need to."
63.093,67.537,And this patient unfortunately did have a hiatal hernia that was not picked up on preoperative endoscopy.
63.093,70.178,And this patient unfortunately did have a hiatal hernia that was not picked up on preoperative endoscopy. approximately a four centimeter hiatal hernia.
68.037,70.178,The surgeon visually identifies a hiatal hernia measuring approximately four centimeters in diameter.
70.579,76.282,"And at this point, we realized that we had to perform a repair on this to hopefully prevent reflux."
70.579,80.465,"And at this point, we realized that we had to perform a repair on this to hopefully prevent reflux. There's a lot of reasons to perform a hiatal hernia on these patients."
76.322,80.465,There's a lot of reasons to perform a hiatal hernia on these patients.
80.965,86.189,"In particular, we're worried if there is a possible leak, we wanna keep that in the abdominal cavity"
80.965,112.066,"The surgeon separates and visualizes the right and left crura of the diaphragm, ensuring the hiatus is appropriately tight to maintain the anti-reflux mechanism. The inferior vena cava is visible just to the left of the screen beneath the liver."
86.689,112.066,"The surgeon separates and visualizes the right and left crura of the diaphragm, with the inferior vena cava visible just to the left of the screen beneath the liver."
112.566,124.198,The surgeon carefully performs blunt dissection to separate the esophagus from adhesions connected to the diaphragmatic crura.
112.566,124.198,The surgeon performs blunt dissection to carefully separate the esophagus from adhesions connected to the diaphragmatic crura.
124.698,128.041,"The surgeon has placed a bougie into the esophagus of the patient, which is visible within the surgical field."
124.698,131.243,"The surgeon places a 36 French bougie into the esophagus of the patient, ensuring proper sizing and positioning for the procedure."
128.541,131.243,I do like to use a thirty-six French bougie.
131.703,153.8,"The surgeon uses a suction bougie, known as a visigi bougie, to calibrate the stapling during the sleeve gastrectomy. The bougie applies a slight vacuum to the intragastric space, ensuring clear visualization of the staple line and facilitating manipulation of the esophagus."
131.703,153.8,"The surgeon uses a visigi bougie, a suction device, to calibrate the stapling during sleeve gastrectomy. The bougie applies a slight vacuum to the intragastric space, ensuring clear visualization of the staple line and esophagus manipulation."
154.3,164.786,"The surgeon has identified the right and left crura and begins the repair of the diaphragmatic hernia, focusing on the anatomical structures visible beneath the liver."
154.3,164.786,"The surgeon identifies the right and left crura of the diaphragm and begins the repair of the diaphragmatic hernia, focusing on the anatomical structures visible beneath the liver."
165.286,169.168,"Again, identification of the anatomy here is very important."
165.286,181.775,"The surgeon identifies the anatomical structures, focusing on preserving the vagal nerves. Using a robotic system, they gently approximate the tissues with a number one Ethabon suture."
169.548,171.45,We want to preserve the vagal nerves.
171.95,181.775,"The surgeon uses a number one Ethabon suture with robotic assistance to gently approximate the tissue, ensuring precise alignment during the hernia repair."
182.275,206.311,"The surgeon uses robotic assistance to approximate the crural fibers, employing slip knots to aid in the diaphragmatic hernia repair. The robotic system provides enhanced visual control, compensating for the lack of tactile feedback."
182.275,222.266,"The surgeon uses robotic assistance to re-approximate the crural fibers with sutures, carefully closing the tissue with slip knots. The robotic tools provide precise control, aiding in the repair of the diaphragmatic hernia."
206.811,222.266,"The surgeon uses sutures to re-approximate the tissue, achieving a precise repair of the diaphragmatic hernia with robotic assistance."
222.766,226.207,Usually it does take about three or four sutures to re-approximate this repair.
222.766,245.813,"The surgeon uses three or four sutures to re-approximate the repair, placing them approximately seven to eight millimeters apart to avoid excessive tension and prevent tearing of the acryl fibers."
226.227,230.668,I usually go about seven to eight millimeters away.
230.688,233.369,I don't want to put any excessive tension on here.
233.389,235.01,I don't want to rip the acryl fibers.
235.07,245.813,"It's very important to be very cautious and very gentle with this tissue, especially given the close proximity to the surrounding structures like the vagus, like the inferior vena cava."
246.313,253.043,"Having excellent tissue control is very, very important in making sure you know where your instruments are"
246.313,262.626,"Having excellent tissue control is very, very important in making sure you know where your instruments are Also another very important thing to do in this area is to make sure that we're not going too tight here."
253.543,262.626,Also another very important thing to do in this area is to make sure that we're not going too tight here.
263.126,266.447,Patients tend to develop some significant dysphagia if these muscles are too tight.
263.126,276.811,"Patients tend to develop some significant dysphagia if these muscles are too tight. We also do expect some swelling of the area of the crucian esophagus after surgery. So if the area is brought too tight, of course they can have dysphagia."
266.807,271.449,We also do expect some swelling of the area of the crucian esophagus after surgery.
271.949,276.811,"So if the area is brought too tight, of course they can have dysphagia."
277.311,279.972,"And of course, if it's too loose, we can have"
277.311,282.474,"And of course, if it's too loose, we can have perhaps increase reflux."
280.472,282.474,perhaps increase reflux.
282.974,285.936,The other thing I like to do is avoid using extra instruments.
282.974,303.169,"The surgeon uses the vessel sealer's cutting function instead of robotic scissors to minimize instrument usage, focusing on cost savings and procedural efficiency."
286.436,290.319,We do not use a robotic scissors to save costs.
290.799,297.583,The surgeon uses a vessel sealer with an integrated cutting function to perform precise tissue cutting during the procedure.
298.083,303.169,We want to limit the amount of instruments that we use both for cost savings and for speed.
303.669,313.26,"The surgeon tightens sutures using a large needle driver, ensuring an adequate repair, and then cuts the sutures with a vessel sealer."
303.669,321.518,"The surgeon uses a large needle driver to tighten sutures, achieving an adequate repair. The vessel sealer is then used to cut the sutures, demonstrating the ability to pull the suture out correctly to avoid extra instrument passes."
313.681,321.518,And not only that but I can actually pull the suture out if done correctly so we can avoid any extra instrument passes.
322.018,324.719,"The surgeon has completed the closure of the hiatus, indicating the end of the suturing process in the surgical field."
322.018,332.463,"The surgeon has closed the hiatus, ensuring the repair is not overly tight and the left and right crura are well approximated. The stapling process is about to begin."
324.739,325.78,I'm happy with the repair.
325.82,329.742,"The surgeon assesses the approximation of the left and right crura, ensuring the sutures are not too tight, with visible alignment of the anatomical structures."
330.182,332.463,"The surgeon initiates the stapling process, using a surgical stapler to secure tissue layers following the completed suturing of the hiatus."
332.883,344.489,"The surgeon inspects the surgical area for any excess fat or herniated omentum that could interfere with the stapling process, ensuring a clear field for the procedure."
332.883,352.599,The surgeon inspects the surgical area for excess fat or herniated omentum that could interfere with the stapling process. The stomach is visually assessed for healthy color and viability before initiating the stapling procedure.
344.989,349.798,"The surgeon inspects the stomach, assessing its color to ensure it appears healthy and viable."
350.298,352.599,"The surgeon initiates the stapling process on the stomach, ensuring the tissue is healthy and viable, with no excess fat or herniated omentum interfering with the procedure."
353.099,355.941,"The bougie is positioned within the stomach to calibrate the stapling process, ensuring accurate alignment and sizing during the procedure."
353.099,365.325,"The surgeon positions the bougie to calibrate the stapling process, beginning approximately four centimeters from the pylorus using a robotic green stapler."
355.981,361.123,The surgeon positions the stapler approximately four centimeters from the pylorus to initiate the staple line on the stomach tissue.
361.623,365.325,"The surgeon begins the stapling process using a robotic green stapler, ensuring precise alignment along the stomach tissue."
365.825,372.711,And I really have become very comfortable using the SureForm stapling devices.
365.825,381.177,"The surgeon uses the SureForm stapling device, which provides feedback cues to ensure the chosen staple is appropriate for the sensed tissue."
373.211,375.052,They do adequately sense the tissue.
375.112,381.177,They make sure that the staple that you're choosing is adequate with giving you feedback cues.
381.677,408.425,"The surgeon aligns the staples along the stomach, ensuring a secure but not excessive bite of tissue. The staple line appears hemostatic, and the stapler's angulation allows for easy manipulation as the surgeon marks up towards the angle of His."
381.677,410.366,"The surgeon aligns the staples along the stomach, ensuring a proper tissue bite without excess. The staple line appears hemostatic. The stapler's angulation aids in maneuvering as the surgeon flattens the stomach towards the angle of His."
408.925,410.366,"The surgeon positions the stapler flat against the tissue, preparing for staple deployment."
410.826,413.248,There's no extra tension that's being placed here.
410.826,424.556,"The surgeon ensures a tension-free staple line at the angle of His, a critical area where leaks are most likely to occur, while firing the stapler."
413.748,417.271,"The surgeon fires the stapler, ensuring a tension-free staple line along the stomach tissue."
417.771,421.814,Some of the most important fires I do believe are at the top at the angle of hiss.
421.834,424.556,This is where the majority of leaks can happen.
425.056,439.753,"in gastric sleeve patients, and I think it's important to not leave too much of the fundus here, and you also don't want to go too tight to the bougie, and you want to make sure that you have a good, healthy amount of tissue and a nice, smooth staple line."
425.056,459.539,"The surgeon ensures that the gastric sleeve procedure results in a well-uniform cylindrical shape of the stomach, avoiding excessive tension or irregularities in the staple line. Care is taken not to leave too much of the fundus and to maintain a healthy amount of tissue while keeping the staple line smooth."
440.253,445.355,"Ultimately, I feel that the angle of the staples coming down is very important."
445.855,456.738,"It's important for that stomach that you're leaving behind to be a well-uniform cylinder without any excessive tension, without any irregularity of the staple line."
457.218,459.539,I think this does help a lot with...
460.039,465.642,post-operative dysphagia and ultimately having patients happier and less symptom free.
460.039,492.341,"post-operative dysphagia and ultimately having patients happier and less symptom free. I do believe in doing an intraoperative endoscopy at the end of the case. Not only am I looking for bleeding, I'm making sure that the stomach that's left behind is healthy, is viable, and is a good cylindrical tube without any torsion. I think this is important to do some sort of leak test in these patients. And also, after this, I do use a fibrin hemostatic agent."
466.083,469.285,I do believe in doing an intraoperative endoscopy at the end of the case.
469.705,481.092,"The surgeon inspects the remaining portion of the stomach for signs of bleeding and assesses its viability, ensuring it forms a healthy cylindrical tube without torsion."
481.592,486.536,I think this is important to do some sort of leak test in these patients.
487.036,492.341,"And also, after this, I do use a fibrin hemostatic agent."
492.841,507.112,"The surgeon cuts the tip of a nasogastric (NG) tube and places it intra-abdominally, using the modified tube as a suction device during the procedure."
492.841,527.258,"The surgeon cuts the tip of an NG tube and places it intra-abdominally to use as a suction device, aiming to reduce costs. A special fibrin glue is applied to control hemostasis, and a portion of omentum is positioned over the stomach to maintain a smooth angle and prevent torsion."
507.412,509.053,to provide a significant amount of cost savings.
509.093,514.154,"The surgeon applies a fibrin hemostatic agent to the surgical site, using the fiber and glue to control bleeding and ensure hemostasis."
514.654,524.698,I also think that this does help at times positioning the stomach to keep that angle of the stomach smooth and avoid any potential torsion.
525.158,527.258,"The surgeon places a portion of the omentum over the stomach, visually covering the gastric surface with the fatty tissue."
527.598,532.341,The surgeon removes the stomach through a twelve millimeter incision and closes the incision using a Carter Thompson device.
527.598,543.061,The surgeon removes the stomach through a final twelve millimeter incision and closes the incision using a Carter Thompson device.
532.841,543.061,Most of these patients do go home within a day after surgery and overall I'm very comfortable and happy with the way these cases have gone with the robot and I think it's an excellent tool.
