start,end,text
0.752,14.116,This is a video to describe the technical aspects in acute cholecystitis in a young lady with a history of pain in abdomen since three days and multiple such episodes in the past with severe pain in the right upper abdomen and leukocytosis.
14.616,18.437,The initial inspection reveals numerous omental adhesions surrounding the gallbladder area.
18.937,22.277,The surgeon begins the procedure by performing adhesiolysis to carefully separate the omental adhesions observed during the initial inspection.
22.777,29.539,"The surgeon uses the left hand to provide counter traction while employing a hook instrument to manipulate tissue, following the technique of 'hook, look, and cook' for precise dissection."
30.039,32.279,"The surgeon uses a hook to grasp the tissue, visually inspects the area, and then applies cautery to the tissue."
32.779,44.83,"The pneumoperitoneum aids in dissecting the tissue planes, allowing the surgeon to access the correct anatomical plane while minimizing collateral damage."
45.33,56.799,"The surgeon continues adhesiolysis in the right upper abdomen, retracting the colon downward and laterally to release the lateral attachments of the omentum."
57.299,63.224,These kind of adhesions signify that this patient had multiple episodes of pain in the past.
63.724,68.998,"The surgeon continues adhesiolysis along the edge of the liver, using surgical instruments to carefully separate adhesions from the liver tissue."
69.498,74.041,"And the principle of surgery here is traction, counter traction and action."
74.541,79.625,"The surgeon uses the left hand to provide counter traction, assisting in the dissection process by stabilizing the tissue and enhancing visibility of the surgical planes."
80.125,90.612,"The surgeon continues adesolysis near the gallbladder, carefully separating adhesions to enable retraction of the gallbladder fundus."
91.112,97.282,"The surgeon observes fluid-laden tissue, indicating an episode of acute cholecystitis, as the dissection continues along the liver edge."
97.782,101.748,"The surgeon completes the dissection of omental adhesions on the lateral aspects, revealing the underlying anatomical structures."
102.248,106.813,"The surgeon addresses the medial aspect of the surgical field, methodically bringing down adhesions using traction and counter traction techniques."
107.313,115.275,without which you can have a small tear in the glycerin capsule which can lead to unnecessarily bleeding.
115.775,124.978,"After completing the adhesiolysis, the surgeon uses a hook to perform dissection, followed by the use of a suction cannula to further dissect and clear the surgical field."
125.478,139.323,"The surgeon uses a dissecting tool to open up tissue planes in the area of Calot's triangle, avoiding energy devices to clearly delineate the anatomy."
139.823,142.844,"The surgeon uses a hook instrument to assist in dissecting tissue, visibly separating anatomical planes and structures."
143.344,151.087,"The surgeon resumes monopolar dissection using blend current mode in the area of Calot's triangle, focusing on precise tissue separation."
151.587,159.729,"The surgeon uses monopolar current to carefully dissect layer by layer, ensuring precise separation of tissue planes."
160.229,163.812,"The surgeon continues the edizolysis in the area of the Calot's triangle, using a suction cannula to assist in the dissection process, visibly separating tissue planes."
164.312,172.198,"The surgeon identifies the vessel originating from the cystic artery that supplies the cystic duct, focusing on the anatomical structures within the dissected area."
172.698,180.483,"The surgeon uses monopolar electrosurgery to coagulate the vessel, creating a visible space between the cystic artery and the cystic duct."
180.983,190.668,"The surgeon uses the left-hand instrument in a splaying technique to carefully dissect between the cystic artery and cystic duct, separating these vital structures."
191.168,196.829,"After completing the dissection, the surgeon identifies the critical view of safety, ensuring clear visualization of the cystic duct, cystic artery, and the liver bed."
197.069,206.791,The surgeon completes the posterior dissection and reflects at least 2.5 centimeters of the gallbladder upward to achieve the critical view of safety.
207.291,209.111,"The surgeon creates a visible window between the cystic artery and cystic duct, highlighting the space formed during dissection."
209.611,216.036,"The surgeon clips and cuts the cystic artery, completing its separation from the cystic duct."
216.536,223.441,"The surgeon uses a laparoscopic technique to milk out the cystic duct, applying pressure to expel its contents during the cholecystectomy procedure."
223.941,231.286,The surgeon identifies a small stone at the level of the cystic duct and uses a milking technique to move the stone upwards.
231.786,240.051,"Two Hem-o-lok clips are visibly positioned on the white cystic duct, securing it during the cholecystectomy procedure."
240.551,248.706,"The surgeon uses a titanium large clip to secure the cystic duct after milking it upwards, ensuring the duct is properly clipped."
249.206,263.897,"The surgeon carefully cuts the cystic duct evenly to prevent any residual tissue at the distal end, which could lead to slippage of the stump."
264.397,271.381,"The surgeon reflects the gallbladder using the flagging technique, manipulating the gallbladder on either side to improve exposure of the surgical field."
271.881,280.505,"The surgeon flags the gallbladder on both the right and left sides, employing the 'hook, look, and cook' technique to manipulate and assess the gallbladder during the procedure."
281.005,289.67,It's important to do it in this sequence so as to avoid any damage because of the direct or indirect application of the current.
290.17,301.292,"The surgeon completes the final dissection around the fundus of the gallbladder, ensuring the area is fully separated from surrounding tissues."
301.792,312.139,"The surgeon safely removes the gallbladder from the fossa without any spillage, placing the specimen into a retrieval bag for extraction."
312.639,321.305,"After placing the gallbladder specimen in a retrieval bag, the surgeon performs a gentle saline lavage in the surgical area to visually inspect for any bleeding spots."
321.805,332,"The surgeon addresses low pressure, low volume bleeding by applying a small piece of Surgicel to the affected area, aiming to control the bleeding effectively."
332.5,338.184,It's always better to avoid any kind of gladiating currents to be applied on the omentum.
338.684,349.531,"The surgeon places a drain in the surgical area using an NG tube, following the removal of an acutely inflamed gallbladder."
350.031,365.787,"The surgeon widens the epigastric port to facilitate the removal of the gallbladder specimen, which is then extracted through the port. A small metadine gauze is used to clean the port area after removal."
366.287,369.731,That completes the entire procedure in an acute scenario. Thank you very much.
