start,end,text
5.201,22.926,"A seventy-four years old female patient presented to our clinic complaining of full thickness rectal prolapse and obstructive defecation. Eight centimeters prolapse bowel segment with segmental ischemia, ulceration and distal rectal stricture approximately two centimeters during examination was found."
23.426,26.266,"The colonoscopy reveals no additional pathology within the rectal and colonic segments, confirming the absence of other abnormalities."
26.766,35.103,"Past medical history consisted of ischemic cardiac disease, type two diabetes and Alzheimer's disease."
35.603,37.687,"The patient is positioned in the lithotomy position, with legs elevated and supported, providing optimal access to the rectal area for the surgical procedure."
38.187,44.576,"The surgeon uses a lone star retractor to expose the renal area, providing a clear view of the anatomical structures in this region."
45.076,85.316,"The prolapsed rectum is fully everted, revealing fibrotic tissues and a distal rectal stricture."
85.816,163.056,"The surgeon makes a circumferential incision in the rectal wall using monopolar electrocautery, positioned approximately one centimeter distal from the dentate line."
163.556,182.636,"The surgeon fully mobilizes the roll-up segment of the rectum using monopolar electrocautery, achieving hemostasis with bipolar I-IV when necessary, and ligates the mesorectal vessels with III-O Vicryl sutures."
183.136,199.823,"The surgeon divides the rectal wall circumferentially proximal to the dentate line using surgical instruments, continuing the dissection process."
200.323,219.21,"The surgeon divides the mesorectum at the rectal transduction line, using surgical instruments to separate the mesorectal tissue from the rectum."
219.71,267.853,The surgeon incises the anterior wall of the prolapsed rectal segment and places three full-thickness interrupted sutures using free-hand technique with Vicryl suture material.
268.353,420.869,"The surgeon transects the distal part of the prolapsing rectum and performs a complete anastomosis using a suturing technique, ensuring the rectal continuity is restored."
421.369,425.635,"Postoperative course was uneventful, patient discharged on postoperative day four."
