start,end,text
19.349,39.672,"The surgeon places ports in the left upper quadrant, aligning them in a straight line with eight centimeters spacing towards the right lower quadrant."
40.172,63.323,"The surgeon uses robotic instruments to suspend the transverse colon and right colon to the abdominal wall, enhancing exposure for dissection."
63.823,87.388,"The surgeon opens the mesenteric envelope and dissects the tumors using a medial-lateral approach. The duodenum is exposed, and the ileocolic vessels are identified."
87.888,112.535,"The surgeon clips and divides the ileocolic vein originating from the superior mesenteric vein. The distal ileum is identified, and the mesentery is divided to address adhesions in the pelvis."
113.035,124.579,"The surgeon frees the small intestine, preparing it for anastomosis later in the operation."
125.079,144.84,"With the robotic fourth arm providing proper exposure, the surgeon continues the cephalad dissection and identifies the right colic vein, which is clipped and divided using robotic clips."
153.901,167.984,"The surgeon identifies the right colic artery, clips it, and divides it, following the previous dissection of the right colic vein."
168.484,182.462,"The surgical field shows proximity to the pancreas and duodenum, with these structures clearly visible in the operative area."
182.962,189.345,"The surgeon continues dissection on top of the pancreas and duodenum, carefully separating tissue layers in this region."
189.845,197.989,"The surgeon uses the fourth arm of the robotic system to take down the suture, allowing for further retraction and improved exposure of the surgical field."
198.489,226.627,"The surgeon identifies the right branch of the midcolic vessels, clips them, and divides them using surgical instruments."
227.127,261.741,"The surgical team replaces a sponge underneath the transverse colon, pulling it caudally to enter the lesser sac. They divide the omentum and identify the right gastroepiploic vessels along the greater curvature of the stomach, which are then divided. The dissection progresses towards the hepatic flexure."
262.241,292.079,"The surgeon attempts to identify and connect the spaces from the opposite side, where the sponge was previously left, revealing the gastrocolic trunk."
292.579,322.451,"The surgeon continues the dissection towards the hepatic flexure to mobilize the right colon, using the previously taken down suture to relieve tension during the procedure."
322.951,326.254,"The surgeon divides the distal ileum using a surgical instrument, completing the separation of this section of the small intestine."
326.754,337.284,"The surgeon marks the transverse colon with a suture and proceeds to divide it, following previous dissection steps."
337.784,356.784,"The surgeon uses a vessel sealer to completely divide any remaining attachments around the hepatic flexure, ensuring full mobilization of the right colon."
357.284,358.485,"The surgeon has completed the disconnection of the anatomical structures, visually confirming the separation of the previously connected areas."
358.825,360.527,The surgeon places the specimen on the side after completing the dissection and mobilization of the right colon.
361.027,366.332,"The distal ileum is positioned adjacent to the transverse colon, showing the spatial relationship between these two sections of the intestine."
366.832,377.461,"The surgeon parks the anastomosis in the right upper quadrant, placing a suture and using the fourth arm of the robotic system for optimal exposure."
377.961,382.445,"The surgeon demonstrates an isoperistaltic anastomosis, showing the alignment of the bowel segments with matching peristaltic directions."
387.055,425.678,"The surgeon uses ICG to assess the blood supply of the small intestine and transverse colon, followed by the use of a 45mm stapler to perform the anastomosis."
426.178,436.484,The surgeon uses the fourth arm of the robotic system to align the anastomosis between the distal ileum and the transverse colon in the right upper quadrant.
436.984,512.841,"The surgeon closes the common channel opening using a 3-0 absorbable barbed suture, employing a canal suture technique with a nine-inch length."
513.341,527.505,"The completed anastomosis is visible, with the barbed suture locked on itself to secure the connection."
528.005,537.808,"The surgeon uses indocyanine green (ICG) to assess the blood supply of the anastomosis, ensuring adequate perfusion to the connected intestinal segments."
538.308,542.068,"The surgeon removes all sutures from the completed anastomosis site, revealing the underlying tissue."
543.869,550.776,"The specimen is extracted through the stapler port, with four visible incisions on the patient's abdomen."
