start,end,text
0.131,12.657,"Hi, Dr. Charles Chabert, urologist and director of The Prostate Clinic. The following video is the first in a series of videos highlighting the various steps used in a robotic assisted radical prostatectomy."
13.157,29.431,"The surgeon gains access from the intraperitoneal cavity into the preperitoneal space by dividing the uracil attachment from the umbilicus, creating the preperitoneal plane."
29.811,42.645,"The surgeon continues the dissection using a combination of sharp and blunt techniques, focusing on the lateral aspect just posterior to the medial umbilical ligament."
43.145,52.005,"The surgeon continues dissection using bipolar forceps in the left hand and monopolar scissors in the right hand, manipulating tissue within the surgical field."
52.505,62.897,Coordination between the assistant and the primary surgeon is critical to facilitate good and prompt access into the retropubic space of retzius.
63.397,84.152,"The surgeon visualizes the pelvic floor and mobilizes the right prevesical space, progressing towards the medial umbilical ligament and descending into the retropubic space of Retzius on the patient's right side."
84.652,97.436,"The surgeon identifies and manipulates loose areolar tissue, which appears relatively avascular, facilitating straightforward access towards the pelvic floor."
97.936,124.305,"The shiny tissue visible on the right side is the reflection of the endopelvic fascia. The puboprostatic ligament, seen as a condensation on both sides, secures the prostate to the posterior aspect of the pubis. The surgeon proceeds to defat the prostate, noting the patient's relative paucity of extraperitoneal or preperitoneal fat."
124.725,138.182,"The surgeon removes tissue to enhance visualization of the anterior surface of the prostate, highlighting the junction between the prostate and the bladder."
138.682,159.661,"The surgeon makes an incision in the endopelvic fascia on the patient's right side, using sharp and blunt dissection to reflect the fibers of the levator ani muscle. These fibers are retracted and dissected off, extending around to the apex of the prostate."
160.001,172.671,"The puboprostatic ligament is visible at the top of the screen, with the prostatic component being divided while the urethral component remains intact."
173.171,181.677,My opinion on this is that it facilitates better support of the urethra and allows earlier return of urinary control.
182.177,188.861,"The surgeon performs sharp and blunt dissection on the patient's left side, reflecting the fibers of levator ani off the endopelvic fascia and retracting them to expose the apex of the prostate."
189.241,198.746,"The surgeon uses diathermy to carefully access the endopelvic fascia, reflecting the levator ani fibers off the prostate with a combination of sharp and blunt dissection."
199.167,207.014,"The surgeon cauterizes a small perforating bleeder from the levator ani muscle using bipolar diathermy, ensuring hemostasis in the surgical field."
207.514,217.3,"The surgeon divides the superficial component of the puboprostatic ligament on the patient's left side, while leaving the urethral aspect intact."
217.8,235.831,"The surgeon releases the cephalad retraction on the bladder, securing the cut edges of the reflected endopelvic fascia over the prostate in the midline, which aids in controlling the dorsal venous complex."
236.331,262.527,"The surgeon uses an O PDS suture on a semicircular needle, passing it through the notch between the urethra and the dorsal venous complex (DVC) to the contralateral side. The absence of bleeding upon pulling the suture confirms correct placement, and the suture is secured on the preserved urethral component."
263.027,302.418,"The surgeon secures the puboprostatic ligament with a stitch, ensuring hemostasis during apical dissection. A slip knot is applied with alternating throws, elevating the suture at ninety degrees to the urethral plane. The knot is cinched down in a lassoing fashion to control the dorsal venous complex (DVC)."
302.918,315.906,The surgeon secures the suture with additional throws to prevent it from pulling through or slipping during the procedure.
316.406,326.525,"The surgeon divides the suture, removes the needle, and places a second suture in the surgical field."
326.965,340.208,"The surgeon places a suture through the previously divided uracus, providing additional cephalad retraction of the bladder to facilitate the dissection of the bladder neck."
340.228,353.419,"If you enjoyed this video, please give it a thumbs up and subscribe to our YouTube channel for more content on the contemporary management of prostate disease. Thanks again, and if you have any questions, please leave them in the dialogue box below."
