start,end,text
0.731,18.243,"Hello everyone, this is Roxanne Liu and I present a large right direct inguinal hernia. This is actually a scrotal direct inguinal hernia. And I'm presenting this case because I ended up placating the transversalus fascia, which I pretty much never do."
18.743,21.605,So I thought I'd share with everyone and see what your thoughts are.
22.105,32.89,"The surgeon begins reducing the direct right inguinal hernia, carefully peeling away the edge of the transversalis fascia."
32.91,43.515,"The hernia sac is primarily composed of peritoneum and preperitoneal fat, with a possible inclusion of bladder tissue."
44.015,54.482,"The surgeon carefully navigates around the edge of the hernia defect, reducing the hernia sac by moving laterally to locate the correct anatomical plane."
54.982,67.128,"The surgeon navigates through the hernia site, distinguishing between preperitoneal fat associated with the femoral space and fat descending with the hernia sac."
67.628,77.151,"The surgeon continues the reduction of the direct right inguinal hernia, carefully manipulating the elongated hernia sac to separate it from surrounding tissues."
77.651,96.46,"In this case, it probably would have helped to have another instrument in, but I felt like I could definitely reduce it without adding the additional instrument."
96.96,105.284,"The surgeon cautiously presses down with scissors, attempting to form a right angle or gently grip the tissue with the scissor tip."
105.784,125.408,"The surgeon identifies a small bleeder and pauses to ensure there is no further bleeding on the counter sac side, carefully monitoring the area for any retraction or additional bleeding."
125.908,133.213,"The surgeon completes the reduction of a large hernia, with visible tissue manipulation and adjustment within the surgical field."
133.713,148.304,"And so I'm thinking now, what am I going to do with that big hole in space? In the past, I would have just placed a piece of mesh. But inevitably, these people always get a big seroma."
148.804,163.738,"And I've never had to go back in to remove a seroma or drain a seroma. you know, it is fairly large and, you know, then this guy, I would guess it would turn into a large mango-sized seroma sac."
163.758,181.452,"So I'm starting to think about, well, maybe I should try to placate the transverse salis despite The warnings out there, you know, I figure I could grab small bites of the transverse salis. I know TJ Swope does that and imprecates it so that there's less dead space."
181.952,197.18,"The surgeon crosses the midline to position the mesh beyond the medial edge of the direct defect, following extensive lateral dissection in the space of Bogros."
197.44,223.211,"The surgeon combines the space of Retzius and the space of Bogros, navigating through a natural plane to avoid disturbing the iliac and femoral fat amidst abundant adipose tissue."
223.711,230.416,The surgeon aims to achieve a depth of at least two centimeters to ensure adequate posterior coverage of the mesh.
230.916,251.849,"The surgeon begins dissection laterally over the testicular vessels, progressing medially into the pelvic region."
252.349,266.174,The surgeon observes bowel positioned closely against the peritoneum and avoids using cautery. The surgeon attempts to plicate the transversealis fascia by carefully grasping it.
266.674,303.675,"The surgeon lifts a tissue layer and identifies an additional layer beneath it, deciding to incise the newly discovered layer. CO₂ is introduced into the space outside the countersack to facilitate reduction of the transverse salis. The surgeon considers removing the inner lining but opts not to due to its complexity."
304.175,329.62,"The assistant switches to a needle driver, preparing to use a 3-0 V-Lock 180 suture. The surgeon attempts to take very small bites with the suture, although the application appears challenging."
330.12,349.744,"The surgeon attempts to take small bites with the suture while pulling the transversalis fascia into the space, facing challenges due to the proximity of the genital branch."
350.244,377.919,"The surgeon attempts to make a small purchase on the transversalis fascia, being cautious due to the proximity of the nerve on the opposite side of the fascia."
378.419,395.098,So my goal was trying to essentially close the dead space And so I don't want to just grab the rim of this defect.
395.478,430.056,"The surgeon aggressively incorporates the tip of the hernia sac with larger suture bites, causing the mass of the transversalis fascia to be pulled into the surgical space."
430.556,459.609,"The surgeon sutures the transversalis fascia down to Cooper's ligament using a 3-0 V-lock suture, effectively reducing the bunching of the transversalis fascia. The V-lock suture secures the fascia in place, preventing slippage."
460.109,480.632,"The surgeon takes another suture bite into Cooper's ligament to secure the counter sack and prevent it from retracting into the inguinal canal, creating a stable wall for mesh placement."
481.132,503.167,"The surgeon locks the suture to prevent unraveling, completing the suturing process. Next, the surgeon prepares to place a 3D Max mid extra-large mesh into the surgical site."
503.667,563.583,"And, uh, this mesh of course is new and, uh, I'm new to the three D max world. I, I'm, I've been a long time pro grip user, but I'm beginning to really like the three D max. It just conforms really nicely to the pelvis. And the mid is very easy to handle. Um, and, uh, It just always seems to conform well to the space. Whereas with ProGrip, a lot of times there are creases and folds. I know that mesh doesn't integrate as well when there are creases and folds. Sorry, I smeared the scope so I'm going to clean the scope. I wish this part was a little bit clearer. The video didn't capture well because of the smear. But you'll see the mesh in good position once I clean the scope. So the mesh covered the direct space quite nicely. This was an extra large. So I made it go past midline."
563.583,600.428,"The surgeon adjusts the position of the extra large Three D Max Mid mesh by shifting it laterally and rotating it clockwise to improve lateral coverage. A stitch is placed in Cooper's ligament to secure the mesh during the tap repair, ensuring the posterior edge overlap remains stable and prevents the mesh from lifting or sliding."
600.928,638.436,"Using the robotic system, the surgeon places an additional stitch to secure the mesh over a large direct defect. The mesh is positioned well laterally, with the posterior lateral edge tucked into a pocket to prevent lifting, eliminating the need for an anterior lateral stitch."
638.456,690.872,"The surgeon checks the posterior edge of the mesh to ensure it is properly positioned in the retropubic space and tucked under the visible hernia sac. The peritoneal defect is closed using a V-lock suture, with a focus on ensuring adequate coverage."
691.372,757.686,"The surgeon uses the MaxMid mesh, aiming for optimal apposition of the peritoneum against the mesh by decreasing the pneumoperitoneum to 8 mmHg to desufflate the pocket. CO₂ is pressed out of the preperitoneal space before closing the defect, then the pneumoperitoneum is increased back to 15 mmHg to achieve a suction-like effect for mesh adherence."
758.186,778.821,"The peritoneum is elevated and positioned well, with a visible large hole that is left as is. The tip of the hernia sac remains in place without additional suturing to the peritoneal flap."
