start,end,text
0.203,10.068,"The laparoscopic view reveals bilateral femoral hernias in the patient, with the robotic setup prepared for repair."
10.088,13.25,"The laparoscopic view shows the right femoral hernia, which appears larger than the left femoral hernia."
13.75,25.865,"After examining the surgical field laparoscopically, the surgeon prepares to dock the XI robotic system, positioning three ports in the upper abdomen for the procedure."
26.365,29.406,"The surgeon holds a fenestrated bipolar instrument in the left hand and a pair of scissors in the right hand, preparing to perform surgical maneuvers on the bilateral femoral hernia."
29.446,38.568,"The surgeon manipulates a piece of fat in the pelvic region, pressing it upward to ensure it remains out of the visual field during the procedure."
39.068,41.729,"The surgeon begins the robotic bilateral femoral hernia repair on the left side, using the laparoscopic view to guide the procedure."
42.229,52.262,"The surgeon creates a standard peritoneal flap by making a vertical, somewhat oblique incision, followed by a transverse horizontal incision."
52.762,60.186,"The surgeon navigates within the preperitoneal plane, avoiding entry into the retrorectus plane, while manipulating tissue layers in the abdominal cavity."
107.045,108.806,"The surgeon navigates to the space of Retzius, an area located behind the pubic bone, as part of the dissection process."
109.306,116.527,The surgeon carefully maintains the retrorectus fat layer while approaching the Cooper's ligament during the dissection.
117.027,126.57,"The surgeon uses scissors to cut the medial umbilical ligament, which was inhibiting the movement of the right arm during the procedure."
127.07,135.547,"The surgeon carefully maneuvers laterally in the space of Bogros, closely hugging the peritoneum to maintain precise dissection."
136.047,141.354,"The surgeon carefully progresses towards the deep pelvis, navigating through the surgical field with visible precision."
141.854,152.327,"The surgeon uses effective retraction to expose and manipulate the cotton candy-like areolar tissue, facilitating the safe development of the surgical space."
158.453,184.196,"The surgeon focuses on achieving hemostasis while dissecting deep into the pelvis near the femoral vessels, obturator structures, and vas deferens, ensuring careful separation to avoid injury to critical anatomical structures."
184.696,218.811,"The surgeon is deep in the pelvis, focusing on the upper pelvis structures before proceeding further. The anatomy appears normal, which is unusual in patients with inguinal hernia."
219.311,225.938,"The surgeon advances deeper into the pelvis, focusing on the herniated femoral contents, with visible manipulation of surrounding tissues."
226.438,234.324,"A large piece of yellow adipose tissue is visible extending into the femoral space, with the surgeon considering whether to reduce or leave it in place."
241.469,246.954,"The surgeon observes preperitoneal fat herniating into the femoral space, noting its appearance and location within the surgical field."
247.454,255.352,"The surgeon exposes the large femoral vein, which transitions into the external iliac vein, within the surgical field."
255.852,270.281,"The surgeon carefully searches for the natural plane between the bladder and lateral structures, as well as between the peritoneum and lateral structures, within the surgical field."
270.781,278.206,"The surgeon applies tension and counter tension to reveal the edge of the peritoneum, enhancing visibility of the anatomical structures in the surgical field."
278.706,287.462,"The surgeon creates lateral space in the surgical field to accommodate the placement of a mesh overlay, ensuring adequate coverage over the anatomical structures."
287.962,292.063,"The edge of the peritoneum is clearly visible, delineating the boundary between the peritoneal cavity and surrounding structures."
292.563,295.845,"A small hole is visible in the peritoneum, which the surgeon plans to repair later."
315.451,320.372,"The surgeon positions the mesh deep within the space of Retzius, ensuring it is laid securely in the anatomical area."
320.532,322.373,"The obturator nerve is visible within the surgical field, identifiable as a distinct structure among surrounding tissues."
322.453,325.173,"The surgeon navigates deeper into the surgical field, moving beyond the visible edge of the peritoneum."
325.673,329.134,"The surgeon uses minimal cautery near the obturator nerve, carefully avoiding excessive thermal spread to protect surrounding structures."
329.634,333.976,"The obturator artery becomes visible in the surgical field, positioned near the previously identified obturator nerve."
334.476,348.383,"The surgeon continues the dissection in a clear surgical field, with no blood staining the tissue, allowing for straightforward visualization of anatomical structures."
348.883,360.105,"The surgeon continues to peel back tissue layers, maintaining close proximity to the perineum, revealing underlying anatomical structures."
360.605,377.332,"The surgeon aims to position the mesh deeply, transitioning from the deep pelvis to the lateral pelvis, ensuring no bladder or peritoneum is behind it. This requires careful skeletonization of the vas deferens."
377.832,383.215,The medial umbilical ligament is visible and begins to obstruct the surgical field.
383.715,388.644,"The surgeon divides the medial umbilical ligament, which is visible in the surgical field."
389.144,399.295,The surgeon examines the fat over Cooper's ligament and places stitches near the vas deferens to secure the mesh and prevent it from riding up.
399.795,408.982,"The surgeon removes fat tissue over Cooper's ligament to expose the ligament for suturing, ensuring clear visibility of the anatomical structure."
409.482,419.011,"On the opposite side, the surgeon decides to leave the fat intact, using palpation to visualize Cooper's ligament through the overlying fat."
419.031,421.094,"The surgeon decides not to divide the fat over Cooper's ligament, maintaining the existing tissue structure in the surgical field."
434.97,439.771,The surgeon observes lymphatic leakage from nodal structures and applies clips to control the leakage.
449.693,459.123,"The surgeon navigates medially and posteriorly, revealing the medial umbilical ligament in the surgical field."
459.623,467.589,"The surgeon identifies a structure that is not the ureter, noting its medial position relative to the vas deferens."
483.241,488.688,"The surgeon divides the medial umbilical ligament, although it did not obstruct the surgical field in this patient."
489.188,502.815,"The surgeon clips the vessel within the medial umbilical ligament, which may still contain blood, on the main side to prevent potential pain."
511.279,517.589,The surgeon completes dissection on the left side and prepares to begin dissection on the larger right side.
520.431,527.158,"The surgeon begins the incision near the anterior superior iliac spine (ASIS), creating an oblique vertical limb before extending the incision across the surgical field."
527.658,531.622,"The surgeon carefully maneuvers to stay outside the retroactive space, avoiding entry into deeper tissue layers."
532.122,537.367,"The surgeon encounters difficulty in developing the surgical field on the right side, possibly due to a higher anatomical position compared to the left side."
547.884,552.045,"The surgeon displays the flap on one side, highlighting its differences compared to the flap on the opposite side."
556.726,569.708,"The surgeon performs dissection by transitioning from the visceral space adjacent to the peritoneum into the parietal space near the rectus muscle, dividing the attenuated posterior rectus sheath."
570.208,575.529,The surgeon exposes two distinct layers of tissue resembling a typical posterior rectus sheath above the arcuate line.
576.029,581.822,"The surgeon identifies the inferior epigastric vessels, visible within the surgical field."
584.303,592.345,"The surgeon leaves a significant amount of retrorectus fat intact, provided it is not excessively thick, during the dissection process."
592.845,600.467,"The surgeon joins the dissection completed on the left side, connecting the previously dissected areas within the surgical field."
600.967,604.408,"The surgeon identifies a potential indirect inguinal hernia, visible in the surgical field."
604.908,611.287,"The surgeon identifies an additional interparietal hernia in the patient, visible within the surgical field."
618.013,628.503,The surgeon reduces a small amount of incarcerated fat and prepares to cover it with mesh used for repairing the primary hernia.
628.523,637.847,The surgeon reduces the fat in the lateral area and prepares to reposition closer to the peritoneum.
638.347,648.977,"The surgeon navigates between the peritoneum and the extraperitoneal fatty tissue, maintaining a clear separation between these anatomical layers."
649.477,656.083,"The surgeon repositions into the surgical plane adjacent to the peritoneum, navigating between the peritoneum and extraperitoneal fatty tissue."
656.583,659.125,The surgeon identifies a structure that is likely the vas deferens within the surgical field.
659.625,666.586,A small amount of fat is visibly herniating lateral to the inferior gastric vessels.
667.086,673.61,"The surgeon navigates medial to the internal ring, adjusting the position relative to the peritoneum and surrounding fatty tissue."
676.991,684.996,"The surgeon begins dissecting the femoral contents, focusing on separating these structures from surrounding tissue."
685.496,691.317,"The surgeon extracts the contents from the femoral hernia, revealing the anatomical structures involved."
698.26,701.582,"The surgeon identifies and manipulates the herniated fat around the gastric area, which is visibly protruding."
723.613,730.86,"The surgeon proceeds smoothly through the tissue layers, aided by effective hemostasis, which minimizes bleeding and allows for clear visualization of the surgical field."
731.36,732.761,The femoral hernia sac is visible in the surgical field.
750.222,765.251,"The surgeon divides both medium vocal ligaments, which were obstructing the surgical field."
770.708,771.729,"The video shows a small area of scarring tissue, possibly related to previous surgical manipulation or anatomical changes."
771.869,777.652,"The medial umbilical ligament is visibly drawn into the femoral hernia, indicating its involvement in the herniation."
787.216,793.34,"The surgeon successfully extracts the contents from the femoral hernia, revealing the tip of the hernia contents."
822.013,825.015,"The surgeon begins to search for the cord lipoma, carefully inspecting the surgical field for the presence of the lipoma within the cord structures."
825.515,830.398,"The surgeon identifies fatty tissue, likely a lipoma, within the surgical field."
830.418,835.078,"The surgeon carefully teases apart the tissue to locate the natural capsule surrounding the suspected lipoma, using gentle manipulation to avoid bleeding."
835.578,838.141,"The surgeon carefully separates the lipoma from the testicular vessels, ensuring clear distinction between the fatty tissue and the vascular structures."
838.641,846.308,"The surgeon has separated an obvious lipoma and identifies another fatty structure surrounding the spermatic cord, indicating the presence of additional lipomatous tissue."
846.328,854.802,"The surgeon continues dissection to differentiate between the testicular vessels and the cord lipoma, carefully teasing apart the fatty tissue structures."
855.302,857.583,"The surgeon visually identifies the vas deferens, located beneath the surrounding fatty tissue and lipoma."
857.623,860.965,"The surgeon identifies the testicular vessel running within the surrounding fatty tissue, attempting to differentiate it from adjacent structures."
865.188,885.768,The surgeon successfully avoids damaging the testicular vessels while dissecting around the fatty tissue and cord lipoma.
886.268,894.371,"The surgeon examines a section of fatty cord tissue, noting its resemblance to hernia-like behavior."
894.411,927.587,"The surgeon separates the fatty tissue from the sacrum vessels, carefully distinguishing between the two structures."
943.452,951.515,"The surgeon navigates through retroperitoneal vascular attachments associated with the cord lipomas, carefully dissecting these structures."
961.164,965.165,"The surgeon disconnects the retroperitoneal vascular attachments from the cord lipoma, separating it from surrounding structures."
965.205,976.789,The surgeon identifies a larger piece of tissue consisting of retroperitoneal fat and decides to keep it attached to its retroperitoneal attachments.
977.289,986.977,The surgeon places a mesh anterior to the previously manipulated tissue.
987.477,1016.718,"The surgeon observes tethered fat that needs to be disconnected to lay the mesh on the cord structures, and continues immediate dissection to achieve this."
1017.218,1018.279,"The surgeon manipulates a tongue of peritoneum, likely preparing to adjust or dissect it in relation to surrounding structures."
1018.319,1025.265,"The surgeon prepares to remove a tissue sling, likely involving retroperitoneal fat, from its attachments."
1025.765,1028.567,"The surgeon continues to separate the peritoneum, extending the dissection as far back as possible, revealing underlying structures and tissues."
1034.849,1063.132,"The surgeon uses the left hand to retract tissue, revealing the anatomical plane and a large packet of nodal tissue on the left side. The nodal tissue is left in place, while the longest obturator artery is visible, extending deep into the space of Retzius."
1065.093,1075.321,"The surgeon attempts to position the mesh deeply within the surgical field, aiming for optimal placement."
1075.821,1079.463,"The surgeon identifies a tissue containing a dense network of lymphatics, visible within the surgical field."
1079.963,1098.63,"The surgeon attempts to identify a natural tissue plane between the bladder and the lymphatic tissue, leaving the nodal tissue intact."
1099.13,1103.311,"The surgeon navigates deep into the obturator space, revealing anatomical structures within the pelvic region."
1103.811,1118.954,"The surgeon has developed a space within the obturator area, leaving the obturator fat in place, to potentially accommodate the mesh deeply if required."
1119.454,1121.355,"The obturator internus muscle is visible in the surgical field, located deep within the obturator space."
1124.412,1127.973,"The surgeon begins to skeletonize the vas deferens, carefully exposing and isolating it from surrounding tissues."
1128.233,1135.155,The surgeon observes a large amount of peritoneum attempting to move behind the mesh within the obturator space.
1135.255,1138.556,"The camera provides a clear view into the femoral space, revealing the anatomical area prepared for potential mesh placement."
1139.056,1141.437,The surgeon visually identifies a large vein within the surgical field.
1141.937,1143.537,"The surgeon identifies additional peritoneum in the surgical field, which may need to be managed or repositioned."
1143.557,1145.598,"The surgeon peels back the tissue, revealing underlying anatomical structures and creating a clearer view of the surgical field."
1146.098,1151.988,The surgeon ensures that the peritoneum is securely positioned to prevent it from slipping behind the mesh in the femoral space.
1167.116,1178.941,"The surgeon secures the mesh to the underlying structures, ensuring that the peritoneum cannot slip behind it."
1180.081,1182.862,"The obturator nerve is clearly visible in the surgical field, surrounded by adjacent anatomical structures."
1197.927,1203.749,"The surgeon identifies the femoral branch and the genitofemoral nerve, visible in the surgical field."
1208.507,1213.15,"The surgeon creates adequate space for the placement of surgical mesh, ensuring sufficient room within the surgical field."
1213.65,1216.132,"The surgeon provides a view into the thermal space, revealing anatomical structures within the surgical field."
1216.632,1222.276,"The surgeon identifies the interparietal hernia, visible within the surgical field."
1244.501,1254.247,"The surgeon uses a flat sheet pro grip mesh, measuring 20 by 15 centimeters, and trims it to the appropriate size for placement over the interparietal hernia."
1254.747,1258.629,"The surgeon uses a tape measure to assess the dimensions of the space surrounding the interparietal hernia, preparing for the placement of a custom-sized mesh."
1333.718,1337.241,"The surgeon displays the first piece of mesh that was cut, showing its size and shape in relation to the surgical field."
1337.741,1344.544,"The surgeon places a trimmed piece of mesh into a large space, visibly noting that the mesh appears small relative to the size of the space."
1344.664,1352.783,The surgeon places the mesh into the surgical site to assess its fit and coverage within the large space.
1358.844,1361.005,The surgeon demonstrates the ability to move and remove the piece of mesh from its placement within the surgical field.
1361.505,1374.567,"The surgeon evaluates the placement of a mesh piece, noting that while it provides good posterior and deep femoral coverage, it appears too short for the medial area."
1375.067,1378.448,"The surgeon assesses the mesh placement, noting that the mesh appears insufficiently wide for the surgical area, leaving gaps in coverage."
1378.508,1385.406,"The surgeon places the mesh obliquely rather than horizontally, adjusting its orientation within the surgical field."
1385.906,1415.167,"The surgeon measures a 20 by 15 centimeter piece of mesh, trimming the corners to ensure better posterior placement."
1415.667,1424.832,The surgeon trims the mesh posterior laterally to achieve better coverage and fit within the surgical site.
1425.332,1438.799,"The surgeon observes the transition from the Bagros space to the space of Retzius, noting the need for additional mesh placement to prevent the peritoneum from protruding."
1439.299,1445.835,"The surgeon positions the mesh to cover the fatty tissue over the psoas muscle, ensuring adequate coverage."
1446.335,1460.792,"The surgeon rolls the mesh back up, preparing to remove it from the surgical field as a new mesh is introduced."
1495.182,1496.703,"The surgeon exchanges the mesh, preparing for its placement in the surgical field."
1496.763,1499.445,"The surgeon presents a newer piece of mesh, preparing for its placement in the surgical field."
1499.945,1505.089,"The surgeon displays a wider piece of mesh, preparing to place it within the surgical field."
1505.589,1518.189,"The surgeon begins to undo the mesh slightly, preparing it for easier unfurling during the procedure."
1518.689,1523.934,"The surgeon positions the newly exchanged mesh over the surgical area, demonstrating its improved coverage of the femoral space."
1524.434,1527.497,"The probe grip adheres firmly to the tissue surface, demonstrating its secure attachment during the procedure."
1541.018,1546.642,"The surgeon positions the mesh deep into the metropubic space, approximately three centimeters deep, ensuring it covers the area effectively."
1547.142,1558.489,"The surgeon observes the positioning of the mesh, noting that if it rises slightly, the femoral space will remain covered and not exposed."
1558.989,1566.214,"The surgeon unfolds the mesh over the surgical area, demonstrating the deployment technique that ensures optimal coverage of the space."
1566.534,1569.954,"The surgeon folds the mesh across the surgical field, ensuring it is properly positioned over the tissue."
1570.454,1577.259,"The surgeon folds the mesh completely before proceeding to the next fold, ensuring it is properly positioned within the surgical field."
1577.759,1594.451,"The surgeon covers an unusual interparietal hernia with a mesh, ensuring it is securely placed over the hernia site."
1598.488,1607.457,"The surgeon identifies Cooper's ligament and positions the mesh over it, visible through the surrounding fat, preparing to anchor the mesh securely in that area."
1607.957,1615.984,The surgeon adjusts the mesh by dragging it lower to achieve more overlap over the lateral femoral space.
1616.004,1623.33,"The surgeon observes a portion of the mesh that is folded, adjusting its position within the surgical field."
1627.667,1631.01,"The surgeon adjusts the mesh to achieve better coverage over the femoral space, ensuring it is properly positioned and visible through the surrounding tissue."
1631.51,1639.657,"The surgeon uses a 3-0 Polysorb suture to secure the mesh to Cooper's ligament, visible through the mesh and surrounding fat tissue."
1640.157,1644.361,"The surgeon observes a wide direct defect and secures it at two points using sutures, ensuring stability and coverage."
1649.545,1652.148,"The surgeon focuses on the periosteum and Cooper's ligament, likely preparing to secure or manipulate these structures."
1652.648,1662.018,"The surgeon secures the mesh in place to prevent it from riding up and exposing the posterior aspect of the femoral space, ensuring stable fixation."
1662.518,1666.322,The surgeon visualizes Cooper's ligament through the surrounding adipose tissue.
1666.822,1673.557,"The surgeon places a stitch near a visible vessel, highlighting the proximity of the vessel to the suture site."
1674.057,1677.198,"The surgeon demonstrates the area where the mesh adheres effectively, ensuring stable fixation within the surgical field."
1677.658,1684.559,"The surgeon demonstrates the adherence of the mesh in various anatomical locations, including posterior, lateral, superior, and medial areas, ensuring stable fixation across the surgical field."
1684.579,1693.84,"The mesh is visibly secure in its placement, with no signs of displacement or exposure in the surgical field."
1699.221,1701.442,The obturator nerve is visible in the surgical field.
1712.259,1714.901,"The surgeon demonstrates the coverage of the interparietal hernia, ensuring it is adequately secured within the surgical field."
1724.969,1732.568,The surgeon observes the seam of the anatomical mesh within the surgical field.
1733.068,1741.272,The surgeon positions the anatomical mesh in a left-right orientation to ensure adequate coverage over the surgical area.
1745.754,1757.441,Clear fluid is observed trickling down from the divided fatty tissue.
1757.941,1764.785,"The surgeon places clips on the fatty tissue, securing it in position."
1768.746,1772.247,The distal side of the surgical field is observed to be draining a small amount of clear fluid.
1772.287,1778.829,The surgeon applies clips to the side of the fatty tissue where clear fluid is observed trickling down.
1789.193,1796.217,"After placing the clip on the tissue, the leakage of clear fluid becomes more pronounced, visibly highlighting the area of concern."
1802.222,1813.571,"The surgeon places an additional clip on the tissue to address an area that was previously unclipped, aiming to prevent further leakage."
1814.071,1832.873,"The surgeon unfurls the remaining portion of the mesh, ensuring it is properly positioned over the surgical area."
1833.373,1843.036,"The surgeon unfolds the mesh, ensuring the lower flap is completely free, and places it down to achieve good coverage over the surgical area."
1850.739,1855.701,"The surgeon ensures that the mesh has good posterior overlap, indicating proper placement and coverage over the surgical area."
1875.126,1885.255,"The surgeon places two stitches in the mesh, securing it in position within the surgical field."
1908.136,1916.445,"The surgeon exposes the area, revealing visible blood vessels through the tissue."
1919.648,1931.587,"The surgeon closes the peritoneal flaps, folding and suturing the tissue to complete the closure of the surgical site."
