start,end,text
6.098,11.542,Nothing fancy here. This is a forty-eight-year-old female with symptomatic cholelithiasis.
12.042,14.603,"The surgeon retracts tissue in a standard manner, likely using robotic instruments to provide a clear view of the surgical field."
14.764,29.433,"The surgeon operates using four robotic arms: Arm one with a ProGrasp, Arm two with a Maryland dissector, Arm three holding the camera, and Arm four equipped with hook cautery."
29.933,34.822,The surgeon uses robotic instruments to dissect and expose the critical view of safety during the cholecystectomy procedure.
35.322,41.425,"using indesign and green. I use two to three cc's depending on weight, pretty much every case."
41.925,52.971,"Some of the cases with acute cholecystitis, unfortunately the cystic duct doesn't usually light up, but sometimes it does. But all cases, I pretty much use it."
53.471,63.156,"An aberrant artery is visible running laterally, just to the right of the hook cautery. The surgeon leaves the artery intact, allowing it to extend up to the cystic plate."
63.656,71.259,"The surgeon has achieved the critical view of safety, with the posterior wall of the gallbladder visible against the right hepatic lobe."
71.759,76.7,"The surgeon uses round-tip scissors for dissection, opting for this tool over monopolar scissors."
76.76,86.143,"So I usually use round-tip scissors. Saves about, I think, three hundred dollars for the case, something along those lines."
86.643,92.225,"The surgeon uses a blunt dissection technique to peel the gallbladder off the cystic plate, revealing the underlying tissue layers in a straightforward manner."
