start,end,text
1.165,28.176,minimally invasive laparoscopic management of colonoscopic perforation when and how primary repair fifty one years old man admitted to gastroenterology ward for persistent diffuse abdominal pain and a scanty p r bleeding a c t scan showed a diffuse edema and concentric thickening of the ascending and transverse and left colonic wall
28.676,52.49,and the patient underwent diagnostic colonoscopy after proper bowel preparation urgent postprocedural CT scan showed a large pneumoperitoneum and a large amount of free fluid suggesting iatrogenic perforation the patient was hemodynamically stable and not severely septic
52.99,77.124,"During diagnostic laparoscopy, the surgeon observes diffuse murky fluid indicative of bowel perforation and identifies a one-centimeter tear on the anti-mesenteric border of the sigmoid colon. The bowel loops appear non-inflamed, and the colonic wall is healthy and well-perfused."
77.624,100.53,"A swab is taken from the intraabdominal free fluid for microbiological analysis. The surgeon observes a large amount of clear, murky fluid present in all quadrants, consistent with bowel preparation mixture, indicating leakage from a full-thickness colonic perforation."
100.93,116.909,"The surgeon performs thorough aspiration of the murky fluid from all four quadrants, focusing on cleaning the areas around the liver and spleen in the right and left hypochondrium."
117.409,154.335,"The surgeon identifies an area of blunt contusion with a visible bruise on the mesenteric border of the sigmoid colon. The cecum and sections of the transverse and descending colon appear distended but without bruising or full-thickness injury. The rectum and distal sigmoid are intact, with no visible lesions on the colonic serosal surface. The margins of the perforation are even and well vascularized."
154.835,168.624,"The surgeon observes the colon and sigmoid, noting that the walls appear healthy with no signs of inflammation or ischemia, and the seromuscular layers are well-perfused."
169.124,193.068,"The surgeon uses automatic graspers to gently explore the bruise on the sigmoid colon, revealing a full thickness injury. The lumen of the sigmoid is visible, with clearly recognizable mucosa. The perforation measures less than one centimeter in size."
193.568,222.324,"The surgeon performs a primary laparoscopic repair of the sigmoid tear, with even and nicely bleeding margins, using advanced laparoscopic suturing techniques."
222.824,232.402,"The surgeon sutures the first layer of the ulcer repair using intracorporeal interrupted stitches with 3-0 Vicryl, taking large bites through the seromuscular layer."
232.902,247.761,"Iatrogenic perforation is a rare but serious complication that may occur during colonoscopy. Nowadays, there are still no specific guidelines for the optimal management of these complications."
248.261,274.298,"open surgery with colonic resection and damastomosis or colonic diversion, primary repair, endoscopic clips, non-operative management and laparoscopic approach. Laparoscopic approach and colon repair has been demonstrated to decrease morbidity, decrease length of stay and shorten incision length compared to an open method."
274.798,290.384,"The surgeon performs a laparoscopic repair of a colonic iatrogenic perforation, carefully grasping the epiploic appendage while avoiding direct manipulation of the colonic wall."
290.884,300.641,"The surgeon places interrupted 3-0 stitches at appropriate intervals to perform a primary seromuscular repair of the colonic tear, ensuring the repair is secure and reliable."
301.141,338.118,"In selected cases, when the patient is hemodynamically stable and not severely septic, and with appropriate minimal invasive surgical skills, laparoscopy for diagnosis and colonic repair is feasible and safe in treating such iatrogenic injuries. Mandatory is the early diagnosis. And when timely management is achieved, laparoscopy is the best option in terms of reduced morbidity, length of stay and faster postoperative recovery."
338.618,363.493,"The surgeon completes the second layer of the primary repair with a running serosal suture using Forth Eurovicryl, ensuring the colon is healthy and well perfused."
363.993,378.553,"The surgeon performs a running suture on the serosal layer of the colon using laparoscopic techniques, demonstrating speed and reliability in the repair process."
379.053,428.742,laparoscopic colonic resection with or without primary anastomosis regardless the degree of peritonitis usually mild in such cases can be considered if an underlying potentially malignant lesion large sessile polyp or suspected colorectal cancer or a segmental severe diverticular disease or a significant stricture is found close to the perforation site if the size of the perforation is large and margins are poorly perfused and if the patient is stable and has no cardiorespiratory contraindications to laparoscopy
429.242,452.55,"The video shows a laparoscopic repair of a colonic iatrogenic perforation. The surgeon addresses the perforation site, which was not identified during colonoscopy, amidst severely inflamed and dusky mucosa without visible intraluminal lesions."
453.05,474.16,"The laparoscopic view shows the transverse colon, where no additional lesions are visible on the serosal surface, following the patient's complaint of worsening abdominal pain."
474.66,495.48,"The surgeon performs a primary laparoscopic repair of the colonic tear, using a double layer of V-acryl sutures. The margins of the tear are even and exhibit healthy bleeding. Following the repair, the abdominal cavity is thoroughly washed out and drained."
495.98,508.69,"The surgeon completes repeated cycles of suction and irrigation around all quadrants of the abdominal cavity, confirming the absence of additional injuries or bowel lesions."
