start,end,text
1.032,16.112,"This is Dr. Jason Engle from Washington, D.C., and today I'll be showing you a hand-assisted laparoscopic radical nephrectomy."
16.612,26.268,"The case that we'll be presenting today is of a seventy-two year old man who had an incidental finding of a very centrally located right-sided renal mass, which I will show you."
26.768,33.263,"He had no comorbidity, normal renal function, no diabetes or hypertension."
33.763,37.045,"The video shows a centrally located renal mass on the right side of the patient's kidney, visible during the hand-assisted laparoscopic radical nephrectomy."
37.545,40.987,This would be an extremely difficult partial nephrectomy to perform.
41.487,49.211,"And in my practice, in a seventy-two year old man with few comorbidities, I still do perform nephrectomies."
49.291,55.748,I don't find that all patients need a partial nephrectomy at all cost.
56.248,60.753,"The video displays the port placement for a hand-assisted nephrectomy on the right side, showing the arrangement of surgical ports on the patient's abdomen."
61.253,70.782,The patient is positioned in a beanbag in a full-flank position. The surgeon makes a small seven-centimeter muscle-splitting incision to place the hand port for the nephrectomy procedure.
71.282,82.352,"Two additional 10mm ports are placed, including one inside the umbilicus. The surgeon uses a 3mm alligator grasper to elevate the liver, providing better access to the surgical field."
82.852,88.056,"The surgeon inspects the patient's abdomen, revealing the visible arrangement of abdominal organs."
88.556,91.338,"The surgeon inserts their hand through the hand port, which is positioned on the right side for hand-assisted nephrectomy."
91.838,99.724,The surgeon ensures the hand port is sealed around their hand to maintain a proper laparoscopic insufflation seal during the nephrectomy procedure.
100.224,108.65,"The surgeon positions a three-millimeter alligator grasper as a self-retaining retractor to elevate the liver, providing a clear view of the surgical field."
109.111,111.834,No extra port is placed for this.
112.334,122.12,"The surgeon visually inspects the abdominal cavity, where the gallbladder, liver, and kidney are clearly visible, especially in this thin patient."
122.62,126.462,"The surgeon begins the nephrectomy by performing a formal takedown of the line of Toldt, which involves mobilizing the colon to access the kidney."
126.962,131.264,I do this even with a partial nephrectomy for mobilization reasons.
131.764,144.81,"One thing to note, and one thing that's very different about how I do hand assisted surgery, I find, as compared to those that are a bit less experienced than myself,"
145.31,151.476,"is I generally am going to use the hand as a retractor, not really as the dissector."
151.976,160.885,"This is in contrast to many others that use the hand as the dissector, but in essence what I'm doing is a laparoscopic nephrectomy almost in every way."
161.325,169.753,"The surgeon uses their hand as a retractor to stabilize and expose the kidney, enhancing visibility and access during the nephrectomy procedure."
170.253,173.294,"The surgeon rapidly dissects along the line of Toldt, visibly separating the colon from the retroperitoneal structures."
173.794,182.176,"And my goal here, of course, is to be holding things for my harmonic scalpel, but I don't need to cut most things."
182.676,190.177,"The surgeon extends the dissection towards the side of the liver and up to the diaphragm, preparing the area for nephrectomy."
190.677,198.209,"The surgeon positions their hand over the top of the kidney to sweep the surrounding Gerota's fascia and fat downwards, facilitating exposure of the kidney during the nephrectomy."
198.289,209.645,"The kidney becomes fully visible in the surgical field, simplifying the procedure as the surgeon continues the nephrectomy."
210.145,215.651,"The surgeon uses their hand to sweep surrounding tissues downwards, demonstrating the advantage of manual manipulation in the surgical field."
216.151,235.738,"The surgeon carefully dissects the peritoneum along the edge of the liver, extending the incision towards the diaphragm."
236.238,240.042,"The surgeon positions their hand over the top of the kidney, preparing to manipulate surrounding tissues."
240.542,247.77,"The surgeon proceeds to take down the duodenum and colon, following the previous steps that exposed the kidney and allowed for downward sweeping of the Girotis fat."
248.27,252.014,"The surgeon uses their hand as a retractor to maintain downward pressure, aiding in the exposure of the kidney."
252.514,256.618,"The surgeon demonstrates the technique for dissecting the kidney during a partial nephrectomy, focusing on precise tissue separation around the kidney."
257.118,262.743,"The surgeon identifies the anatomical plane where the colon rests upon the Gerota's fat, carefully delineating the tissue layers in preparation for further dissection."
263.243,268.746,"The surgeon mobilizes the colon downwards, creating space and exposing the underlying structures for further dissection."
269.246,274.729,"Of course, on the right side, the main things to look out for would be the duodenum."
275.229,282.749,"The surgeon exposes the bowel, likely the duodenum, situated beneath the colon during the nephrectomy procedure."
283.249,291.096,"The surgeon uses fingers as a dissector to manipulate and hold the tissue, functioning as a retractor during the nephrectomy procedure."
291.176,296.321,"The surgeon uses their hand to dissect and create retraction points, manipulating the surrounding tissue to facilitate exposure."
296.821,299.664,"The surgeon uses two fingers to retract tissue, providing a clear view of the surgical field."
300.164,309.22,"The surgeon uses their pinky finger to push the kidney laterally while simultaneously using their thumb to push the bowel medially, manipulating these structures to improve surgical exposure."
309.72,317.584,"The surgeon carefully manipulates the tissue to access the surgical plane, ensuring the duodenum is moved out of the way, visible beneath the colon."
318.084,325.829,Another hallmark of when I do a hand assisted case is that classically I'm not necessarily looking for structures.
326.329,336.294,"The surgeon systematically identifies anatomical planes and structures, using hand-assisted techniques to reveal them progressively within the surgical field."
336.794,340.871,"The renal vein becomes visible as the surgeon continues to manipulate surrounding tissues, revealing its location in the surgical field."
341.371,348.834,"The surgeon frees the lower pole of the kidney and completes the mobilization of the colon, with the duodenum and bowel positioned downward."
349.034,357.302,"The surgeon continues the dissection, extending the surgical field down to the pelvis, ensuring clear visualization of anatomical structures."
357.802,362.669,"The surgeon uses their hand to hold the kidney in an upright position, providing a clear view of the organ during the nephrectomy procedure."
363.169,364.752,"The surgeon exposes the vena cava, visible in the surgical field as part of the nephrectomy procedure."
365.252,368.536,"An aberrant vessel is visible near the renal vein, distinct from the expected anatomical structures."
368.576,375.394,"A crossing vessel is visible, identified as a non-pathologic structure, crossing over the surgical field."
375.894,377.835,"The surgeon holds the kidney upright with one hand, but refrains from dissecting it, maintaining the current position without further manipulation."
378.335,382.978,"The surgeon holds up the lower pole of the kidney while completing the dissection around the colon, ensuring clear exposure of the anatomical structures involved."
383.478,385.199,And that's what I'm doing right now.
385.699,395.411,And whatever structures come into view just happen to come into view.
395.911,400.878,"The surgeon advances along the vena cava, ensuring not to move more medially than necessary."
401.378,410.872,"The surgeon identifies a small crossing vessel near the kidney, which may be an aberrant gonadal vessel or another vessel associated with the kidney."
411.372,415.315,"Again though, I'm not going to spend any time looking for that."
415.815,420.639,"The surgeon positions onto the psoas muscle and begins to move upwards along its surface, revealing surrounding anatomical structures."
421.139,428.164,"The surgeon approaches the renal vein, previously identified, within the surgical field, preparing to demonstrate its anatomical position and relation to surrounding structures."
428.264,432.227,"The surgeon identifies several aberrant vessels in the surgical field, which are visually distinct and do not typically belong in the expected anatomical location."
432.727,437.602,"The surgeon identifies a small crossing artery and vein, possibly aberrant vessels, near the kidney."
438.102,450.914,"The surgeon holds the kidney straight up using the thumb and forefinger, revealing a clear plane of fascia with the duodenum positioned downward."
451.414,466.202,"The surgeon anticipates visualizing the plane beneath which the main renal vein is clearly visible, preparing to expose this anatomical structure during the nephrectomy."
466.702,468.364,Notice I didn't really look for the vein.
468.785,482.928,"The surgeon follows a predictable fascial plane located one level beneath the plane developed for duodenum mobilization, revealing underlying anatomical structures."
483.428,486.83,"The surgeon approaches the top of the kidney, preparing to dissect across this area, with the kidney held in position for clear visibility."
487.33,493.493,"The surgeon releases the gyrotis fat near the kidney, aiming to spare the adrenal gland during the nephrectomy procedure."
493.993,495.073,This is what I'm doing here.
495.334,498.915,"The renal vein is visible branching from the main vessel, indicating the anatomical location and vascular structure during the nephrectomy procedure."
499.415,509.06,"The surgeon gently manipulates the tissue to expose the parenchyma of the kidney, ensuring that no vascular structures remain in the field of view."
509.56,519.951,"The surgeon creates windows in the Girotis fat at the upper pole of the kidney, having previously swept the fat down to expose the area."
520.191,529.736,"The surgeon prepares to staple the Girotis fat, noting that the adrenal gland is located within this fat near the vena cava."
530.236,532.158,"The surgeon observes the fat tissue, noting that it can often bleed during manipulation."
532.198,550.144,"This is especially true on the left side, so I usually do use a stapler and not a harmonic scalpel as the most efficient, safest way to handle this."
550.644,554.045,"The surgeon uses both hands to carefully dissect around the kidney, ensuring precise manipulation of the surrounding tissues."
554.325,566.089,"I'm using either my sucker or my hand as a retractor, but one of the hallmarks of how I operate is there are very few times where I'm ever operating with only one hand."
566.589,579.902,"This is very crucial to understand with the hand in place because the inexperienced surgeon can fall into a trap of only using the hand, which is not a very effective thing to do."
580.402,584.116,The surgeon completes the dissection of the fat at the upper pole of the kidney.
584.616,588.961,The surgeon confirms the preservation of the patient's adrenal gland during the nephrectomy procedure.
589.461,598.965,"The surgeon has reached the upper pole of the kidney and is now holding the kidney straight up, preparing for the final steps of the nephrectomy."
599.445,613.511,The surgeon places fingers behind the renal hilum and begins dissecting out the visible vessels surrounding the renal vein.
614.011,620.135,"The surgeon works on a crossing vessel located inferiorly, carefully dissecting around it to ensure clear separation from surrounding tissues."
620.635,624.178,"The surgeon creates retraction points around the kidney, facilitating better exposure and manipulation during the nephrectomy procedure."
624.678,631.863,"The surgeon uses their thumb as a retractor to hold the kidney straight up, facilitating further dissection during the nephrectomy."
632.363,641.308,"The surgeon positions their middle finger around the renal hilum and applies pressure to the hilum, aiming to manipulate the kidney during the nephrectomy."
641.548,645.471,"The surgeon manipulates the hilum, causing the renal artery to emerge from beneath the renal vein, revealing the spatial relationship between these vessels."
645.971,650.352,"The surgeon dissects around the vessels, carefully isolating each one using precise movements."
650.852,656.794,"The surgeon applies pressure on the artery, visibly demonstrating its position and separation from surrounding structures."
657.294,662.575,"The surgeon uses their finger to create a window around the hilum, preparing to suck over the finger for further dissection."
662.595,670.958,"The surgeon proceeds retroperitoneally along the psoas muscle, navigating the anatomical space adjacent to the kidney."
670.998,676.96,"The surgeon mobilizes the kidney, manipulating it to achieve a position where it can be held straight upwards, indicating complete detachment from surrounding structures."
677.06,681.04,"The psoas muscle is visible in the surgical field, providing a landmark for further dissection during the nephrectomy procedure."
681.54,684.101,Notice I have not finished the hilum at this point.
684.601,688.123,"I've identified it so that I know if there's bleeding, I can go get it."
688.623,695.686,"But for me, and this is also different than other surgeons, I tend to get the hilum as the last step."
696.186,698.748,"The surgeon positions the kidney to visualize all surrounding vessels, ensuring clear identification of each vessel in the surgical field."
699.248,708.592,There's no way that I'm going to confuse myself and potentially take the inferior mesenteric artery.
708.852,711.813,That's a complication that can occur with big tumors.
712.313,721.898,"The surgeon releases the lateral attachments of the kidney, preparing to perform additional work on the hilum."
722.398,725.079,Notice I've not looked for the ureter.
725.579,729.521,"The surgeon visually identifies the ureter for the first time during the procedure, highlighting its location in the surgical field."
730.021,737.983,It's really one of the last steps that I do.
738.483,743.845,"And again, I thought this was a good case to showcase because I was not expecting to see all these aberrant vessels."
743.885,747.286,The surgeon identifies an aberrant gonadal vessel within the surgical field.
747.786,750.307,"The surgeon manipulates a structure that is not a vessel, distinguishing it from surrounding vascular elements."
750.807,754.809,The surgeon identifies an aberrant gonadal vessel along with a crossing artery and vein in the surgical field.
755.129,758.69,And none of it really matters if you follow all these steps.
759.19,763.152,"The surgeon's finger is visibly passed completely underneath an anatomical structure, likely an aberrant vessel, as part of the nephrectomy procedure."
763.652,768.939,"The surgeon prepares to isolate and secure the artery on the right side, which is typically the final step in this part of the nephrectomy procedure."
769.439,775.346,"The surgeon uses their finger to carefully pull a structure out from underneath the vein, demonstrating the separation of tissues."
775.846,779.47,Otherwise it can be very much behind the vein.
779.97,788.922,"And notice I'm not rubbing on the artery, I'm rubbing on my finger."
789.422,792.143,"The surgeon continues to manipulate the tissue, gradually bringing the artery into clearer view as it is separated from surrounding structures."
792.483,800.826,"The surgeon positions their finger underneath the vein, creating a visible space or 'window' for the insertion of a surgical stapler."
801.326,817.826,"The surgeon positions their finger on both sides of the kidney, creating a clear window for the stapler. The kidney is held up to ensure no obstructions are present behind it, facilitating the stapling process."
818.326,828.354,"The surgeon successfully creates a window around the kidney, visible enough to insert a finger through the space, ensuring clear access for the stapler."
828.854,832.977,"The surgeon demonstrates a clear window beneath the kidney, indicating readiness to pass the stapler through this space without obstruction."
833.477,835.578,"The surgeon maintains upward traction on the kidney, ensuring a clear view and access for the stapler placement."
835.759,837.961,"The surgeon maintains tension on the vessels, ensuring they are clearly visible and accessible for further manipulation or stapling."
838.461,845.262,It would never be safe for me to be manipulating these vessels if they were not under traction.
845.762,850.406,The surgeon visually confirms that the identified structures are not connected to the mesentery of the bowel.
850.906,853.728,These are all things that will have to be taken.
854.228,859.273,"The surgeon uses a harmonic scalpel to address the lymphatic vessels, applying the instrument to cut and coagulate the tissue."
859.773,864.577,"The surgeon prepares the kidney for staple firing, ensuring the surrounding tissue is adequately positioned for the next step in the nephrectomy procedure."
865.077,867.379,"The surgeon identifies the arteries, visually distinguishing them from surrounding structures in preparation for further surgical manipulation."
867.879,872.579,"The surgeon identifies the veins associated with the kidney, preparing for further dissection or ligation."
873.079,888.169,"The surgeon identifies several aberrant arteries and veins, which are gradually exposed and managed through the steps of a hand-assisted nephrectomy procedure."
888.669,903.16,"The ureter is visible in the surgical field. The surgeon begins to dissect tissue adjacent to the ureter, leaving only the necessary structures for removal."
903.66,921.276,"The surgeon uses small metal clips to secure and occlude several small aberrant vessels surrounding the kidney, preparing for further steps in the nephrectomy procedure."
921.776,933.271,"The surgeon prepares to ligate the identified arteries, prioritizing their removal before addressing the veins."
933.771,948.383,The main renal artery is clearly visible in the surgical field.
948.883,957.534,"We tend to use an automatic firing stapler, but of course a manual stapler would work just as well."
958.034,968.122,"The surgeon identifies an aberrant crossing artery, preparing to ligate it as the next step in the procedure."
968.622,969.542,So that's what I'll do.
969.562,975.007,"The surgeon identifies an atypical artery, which is not commonly observed in most nephrectomy cases."
975.507,980.602,It was not causing obstruction to his renal pelvis.
981.102,983.646,The surgeon observes the remaining veins in the surgical field after previous dissection steps.
983.686,1006.438,"The surgeon carefully dissects around a vessel near the inferior vena cava, ensuring to address the vessel before it branches."
1006.938,1012.106,"The surgical field reveals a few remaining lymphatic vessels and one visible vein, which are left after previous dissection steps."
1012.606,1031.695,"The surgeon isolates the vessels, focusing on separating them from surrounding tissues during the nephrectomy procedure."
1032.195,1037.558,"The surgeon ligates and removes the vein, leaving the ureter as the remaining structure in the surgical field."
1038.058,1044.882,"The surgeon identifies the ureter, which is the last structure to be dissected and removed in the nephrectomy procedure."
1045.382,1046.863,I typically use metal sutures.
1046.903,1050.605,"If it's a hydronephrotic ureter, I might use a wet clip."
1051.105,1054.808,"Of course, if there's any suspicion of reflux, you take the clip."
1054.928,1058.494,One could leave the ureter open. I usually don't.
1058.994,1060.676,"The surgeon presents the excised kidney specimen, displaying its anatomical features and size after removal."
1060.716,1065.863,"Of course, we don't see this patient's tumor because it's very much centralized."
1066.363,1071.349,"I'm not worried, therefore, about seeding anything here lest I would be putting it in a lap sac."
1071.849,1079.648,"The surgeon pulls the kidney specimen straight out of the abdomen, completing the extraction process."
1080.148,1093.454,The surgeon places a sponge in the surgical field to address minimal bleeding observed during the nephrectomy procedure.
1093.954,1096.615,"The surgeon inspects the surgical stumps, examining the area where the kidney was removed for any signs of bleeding or other abnormalities."
1097.115,1107.502,"The surgeon reduces the insufflation pressure to five, visually confirming the absence of oozing or bleeding in the surgical field."
1108.002,1111.805,"The surgeon displays the staple line on the renal vein, indicating the completion of vessel ligation during the nephrectomy procedure."
1112.305,1113.286,"The vena cava is visible in the surgical field, likely adjacent to the renal vein staple line."
1113.606,1118.991,"The surgeon visually identifies the accessory artery and the stump of the main renal artery, inspecting these structures for any signs of bleeding or complications."
1119.491,1120.532,"The surgeon inspects the stumps of the accessory artery and renal vein, confirming visually that there is no leakage from these structures."
1121.032,1123.655,This all looks satisfactory.
1124.155,1128.819,"I have my own internal rule that if the sponge still has white on it, we're not bleeding."
1129.319,1131.701,"The surgeon displays the bivalve kidney, showing the internal structure and anatomy of the kidney in this nephrectomy case."
1131.741,1136.78,"The video shows a centrally located tumor within the kidney, highlighting its position relative to surrounding renal structures."
1137.28,1144.642,"you can see that we would have had to do an actual heminephrectomy, which would be fraught with potential complication to remove that."
1145.142,1149.784,"The operative time was thirty-two minutes, which is typical of a hand-assisted case."
1150.284,1153.745,He went home on post-operative day one with a creatinine of one point two.
1154.245,1161.252,"This happened to be a chromophobe renal cell carcinoma, and all margins were negative."
1161.752,1171.723,"Again, this is Jason Engle showing a hand-assisted laparoscopic nephrectomy, a very useful tool in a urologist's armamentarium for a kidney tumor."
