start,end,text
52.069,63.181,"The surgical team carefully dissects into the renal hilum, preparing and identifying the arterial branches for clamping as per the preoperative plan."
63.681,136.217,"The surgeon encircles the different arterial branches with vessel loops, progressing towards the quaternary branches in preparation for selective clamping."
136.717,158.685,"The surgeon uses laparoscopic bulldog clamps to initially clamp the tumor-specific tertiary and quaternary segmental arteries, visible within the surgical field."
159.185,197.555,"The surgeon begins the tumor excision by dissecting the overlying Gerota's fascia, fully liberating the kidney from its attachments to allow for mobilization during the excision and reconstruction of the tumor bed."
198.055,203.807,"During the tumorectomy, significant bleeding occurs, temporarily halting the procedure due to inadequate exposure conditions."
204.307,243.806,"The surgeon downgrades the clamp from the quaternary branch to the tertiary branch below, adjusting the laparoscopic bulldog clamp placement on the arterial branches within the kidney hilum."
244.306,305.745,"The surgeon clamps the perforating upper pole artery at the posterior aspect of the kidney, which was previously identified, using laparoscopic instruments."
306.245,324.553,"The surgeon progresses with the tumor excision by carefully detaching the capsule of the renal mass from the surrounding normal parenchyma, following the cleavage plane."
325.053,383.407,The surgeon begins reconstructing the deep tumor bed using a 3-0 V-lock suture after the tumor has been excised from the kidney.
383.907,390.05,"The surgeon removes three laparoscopic bulldog clamps, utilizing the early unclamping technique facilitated by the placement of the first suture."
397.232,404.915,"The surgeon completes the tumor bed reconstruction by placing two additional 3-0 V-Loc sutures, ensuring hemostasis of the kidney parenchyma."
410.994,417.279,The surgeon applies a Tacosil hemostatic patch to the large tumor bed to address residual bleeding.
