start,end,text
30.808,51.333,"The surgeon encounters a challenge during dissection as the cord lipoma is connected to retroperitoneal lymph nodes, affecting the direct and indirect spaces."
54.494,69.96,"The surgeon creates a wide peritoneal flap, beginning with medial dissection, to expose the hernia site."
70.46,108.948,"The surgeon navigates pre-transverse salus, attempting to access the pre-peritoneal space laterally."
109.448,112.249,The surgical field shows minimal presence of an indirect hernia sac.
126.573,153.491,"The surgeon identifies the pubic bone, which is visible within the surgical field during the hernia repair procedure."
153.991,162.035,"The surgeon works on parietalizing the cord structures, carefully separating them from surrounding tissues in the absence of a hernia sac."
188.759,197.847,"The surgeon sweeps the cord structures laterally, creating space in the surgical field. The absence of a hernia sac is noted."
198.347,217.967,"The surgeon continues to work in the exposed area, but the surgical field begins to visibly collapse, limiting the working space."
218.467,222.27,The surgeon observes the vas deferens in the surgical field but struggles to maintain exposure due to collapsing tissue or workspace limitations.
222.77,229.054,"The surgeon uses a sponge to assist with retraction, preventing tearing of the surrounding fat tissue with the left hand."
229.554,242.283,"The surgeon observes a large ball of fat located to the right, which is likely associated with the patient's symptomatic hernia."
242.783,250.128,"The surgeon begins to reduce the hernia, manipulating the tissue to reposition it within the abdominal cavity."
250.628,274.897,The surgeon attempts to visualize the chord structures but struggles to maintain a clear view due to collapsing tissue around the surgical area.
302.595,312.199,"The surgeon observes the abdomen re-insufflate, indicating the restoration of proper gas pressure within the abdominal cavity."
317.942,333.159,"The surgeon parietalizes the cord structures, identifying the vas deferens in an area without a hernia sac."
345.378,374.506,The surgeon locates the spermatic cord within the surgical field.
375.006,381.071,"The surgeon begins to reduce a large lipoma, which is visibly prominent in the surgical field."
402.388,420.255,"The surgeon encounters lymph node tissue during the reduction, which poses a challenge as it obstructs the placement of the mesh."
420.755,433.122,The surgeon attempts to resect as much of the lipoma as possible to prevent any tissue from herniating behind the mesh in the inguinal canal.
433.622,442.667,The surgeon ensures that no obstructive tissue prevents the mesh from properly seating against the right myopectineal orifice (MPO).
443.167,469.023,"The surgeon continues to mobilize a large lipoma from the indirect space, carefully evaluating its extent as it is gradually freed from surrounding tissues."
469.523,488.889,"The surgeon isolates and removes the remaining portion of the lipoma, which is visibly extending and connected to the lateral aspect of the spermatic cord."
489.389,506.002,"The surgeon carefully protects the cord structures while observing additional tissue extending upwards, indicating further dissection may be required."
506.502,515.928,"The surgeon amputates the remaining portion of the lipoma at the specified level, ensuring complete removal from the surgical field."
516.428,527.444,"The surgeon observes the remaining retroperitoneal nodes, considering their potential impact on the placement of the mesh within the surgical field."
609.754,645.438,"The surgeon completes the reduction of the hernia, opting to leave the tissue intact while finishing the parietalization and establishing the right medial preperitoneal overlay (MPO)."
645.938,683.953,The surgeon reveals a large pocket within the surgical field and uses a 16x12 ProGrip mesh to address the hernia.
684.453,693.031,"The surgeon sutures the flap closed, completing the procedure."
