start,end,text
1.252,10.843,laparoscopic primary repair of perforated diverticulitis by Dr. Andrew Iraniha.
11.343,25.39,"This is a fifty-two-year-old female who presented with two days history of severe left lower quadrant abdominal pain, nausea, vomiting and fever and found to have sigmoid diverticulitis with microperforation on her CT scan."
25.89,32.813,"Despite conservative therapy with bowel rest and antibiotics, she continued to have increasing abdominal pain and tenderness."
33.313,43.218,"During the diagnostic laparoscopy, the surgeon identifies sigmoid diverticulitis with an intraabdominal abscess, noting the absence of gross fecal contamination in the abdominal cavity."
43.718,53.679,"The video shows the surgeon performing a primary repair of perforated diverticulitis, with visible suturing of the affected sigmoid colon and drainage of the intraabdominal abscess."
54.179,68.599,"The laparoscopic inspection reveals significant sigmoid diverticulitis with visible pericolonic inflammatory adhesions, a small interloop abscess, and the presence of frank intraabdominal purulent fluid."
69.099,76.883,"The surgeon drains the intra-abdominal purulent fluid and irrigates the abdominal cavity with an antibiotic solution, ensuring thorough cleansing of the surgical area."
77.383,105.765,"The laparoscopic view reveals microperforation in the sigmoid colon due to diverticulitis, with surrounding tissue showing inflammation but no visible gross fecal contamination."
106.265,115.89,"To eliminate the requirement for temporary colostomy for this patient, it was decided to repair the perforated diverticulitis primarily."
116.39,128.401,The surgeon places multiple intracorporeal sutures using a two-hole etabond technique to repair the perforated diverticulitis.
128.901,145.813,"Even though a sigmoid colectomy with temporary colostomy is the standard of care in these emergency situations, these patients would require second operation to take down their colostomy and reconstruct their colon after a minimum of three months."
146.313,213.593,"However, in this case, to prevent a temporary colostomy and improve the patient quality of life postoperatively, it was decided to repair the microperforation primarily and drain the abscess."
214.093,225.055,This patient tolerated the procedure very well and was discharged home on day number three after the operation with two antibiotics.
225.555,231.316,"The surgeon performs a laparoscopic sigmoid colectomy, followed by a primary anastomosis to reconnect the colon segments."
231.816,241.798,This approach did eliminate the requirement for creation of a temporary colostomy and improved the patient's quality of life tremendously within that three months interval.
242.298,252.767,"Obviously, this surgical option would not be suitable in most emergency cases when there's gross contamination or when patients are extremely sick and unstable."
253.168,257.512,"However, in selected cases, it could be the alternative surgical option."
