start,end,text
1.452,8.454,This video will demonstrate an en bloc minimally invasive DII resection for proximal gastric cancer in a North American context.
8.954,12.475,This patient is a seventy-three year old male who presented with anemia.
12.975,19.844,A large ulcerated lesion was identified on endoscopy in the gastric cardia and was biopsy proven to be an adenocarcinoma.
20.344,25.066,Saging CT did not show any evidence of local invasion of metastatic disease.
25.566,33.208,"After discussion with the patient and the medical oncologist, it was decided to proceed directly to surgery with planned adjuvant treatment."
33.708,36.47,"The tumor is visible on the anterior surface of the stomach, appearing as a distinct lesion against the surrounding gastric tissue."
36.97,47.448,"The surgeon performs a thorough laparoscopy to inspect for metastatic disease, then uses electrocautery and ligature to separate the greater omentum and dissect into the lesser sac."
47.948,65.597,"The surgeon visually confirms the absence of posterior extension of the gastric tumor into the pancreas, mesocolon, or any major vessels."
66.097,70.039,"The surgeon identifies and ligates the right gastroepiploic artery using a ligature, securing the vessel within the surgical field."
70.539,83.791,"The surgeon dissects the remaining portion of the distal stomach away from the pancreas, carefully separating the stomach tissue from the underlying pancreatic surface."
84.291,86.478,"The surgeon begins dissection of the portal lymph nodes, carefully separating them from surrounding tissues using surgical instruments."
86.978,113.244,"The surgeon divides the overlying peritoneum, revealing the common bile duct, portal vein, and common hepatic artery within the surgical field."
113.744,119.311,"The surgeon begins posterior dissection to identify the right gastric artery, carefully navigating the anatomical structures in the surgical field."
119.811,131.526,"The surgeon isolates the right gastroepiploic artery, ligates it with a ligature, and visually confirms that none of the portal structures are involved in the ligation."
132.026,145.357,"The surgeon ligates the identified vessel, securing it with a ligature to prevent bleeding."
145.857,166.208,"The surgeon clears the hepatoduodenal nodes medial to the identified portal structures and divides the gastrohepatic ligament, ensuring all critical structures are isolated."
166.708,177.548,"The surgeon mobilizes the remaining portion of the stomach away from the pancreas and isolates the left gastric vessels, ensuring clear separation from surrounding tissues."
178.048,186.715,"The surgeon ligates the left gastric vein using a ligature, securing the vessel within the surgical field."
187.215,217.191,"The surgeon identifies the left gastric artery and ligates it using both clips and a ligature, ensuring secure closure of the vessel."
217.691,227.837,The surgeon divides the duodenum distal to the pylorus after mobilizing the entire distal stomach and proximal duodenum.
228.337,232.86,"The surgeon uses a 60mm tan tri-stapler to divide the duodenum distal to the pylorus, following the mobilization of the distal stomach and proximal duodenum."
233.36,238.023,"The surgical field shows the results of the portal dissection, with all hepatoduodenal nodes visibly removed."
238.523,246.418,"The surgical field displays the common bile duct on the left, alongside the right and left hepatic arteries, the celiac axis, and the origin of the splenic artery."
246.918,269.476,"The surgeon clears the remaining lymph nodes from the splenic artery, which are located adjacent to the pancreas, using precise dissection techniques."
269.976,292,"The surgeon dissects the stomach away from the spleen, clearing nodes at the splenic hilum and dividing the short gastric vessels using a ligature device."
292.5,299.406,"The surgeon dissects the pericardial nodes while mobilizing the proximal stomach and esophagus, completing the nodal basin clearance."
299.906,322.053,"The surgeon uses cautery to divide the peritoneum circumferentially around the esophagus, enabling the esophagus to be retracted inferiorly."
322.553,327.067,"The surgeon divides the esophagus using a 60mm purple linear stapler, completing the transection with precise alignment."
327.567,340.63,"The surgeon places the fully mobilized specimen above the liver, preparing the surgical field for the reconstruction phase."
341.13,342.931,"The surgeon identifies the ligament of Treitz, a key anatomical landmark located at the junction of the duodenum and jejunum."
343.071,357.237,"The surgeon measures approximately fifty centimeters of small bowel and divides it using a forty-five millimeter white linear stapler, separating the bowel segment from the rest of the intestinal tract."
357.737,365.281,"The surgeon measures the Roux limb and performs a side-to-side jejunogenostomy using a 60mm white linear stapler, joining the jejunum segments."
365.781,375.086,"The surgeon closes the enteric defect using a three-year absorbable suture, ensuring the defect is securely sealed."
375.586,380.707,"The surgeon uses a circular EEA stapler to create the esophago-jejunal anastomosis, connecting the esophagus to the jejunum."
381.207,389.841,"The surgeon passes the anvil through the patient's mouth and inserts the circular stapler through a small incision in the abdominal wall, using a wound protector to safeguard the incision site."
390.341,413.865,"The surgeon inserts the stapler through the end of the roux limb and deploys the spike through the anti-mesenteric wall of the bowel, preparing for anastomosis."
414.365,420.212,"The surgeon uses a sixty millimeter white linear stapler to staple closed the end of the jejunum, completing the closure of the jejunal segment."
420.712,443.511,"The surgeon reinforces the esophago-jejunal anastomosis with a hand-sewn layer of absorbable suture, applying the suture circumferentially around the anastomosis site."
444.011,451.48,"The surgeon tests the esophago-jejunal anastomosis by passing a nasogastric tube through it and insufflating with air and blue dye, observing for any leaks or abnormalities."
451.98,455.405,"The surgeon removes the gastrectomy specimen through a small incision, using a fan and seal technique to facilitate extraction."
455.905,459.43,We do not routinely leave drains or feeding tubes for these patients.
459.93,473.102,This patient went home on post-op day four.
473.602,474.105,Thank you.
