start,end,text
15.36,40.354,"The laparoscopic cholecystectomy begins with the placement of an 11mm camera port and three additional ports: one in the epigastrium and two 5mm ports in the right hypochondrium along the mid-clavicular and mid-axillary lines. The mid-axillary port is used for fundal retraction, initiating the operation with posterior Calot's triangle dissection."
40.854,44.499,The surgeon uses a hook cautery or Maryland dissector to perform the dissection during the laparoscopic cholecystectomy.
47.662,50.105,"The surgeon performs anterior dissection of the gallbladder, using laparoscopic instruments through established ports in the epigastrium and right hypochondrium."
56.632,81.951,"The surgeon identifies the cystic duct and cystic artery while achieving the critical view of safety. The posterior dissection is performed to ensure no structures extend from the gallbladder bed into the liver, with the critical view of safety clearly visible."
82.451,106.288,"The surgeon visualizes the gallbladder and Calot's triangle, ensuring no structures extend into the liver. The cystic duct and cystic artery are carefully dissected using a Maryland dissector."
106.788,135.071,"In the Calot's triangle, the surgeon achieves hemostasis after separating the cystic duct and cystic artery. Clips are applied with two proximally and one distally, followed by cutting the cystic duct and cystic artery."
135.571,164.989,"The surgeon achieves proper hemostasis using bipolar, unipolar, and harmonic scalpels. After clipping and cutting the cystic duct and cystic artery, the gallbladder is dissected from the liver bed and removed."
165.489,205.524,The gallbladder is removed through the epigastric or umbilical port and prepared for histopathological examination.
