start,end,text
7.037,12.64,This is a pretty straightforward robotic repair of an incarcerated right inguinal hernia.
13.14,16.921,I did have to reduce the contents preoperatively.
16.941,20.503,"The surgeon works on creating a preperitoneal flap, manipulating the tissue layers to expose the underlying structures."
20.523,40.226,"The surgeon encounters adhesions around the infraepigastric vessels, carefully creating space and reorienting the surgical approach to access the desired window for further dissection."
40.726,60.234,"The surgeon carefully pulls the pocket away from the abdominal wall, noting the minimal presence of lateral fat to avoid drifting into the abdominal wall."
60.734,125.222,"The surgeon maneuvers within the supravesicular space, moving instruments back and forth to manipulate the tissue in this area."
125.722,133.693,Changing my angle of the camera to my right lateral oblique angle. Always helps me to differentiate.
133.713,153.637,"The surgeon uses electrocautery on the sac, carefully pulling surrounding structures and fat to allow them to separate and fall away."
154.137,159.838,"The surgeon uses electrocautery to buzz directly on the sac, targeting fatty tissue to push it laterally and allow it to sweep downwards."
160.098,170.301,"The surgeon approaches the edge of the sac, revealing the vas deferens. A small cord lipoma is pulled out alongside the vas deferens."
170.321,185.706,The surgeon identifies the vas deferens on the right side of the surgical field.
186.206,215.574,"Right there, you can see it."
216.074,236.483,"The surgeon opens up the fat tissue to orient themselves towards the Cooper's ligaments and pubic tubercles, revealing underlying anatomical landmarks."
236.983,254.073,The edge of the sac is clearly visible in the surgical field.
254.573,268.428,"The surgeon searches for a cord lipoma, examining the surrounding tissue for its presence."
268.928,285.92,"The surgeon carefully navigates around the corner, ensuring to maintain distance from the iliac vessels during the dissection."
286.42,318.571,"The surgeon performs bilateral suprapubic fixation, with high medial positioning. The muscles are visible in front of the surgeon, and there are no identifiable vascular structures obstructing the view."
319.071,320.254,"And that's it, standard closure."
