start,end,text
1.56,28.211,So this is Yuigi Ubinaga and Dr. Mohan Aryanagam talking about Left Transparent Toneal Laparoscopic Nephrectomy.
28.711,51.967,"The surgical team places a 10mm port at the left iliac fossa, followed by a 5mm camera port at the transumbilical point, and another 5mm port under the costal margin in the left upper quadrant. A 5mm assistant port is positioned laterally."
52.467,55.25,The main point here is to not go behind the posterior to the kidney.
55.75,65.098,"The surgeon carefully mobilizes the left colon, ensuring it is dropped down without breaching the Gerota's fascia."
65.598,69.681,"The surgeon navigates between the mesenteric fat and the Gerota's fascia, carefully separating these layers during the laparoscopic nephrectomy procedure."
70.121,82.051,"The video demonstrates the contrasting colors of the mesenteric fat, which appears egg yellow, and the gyrotus fascia fat, which is salmon pink."
82.551,89.057,"The surgeon mobilizes the spleen, an essential step in the left nephrectomy procedure, ensuring proper exposure and access to the kidney."
89.557,95.402,"The surgeon performs early mobilization of the spleen and pancreas, carefully maneuvering these organs to facilitate access for the left nephrectomy."
95.902,103.709,"And I think it's important that you have a nice retraction beyond the spleen to show you where you need to go, isn't it?"
103.937,114.151,"The surgeon uses a retractor to carefully push the spleen away, ensuring it is moved without causing injury or bleeding."
114.651,119.318,"The surgeon continues to mobilize the spleen, ensuring it is fully detached and repositioned to allow optimal access for the nephrectomy procedure."
119.818,137.515,"The surgeon cuts the peritoneal attachments on the lateral side wall to release the spleen, allowing it to fall away completely while being mindful of the pancreas's proximity."
138.015,162.623,"The surgeon has mobilized the spleen sufficiently to expose the psoas muscle at the upper pole of the kidney, indicating successful retraction and freeing of the upper pole during the left nephrectomy."
163.123,174.387,"The surgeon continues to mobilize the bowel in a caudal direction using a grasper, applying good traction while ensuring the dissection remains within the correct anatomical plane."
174.887,181.05,"The surgeon navigates through an avascular plane, ensuring proper positioning within the correct anatomical layer to avoid vascular structures."
181.55,187.217,This plane is often a bit different when it's a nephroureotrectomy for urethelial carcinomas. There's often a
187.717,204.12,"The surgeon encounters a desmoplastic reaction while dissecting near the iliac vessels and bifurcation, which may not open cleanly during the nephrectomy procedure."
204.58,210.967,"pulsation, pulmonary pulsation when you're going down to the lower area, isn't it? Yes, definitely. And you've got to be careful. Yeah, in smaller patients."
211.027,227.67,"So I think the smaller patients, people who've had kyphosis or scoliosis and even paraplegics and patients who've been in wheelchairs for long periods of time, their entire body shape is different and so you have to be prepared for anything."
228.17,240.067,"The surgeon carefully navigates around the pancreas, visible on the left side of the screen, to avoid injury during the nephrectomy procedure."
240.567,257.856,"The surgeon continues the dissection during a left nephrectomy, focusing on mobilizing the kidney's upper pole and freeing it medially. The kidney is carefully lifted off the aorta as part of the procedure."
258.356,267.72,And then it's difficult to mess it up. Do you see pulsation at this dissection?
268.16,291.128,"You may not see the pulsation, but you need to, by the time you get to the hilum, you really do need to, ideally you should have the aorta on view so that it's clear where exactly the hilum lies. But again, it's different. Each case is different, and it's something that's much more important when doing a medial tumor compared to this, which is a much more standard tumor."
291.628,295.215,"So in this section, I'm going to start opening up"
295.715,329.231,"The surgeon mobilizes the bowel medially and opens the Gerota's fascia to access the psoas major muscle. The gonadal vein is visible as a landmark, typically used for retraction, but in this instance, it naturally lies below and does not require lifting."
329.731,348.309,"The surgeon inserts a fixed retractor, using either a metal pointer or a laparoscopic peanut, to lift the kidney. The view shows the hilum remaining with some surrounding fat, while the posterior part of the kidney is completely freed."
348.809,363.139,"The surgeon uses sharp dissection to carefully operate and dissect the hilum, utilizing both hands for precise manipulation of the tissue."
363.639,377.282,"The surgeon mobilizes and opens the gyrotous fascia anterior to the renal vein, revealing the adrenal vein once the fascia is fully opened."
377.782,396.734,"The surgeon proceeds medially, identifying the lumbar veins on the left side, which are seen wrapping around the artery and joining the renal vein, potentially obstructing the artery's exposure."
397.174,409.413,"The surgeon has dissected and clipped a lumbar vein, with the gonadal vein visible below. Additional lumbar veins are observed posteriorly, highlighting their potential risk during the procedure."
409.913,422.041,"The surgeon observes slight oozing from the surgical site, noting that if avulsed, the area near the psoas muscle may retract and continue to bleed, potentially causing complications."
422.541,459.988,"The surgeon applies green Hem-o-lok clips to the lumbar vein, ensuring careful placement to avoid interference with a stapler during subsequent steps. The gonadal vein is also divided in this section."
460.488,494.501,"Gentle suction reveals a tributary of the renal vein, likely a small branch of a lumbar vein. The surgeon prepares to dissect and control this vein using green hemlock clips."
495.001,560.222,"The surgeon cleans the area inferior to the vein, revealing the artery. Using scissors, the artery is gently dissected by stroking it to remove fascia and expose it fully. This preparation facilitates the placement of hemologs or staples for controlling the artery and vein."
560.722,582.176,"The surgeon places a purple hemlock clip on the renal artery, using two clips on the stay side and one at the top. Due to difficulty in fully mobilizing the artery, a single clip is initially applied to control the inflow before addressing the vein."
582.396,611.951,"The surgeon carefully dissects around the renal vein, paying attention to the nearby adrenal vein located in the upper corner of the surgical field. The adrenal vein is identified and spared during the mobilization process."
612.451,639.933,"The surgeon applies gold hemlocks to preserve the adrenal and adrenal vein, using a technique of cutting along the curve and lifting upwards to gain additional millimeters of tissue cuff."
640.433,662.86,"The surgeon applies two hemlocks to secure the vessel, ensuring they are positioned to prevent slipping. The tissue between the hemlocks appears ischemic, indicating that the first hemlock is primarily effective."
663.36,695.142,"The surgeon has exposed the renal artery, which is now visible and ready for further manipulation. A band of tissue around the hilum is also present, which can be clipped or addressed using a harmonic scalpel for smaller structures."
695.642,746.088,"The surgeon applies additional purple clips to secure the renal artery, avoiding metal clips due to concerns about slippage. A band of tissue remains, and the next step involves separating the kidney from the adrenal gland. The Gerota's fascia is opened, revealing ample space as the spleen is displaced."
746.588,798.07,"The surgeon uses a vascular stapler to secure the area around the upper pole of the kidney, ensuring careful dissection due to the presence of significant blood vessels. Hemlocks are applied to control bleeding, and the diathermy is increased to fifty or sixty to further reduce bleeding. A Hemlock is placed on the fat at the upper pole, which contains vessels, while alternative instruments like harmonic or ligature can be used for ease."
798.11,836.393,"The surgeon uses a grasper with the left hand to lift the kidney while cutting with the right hand, providing better traction. The dissection reveals the source in the aqua pool, and the ureter is taken, completing the procedure."
836.893,857.6,"The surgeon identifies the gonadal vessels, which have fallen down, and the ureter, which is clamped."
858.1,898.569,"So I think you always do the upper pole and then come down to the lower pole and sort of lift you, lift it up from, that's the right way, you sort of dissect from the below, isn't it, rather than going from above. And I find that it's quite sort of easier almost to... Oh, like that, yeah, yeah. Well, I think you just, the main thing is that when you take, once you've done the high limb and everything else and you're just left with the kidney to immobilize, Again, the time efficient way to do it is to just get into the right plane once and then just get on the back wall and then do it. So it doesn't really matter where you do it from. It's wherever it's working for you. So usually it's reasonable to do a bit from the top and a bit from the bottom and do whatever you want, whichever order you want."
898.789,955.786,"The surgeon carefully dissects through the spider web-like loose areolar tissue, avoiding the abdominal wall to minimize post-operative pain. High diathermy settings are used to efficiently separate the kidney from surrounding tissues, ensuring it is free before attempting to bag it, thus preventing potential bleeding from small arteries."
956.286,994.413,"The surgeon cuts the last section of the peritoneum, maintaining good traction to reveal the areolar tissue plane. The retroperitoneal layers are visible, demonstrating the anatomical separation."
994.913,1037.452,"The surgeon prepares to bag the kidney by positioning it to slide easily into the retrieval bag. A grasper is used to hold the kidney up, facilitating the placement of the bag underneath. The surgeon considers using a fifteen millimeter port for easier access but typically opts to change the gas settings on the existing five millimeter ports."
