start,end,text
60.301,64.863,"The surgeon reduces the stomach into the abdominal cavity, visually repositioning it from its previous location."
65.363,71.906,"The surgeon begins the initial dissection from the patient's left side, moving towards the right, using robotic instruments."
72.406,81.249,"The surgeon divides the short gastric vessels superiorly, approaching the left crus of the diaphragm."
81.749,86.858,The surgeon identifies the hernia sac and carefully dissects it free from surrounding tissues.
87.358,115.82,"The surgeon uses a bipolar instrument to bluntly and sharply dissect the left crux, then shifts attention to identifying and dissecting the right crux. The dissection continues from the left side to the right side, and the anterior vagus nerve is identified."
116.32,132.446,"The surgeon mobilizes the esophagus and performs further posterior dissection, revealing the anatomical structures surrounding the esophagus."
132.946,138.548,The surgeon identifies the posterior vagus nerve during the dissection.
139.048,142.749,The surgeon identifies the anterior vagus nerve during the dissection process.
143.249,148.054,"The surgeon focuses on the hernia sac, which has been identified and is being dissected free from surrounding tissues."
148.554,182.439,"The surgeon performs retraction and intersection, continuing dissection with excessive traction from the left side. The left posterior vagus nerve is inadvertently dissected free during this process."
219.506,230.35,The surgeon identifies the injury to the vagus nerve and prepares to perform a repair procedure.
230.85,238.973,The surgeon identifies the anterior vagus nerve and ensures its preservation during the procedure.
239.473,249.499,"The surgeon cleans the edges of the vagus nerve and approximates them using floral PDAs, ensuring precise alignment of the nerve tissue."
249.999,277.462,"The surgeon uses robotic assistance to place two sutures, approximating the vagus nerve. Attention is given to the hiatus during the initial approximation."
277.962,292.026,The surgeon uses CRIO V-Lock absorbable sutures followed by CRIO silk sutures in an interrupted fashion to repair the identified injury.
292.526,324.1,The surgeon reinforces the hiatal repair by placing an absorbable mesh over the repaired area.
324.6,333.885,"The surgeon performs a partial fundoplication, wrapping the stomach around the lower esophagus to create a valve mechanism."
334.385,347.233,"The surgeon fashions the fundoplication and secures it using serial cell sutures, completing the wrapping of the stomach around the esophagus."
347.733,357.921,"The surgeon performs a pexy of the fundoplication to the diaphragm, securing the fundoplication in place using sutures."
358.421,366.947,An intraoperative endoscopy is performed to visually assess the identity and integrity of the recently completed fundoplication.
