start,end,text
98.675,114.469,"The surgeon begins the operation by reducing the incarcerated omentum, with assistance from the bedside assistant."
124.183,139.031,"The surgeon removes the falciform fat to improve mesh apposition to the fascia. If significant umbilical ligament fat is present, it would be similarly excised."
139.531,147.956,"The surgeon divides the ligamentum teres, ensuring they are operating within the correct anatomical plane."
158.603,186.229,The surgeon removes the median fat pad and carefully dissects some of the peritoneum from the posterior rectus sheath. The transversalis fascia is separated from the anterior structures to preserve a robust peritoneal layer.
198.994,209.998,"The surgeon observes a two-centimeter rectus diastasis in the patient. The fascial defect is closed using a running V-lock 180 suture, visibly bringing the edges of the fascia together."
232.437,266.596,The surgeon instructs the bedside assistant to push down on the umbilical skin while carefully taking a small bite of the hernia sac to invert the umbilicus.
267.096,308.205,"The surgeon lays sutures without tightening them, facilitating the grasping of the umbilical stock through a small hernia defect. The suture is run back at least two throws, sometimes covering the entire length of the defect, while maintaining insufflation pressure."
308.705,334.558,"The surgeon uses a Bard Ventralight ST mesh, pre-placing a V-Loc 180 suture in the center to suspend the mesh towards the ceiling. The suture is then threaded back through the mesh onto the coated side."
335.058,356.123,"The surgeon secures the mesh on their side by suturing it towards themselves, ensuring at least a four-centimeter overlap for the smaller defect."
356.623,380.416,"The surgeon uses the same suture to perform a baseball stitch circumferentially around the defect, advancing the stitch with intervals of slightly less than a centimeter."
380.916,398.839,"The surgeon uses a twelve-inch V-Loc suture to begin suturing in a counterclockwise direction, approaching the area of the diastasis."
461.087,511.456,"The surgeon continues suturing around the periphery of the mesh after passing the diastasis area, securing the central part of the mesh to the abdominal wall to minimize the pocket and reduce seroma formation. The video is sped up to show the straightforward suturing process."
511.956,528.065,"The surgeon alternates between suturing techniques, going from flesh to mesh and mesh to flesh, as they secure the mesh to the abdominal wall."
528.565,553.665,"The surgeon secures the falciform ligament to the abdominal wall using absorbable braided sutures, covering the portion of the mesh that was not secured at the edge."
554.165,578.235,"The surgeon demonstrates clear visualization of the mesh, particularly the ipsilateral edge, facilitated by effective port placement. The mesh appears adequately sized for the surgical field."
