start,end,text
15.843,21.424,The laparoscopic view shows the gallbladder positioned beneath the liver within the abdominal cavity.
21.924,23.424,The surgeon uses dissectors to manipulate and separate tissues during the laparoscopic cholecystectomy procedure.
23.584,26.985,"The surgeon uses a fundus holder to grasp the gallbladder fundus, stabilizing it for further manipulation during the laparoscopic cholecystectomy."
27.045,29.386,The surgeon uses a Maryland curved dissector to manipulate the gallbladder during the laparoscopic cholecystectomy procedure.
29.886,53.5,"The surgeon begins peeling off the fat and peritoneum from the junction of the gallbladder and cystic duct, dissecting the peritoneum over the cystic artery anteriorly. The dissection continues as the surgeon carefully removes the fat and peritoneum."
54,68.812,"The surgeon delineates the anatomy at the junction of the cystic duct, which connects the gallbladder to the common bile duct visible below."
69.312,72.471,"The surgeon uses a Maryland curved dissector to peel off the peritoneum from the junction of the gallbladder and cystic duct, continuing the dissection process."
72.971,86.385,"The surgeon clears the layer of fat around the junction of the gallbladder and cystic duct, ensuring a clear view before applying clips. The surgical field experiences temporary fogging."
86.885,115.8,"The surgeon clears the fog from the camera and re-enters the surgical area, using a blunt dissector and fundus holder to grasp the gallbladder fundus. The posterior dissection involves peeling the gallbladder away from the liver fossa to increase the exposed area."
116.3,125.607,"The surgeon carefully dissects anteriorly near the junction of the gallbladder and cystic duct, taking care to preserve the underlying common bile duct visible below."
126.107,152.596,"The surgeon carefully navigates the inflamed area between the cystic artery and the cystic duct, successfully entering the space while noting the presence of associated lymph nodes."
153.096,166.345,"The surgeon encounters a thickened and slippery gallbladder due to chronic inflammation and surrounding fat, making the dissection challenging."
204.542,213.509,"The surgeon performs the procedure under general anesthesia, with the abdomen visibly inflated using carbon dioxide for laparoscopic access."
214.009,240.138,"The surgeon performs a posterior dissection, focusing on the area above the gallbladder, resembling a fundus-first approach. The dissection technique involves a quadrangle dissection, differing from the traditional Calot's triangle dissection."
245.639,263.064,"The surgeon performs dissection in the posterior window, focusing on the area between the cystic duct, cystic artery, and the base of the gallbladder junction."
301.032,319.47,"The surgeon identifies a cholecystohepatic duct, an additional duct that connects directly from the liver to the gallbladder, distinct from the common bile duct."
336.157,366.068,"The surgeon coagulates a visible vein before tearing it to prevent bleeding, which could obscure the surgical field and necessitate suction to maintain clear visibility."
366.568,395.017,"The surgeon carefully peels off the fat and peritoneum from the cystic artery, which is visibly leading to the gallbladder. A small vessel, possibly a cystic vein, is coagulated during the procedure."
395.517,399.28,"The cystic artery is visibly positioned on the surface of the gallbladder, demonstrating its anatomical course as it supplies the gallbladder."
399.7,415.493,"The surgeon identifies the cystic artery and cystic duct, highlighting the junction between the cystic duct and the common bile duct, which is positioned horizontally below."
415.974,422.469,"The surgeon is positioned at the base of the cystic structure, with the cystic artery visible vertically in the surgical field."
422.969,428.973,"The surgeon visually identifies the junction between the cystic duct and the horizontally lying common bile duct, highlighting the anatomical relationship between these structures."
454.592,462.877,The video shows a clear demonstration of the junction between the vertically oriented cystic duct and the horizontally lying common bile duct.
462.917,470.682,"The surgeon clips the cystic artery and cystic duct, securing these vessels to prevent bile leakage during the cholestectomy procedure."
471.182,478.566,The surgeon removes the Maryland dissector and prepares to insert the clip applicator through the surgical port.
478.606,481.348,"The surgeon uses a clip applicator to secure a clip onto the cystic duct and artery, preparing for ligation."
481.848,510.069,"The surgeon applies a clip onto the base of the cystic artery, ensuring it is securely pressed to maintain the structure and prevent fluid leakage."
510.569,527.687,"The surgeon ensures that the clips applied to the cystic duct are secure, squeezing out tissue fluid and blood to prevent the clips from becoming loose."
528.187,556.156,"The surgeon identifies the cystic duct, which is positioned vertically and horizontally adjacent to the common bile duct. The gallbladder is relaxed to ensure the clip is applied correctly onto the cystic duct, avoiding the common bile duct."
566.829,569.172,"The surgeon applies a clip securely onto the cystic duct, ensuring it is positioned away from the common bile duct."
569.192,572.777,"The surgeon prepares to apply another clip onto the cystic duct, ensuring it is positioned away from the common bile duct."
573.277,599.983,"The surgeon uses a single-clip applicator to securely apply a clip onto the cystic duct, ensuring that the clip is properly positioned and secured."
600.483,618.407,"The surgeon applies clips to the cystic duct and cystic artery, preparing to cut these structures to detach the gallbladder from the common bile duct."
618.427,622.928,"The surgeon visually identifies the cystic duct, preparing for further surgical manipulation."
623.428,646.977,"The surgeon focuses on the cystic artery, clearly visualizing and dissecting both the anterior and posterior branches. Careful delineation of the posterior branch is emphasized to prevent potential bleeding."
647.477,651.079,"The surgeon carefully removes the gallbladder from the gallbladder fossa, separating it from the surrounding tissue."
651.479,669.992,"The surgeon uses a monopolar cautery hook to cut and remove the attachments of the gallbladder from both sides, as visible on the screen."
670.492,696.689,"The surgeon pushes up the gallbladder from the liver bed, noting that the posterior wall is not thickly attached despite the thickened fascia and peritoneum on the sides."
737.139,749.887,"The surgeon uses electrocautery to coagulate small capillaries and blood vessels in the fossa where the gallbladder was attached, ensuring hemostasis in the area."
750.387,754.851,"The surgeon performs cauterization on the gallbladder bed, applying heat to coagulate small blood vessels and capillaries in the area."
755.292,767.583,"The gallbladder is successfully separated from the surrounding structures and rests on the gallbladder bed or fossa, with visible cauterization marks from previous dissection."
768.043,770.045,"The gallbladder has been completely removed from the gallbladder bed, leaving the surgical site clear of the organ."
770.486,772.888,"The surgeon uses a suction device to clear fluids and debris from the gallbladder fossa, ensuring a clean surgical field after the gallbladder removal."
773.388,798.346,"The surgeon inspects the gallbladder fossa, ensuring that clips on the cystic duct and artery are properly applied. Any residual blood is suctioned out, confirming there is no bleeding or bile leakage in the area."
812.397,837.922,"The surgeon places a suction drain inside the surgical site, ensuring proper drainage post-procedure."
