start,end,text
2169.775,2200.358,The surgeon completes the sacral colpopexy by tying and fixing the mesh to the sacral promontory using a suture.
2200.858,2213.183,"So this is at the end of the surgery. I'm not showing the whole surgery, I'm just showing the difficult parts of the surgery where, where three D laparoscopy plays an important role. So yeah, I finished the surgery. Okay, I've completed the surgery."
2213.683,2227.073,"So the last video is a case of a radical hysterectomy. Now I'm not going to show the whole radical hysterectomy. I'm just going to show one part, which I think is the most difficult part in the radical hysterectomy, which is de-roofing the ureteric tunnel."
2227.573,2242.503,"The surgeon identifies the ureter and the already cut left uterine artery. Using harmonic scalpel, the surgeon carefully de-roofs the ureteric tunnel, ensuring the ureter remains uninjured."
2243.003,2259.221,"The surgeon uses a harmonic scalpel to de-roof the ureteric tunnel, carefully dissecting around the ascending branch of the uterine artery."
2259.721,2279.514,so this area is very we need to be very careful because if you're not careful you can cause fistulas and you cannot what it call as you cannot be the vascularized so here I'm using another instrument which is a bipolar I don't like to use a harmonics at this place I like to use a very precise
2280.014,2290.159,"The surgeon uses the ERBI BiClan, a precise coagulative instrument, to perform tissue coagulation. This smart bipolar device is reusable and offers controlled coagulation during the procedure."
2290.519,2303.026,"The surgeon identifies the knuckle of the ureter and begins releasing surrounding tissue using a precise bipolar coagulative instrument, ensuring careful manipulation to avoid injury."
2303.526,2317.615,"The surgeon uses the ERBI BiClan bipolar instrument to coagulate and cut tissue near the ureter, avoiding the use of harmonics or bisect tools in this area to prevent injury to the ureter."
2317.635,2330.037,"The surgeon uses a bipolar instrument to coagulate and cut tissue around the ureter, releasing it from surrounding structures. The three-dimensional laparoscopic view enhances precision in this delicate area."
2330.077,2345.363,"The surgeon identifies the Yabuki space, which is medial to the ureter, and completes the dissection of the ureter during a radical hysterectomy."
2345.863,2360.034,"The surgeon releases the ureter from surrounding bladder tissue, using harmonic instruments to separate the bladder area."
2360.394,2373.184,"But very near the ureter, we need to be very careful. So having a three-D laparoscopy, this kind of difficult cases, you get more confidence. You can do the surgery in a more confident manner."
2373.684,2381.092,"The surgeon has completely de-roofed the ureter, exposing it fully within the surgical field."
2381.392,2391.843,"The surgeon approaches the right side of the surgical field, noting the increased difficulty due to the angle of approach, with all instruments positioned on the left side."
2391.863,2406.296,"The surgeon approaches the left side to de-roof the ureter using harmonic scalpel, carefully navigating through the tunnel to release the ureter from surrounding tissue."
2406.416,2420.671,"The surgeon releases the parametrial tissue on top of the ureter, which will be removed with the uterus. The surgeon continues to de-roof the ureter on the right side using surgical instruments."
2421.071,2431.334,"The surgeon highlights the ureter, focusing on an area known as the 'knuckle,' where the ureter shifts and turns. This region is visually identified as one of the most dangerous areas during the procedure."
2431.375,2442.541,"The surgeon isolates the ureter, carefully dissecting the surrounding tissue to prevent accidental cutting or coagulation of the ureter."
2443.041,2453.37,"The surgeon identifies the medial part of the ureter within the Yabuki space, observing the ureter's path through this anatomical area."
2453.49,2466.632,"The surgeon uses precise dissection and coagulation techniques to release surrounding tissues from the ureter, utilizing the enhanced visualization provided by 3D laparoscopy."
2466.812,2481.976,"The surgeon uses scissors to release tissue, followed by diathermy for further dissection. As the procedure progresses closer to the ureter, a harmonic device is employed for distant tissue release, while a bipolar instrument is used for precise tissue separation near the ureter."
2481.996,2493.12,"The surgeon releases the bladder from the cervix, completing the dissection of the ureter, which is now fully isolated."
2493.2,2501.776,"So once both the ureters are dissected, then the surgery becomes easy. So this is where I think your three-D laparoscopy becomes very useful."
2502.276,2510.783,"So those are my three cases, so now I'll conclude. In conclusion, I enjoy three-D laparoscopy. I'm a passionate laparoscopist, I think you all know."
2511.223,2523.792,"And because I do three-D laparoscopies, I enjoy my surgery. I enjoy it because identification and dissection of tissues is easier. It is safer for the patient. It is also suturing becomes very easy."
2524.292,2542.16,"And more importantly, I become less fatigued when I'm performing long surgery, especially endometriosis surgery. And when I want to do a good endometriosis surgery, I must do it with three D laparoscopy. It is of course more expensive than two D laparoscopy, but I think it is a worthwhile investment."
2542.66,2557.31,And nowadays two D laparoscopy is already incorporated into a three D camera system. So you can get two in one. I hope that in future there will be some improvements in three-day laparoscopy and this will include thinner telescopes.
2557.37,2574.851,"We want eight millimeter telescopes. We want five millimeter telescopes. We want the ability to rotate the telescope so that we can see the sites. And I think this will come soon. And also the ability to zoom out. We can zoom in, but we cannot zoom out. If we can zoom out, then I can do a lot more surgery from the umbilicus."
2575.351,2583.617,"Okay, thank you very much for listening. And if there is any questions, I would be ever happy to answer this question. So back to you, Raj."
