start,end,text
2.068,14.132,Welcome everyone who is participating in our webinar session. It's a digital dialogue on three D laparoscopy in gynecology with Dr. Selva.
14.632,24.096,Thank you for joining us today. I'm going to run through the program with you before Dr. Selva takes over the session.
24.596,31.452,"Five minutes, welcome and introduction, which I'm currently doing. And I will also introduce you Dr. Selva in a few minutes time."
31.952,43.676,We will have a thirty-minute session on three-D laparoscopy in gynecology by Dr. S. Selva. The difference between two-D and three-D and why a lot of gynae would prefer a three-D technology.
44.176,58.492,"Case presentation, so he has lined up a few case presentation as well for this afternoon and we will also then prolong this with a twenty-five minute question and answer session which you could ask while the"
58.992,69.178,"theoretical or the case presentation is running, you can also already start putting in your questions so that Dr. Selva will be able to answer this later on."
69.639,87.465,"Of course, we have kept the duration of this entire program to an hour, but we will also extend this slightly later because we would like Dr. Selva to share all these cases and he needs a little bit more time because he would not want to edit too many of these videos."
87.965,92.788,And we hope that you would stay until the end of this session.
93.288,100.131,"Let me first introduce Dr. Selva. He's a consultant obstetric and gynecologist from the Makota Medical Center, Malacca."
100.211,111.536,It's a very nice historical town in Malaysia. He's one of our lead person who has bought the three-D Einstein many years ago as well. So I'd like to thank Dr. Selva for that.
112.036,131.179,"And since then, he has been using it very frequently. He is a consultant OBGY in this hospital. He also sub-specialized in reproductive medicine at the Makuta Medical Center and is the head of OBGY unit and CVF center."
131.36,142.873,He was also the past president of the OBGY Society of Malaysia and he chairs the endoscopic subcommittee as well for Malaysia.
143.373,159.409,"Now, some guidelines and important messages. All your microphone will be muted because that would allow Dr. Selva to present his cases and also his presentation. You can post your questions in the question and answer section anytime throughout the session."
159.909,173.928,"And for your info, the sessions will be recorded. And without further ado, we would like to welcome Dr. Selva. for this eWebinar session and I'm handing over the session to Dr. Selva."
173.968,183.21,Thank you.
183.71,196.677,"Okay. Thank you, Raj. Firstly, let me thank B. Brown for inviting me to speak during this webinar."
197.177,199.498,Is it shared? I think it is shared.
199.998,213.004,"Um, so, uh, my topic today is on treaty laparoscopy in gynecology. I, again, I would like to thank, uh, S club B Brown for inviting me to share my experience in using treaty laparoscopy in gynecology."
213.504,222.341,"I also like to thank all of you for spending your time, your afternoon with me."
222.841,241.896,"Okay, how I decided on three-D laparoscopy. In, I was invited by the late Dr. Rakesh Sinha to the first three-D laparoscopy workshop at his center in Mumbai."
242.396,257.448,"And he was using the version one Einstein vision, three D laparoscopy at that time. And I was very impressed with that system. In June, nearly one year later, I was able to test the camera system in Malaysia and I fell in love with it."
257.948,264.576,"And I got the system in December, So now I've been using it for more than six years."
265.076,275.852,"The video displays the Einstein Vision version one system, featuring a robotic arm and a camera head weighing approximately two kilograms."
276.352,284.679,And this is Dr. Rakesh Sinha operating in his center in Mumbai. the first in the world to start a three-D laparoscopy.
285.179,296.283,"And I happen to be the first in Malaysia to start a three-D laparoscopy. And this is us operating in Makoto Medical Center using the old version one, which is a heavy instrument."
296.323,303.074,"The robotic arm is here. Sometimes we use the robotic arm. If not, I will make my assistant hold. This is a good exercise for her."
303.574,320.268,"Now, this is the three-D laparoscope. This is a photograph I took last Friday. It has got two lenses and it has got light source here. They can see that it has been used for almost nearly two thousand cases and it's still functioning very well."
320.768,333.831,"This is the version two. Now we already have version three. Now this is the version two. It's much smaller, lighter, and it's got this telescope. And this telescope is actually, I'm using a thirty degree lens."
333.871,346.474,"I like this thirty degree lens. We can discuss that later. And this is a sleeve. It comes with a sleeve. It is a little bit of a disposable, but It protects my telescope, and that's the part I like. I like sleeving."
346.514,365.219,"Some people don't like sleeving, but I like sleeving because you can actually preserve your laparoscope if you sleeve. So although it's a little bit expensive to have this sleeve, but it protects your camera system. There are some camera system now you can soak, but soaking actually spoils the camera."
365.519,395.04,"The surgeon performs laparoscopic surgery using a 10mm trocar in the operating theater. The video appears blurred due to the dual vision system, and the surgical team is wearing spectacles for the 3D laparoscopy."
395.54,412.348,"So we are looking at a three D camera. You can actually attach another monitor, three D monitor, but we are working with just one three D monitor. So this is my, what you call as my list of cases that I've done in Makuta Medical Center."
412.348,432.043,"I've been working in Makuta Medical Center for twenty-five years and it's the only place that I operate except when I go out to do what we call as workshops. And of the eleven thousand five hundred and twenty-nine cases, I keep meticulous records. Every case that I operate is kept in a file with me. There are eight thousand nine hundred and sixty five days up to end of two thousand and nineteen."
432.243,451.015,"And out of that seven thousand two hundred and seventy six are major surgeries, of which six thousand ninety nine are laparoscopic surgeries. And these are laparotomies. Laparotomies basically are mostly ovarian cancers and very difficult cases. In my setup now, almost ninety-five percent of cases are performed laparoscopically."
451.475,460.658,"Now, there's a thousand six hundred sixty-five for laparoscopic cystectomy. In the early years, we were doing LAVH, and now we have moved on to TLH, and this is laparoscopic myomectomy."
460.698,479.548,"If you can see, for the last six years, I've been doing a three-D laparoscopy. I've done about thousand seven hundred eighty-seven three-D laparoscopies till December two thousand and nineteen. So I have a fair bit of experience doing a three-D laparoscopy, so much so that I've become lazy and I only do three-D laparoscopy now."
480.048,524.763,"Now, what are the advantages of three-D laparoscopy? Now, one thing is depth perception. Many people ask me, three-D laparoscopy or four-K? Okay, four-K can give you very detailed view, but three-D laparoscopy, you get this depth perception, which is wonderful when you're operating. Now, it is also, of course, high resolution. Of course, you can't compare this highest resolution to four K, but it's still very high resolution. and you get less tired, you don't realize it. Many people who do two-D laparoscopy tell me that I can do the surgery by two-D laparoscopy. But when you operate for a long time and your brain is actually trying to convert a three-D view into a two-D view to operate, you get tired, you don't realize it."
524.843,532.078,Only when you do three-D laparoscopy you realize how less tiring it is when you're doing three-D laparoscopy.
532.578,540.568,"But there are some disadvantages of three-D laparoscopy. Now, the first disadvantage is the camera pod need to be at higher level in the umbilicus."
540.608,558.704,"As you can see here, most of the time I'm operating at a pod higher up and not in the umbilicus. The reason is because the three-D laparoscope has got a zoom view. We call it a plus one. as opposed to a zero point eight when you can do with a two D laparoscopy. So you have to be further away."
559.104,575.45,"And this is one of the biggest disadvantage of a three D laparoscopy, I think. The other one is only ten millimeter telescope is available. As you can see, this is a ten millimeter telescope. I'm looking forward to them bringing in the eight millimeters and five millimeters in the future. Another thing is"
575.95,592.733,"This telescope comes with either zero or thirty degrees. I'm a big fan of thirty degree telescopes and even today I use thirty degree telescopes because I have the ability to look at the site. For three-D, you cannot do that. You cannot look at the site. You only can look vertically down or vertically up."
592.873,602.984,You cannot turn to the side and I hope this is another improvement that in future we will get. So these are the three small disadvantages of three-D laparoscopy.
603.484,609.471,"Now, what I'm going to do subsequently is I'm going to show three cases. The first case is an endometriosis case."
609.531,629.519,"The second case is a prolapse case for sacral colpopexy. And the third case is a radical hysterectomy for cancer of the cervix. And I'm just showing a little bit to give you an idea of why a three-day laparoscopy is the way to go. The first case is a thirty-four-year-old lady. She had regular periods with normal flow, slight dysmenorrhea."
629.539,646.56,"She was married for two years, but was unable to conceive. And on ultrasound, there is bilateral endometriomas. They are measuring four point seven, zero seven times four point zero, four point eight six, and four point zero six times six point four one centimeters."
647.06,664.589,"The transvaginal ultrasound image shows the rectum adhered to the posterior wall of the uterus, with a small anterior fibroid visible. The uterus appears otherwise normal."
664.87,682.125,"There's no nodule here, but it is stuck there. And this is the part that is going to be difficult. So this is the case. I'm going to go through this case with you all in detail. As you can see, I think most people who do laparoscopy will encounter this problem, bilateral kissing cyst, endometriomas."
682.625,697.175,"This surgery, you can do it in forty-five minutes, or you can take two and a half hours as I have done. It took me two and a half hours to do this case, and I'll tell you why it took me so long. So the first step is actually to drain this cyst."
697.675,718.309,"The surgeon examines the area where the cyst is attached to the uterus, preparing to break the cyst wall for aspiration. The right fallopian tube is visibly adherent to the ovary, and the surgeon works to release this adhesion while separating two cysts."
718.73,746.471,"Now, as you all know, in my mind, the most difficult surgeries are actually endometriotic surgeries. The reason why it's difficult is that you need to remove as much disease as possible, but also you need to preserve function. As opposed to other surgeries like TLH, you're just removing. Here, it is a reconstructive surgery. So you need to be more careful because you need to do the surgery so that the patient will be able to conceive. And that is the difficulty in doing endometriotic surgeries."
746.511,757.9,"Using a 3D laparoscopic view, the surgeon releases the right ovary from the pelvic side, carefully separating it from surrounding adhesions."
757.94,804.795,"The surgeon aspirates the cyst on the left side, revealing a thick, dried chocolate cyst. The ovary is released from the pelvic side wall, and the adhesions between the ovaries and the uterus are minimal. The surgeon tests for tubal patency, confirming that both the right and left fallopian tubes are patent."
805.295,817.585,"The surgeon examines the anterior aspect of the surgical field, revealing the bladder adherent to the uterus with multiple nodules present in the area, indicating extensive adhesions requiring further dissection."
818.085,839.036,"The surgeon uses a non-absorbable suture on a straight needle to hook up the ovaries, leaving the cyst intact. The surgical focus shifts to working in the pouch of Douglas."
839.076,858.349,"The surgeon encounters the rectum adhered to surrounding tissue, highlighting the complexity of the dissection area. The use of three-D laparoscopy provides enhanced visualization of the anatomical structures, aiding in precise separation without damaging the rectum."
858.809,889.993,"The surgeon navigates the right pararectal space, identifying the adhesion between the rectum and vagina. Using three-dimensional laparoscopy, the surgeon seeks the demarcation line to carefully separate the rectum from the vaginal tissue, noting minimal adhesion on the left side."
890.053,912.266,"The surgeon identifies the demarcation line between the rectum and uterus and begins to carefully shave the nodular adhesions from the uterus, aiming to detach the rectum without leaving any nodules on it."
912.766,933.606,"The surgeon carefully releases the rectum from its dense adhesion to the uterus, gradually separating the two structures. Once the rectum is freed, it descends, allowing the surgeon to continue with the hysterectomy procedure."
933.886,947.475,"So this is the one that takes a lot of time. This case, the additions is not too bad. Sometimes like another case that I did last week, the whole length of the rectum was stuck to the uterus and there was even more difficult, but this one, with this I could do."
947.555,970.224,"The surgeon locates the right ureter and isolates it, preparing to excise diseased tissue and nodules from the uterus to reduce recurrence rates."
970.364,997.806,"The surgeon uses a bisect instrument to coagulate and cut nodules on the right utero sacral ligament, carefully excising the diseased tissue."
998.246,1012.734,"The surgeon palpates the nodules on the uterus, preparing to excise them while carefully preserving normal tissue, demonstrating the technique of endometriotic surgery."
1013.234,1040.389,"And to do this, if you have three-D laparoscopy, you have all the depth perception and all the advantages of performing laparoscopy. Many people say, is this better to do this kind of surgery robotically? I mean, robot is very good. Robot also has got a three D picture and it has got a robotic arm. But one of the disadvantage of the robot is that you cannot palpate to feel which is hard and which is soft."
1040.81,1053.477,"The surgeon palpates the tissue to identify hard nodules, selectively excising only the diseased tissue while ensuring the rectum has been safely dissected away, utilizing the advantages of three-D laparoscopy."
1053.737,1072.281,"The surgeon uses a bisect instrument to simultaneously coagulate and cut tissue during the excision of endometriotic nodules, enhancing efficiency by eliminating the need to switch between separate coagulation and cutting tools."
1072.602,1092.912,"The surgeon examines the ureter and palpates the area, identifying additional endometriotic nodules. Using a bisect instrument, the surgeon safely coagulates and cuts the nodules, aided by the depth perception provided by 3D laparoscopy."
1092.952,1133.727,"The surgeon uses a three-dimensional laparoscopic approach to excise endometriotic disease from the peritoneum above the ureter, carefully dissecting and removing the affected tissue while preserving vital structures."
1133.747,1145.709,"The surgeon tests the integrity of the rectum after excising endometriotic tissue, ensuring that vital structures such as the ovaries, ureters, and bladder remain unharmed."
1145.769,1170.643,The surgeon performs a Michelin test by placing water in the pelvis and injecting air and methylene blue to identify a serosal tear on the rectum. The serosal areas are brought together for suturing to repair the tear.
1170.823,1194.171,"The surgeon uses a 3-0 polyglecting suture to close a slight raw area, utilizing the enhanced depth perception provided by 3-D laparoscopy for precise suturing."
1194.631,1214.577,"The surgeon begins the cystectomy, carefully separating the cyst wall from the ovary. Vasopressin is injected between the cyst wall and the ovary to facilitate the dissection, ensuring minimal removal of the cyst wall while avoiding leaving any remnants."
1214.617,1242.708,"The surgeon uses hydrodissection to separate the cyst wall from the ovary, ensuring minimal bleeding and preserving the ovary for future fertility. The three-dimensional laparoscopic view enhances visibility of the anatomical structures during this critical step."
1243.208,1261.914,"Using a three-dimensional laparoscopic view, the surgeon completes the cystectomy on the left ovary, ensuring maximum preservation of ovarian tissue. Any remaining cyst tissue is carefully removed before proceeding to the right side."
1262.255,1300.389,"The surgeon injects vasopressin into the space between the cyst wall and the ovary, visibly separating the cyst wall. The cyst wall is then carefully teased away from the ovary using a combination of sharp and blunt dissection techniques, ensuring minimal impact on the ovarian reserve due to bilateral endometrioma."
1300.409,1322.813,"The surgeon carefully approaches the ovarian hilum during the laparoscopic cystectomy, using electrocautery to precisely excise the cyst wall while preserving ovarian tissue. The three-dimensional laparoscope provides enhanced visualization for precise tissue access."
1323.313,1341.927,The surgeon has completed the cystectomy and is now focusing on the anterior wall of the uterus. Visible endometriotic nodules are present on the left utero sacral ligament and the bladder. The surgeon prepares to remove the endometriotic tissue while carefully avoiding injury to the bladder.
1342.187,1361.833,"The surgeon uses scissors to carefully excise an endometriotic nodule from the bladder, minimizing thermal damage to surrounding tissues."
1361.833,1399.363,"The surgeon excises endometriotic tissue from the round ligament, using precise techniques to remove diseased tissue while preserving normal structures. The surgical field is viewed in two-dimensional imaging, though the surgeon notes the enhanced clarity provided by three-dimensional imaging."
1399.863,1422.642,"The surgeon uses a bisect to gently excise endometriotic tissue from the left side, completing the removal of disease in that area. The procedure then progresses to the right side, where endometriotic tissue is visible on the right utero-sacral ligament and involves the bladder."
1423.142,1453.667,"The surgeon carefully dissects and excises endometriotic nodules, using a bisect tool away from the bladder and switching to scissors for areas closer to the bladder to avoid thermal damage. The focus is on removing as much diseased tissue as possible while preserving surrounding structures."
1454.167,1482.041,"The surgeon excises and removes visible endometriotic disease near the bladder, ensuring thorough removal to minimize recurrence and improve fertility outcomes. Despite removing a significant amount of disease, the surgeon identifies additional areas requiring further excision."
1482.061,1507.383,"The surgeon uses a sharp incision technique to excise the endometriotic disease, employing a grasper to gently pull on the affected tissue for precise removal."
1507.883,1536.798,"The surgeon identifies a small fibroid in the surgical field and proceeds to enucleate and remove it. Following the removal, the surgeon repairs the defect left by the excised fibroid."
1536.838,1572.572,"The surgeon uses a polyglycine one suture to repair the defect, employing a baseball suture technique to invert and close the shallow lesion completely."
1572.572,1605.867,"The surgeon completes the closure of the defect with a single layer suture. The fibroid and nodules have been removed, and the next step involves repairing the ovarian defect. The ovary is visibly repaired to prevent the defect from remaining open."
1605.947,1647.299,"The surgeon performs an ovariopexy by hooking the ovary to the peritoneum using a polyglycine 2-0 suture, leaving a visible length of two to three centimeters. The right ovary is already secured, and the surgeon proceeds to hitch up the left ovary after repairing it."
1647.319,1684.744,"The surgeon identifies and excises a nodule using a bisect tool, followed by another nodule located on top of the right ureter, which is carefully excised using sharp scissors to avoid diathermy. The surgical field is thoroughly examined to remove visible disease nodules, enhancing the patient's chances of spontaneous pregnancy."
1684.964,1707.903,"The surgeon places anti-adhesion barriers throughout the pelvic region to prevent postoperative adhesions. The uterus is visible without the uterine manipulator and remains in a non-retroverted position, demonstrating the final appearance of the pelvis at the end of the surgery."
1707.923,1722.853,"The aim is to remove as much disease as possible and to preserve function. And three-D laparoscopy makes this possible. Okay, so I'll go on to the next surgery where I think Tridi makes a big impact."
1723.353,1743.24,The surgeon addresses uterovaginal prolapse by using a hook and suction instrument to open the peritoneum over the sacral promontory.
1743.74,1764.793,"The surgeon opens the posterior part of the uterus and identifies the right utero sacral ligament. A space is created to separate the rectum from the peritoneum, with dissection proceeding along the right utero sacral ligament."
1765.293,1786.088,"The surgeon opens the peritoneum to access the levator ani muscle, preparing to place a posterior mesh for prolapse support."
1786.508,1809.983,"The surgeon uses a 3D laparoscopic approach to open the peritoneum on the right side, revealing the right utero sacral ligament."
1810.063,1830.117,"The surgeon makes a U-shaped incision posterior to the uterus, pushing the rectum downward. The rectum is visible in the center, and the surgeon clears the overlying fat tissue to access the levator ani on either side."
1830.178,1846.181,"The surgeon navigates the left lateral pararectal space, dissecting down to the levator ani using three-dimensional laparoscopy, which enhances depth perception during the procedure."
1846.601,1861.872,"Here you can see it, but you don't know how deep it is. And this is where three D comes in. And even the best of surgeons, for example, Jimmy from Japan, he uses a three D to do this kind of surgery because it makes your life easier."
1862.372,1874.439,"The surgeon performs a slow dissection near the medial rectal artery, carefully avoiding injury to the vessel while progressing towards the levator ani."
1874.479,1893.568,"The surgeon dissects on the right side, with the rectum visible in the center of the surgical field. The right medial pararectal space is opened, and dissection continues towards the levator ani muscle."
1894.068,1917.256,"The surgeon identifies and dissects the right puborectalis muscle, preparing to stitch the mesh to it. The levator ani muscle is exposed and clearly visible in the surgical field."
1917.736,1934.23,"The surgeon performs a subtotal hysterectomy, removing the body of the uterus while leaving the cervix intact. The cervix is prepared as a site for mesh attachment during sacrocopopexy."
1934.73,1954.087,"The surgeon has completed the subtotal hysterectomy and is now releasing surrounding fat tissue to expose the rectum. The rectum is clearly visible, and the surgeon prepares to place mesh on top for posterior support."
1954.528,1972.897,"The surgeon excises surrounding tissues and places the first stitch into the left puborectalis muscle, preparing to attach the stitch to the mesh for posterior support."
1973.397,1990.987,"The surgeon uses a non-absorbable suture to attach the mesh deep within the surgical field, where instruments have limited reach."
1991.487,2012.492,"The surgeon ties down the non-absorbable suture, securing the mesh in place with seven or eight knots. Stitches are being placed on both the right and left sides."
2012.992,2039.927,"The surgeon places a stitch into the right puborectalis muscle, pulling the needle out before attaching the mesh to the muscle."
2040.427,2060.54,"The surgeon attaches the mesh to the rectum using multiple throws of non-absorbable suture, ensuring the mesh sits securely for posterior support. The mesh is visibly positioned on the rectum, providing structural reinforcement."
2061.22,2085.373,"The surgeon dissects the bladder down to the trigone, aiming to correct any cystocele. The depth of dissection is visually enhanced by the 3D imaging, allowing precise attachment of the mesh."
2085.393,2104.385,"The surgeon places a fine 2-0 non-absorbable suture to attach the mesh to the lower area, ensuring it is positioned to correct the cystocele."
2104.885,2125.213,"The surgeon places two additional stitches on the lateral side to attach the mesh to the vaginal wall, ensuring it is positioned superficially at the level of the vagina."
2125.713,2146.297,"The surgeon positions the mesh below the bladder and sutures it in place, ensuring it sits securely to provide support."
2146.797,2169.275,"The surgeon places a large number two stitch into the longitudinal ligament of the sacral promontory, followed by another stitch, securing the mesh to the ligament."
