start,end,text
18.633,41.161,"Welcome to another video in this series of Versius robotic thoracic surgery from Sven Seifert and his team in Chemnitz in Germany. So here we're doing quite a small case really. This is a right upper lobe nodule of unknown histology. The mission is to go and get it out, maybe look at some lymph nodes and main mission, find histology."
41.242,54.586,"The surgical setup includes four ports instead of the usual five, with two Versius robotic arms visible, marked by purple and cyan instrument units positioned at the top right and top left of the surgical field."
55.086,72.532,"The surgeon utilizes the Versius robotic system to carefully dissect and remove adhesions from the collapsed lung, aided by a bedside assistant. The lung is deflated using CO², providing a clear view of the surgical field."
73.032,80.894,The surgeon uses a fenestrated grasper in his right hand and a fenestrated Maryland dissector in his left hand to manipulate and dissect tissue adhesions.
81.394,95.259,"The surgeon uses a harmonic device with energy in the left hand to address vascular adhesions, while the right hand instrument remains without energy. An assistant brings in shears with energy for further dissection."
95.639,110.246,"But a harmonic case I think was a really nice choice for these adhesions, does a great job of being nice and haemostatic. As we all know in robotic surgery, if you get a lot of blood in the field, the camera just gets darker."
110.746,122.094,"So well done for him for doing that. So he's using his right hand. It's a really good idea to get a rolled up swab for all robotic operations, really."
122.594,134.081,"The surgeon uses CO₂ insufflation to maintain lung collapse, avoiding the use of a sucker which would remove CO₂ and cause the lung to rise, facilitating better visualization of the adhesions."
134.461,164.423,"The surgeon uses rolled-up swabs to pad around the lung, avoiding direct grasping to prevent air leaks or tears. Sven peels away loose adhesions manually and employs the harmonic device to address larger adhesions, utilizing both arms for precision."
164.923,183.177,The surgeon uses a Maryland and fenestrated grasper to identify a nodule located peripherally on the lung surface at the apex of the right upper lobe. The removal of adhesions allows for better access and preparation for firing to the opposite side.
183.677,205.111,"The robotic fenestrated grasper lifts the nodule on the lung surface at the apex of the right upper lobe, preparing for stapling. The setup includes two 5mm ports for the robotic arms, a 12mm port for the stapler, and a 10mm port for the endoscope, utilizing a four-port technique."
205.611,229.262,"The bedside assistant fires a Covidien purple tri-stapler 60, while the endoscope is positioned low in the chest, and the robotic arms are situated higher."
229.702,246.235,Just then experimenting with arm positions and also having the expert knowledge of knowing exactly the target he's going for. So that was a really good idea. It allowed good arm movement. He got around the chest really nicely with the five mil arms to get out this module.
246.735,255.037,"The surgeon retrieves the excised nodule in a specimen bag, slightly extending the incision to facilitate its removal from the surgical site."
255.537,273.243,"And it's always good to just have a little look around to see if we can find any lymph nodes. So here he is. And also, because we don't have a third robotic instrument unit in as a retractor, he's very cleverly using the"
273.743,296.392,"The assistant performs adhesiolysis, retracting tissue to expose the surgical field. They examine the area for lymph nodes, focusing on accessing the subcarinal station seven, amidst numerous adhesions."
296.892,310.557,"As we come to the close of this video, it actually turned out that this nodule was benign. It was pulmonary necrosis and not malignancy, which is really good news. Obviously, that was on final histology."
311.057,322.902,"So Sven was obviously very careful, having a look and taking some lymph nodes where possible as well, just in case it had been malignant. So we're just having a look up the back here, seeing if we can get to the subcranial station."
322.962,340.057,"The surgeon uses two robotic arms to address firm adhesions, with the Versius system displaying colored arms for flexible positioning of instrument base units."
340.557,367.501,"The surgeon identifies and extracts a mid-lymph node, likely a station IIIa node located anterior to the superior vena cava (SVC). The node is removed using the thumb of a glove to prevent potential seeding through the port."
367.921,384.609,"Shows that you can do much more minor cases as well as major cases with the Versius. Shows you can just use two arms rather than three if it's a small, quick case. And really nice job. You can use the robot just to position your drain really nicely. And a great job."
384.669,399.179,Well done to Sven and the team making a real success of Versys robotic lobectomy in Chemnitz in Germany. And look out for many more videos in this series. We're trying to do as many as we can just to show everybody how it's working with Versys in the chest.
