start,end,text
0.76,17.068,I am sharing a robotic rectopexy for a patient with full thickness rectal prolapse. This is just showing my usual technique of just a full posterior right lateral and anterior mobilization with a suture proctopexy.
0.76,17.068,I am sharing a robotic rectopexy for a patient with full thickness rectal prolapse. This is just showing my usual technique of just a full posterior right lateral and anterior mobilization with a suture proctopexy.
17.088,25.666,"The surgeon encounters adherence of the proximal sigmoid colon in the deep pelvis, likely due to the patient's prior hysterectomy."
17.088,25.666,"The surgeon observes adherence of the proximal sigmoid colon in the deep pelvis, likely due to the patient's prior hysterectomy."
26.066,34.593,The surgeon attempts to free the mesentery to improve visibility for dissection during the robotic rectopexy procedure.
26.066,34.593,"The surgeon attempts to free the mesentery to improve visibility for dissection, manipulating the tissue to gain a better view."
35.093,53.456,"It's an elderly female. She had been seen in consultation by another colorectal surgeon and was offered a Altmaier procedure, which is perfectly reasonable for this patient and her age and her comorbidities."
35.093,53.456,"It's an elderly female. She had been seen in consultation by another colorectal surgeon and was offered a Altmaier procedure, which is perfectly reasonable for this patient and her age and her comorbidities."
53.956,61.3,I've gotten very comfortable with this procedure. It takes me about one hour and I offered this to her.
53.956,61.3,I've gotten very comfortable with this procedure. It takes me about one hour and I offered this to her.
61.32,74.792,"I feel like it gives a more durable repair and preserving the rectum I think is advantageous for bowel control, particularly in this age group."
61.32,74.792,"I feel like it gives a more durable repair and preserving the rectum I think is advantageous for bowel control, particularly in this age group."
75.292,99.974,"The surgeon continues to unfold the looping of the sigmoid colon, carefully manipulating the tissue to address its folded position within the pelvic cavity."
75.292,99.974,"The surgeon continues to unfold the looping of the sigmoid colon, carefully manipulating the tissue to address its folded orientation."
100.114,112.215,And I imagine that it might because you might think that you have reduced all the redundancy and you haven't. But I really don't know.
100.114,141.496,"The surgeon continues to unfold the proximal loop of the sigmoid colon, which is adhered to the rectum and positioned deep within the pelvis."
112.715,141.496,"The surgeon carefully unfolds the proximal loop of the sigmoid colon, which is adhered to the rectum and positioned deep within the pelvis."
141.996,153.181,"The surgeon examines the redundancy of the rectosigmoid mesentery and places it on stretch over the sacral promontory, preparing for fixation."
141.996,181.098,"The surgeon stretches the recto sigmoid mesentery over the sacral promontory, navigating the redundancy to achieve a clear view. The pneumoperitoneum aids in dissecting and revealing the anatomical plane."
153.681,181.098,"Sometimes this can be challenging to get the view just due to the redundancy, but you just look for that curve right where I entered there and then the pneumo will actually start to dissect and show you your plane."
181.598,207.956,"The surgeon identifies the hypogastric plexus and nerves, carefully preserving them while performing the posterior total mesorectal excision (TME) dissection."
181.598,207.956,"The surgeon identifies the hypogastric plexus and nerves, carefully preserving them while performing the posterior total mesorectal excision (TME) dissection."
208.456,219.681,"The surgeon continues to work downwards, manipulating the recto sigmoid mesentery and surrounding tissues to address redundancy and ensure proper positioning over the sacral promontory."
208.456,227.066,"The surgeon continues to work down the surgical field, maneuvering around the iliac vessels on the sidewall, with the right arm occasionally contacting the iliacs during the procedure."
220.181,282.183,"The surgeon navigates the right arm of the instrument, avoiding contact with the iliac vessels on the sidewall. The camera is repositioned from port three to port two, providing a clear view of the sacral promontory. The setup now includes two right ports and one left port, allowing the scissors in arm three to access the deep pelvis without obstruction."
227.566,282.183,"The surgeon port hops the camera from port three to port two, providing a view of the sacral promontory. The setup is adjusted to two right ports and one left port, enhancing the central view of the pelvis and allowing the scissors in arm three to access the deep pelvis without obstruction."
282.683,300.289,"A flap of the bladder is visible in the surgical field. The surgeon uses a nylon Keith needle to suspend the bladder, improving visibility of the anterior cul de sac."
282.683,300.289,The surgeon identifies a flap of the bladder obstructing the view and suspends it using a nylon Keith needle to improve visualization of the anterior cul de sac.
300.309,364.361,"The surgeon has a clear view of the deep cul de sac and performs anterior dissection in the rectovaginal septum. The vagina is visible, and the surgeon palpates both the rectum and vagina to assess the depth of dissection. The surgeon then proceeds with additional lateral dissection."
300.309,364.361,"The surgeon has a clear view of the deep cul de sac and performs anterior dissection in the rectovaginal septum. The vagina is visible, and the surgeon palpates both the rectum and vagina to assess the depth of the dissection. The surgeon then proceeds with additional lateral dissection."
364.861,408.118,"The surgeon completes the total mesorectal excision (TME) dissection, reaching the pelvic floor in the posterior, right lateral, and anterior regions, ensuring thorough removal of mesorectal tissue."
364.861,408.118,"The surgeon completes the total mesorectal excision (TME) dissection, reaching the pelvic floor in the posterior, right lateral, and anterior regions, ensuring thorough removal of the mesorectal tissue."
408.618,436.907,"The surgeon exposes the sacral promontory, ensuring clear visibility of the bone. Bipolar cautery is applied to the vessels directly on the bone to prevent bleeding during needle insertion."
408.618,436.907,"The surgeon exposes the sacral promontory, carefully using bipolar cautery to coagulate vessels directly on the bone, minimizing the risk of bleeding during needle insertion."
437.407,484.567,"The surgeon takes large bites of the periosteum using a silk suture and secures the lateral stalk, demonstrating a technique that avoids the use of mesh."
437.407,484.567,"The surgeon takes large bites of the periosteum using a surgical tool and silk sutures, followed by securing the lateral stalk. The technique appears visually stable despite the absence of mesh placement."
485.067,507.364,"The surgeon takes two bites into the periosteum using a surgical needle, securing the tissue as part of the rectopexy procedure."
485.067,507.364,"So just these two bites here to the periosteum This is done as an outpatient surgery. Despite the patient's age and comorbidities, she was able to leave within a few hours in the recovery room and then went home."
507.864,541.443,"The surgeon closes the peritoneal defect to prevent small bowel from descending into the pelvis, using sutures to secure the peritoneal tissue."
507.864,561.444,And now I will close the I actually never used to do this. It was pointed out to me when I started sharing some of my videos by another surgeon. that you should close this to avoid the possibility that any small bowel would go down into the pelvis. And so I do routinely close this now. I'm not sure and I doubt that this adds any strength to the prolapse repair as it's just peritoneal bites. But it does make sense to me to not have small bowel fall into that dissected space.
541.943,618.633,"The surgeon takes small bites of the peritoneum to close the dissected space, ensuring that the small bowel does not fall into it. Care is taken to avoid proximity to the right ureter and iliac vessels."
561.944,618.633,"The surgeon takes small bites of the peritoneum, exercising caution due to proximity to the right ureter and iliac vessels."
619.133,650.311,"The surgeon sutures the anterior peritoneal flap from the dissected rectovaginal septum to the suture line of the closed peritoneal flap, using robotic assistance for precise manipulation."
619.133,650.311,"The surgeon sutures the anterior peritoneal flap from the dissected rectovaginal septum to the suture line of the closure of the peritoneal flap, using robotic assistance for precision."
650.811,686.282,"I don't know if I'm trying to convince myself that this is going to add any durability or strength to the repair by pexing the anterior component, but I did it. I put two sutures in here. And it actually looks pretty good, so maybe it did something, maybe it doesn't. I do this very sparingly. I think this might have only been the third time I've done something like that. But that's the case. Looking at the PEXI, looking at the redundancy, I was very happy with things, and I hope you enjoyed."
650.811,686.282,"I don't know if I'm trying to convince myself that this is going to add any durability or strength to the repair by pexing the anterior component, but I did it. I put two sutures in here. And it actually looks pretty good, so maybe it did something, maybe it doesn't. I do this very sparingly. I think this might have only been the third time I've done something like that. But that's the case. Looking at the PEXI, looking at the redundancy, I was very happy with things, and I hope you enjoyed."
