start,end,text
24.294,38.322,The patient is positioned in a semi-decubitus orientation to facilitate the hanging technique for laparoscopic splenectomy.
24.294,38.322,The patient is positioned in a semi-decubitus orientation to facilitate the hanging technique for laparoscopic splenectomy.
38.822,49.413,"The patient is positioned in a semi-decubitus position for the hanging technique of splenectomy, with the surgical table tilted to elevate the left side, optimizing access to the left upper quadrant."
38.822,49.413,"The patient is positioned in a semi-decubitus position, which is enhanced by tilting the surgical table to elevate the left side, facilitating the hanging technique for the splenectomy."
49.913,57.388,"The patient is positioned in an almost left lateral decubitus position, causing the spleen to fall medially within the surgical field."
49.913,57.388,"The patient is positioned in an almost left lateral decubitus position, causing the spleen to fall medially within the abdominal cavity."
57.888,63.38,"The surgeon uses a retractor or instrument to lift and hang the spleen, providing better access and visibility for the splenectomy procedure."
57.888,63.38,"The surgeon uses a retractor or instrument to lift and hang the spleen, providing better access for the splenectomy procedure."
63.88,73.439,"The spleen is suspended using a retractor, facilitating the dissection of the splenic vessels by providing clear access to the vascular structures."
63.88,73.439,"The spleen is suspended using a retractor, facilitating the dissection of the splenic vessels in the semi-decubitus position."
73.939,89.422,"The surgeon enters the lesser sac by dividing the short gastric vessels, starting from the midpoint of the greater curvature of the stomach and extending to the uppermost short gastric vessels between the upper pole of the spleen and the gastric fundus."
73.939,89.422,"The surgeon enters the lesser sac by dividing the short gastric vessels, starting from the midpoint of the greater curvature of the stomach and extending to the uppermost short gastric vessels between the upper pole of the spleen and the gastric fundus."
89.922,121.625,"The surgeon carefully dissects the uppermost short gastric vessels near the upper pole of the spleen, taking extra caution due to limited space and the risk of vessel avulsion, especially in cases with large splenic lesions or enlarged spleens."
89.922,121.625,"The surgeon carefully dissects the uppermost short gastric vessels near the large splenic lesion, navigating the limited space to prevent avulsion and potential bleeding from the vessels."
122.125,148.633,"The surgeon divides the uppermost short gastric vessels and dissects the upper pole of the spleen away from the gastric fundus, revealing the separation between these anatomical structures."
122.125,148.633,"The surgeon divides the uppermost short gastric vessels and dissects the upper pole of the spleen away from the gastric fundus, with the spleen positioned medially."
149.133,170.495,"The surgeon decompresses a large splenic cyst to create space in the left upper quadrant, facilitating the procedure. The splenic artery is ligated first, leading to visible shrinkage of the spleen."
149.133,151.414,"The surgeon addresses a large spleen cyst, with the spleen lifted using a retractor or instrument to facilitate further dissection."
151.914,170.495,"The surgeon decompresses the splenic cyst to create space in the left upper quadrant, preparing for further surgical steps. The splenic artery is ligated to reduce the spleen's size, facilitating the procedure."
170.995,189.342,"The surgeon places a hitching stitch on the posterior wall of the stomach, securing it to the anterior abdominal wall to keep the stomach away from the operative field, facilitating comfortable dissection of the splenic vessels in the lesser sac."
170.995,179.338,The surgeon retracts the stomach away from the operative field to provide clear access for dissecting the splenic vessels within the bed of the lesser sac.
179.838,189.342,"The surgeon places a hitching stitch on the posterior wall of the stomach, securing it to the anterior abdominal wall to keep the stomach away from the operative field."
189.782,202.798,"The surgeon places a hitching stitch on the posterior wall of the stomach, closer to the lesser curve than the greater curve, to improve exposure of the surgical field."
189.782,202.798,The surgeon places a hitching stitch closer to the lesser curve of the stomach than the greater curve to improve exposure of the surgical field.
203.298,218.605,"After dividing the short gastric vessels and lifting the stomach, the surgeon identifies the splenic vessels at the upper border of the body and tail of the pancreas."
203.298,210.541,"After dividing the short gastric vessels and lifting the stomach, the surgeon focuses on dissecting the splenic vessels, which are visible in the operative field."
210.941,218.605,The surgeon identifies the splenic vessels at the upper border of the body and tail of the pancreas.
219.105,231.366,"The surgeon opens the peritoneum at the upper border of the pancreas and begins the dissection of the splenic artery, which is visible at this stage of the splenectomy procedure."
219.105,229.149,The surgeon opens the peritoneum at the upper border of the pancreas and begins the dissection of the splenic artery.
231.866,242.571,"The surgeon ligates the splenic artery before the vein, which results in the visible shrinkage of the spleen, facilitating easier handling during the procedure."
231.866,242.571,"The surgeon ligates the splenic artery before the vein, causing the spleen to shrink in size, which facilitates easier handling during the procedure."
259.322,276.391,"The surgeon examines the branching pattern of the splenic artery, noting the presence of either a single branch or multiple polar branches at the dissection site near the upper border of the pancreas."
259.322,276.391,"The surgeon examines the branching pattern of the splenic artery, observing either a single branch or multiple polar branches at the dissection site near the upper border of the pancreas."
276.891,289.985,"The surgeon securely clips the splenic artery using hemlocks and divides it, with the option to clip the artery in continuity without division."
276.891,282.235,"The surgeon securely clips the splenic artery using hemlocks and then divides it, following the dissection initiated at the upper border of the pancreas."
290.485,302.64,"The surgeon repositions the artery at the hilum on the splenic surface, preparing for further dissection or ligation."
290.485,302.64,"The surgeon repositions to retake the splenic artery at the hilum, near the splenic surface."
303.14,309.649,"After dividing the splenic artery, the surgeon begins dissecting the splenic vein, preparing for its ligation."
303.14,309.649,"After dividing the splenic artery, the surgeon begins dissecting the splenic vein, carefully separating it from surrounding tissues."
310.149,321.796,"The surgeon carefully dissects the splenic vein, which appears dilated and thin-walled, a critical step in laparoscopic splenectomy, particularly in patients with enlarged spleens."
310.149,321.796,"The surgeon carefully dissects the splenic vein, which appears dilated and thin-walled, a critical step in laparoscopic splenectomy, especially in patients with enlarged spleens."
322.296,338.795,"The surgeon identifies potential collateral vessels around the splenic vein and branches entering the pancreas, which pose a risk of tearing and difficult bleeding during dissection."
322.296,338.795,"The surgeon carefully navigates around the splenic vein, identifying potential collateral vessels and branches entering the pancreas that could be torn, leading to bleeding complications."
339.295,358.27,"The surgeon ligates the splenic artery and proceeds to take the splenic vessels at the splenic hilum where they enter, bypassing the dissection of the main splenic vein."
355.947,358.27,"The surgeon focuses on the splenic hilum, where the splenic vessels enter, preparing for further dissection or ligation."
358.55,375.873,"The surgeon clips, divides, and ligates multiple branches containing both the artery and vein at the splenic hilum, avoiding dissection at the pancreatic bed."
358.55,375.873,"The surgeon clips, divides, and ligates multiple branches containing both the splenic artery and vein, avoiding dissection at the pancreatic bed."
376.373,395.58,"The surgeon employs a hanging maneuver with the patient in lateral decubitus position, lifting the spleen to facilitate the dissection of the splenic vein. If the vein is safely dissected, the surgeon prefers ligating it with a tie rather than using clips or a hemlock."
376.373,382.636,"The surgeon performs a hanging maneuver with the patient in lateral decubitus position, lifting the spleen to facilitate dissection around the splenic vein and artery."
383.136,395.58,"The surgeon safely dissects the splenic vein and prepares to ligate it with a tie, avoiding the use of clips or a hemlock."
404.849,416.063,"The surgeon places a tie around the spinny quain, visibly narrowing it, allowing for the comfortable application of a hemlock or clip."
416.563,453.973,"The surgeon identifies the left gastroepiploic artery, a branch of the splenic artery, arising near the splenic hilum and proceeds to divide it to free the lower end of the spleen."
416.563,453.973,"The surgeon identifies the left gastroepiploic artery, a branch of the splenic artery, arising near the splenic hilum and proceeds to divide it to free the lower end of the spleen."
454.473,485.667,"The surgeon identifies a vein dividing into its tributaries and individually ligates each tributary for better venous control, avoiding the higher risk of clip slippage and bleeding associated with taking the vein at the confluence."
454.473,468.822,"The surgeon identifies a vein dividing into its tributaries and individually ligates each tributary for improved venous control, rather than attempting to ligate the vein at its confluence."
486.167,515.021,"The surgeon proceeds to separate the pancreas from the splenic hilum after successfully dividing the splenic vein, using careful dissection techniques to ensure clear separation of these anatomical structures."
486.167,515.021,"After dividing the splenic vein, the surgeon proceeds to separate the pancreas from the splenic hilum, carefully dissecting the tissue connections between these structures."
515.521,542.409,"The surgeon carefully exposes the pancreatic tail deeply embedded in the splenic hilum, taking care to avoid transecting the pancreatic tissue to prevent potential duct opening and subsequent pancreatic leak or fistula."
515.521,524.404,"The pancreatic tail is visibly embedded deep into the splenic hilum in this patient, requiring careful dissection to separate it from the spleen."
559.135,578.426,"The surgeon carefully dissects the loose irregular tissue to separate the pancreatic tail from the splenic hilum, ensuring the pancreatic parenchyma remains intact and the tail is not amputated."
559.135,571.043,"The surgeon carefully dissects the loose irregular tissue to separate the pancreatic tail from the splenic hilum, avoiding trauma to the surrounding structures."
578.926,603.351,"The surgeon gently separates the pancreatic tail from the splenic hilum, successfully moving it away. The spleen is suspended to maintain tissue traction, aiding in the dissection process."
578.926,589.972,"The surgeon gently separates the pancreatic tail from the splenic hilum, successfully moving it away from the surrounding tissue."
590.472,603.351,"The surgeon maintains traction on the spleen, facilitating the dissection process by keeping the surrounding tissues taut."
603.851,639.454,"The spleen is suspended by the linoleum ligament and diaphragmatic attachments after the short gastric vessels, splenic vessels, and pancreas have been separated from the splenic hilum. These attachments are typically avascular and can be easily divided, except in cases of portal hypertension."
603.851,620.108,"The spleen is now only attached by the linoleum ligament and its diaphragmatic attachments after the short gastric vessels, splenic vessels, and pancreas have been separated from the splenic hilum."
620.608,639.454,"The surgeon divides the avascular tissues surrounding the spleen, which are typically easy to separate unless portal hypertension is present."
639.954,657.371,"The surgeon separates inflammatory adhesions from the diaphragmatic surface of the diseased and massively enlarged spleen, completing the dissection."
639.954,657.371,"The surgeon separates inflammatory adhesions from the diaphragmatic surface of the massively enlarged spleen, preparing for its removal."
657.871,672.866,"The surgeon checks the hemostasis of the splenic bed and vascular stumps following the completion of the splenectomy, ensuring no bleeding is present as the anesthetist adjusts the patient's blood pressure."
662.455,672.866,"The surgeon inspects the splenic bed and vascular stumps, ensuring hemostasis while the anesthetist adjusts the patient's blood pressure."
673.366,682.958,"The surgeon retrieves the spleen through a suprapubic incision, completing the extraction process."
673.366,682.958,"The surgeon retrieves the spleen through a suprapubic incision, completing the removal process."
