start,end,text
36.926,40.916,"The patient is positioned in the prone jackknife position, lying face down with hips elevated and knees bent, to facilitate access to the anal region for surgery."
41.416,110.978,"The surgeon identifies the internal and external openings of the fistula, marking the locations on the anal region."
111.478,136.55,"The surgeon performs a thorough debridement of the fistula tract, removing necrotic tissue and debris from the affected area."
137.05,167.744,"The surgeon marks the internal opening of the fistula with a single suture, visually identifying the location within the surgical field."
168.244,209.655,"The surgeon inserts a flexible cannula sheet into the external opening of the fistula, advancing it to the internal opening, and injects paste through the cannula."
210.155,277.768,"The surgeon closes the internal opening of the fistula with several sutures, securing the tissue to prevent further leakage."
278.268,282.274,The surgeon closes the external opening of the fistula with a single loose suture.
