start,end,text
37.12,53.124,"The surgeon uses epigastric ports to hold the bladder, with the rectum visible below it. Behind the rectum, a large cystic structure occupies nearly the entire pelvic cavity."
53.144,68.676,"The video shows the cystic component of the pelvic teratoma, with the solid component extending from the S-III and S-IV vertebrae onto the surface in the perineum, located posteriorly between the coccyx and the anal region."
69.176,81.943,"The surgeon begins dissecting the rectum away from the large cystic structure occupying the pelvic cavity, carefully preserving the rectum's vascularity during the procedure."
128.997,154.955,"The surgeon aspirates fluid from the large cystic structure occupying the pelvic cavity, sending it for cytology. The rectum is then hitched to the anterior abdominal wall to facilitate further dissection."
155.455,182.981,"The surgeon begins dissecting between the rectum and the cyst, carefully separating the cyst from the mesorectal tissue. The dissection follows the mesorectal plane, which is well-defined and minimizes bleeding."
183.001,196.32,"The surgeon navigates across the mesentery of the rectum, reaching down to the fundus of the cyst. The dissection proceeds by separating the cyst from the rectum."
196.82,211.45,"The surgeon identifies and dissects along a well-defined avascular plane between the rectum and the cyst wall, ensuring preservation of the rectum's vascularity."
242.166,255.634,"The laparoscopic view provides clear visualization of the anatomical planes, allowing the surgeon to perform atraumatic dissection without damaging surrounding structures."
297.901,316.347,"The surgeon has separated the fundus of the cyst, completing the anterior wall dissection. The lateral dissections have been extended up to the level of the ureters."
316.847,344.303,"The surgeon moves posteriorly after freeing the fundus of the cyst, carefully dissecting to avoid damaging the pre-sacral plexus of veins and the parasympathetic outflow, which are critical to prevent excessive bleeding and urogenic bladder complications."
344.803,364.448,"The surgeon carefully manipulates the mass, defining the dissection planes while staying close to the cyst. The final strands of tissue are being separated during the lateral dissection."
390.774,416.967,"The surgeon continues using monopolar cautery to dissect in the pre-sacral space, with no visible bleeding encountered. Additional fluid is aspirated from the cyst to maintain a clear surgical field."
417.467,448.068,"The surgeon uses a Covedian Ligature vessel sealing device to separate the tissue from the pre-sacral space and detach it from the sacrum, ensuring minimal current spread to avoid nerve damage while maintaining hemostasis."
448.568,506.922,"The surgeon carefully dissects in the pre-sacral space, staying close to the tumor mass to avoid deeper penetration into the sacrum. Adhesion bands are being removed, with dissection proceeding laterally towards the ischiopubic ramus, ensuring not to extend distally beyond this anatomical landmark."
507.422,533.537,"The surgeon carefully removes residual adhesion bands in the abdominal cavity, ensuring to maintain the correct dissection plane to minimize bleeding risk. The abdominal dissection is completed, and the transition to the perineal approach is planned."
534.037,558.51,"The surgeon loosens the stitch that hitched the cyst to the anterior abdominal wall and dissects the remaining bands, ensuring the cyst wall is completely free from intrapelvic structures in preparation for delivery from the perineum."
559.01,592.756,"The surgeon removes the final adhesions around the cyst, ensuring the dissection is at a consistent level around the S-III and S-IV vertebrae. The peritoneum is carefully dissected away, preparing for the transition to the perineal approach."
593.256,644.995,"The surgeon checks the orientation of the ureter and fallopian tubes, with the uterus visible above the cyst. The rectum is moved to the side, and the surgical field is thoroughly washed to ensure hemostasis. A drain is prepared for placement, either from the perineal part or through the gluteal fold, marking the completion of the abdominal dissection. The rectum and uterus appear undamaged."
645.495,718.851,"The patient is positioned prone, and a central incision is made from the S-V level down to the cyst. The surgeon carefully dissects around the rectum, avoiding damage, and delivers the cyst from the perineum. The coccygectomy is performed to reduce recurrence risk, and the large specimen, approximately twenty centimeters in length, is completely removed."
