start,end,text
0.371,3.896,"The surgeon prepares to convert a coiled sleeve into a Roux-en-Y gastric bypass, focusing on the anatomical structures involved in the procedure."
4.396,9.702,Patient is a fifty-year-old female with history of hypertension and obstructive sleep
10.202,13.887,She underwent a laparoscopic sleeve gastrectomy two years ago.
14.387,17.809,"She did well after the surgery, tolerating diet normally."
18.309,25.971,"Six months ago, she began to experience dysphagia to solids, tolerating only some liquids with constant daily vomiting."
26.392,29.193,Her BMI before sleeve was fifty-four.
29.693,33.234,Her actual BMI prior to the conversion is nineteen.
33.734,43.078,"The upper GI fluoroscopy showed evident passage of contrast with two acute kinks on the sleeve, one superior and another inferior,"
43.578,53.026,"The video shows a proximal dilatation in the gastric sleeve, visible in the current imaging."
53.526,63.234,The esophagogastroduodenoscopy reveals a large proximal gastric dilatation with an acute angulation that is easily traversed by the endoscope.
63.734,70.787,"The surgeon attempts to pass the scope at the level of the incisura, encountering an acute angulation that prevents successful passage despite multiple attempts."
71.287,74.771,"Multiple trocars are visibly placed in the abdominal wall, arranged to facilitate access for the gastric bypass procedure."
75.271,91.747,"During the diagnostic laparoscopy, the surgeon observes two acute angulations in the gastric tube, with visible adhesions maintaining the tube in a fixed position."
92.247,139.08,"The surgeon begins the dissection at the hiatus using a monopolar hook, carefully separating tissue in this area."
139.58,158.131,"The surgeon lyses all adhesions around the gastric tube, progressively freeing it from surrounding tissue."
158.631,170.446,"After fully mobilizing the stomach, the surgeon dissects a posterior window around the gastric tube, ensuring complete circumferential access."
170.946,183.717,"The surgeon uses two stapler loads to transect the stomach, visibly separating the gastric tube from the remaining stomach tissue."
184.217,191.082,"The surgeon retracts the transverse colon to expose and identify the angle of the Treitz ligament, revealing its anatomical position in relation to the surrounding structures."
191.582,210.488,The surgeon measures fifty centimeters from the angle of Treitz along the jejunum and transects it using a surgical stapler.
210.988,216.453,"The surgeon measures and runs the alimentary limb to a length of one hundred and twenty centimeters, preparing it for the next step in the gastric bypass procedure."
216.953,228.724,"The surgeon performs enterotomies using a monopolar hook, creating openings in the intestinal tissue."
229.224,248.73,"The surgeon performs a side-to-side anastomosis using a stapler, joining two sections of the gastrointestinal tract."
249.23,280.908,"The surgeon over-sews the enterotomies in two layers using a 3-0 absorbable suture, ensuring secure closure of the openings created during the gastric bypass procedure."
281.408,307.083,"The surgeon begins the gastrojejunostomy by placing a continuous posterior outer layer of three-oh absorbable sutures, securing the connection between the stomach and jejunum."
307.583,332.352,"The surgeon uses a monopolar hook to perform enterotomies, creating openings in the intestinal tissue."
332.852,341.796,"The surgeon begins suturing a continuous inner-posterior layer using a 3-0 absorbable suture, following the completion of the outer layer in the gastrojejunostomy."
342.296,346.638,"The surgeon begins suturing the inner-anterior layer of the gastrojejunostomy using three O absorbable sutures, following the completion of the posterior layer."
347.138,357.551,"The surgeon begins a new suture from the opposite side of the gastrojejunostomy and joins it with the existing suture in the middle, enhancing the reconstruction of the anastomosis."
358.051,380.811,"The surgeon completes the anastomosis by performing the outer anterior layer using absorbable sutures, finalizing the gastrojejunostomy."
381.311,383.582,The OR time was a hundred and twenty minutes.
384.082,386.373,"The estimated blood loss, ten cc's."
386.873,390.949,No complications were registered and discharge was post-op day number one.
