start,end,text
87.565,97.328,The surgeon begins the dissection by using bipolar cautery to take down the inferior pulmonary ligament. A level nine lymph node is identified and carefully dissected out from the surrounding tissue.
97.828,111.107,"The surgeon identifies and dissects out a level seven lymph node pocket. The anterior oblique fissure is divided using a pulper staple load, complemented by gentle blunt dissection."
111.607,124.275,"The surgeon identifies and dissects out a level XI lymph node located within the oblique fissure. Above the node pocket, a clear passage is visible from the interlobar fissure to the posterior hilum."
124.775,138.184,"The surgeon identifies the inferior lingual branch of the pulmonary artery within the interlobar fissure, circumferentially controls it using blunt dissection, and divides it. Subsequently, the superior lingual artery is also divided."
138.684,152.261,The bedside assistant introduces a wide load stapler through the posterior port. The surgeon completes the division of the posterior fissure using purple staple loads inserted through the anterior port.
152.761,163.305,"The surgeon identifies the apico-posterior branch of the pulmonary artery, circumferentially controls it, and divides it within the surgical field."
163.805,185.661,"The surgeon retracts the upper lobe posteriorly to isolate and divide the superior pulmonary vein, as the anatomical features prevent identification of the anterior branch of the pulmonary artery at this stage."
186.161,209.173,"The surgeon divides the left upper lobe bronchus using electrocautery, providing clear exposure of the anterior branch of the pulmonary artery for safe identification and division."
209.673,242.243,"The surgeon closes the left upper bronchial stem using a running IIIO absorbable V-lock suture, securing the bronchial stump with precise stitching."
242.743,253.95,The surgeon places the resected left upper lobe into a specimen retrieval bag and removes it through the previously made incision and the 15mm assistant port.
254.45,269.095,"After the specimen removal, the surgeon performs a multilevel intercostal block and places a single 28 French chest tube through the camera port incision. The lung is inflated, and the remaining surgical wounds are closed."
