start,end,text
0.688,17.842,"In the name of God, the Most Gracious, the Most Merciful Types of radicality regarding the hysterectomy, the old classification, we used to divide them into five classes The one who divided them like this, since the time of the division, is Bitlet Why"
18.342,25.68,Because there is no clear limit between the classes And class one in the division of Smith in the year of nine hundred and seventy-four
26.18,46.505,is not considered a radicality and class five is considered obsolete and nothing happened in the nerve sparing approach that's why we had to have a recent classification of radicality according to the hysterectomy in oncogene what is new?
46.945,53.198,the new is that I put the nerve sparing approach as
53.698,80.931,"a very important topic and that the four classes type A, B, C, and D based on anatomical landmark regarding the paracervix, paraculbus, and parametrium and the paracervical lymphadenectomy, of course, they don't have the right to hide it I'm not here to tell you that the case I'm working on is type A You tell me, no, you teach me to hunt and don't give me fish"
81.431,85.715,"Type AA, type BA, type CA, and I'll tell you what you're working on."
86.215,88.777,"Type A, guys, every type you need to know."
88.837,101.388,"The surgeon removes tissue labeled 'A' from the paracervix, bladder, rectal pillar, and vagina. The resection is performed between the ureter and cervix within the paracervical region."
101.888,105.131,The bladder and rectal pillar at the level of the cervix.
105.251,107.293,The vagina less than ten millimeters.
107.753,110.496,The main goal is to remove the cervix in two.
110.936,117.923,"The surgeon addresses Type B tissue in the paracervical region, focusing on the anatomical structures surrounding the cervix."
118.423,121.036,"The surgeon removes tissue at the level of the ureteric tunnel, focusing on the area between the ureter and the cervix."
121.536,135.303,"After unroofing the ureter, the surgeon positions the bladder at a distance from the uterus and vagina, ensuring at least a ten-millimeter separation, while carefully preserving the neuronal part of the paracervix."
135.803,143.467,"The surgeon performs an additional paracervical lymphadenectomy, focusing on the Type B region of the paracervix."
143.527,148.815,"The surgeon performs a Type C resection of the paracervix at the level of the hypogastric vessel, focusing on precise removal of tissue in this anatomical region."
149.315,152.536,"The surgeon positions the bladder and rectal pillar at the level of the bladder and rectum, ensuring proper alignment during the hysterectomy procedure."
152.556,155.917,"The surgeon measures and prepares to resect the vaginal tissue, ensuring a distance of fifteen to twenty millimeters from the uterus."
156.417,159.039,"The surgeon aims to remove the paracervix in two sections, focusing on precise dissection around the anatomical structure."
159.539,162.339,"The surgeon performs a Type A hysterectomy, removing the cervix in two distinct sections."
162.56,165.521,"The surgeon performs a Type C resection, removing the paracervix in two parts at the level of the hypogastric vessel."
165.561,167.541,But I kept it on the nerve.
167.581,169.482,"The surgeon performs a nerve-sparing radical hysterectomy, focusing on preserving the nerve while removing the cervix and paracervix."
169.982,172.677,"The surgeon performs a Type C radical hysterectomy, removing the paracervix without preserving the surrounding nerves."
173.177,180.562,"The surgeon performs a Type C-II hysterectomy, transsecting the paracervical tissue lower to the D-butane vein."
181.062,186.625,"So, when you look, if I selected the ureteric tunnel, you will know which type I worked on."
186.705,191.327,"If I selected the D-butane vein, you will know which type I worked on."
191.468,201.745,"If I selected the hypogastric plexuses and entered the spaces regarding the nerve sparing, you will know which type I worked on."
202.245,223.99,"Regarding the type, it is regarding the carcinoma, whether the carcinoma needs to remove the cervix in two or remove the paracervix or remove the paracervix with the paracervical lymph nodes This is the type of A, B, C and D, very important, very important, very important So, the type, you will ask yourself, how much will the paracervix remove?"
224.01,227.89,"The bladder and rectal pillar, will you remove them at the level of A?"
227.91,232.104,"The vagina, will you remove it at the level of A?"
232.604,244.394,"The surgeon performs a resection of the paracervix halfway between the ureter and the cervix. The bladder and rectal pillar are addressed at the level of the cervix, and the vagina is noted to be less than ten millimeters."
244.735,251.021,"The surgeon focuses on removing the cervix in two distinct sections, a critical step in the hysterectomy procedure."
251.521,256.439,"The surgeon exposes the paraservix at the level of the ureteric tunnel after unroofing the ureter, revealing the anatomical structures in this area."
256.939,262.404,"The surgeon observes the bladder and rectal pillar positioned at a distance from the uterus, with the vagina measuring at least ten millimeters in proximity."
262.844,267.397,The surgeon focuses on preserving the neuronal part of the paracervix during the procedure.
267.897,270.238,"The surgeon prepares to remove the paracervical lymph node, focusing on the area labeled B-two."
270.318,274.481,"The surgeon performs a resection of the paracervix at the level of the hypogastric vessel, focusing on precise tissue removal in this area."
274.981,278.383,"The surgeon exposes the rectal and bladder pillars at the level of the bladder and rectum, highlighting their anatomical position relative to these structures."
278.743,281.365,"The surgeon measures the distance of the vagina, ensuring it is at least twenty millimeters from the uterus."
281.465,284.507,"The surgeon proceeds to remove the paracervix using a technique referred to as 'two-two,' focusing on the excision of this anatomical structure."
285.007,287.057,"The surgeon performs a Type C-two resection of the paracervix without nerve preservation, focusing on the area around the hypogastric vessel."
287.557,305.383,This is a very important recent classification regarding the radicality of the hysterectomy If you notice that there is no oncogene without barorectal space
305.883,308.964,"The surgeon performs dissection in the paravesical space, carefully separating tissue layers adjacent to the bladder."
309.464,316.285,"The surgeon divides the uterine artery, visually separating it into the paravesical space in front and the pararectal space in the back within the pelvic region."
316.305,321.626,The surgeon divides the pararectal space into medial and lateral sections to allow the ureter to reach the promontory level.
321.986,328.167,The surgeon identifies the medial Okabashi space and the lateral Latsuko space during the dissection process.
328.667,335.036,"The surgeon highlights the avascular spaces within the pelvis, emphasizing their relevance in the context of oncogene considerations during the hysterectomy procedure."
335.536,345.824,"The surgeon divides the pararectal space at the level of the promontory, with the ureter visible, separating it into the occipital space and the latic space."
345.844,349.667,"The surgeon approaches the second ureter, guided by the Yabuki technique, within the pelvic spaces."
349.687,351.088,The Japanese Yabuki
351.588,362.848,They are the first people who invented the Euryteric Tunnel regarding the dissection and unroofing of the Euryter and the types of radicality.
363.348,366.061,So Book Space is the Euryteric Tunnel.
366.561,381.845,"The surgeon identifies avascular spaces around the uterine artery, distinguishing between areas above the paravaginal space and below the pararectal space."
382.345,390.628,"Cosimal barorectal biliorator elamedia leucopascii, lateral latsku, and the ureteric tunnel is the Yabuki space."
390.788,405.432,"Of course, there are other spaces that we do not use in oncogeneism, but we use them in benign gynecology, such as endosurgery in endometriosis, deep infiltration in endometriosis, and urogyneism."
405.932,415.215,"For example, like the retropiopic of the retius space, like the pre-vasical space, like the pre-rectal and pre-sacral."
415.616,429.641,"These midlines, I don't use them much in the oncogene, but I use them in the urogyne, and deep infiltrative endometriosis, and surgery in deep infiltrative endometriosis."
430.141,431.031,Okay?
431.531,447.77,"These are the types of hysterectomy, I hope you know them, because when I say type A, you know that I remove the paracervix, the rectal, the bladder pillar, the gall, and the vagina."
448.27,452.991,"B, C, B-I, B-II, C-I, and C-II are mandatory."
453.151,454.672,All of these things are known.
454.692,456.552,What does Nervous Peering mean?
456.692,464.434,"Of course, Nervous Peering is the lateral pelvic wall in the level of hypogastric nerves."
464.454,472.356,How do we get into the Latsko space and the Dibiotriene vein to do Nervous Peering?
472.496,476.717,"This will be a full lecture on Nervous Peering Hysterectomy, God willing."
477.177,482.38,regarding the radicality in the hysterectomy.
482.88,490.463,The surgeon utilizes a bipolar device and harmonic ultrasonic device during the hysterectomy procedure.
490.483,492.844,The ultrasonic device is not a visor sealer.
492.864,495.405,It is a tissue dissector actor.
495.625,496.986,We cannot use a pipedecal.
497.426,500.847,"The surgeon holds a bipolar device in one hand and a tissue dissector in the other, preparing to manipulate and dissect tissue during the hysterectomy procedure."
500.887,502.428,And we couldn't do anything.
502.448,503.889,The surgeon uses an in-sealer device to seal tissue during the hysterectomy procedure.
503.909,506.982,"The surgeon uses the in-sealer, an advanced bipolar device similar to a ligature, to perform tissue sealing during the hysterectomy procedure."
507.482,510.644,"The surgeon uses the in-sealer device to transect the uterine pedicle, applying advanced bipolar energy to separate the tissue."
511.044,512.445,"As you can see, this is very important."
512.465,515.087,We couldn't do it with the harmonic.
515.167,517.248,The harmonic doesn't have any pedicle.
517.268,526.892,This is what I wanted to say today.
527.392,536.696,In the oncogynes I want you to tell me the case that I am working on What is the type of hysterectomy?
536.716,539.057,And what do I remove from the paracervix?
539.257,541.758,And at the level of what in the rectal and the bladder pillar?
542.238,542.938,And in the vagina?
542.958,554.343,And the main goal you will know if you know the type of hysterectomy Thank you very much I hope to see you in a lecture in God's will
