start,end,text
21.591,33.493,"The surgeon injects a solution into the fibroid capsule, utilizing aqua dissection to facilitate the release of the fibroid from the uterine cavity and bed."
33.993,48.144,"The surgeon prepares to suture the large bed left by the removal of the anterior intramural fibroid, employing a multilayered suturing technique using a quill suture, which eliminates the need for tying knots."
48.644,60.645,"The surgeon uses baseball sutures to take the deeper layer of the uterine tissue, aiming to obliterate the bed of the myoma and achieve hemostasis."
72.43,80.267,"The surgeon demonstrates ipsilateral baseball suturing at the myoma bed, showing no visible evidence of hematoma formation in the sutured area."
92.818,106.568,"The surgeon completes suturing the deeper layer of the myoma bed and begins suturing the external layer using baseball sutures, ensuring the outer layer is securely closed."
107.068,121.012,"The surgeon demonstrates the overlapping technique of suturing the external surface of the myoma bed, minimizing contact between the sutures and the raw area with the peritoneum."
135.735,145.662,"The surgeon applies gentle traction while pulling the suture, ensuring the tissue approximates along the suture line in the myoma bed."
163.738,178.042,"The surgeon removes the suture material, ensuring the knot prevents any slippage. The surgical field reveals a bloodless bed of the myoma, indicating complete suturing."
