start,end,text
1.803,18.072,"The retrohepatic cavell dissection for a robotic right hepatectomy seems intimidating, but actually with the robotic visualization and articulating instruments, it can be performed similar to an open right hepatectomy."
18.572,22.914,"My name is Jason Hawksworth, and I'm a transplant and hepatobiliary surgeon."
23.414,32.19,"In this brief video, I'll demonstrate how we perform the retrohepatic cavell dissection for a robotic right hepatectomy."
32.69,45.923,"The surgeon uses the fourth robotic arm equipped with a Raytech to mobilize the liver, allowing for the division of the hepatorenal ligament."
46.423,57.546,"The surgeon sequentially divides the short hepatic vein branches as they come into view, preventing inadvertent tearing while medializing the liver during the robotic right hepatectomy."
58.046,71.376,"The surgeon divides smaller short hepatic veins using robotic metal clips or a robotic vessel sealer, demonstrating the options for vessel management during the procedure."
71.876,77.94,"The surgeon divides the triangular ligament, continuing the mobilization of the liver using robotic instruments."
78.44,84.013,"The surgeon controls and divides the short hepatic vein branches as they come into view during the robotic right hepatectomy, ensuring careful separation to prevent tearing."
84.513,92.181,"The surgeon uses hemlock clips to divide larger short hepatic vein branches, ensuring controlled separation as the liver is medialized."
92.681,96.325,"The surgeon divides the triangular ligaments, progressing towards the right hepatic vein, facilitating further liver mobilization."
96.825,110.925,This is sometimes easier by flipping the camera in the thirty degree up position or even placing the camera through robotic port number one for better medial visualization.
111.425,120.108,"During the retrohepatic caval dissection, the surgeon identifies and exposes the inferior hepatic vein accessory branches, which are commonly observed in this area."
120.608,127.631,"The surgeon controls and divides the short hepatic vein branches using hemlock clips, ensuring secure ligation of these vessels during the hepatectomy procedure."
128.131,132.833,"The surgeon uses a robotic stapler to divide larger short hepatic vein branches, demonstrating an alternative method to hemlock clips for vessel control."
133.333,144.179,"The surgeon fully mobilizes the liver, revealing the base of the right hepatic vein, which is typically adequate for completing a robotic right hepatectomy."
144.679,157.111,"The surgeon dissects around the extrahepatic right hepatic vein, which is located near the inferior vena cava, although this step is typically not necessary unless a lesion is present."
157.611,163.765,"At the completion of the dissection, a Raytech sponge is placed just lateral to the inferior vena cava, marking the end of the surgical exposure in this area."
164.265,171.588,And this can be used later to ensure a proper plane of transection during liver division.
172.088,178.831,Stay tuned for our next video demonstrating parenchymal division during a robotic right hepatectomy.
179.331,182.833,We hope you enjoyed this video and have a great day.
