start,end,text
33.115,41.318,"Hello everyone, today I will show you the video about laparoscopic parietal duodenectomy."
41.818,88.627,"As you know, the procedure involves resection of the parietal head, duodenum, gallbladder, and bile, with or without removal of the elastic angina."
89.127,181.433,"The surgeon mobilizes the right omentum, lifting it upwards from the transverse colon to gain access to the surgical field."
181.933,355.06,"The surgeon divides the loose attachments between the posterior gastric wall and the anterior surface of the pancreas, separating these structures."
355.56,619.859,"The surgeon frees the hepatic flexure of the colon from its retroperitoneal attachment, facilitating the exposure and mobilization of the pancreatic head and duodenum."
620.359,793.552,"The surgeon incises the visceral peritoneum along the inferior border of the pancreas, starting from the left of the middle colic vessel and extending toward the patient's right and inferiorly, exposing the transverse section of the middle colic vein and the superior mesenteric vein (SMV)."
794.052,836.1,"Inside of SMV, there are several fans that friend directly into SMV, so it is easy to enjoy the visual and magnetic."
836.6,841.975,I must stop the video here and see you later in my next video about WIPO procedure.
842.436,843.799,Thanks for watching my video.
