start,end,text
9.877,16.619,"The video shows a direct inguinal hernia located medial to the inferior epigastric vessels, clearly visible within the surgical field."
17.119,24.48,"The surgeon initiates the operation by creating a preperitoneal flap, fully exposing the hernia space for further surgical intervention."
24.98,32.528,"The surgeon performs a sweeping dissection from top to bottom, further exposing the hernia space and separating tissue layers."
33.028,43.81,"The hernia contents, consisting of preperitoneal adipose tissue, are visible protruding through the direct hernia space."
44.31,53.593,"The surgeon dissects the preperitoneal sac from the hernia contents, reducing them back into the abdominal cavity."
54.093,62.254,"The surgeon exposes Cooper's ligament, ensuring adequate dissection within the surgical field."
62.754,65.797,"The surgeon evaluates the indirect space, inspecting the area for any hernia contents or anatomical abnormalities."
66.297,78.746,"The surgeon carefully dissects a cord lipoma from the vas deferens and testicular vessels, revealing the absence of an indirect hernia in the surgical field."
79.246,91.667,The surgeon deploys a mesh into the preperitoneal space after exposing all potential hernia spaces and completing the dissection.
92.167,99.009,"The self-fixating mesh is positioned within the preperitoneal space, adhering to the surrounding tissue without the need for sutures or tacks."
112.692,117.595,"The surgeon positions the self-fixating mesh to cover all potential hernia spaces within the preperitoneal area, ensuring complete coverage without the need for sutures or tacks."
118.095,122.985,"The surgeon sutures the preperitoneal space closed, completing the operation."
