start,end,text
22.761,35.872,"The surgeon begins in the left retrorectus space, attempting to incise the posterior rectus sheath, which is part of the previous minimally invasive inguinal hernia repair."
55.681,65.967,"The surgeon observes a well-defined tissue plane in the suprapubic area, indicating a smoother dissection compared to previous regions."
82.798,112.808,"The surgeon observes the inferior plane, noting that it appears better preserved compared to other areas, despite some fusion due to previous inguinal hernia repairs."
113.308,153.184,"The surgeon navigates around the midline, crossing over to the right side, where the right rectus muscle is visible."
153.684,166.054,The surgeon encounters adhesions in the surgical field and begins to carefully dissect and remove them.
166.074,175.722,"The surgeon incises the rectus sheath on the left side, revealing underlying tissue layers."
176.222,193.212,"The surgeon opens the falciform ligament, pulling it down to expose the underlying structures. The hernia in the epigastric area becomes visible."
193.712,208.672,"The surgeon identifies a hernia, suspected to be a trocar site hernia, in the region associated with a previous inguinal hernia repair."
209.172,221.74,"The surgeon enters the right retroactive space, revealing a Swiss cheese hernia characterized by multiple small defects in the posterior sheath."
236.649,254.835,"The surgeon places a Vicryl mesh over the defect in the posterior sheath of the Swiss cheese hernia, opting for this method instead of an eye pump technique."
290.189,300.711,The surgeon positions a Vicryl mesh over the visible hernia defect near the diaphragm and sternum.
301.211,323.388,"The surgeon begins suturing with a 3-0 V-lock through the Vicryl mesh but encounters difficulty pulling it through. The surgeon then switches to a Stratafix suture, which is visibly easier to maneuver through the mesh."
323.888,331.074,"The surgeon sutures the edges of the posterior sheath to the Vicryl mesh, securing the mesh in place over the defect."
331.574,358.933,"The surgeon adjusts the camera view and switches arm positions to improve visibility while suturing the ipsilateral side of the surgical area, using a single dock setup."
359.433,373.084,"The surgeon uses a PDS Stratafix suture, visibly demonstrating its ease of passage through the surgical site."
414.696,429.101,"The surgeon performs a baseball stitch under laparoscopic view, revealing the internal appearance of the sutured area. Some canal stitches show exposed sutures in certain areas."
429.121,443.703,"The surgeon places a figure-eight silk suture to cover exposed areas, opting not to use additional canal stitches due to unsatisfactory appearance."
444.203,462.353,"The surgeon places figure eight silk sutures to cover specific areas, ensuring the sutures are positioned superiorly, away from the viscera."
462.853,481.792,"The surgeon places a 30 cm by 25 cm soft barred mesh over the surgical site, securing it with several stitches using a baseball stitch technique."
