start,end,text
0.492,8.201,"Hello, this is Roxen Liu with a video of a robotic tap right lower quadrant spaghelion hernia repair that I converted to Tarm."
8.701,17.442,"Now this may be kind of splitting hairs, but I think it's an important distinction to make because the linea semilunaris is involved."
17.942,23.129,"The surgeon identifies a right lower quadrant Spigelian hernia and attempts to access the preperitoneal plane, manipulating the tissue layers to create space for the repair."
23.349,27.615,"The surgeon demonstrates the width of the rectus muscle, which appears notably wide in this patient."
28.115,33.402,"The video shows a vertical indentation on the right side of the screen, identified as the linea semilunaris."
33.902,36.905,"The surgeon attempts to access the preperitoneal space in the right lower quadrant, focusing on the area surrounding the spigelian hernia."
36.925,39.968,"The surgeon attempts to bring down the thin transverse salus fascia, revealing its delicate structure during the dissection process."
40.468,44.932,"If I persisted, I probably could have done this case tap."
45.432,51.678,"I could have also gone laterally to start, which maybe would have been easier as a right-hander to stay preperitoneal."
52.178,59.561,"The surgeon attempts to stay within the preperitoneal space, with visible efforts to navigate the anatomical layers, while considering transitioning into the retro-rectus space."
60.061,63.042,Now this approach is similar to an inguinal hernia repair.
63.082,71.145,"When you start the tap inguinal hernia flap, you could be either outside the retro-rectus space or inside the retro-rectus space."
71.645,76.668,"So in this case, what I decided to do is instead of staying outside of the retro-rectus space, I decided to go"
77.168,82.757,into the retro-rectus space because of course the retro-rectus space is much easier to work with.
82.797,87.364,"The surgeon opens the posterior rectus sheath, gaining access to the retro-rectus space."
87.864,92.907,"The surgeon is positioned within the retro muscular retro-rectus space, continuing the procedure in this anatomical area."
93.407,101.529,"The surgeon moves laterally within the retro-rectus space, approaching the linea semilunaris. The grasper visibly contacts a firm boundary, likely the lateral edge of the rectus sheath."
102.029,108.851,"The surgeon pauses dissection to avoid disrupting the linea semilunaris, indicating a careful approach to maintain the integrity of this anatomical structure."
109.351,114.893,"The surgeon performs additional dissection within the retro-rectus space, preparing to continue lateral dissection while maintaining careful technique."
115.393,127.396,"In the retro-rectus space, the surgeon manipulates the tissue so that the fat is elevated and remains against the rectus muscle, ensuring protection of the inferior gastric vessels and neurovascular bundles."
127.896,129.996,"The surgeon continues the dissection in the retro-muscular retro-rectus space, carefully navigating around the linea semilunaris."
130.016,135.697,"The surgeon continues dissection in the retro-rectus space, where the tissue separation is visibly easier compared to the preperitoneal plane."
136.197,139.867,"So this is, again, very similar to an inguinal hernia dissection where"
140.367,151.509,"The surgeon demonstrates the option to either remain within the retro-rectus space, which is easily accessible, or attempt to separate the tissue layers outside of this space."
152.009,158.851,"The surgeon demonstrates the anatomical layers outside the retro-rectus space, highlighting the difficulty of accessing the true preperitoneal layer."
159.351,166.673,"The surgeon navigates between the layers of the attenuated posterior rectus sheath, which are sometimes easier to access during dissection."
167.173,172.701,"The surgeon operates within the retro-rectus space, with the attenuated posterior rectus sheath visible on the floor of the surgical field."
173.201,182.504,"The surgeon divides the attenuated posterior rectus sheath, also referred to as the transverse salus fascia, while progressing laterally in a manner similar to an inguinal hernia repair."
183.004,186.705,"Some, David Laurier calls it the intermediate fascia."
187.205,197.808,"I like to use the term of attenuated posterior rectus sheath because frequently, even below the arcuate line, this posterior rectus sheath continues downwards and you still get a lydia similar."
197.868,201.948,"The surgeon exposes the linea semilunaris, a visible anatomical structure forming a lateral boundary in the abdominal wall."
202.448,212.296,"The surgeon continues lateral dissection to create more space for mesh overlap, dividing the posterior rectus sheath visible on the surgical field."
212.336,221.118,"The surgeon cuts the posterior rectus sheath medial to the linea semilunaris, performing a technique similar to a transversus abdominis release (TAR)."
221.618,232.501,"Below the arcuate line, the surgeon exposes a thickened layer identified as the attenuated posterior rectus sheath."
233.001,243.664,"The surgeon moves cephalad, creating a pocket behind the posterior rectus sheath to push off the peritoneum, similar to a robotic TAR procedure for a large incisional hernia."
244.164,250.472,"The surgeon pushes the peritoneum aside, facilitating the division of the posterior rectus sheath. The attenuated posterior rectus sheath is visibly being cut."
250.492,255.855,"The surgeon reveals two distinct layers below the arcuate line, similar to the anatomical structure observed above the arcuate line."
256.355,262.258,"The surgeon approaches the spigot line sac and cuts through the attenuated posterior rectus sheath, revealing the underlying anatomical structures."
262.758,268.441,"The surgeon exposes the two layers consisting of the posterior lamella, internal oblique, and transverse abdominis muscles, visible beneath the attenuated posterior rectus sheath."
268.941,273.402,"The surgeon carefully dissects around the hernia sac, ensuring clear separation from surrounding tissues."
273.902,279.924,"The surgeon uses scissors to navigate between layers, moving preperitoneally when the scissors are under the layer and retrorectus when above it, demonstrating the spatial relationship between these anatomical planes."
280.424,295.01,"The surgeon advances further into the surgical field, where the layers of fascia between the retrorectus space and the preperitoneal space visually merge, with the fascia appearing almost non-existent."
295.51,301.11,"The surgeon continues to divide the posterior rectus sheath, carefully extending the incision along the previously identified line."
301.61,312.435,"The surgeon divides the posterior rectus sheath vertically, joining the medial retro-rectus space with the lateral pre-peritoneal space."
312.935,317.997,"The surgeon carefully divides the posterior rectus sheath, ensuring not to cut through the underlying peritoneum, while maneuvering around the hernia sac."
318.477,330.793,"The surgeon uses a grasper to carefully peel the peritoneum away from the posterior rectus sheath, facilitating the division of the sheath. The peritoneum is visibly separated from the underlying tissue."
331.293,337.895,"The surgeon carefully dissects the preperitoneal space, separating the tissue layers to expand the surgical field."
338.395,347.897,"The surgeon continues to peel the peritoneum off the abdominal wall, maintaining the dissection along the preperitoneal space."
347.977,358.156,"The surgeon observes a small remainder of the posterior rectus sheath, noting that the recent dissection did not disrupt the linea semilunaris."
358.176,365.825,"The surgeon makes a vertical incision in the posterior rectus sheath just medial to the linea semilinaris, transitioning from the retro rectus space to the preperitoneal space."
366.325,378.713,"So this is a technique I do quite often when I have a lower abdominal hernia, whether it's a Spigellian or lobe midline incisional hernia, an incisional hernia from a fan and steel incision."
379.213,394.017,"The surgeon navigates from the retrorectal space into the preperitoneal space, carefully respecting the linea alba and linea semilunaris, to develop a large pocket within the preperitoneal space."
394.517,400.358,"The rest of the operation was pretty routine, and I'm not going to demonstrate it. Thank you for watching."
