start,end,text
176.377,186.059,"In the initial part of the dissection, the surgeon uses hot shears at the supraumbilical port (R-I), a vessel sealer at the suprapubic port (R-II), and a tip-up prograsp at the right iliac fossa port (R-III) to manipulate and dissect tissue."
186.559,202.972,"The surgeon begins the dissection by visualizing the hepatic flexure of the colon, followed by mobilization of the hepatic flexure using surgical instruments."
203.472,216.535,"The surgeon begins dissection from the right ascending colon, following the white line of Toldt to medially mobilize the ascending colon."
222.076,229.338,"The surgeon proceeds towards the right lateral parietal wall to mobilize the hepatic flexure of the colon, using surgical instruments to separate the colon from the surrounding tissue."
229.838,238.102,"The surgeon continues the dissection, revealing the underlying duodenum medially as the hepatic flexure is mobilized."
238.602,244.288,"The surgeon meticulously dissects around the duodenum using monopolar hot shears, carefully separating the tissue while maintaining precision."
257.499,264.9,"The surgeon visualizes the right branch of the middle colic vein during the procedure, highlighting its location within the surgical field."
265.4,292.447,"The surgeon proceeds with the dissection of the greater omentum from the mesocolon, with the head of the pancreas clearly visible below the duodenum."
292.947,312.203,"The surgeon visualizes the branching pattern of the middle colic vein, highlighting its anatomical layout within the surgical field."
312.703,317.102,"The surgeon continues the dissection process, likely focusing on the area around the duodenum and mesocolon, using monopolar hot shears for precise tissue separation."
317.602,332.418,"The surgeon moves towards the right iliac fossa and begins separating the cecum from the white line of Toldt, carefully dissecting the connective tissue between these structures."
332.918,358.992,"The surgeon identifies the right-sided gonadal vessels and ureter, carefully distinguishing these structures from surrounding tissues."
359.492,364.674,"The surgeon continues the dissection cranially, moving upwards from the previously exposed area below the duodenum and head of the pancreas, separating the greater omentum from the mesocolon."
365.174,367.515,"The surgeon mobilizes the terminal ileum, carefully freeing it from surrounding tissues."
367.935,378.86,"The surgeon lifts the cecum along with the appendix, elevating these structures from their anatomical position."
379.36,397.368,"The surgeon flips the bowel to locate the ileocolic pedicle, which is then ligated, securing the blood supply to the terminal ileum and cecum."
397.868,425.192,"The surgeon uses a vessel sealer to ligate the right colic pedicle, securing the blood vessels in the surgical field."
425.692,432.977,"The surgeon visually identifies the right branch of the middle colic artery, preparing for further dissection or ligation."
433.477,457.758,"The surgeon uses a vessel sealer to ligate the right branch of the middle colic pedicle, securing the vessel within the surgical field."
458.258,466.901,"The surgeon lifts the entire transverse colon, elevating it to expose underlying structures and facilitate further dissection."
467.401,481.205,"The surgeon mobilizes the splenic flexure of the colon by dissecting towards the left side, continuing the procedure after ligating the ileocolic pedicle."
490.54,504.853,"The surgeon completes the mobilization of the colon, extending from the terminal ileum to the splenic flexure, ensuring the entire section is free and ready for further surgical steps."
