start,end,text
30.213,61.312,"The surgeon identifies the ureter and mobilizes the colon from the lateral abdominal wall along the line of the wall, using surgical instruments to carefully separate the colon from surrounding tissues."
61.812,70.346,"The surgeon continues the dissection of the colon, further identifying and mobilizing the ureter from surrounding tissues."
70.846,93.436,The surgeon uses the ureter as a landmark to trace the hilum of the left-sided non-functioning moiety in the kidney.
93.936,132.46,"The surgeon meticulously dissects and mobilizes the colon near the hilum of the left-sided non-functioning moiety, reaching the upper pole of the non-functioning kidney."
132.96,138.088,"The surgeon dissects the lower pole of the non-functioning moiety, carefully separating it from surrounding tissues."
138.588,160.497,"The surgeon clips the aberrant vessel located at the lower pole of the non-functioning moiety, securing it to prevent bleeding."
160.997,193.383,"The video shows the lower pole artery, ureter, and the lower pole of the kidney, all clearly demarcated. These anatomical structures are visible as the surgeon continues the dissection."
193.883,233.698,"The surgeon performs further medial dissection at the hilum of the left-sided non-functioning moiety, identifying and looping the left renal vein."
234.198,263.421,"The surgeon dissects the renal artery located behind the renal vein and clips the artery, demonstrating the procedure visually."
274.504,286.108,"After controlling the vessels, the surgeon performs further dissection to free the upper pole of the kidney, carefully separating it from surrounding tissues."
286.608,305.963,"The surgeon completes the dissection of the upper pole of the kidney, revealing the psoas muscle posteriorly."
306.463,319.674,"The surgeon completes the mobilization of the kidney, ensuring it is freed from surrounding tissues and structures."
320.174,334.843,"The surgeon dismembers the non-functioning kidney from the normal kidney, separating the two structures within the surgical field."
335.343,339.327,"The surgeon opens the collecting system of the normal kidney, revealing the internal structures of the renal pelvis and calyces."
339.827,341.609,"The surgeon continues the dissection beyond the isthmus, further freeing the kidney from surrounding tissues."
342.109,352.379,"The surgeon places a stay suture at the corner of the incision, securing the tissue in position."
352.879,369.595,The surgeon applies traction to facilitate the continued dismembering of the non-functioning kidney moiety from the normal kidney.
370.095,420.068,"The surgeon completes the dismemberment of the non-functional kidney moiety, separating it entirely from the normal kidney."
420.568,426.478,"The surgeon cuts the ureter and performs a pyelography on the normal kidney, visualizing the collecting system."
452.333,454.959,The surgeon places the excised specimen into a surgical retrieval bag for removal from the operative field.
