start,end,text
51.232,62.258,"The surgeon aligns the two ends of the bowel, resembling two rosebuds, to prepare for the back wall anastomosis."
62.758,76.169,"The surgeon uses interrupted sutures to align the jejunostomy site, ensuring there is no tension on the tissue and addressing any size mismatch between the sections."
76.669,82.293,"The surgeon performs an indocyanine green test to assess the perfusion and viability of the tissue, ensuring the anastomosis appears healthy and well-perfused."
82.394,94.282,"The surgeon uses two ovicryl sutures to secure the center of the anastomosis, followed by a transition stitch at the corner to complete the suturing around the junction."
135.556,152.592,"The surgeon uses a needle to set the suture, walking it up to the corner of the incision. At the corner, the suture is locked to prevent a purse-string effect, as visible in the video."
153.092,161.656,"The surgeon throws a locking stitch, followed by another stitch, before beginning suturing from the opposite side of the jejunostomy site."
162.156,173.87,"The surgeon sets the needle in place and proceeds to take another stitch, repeating the same suturing technique."
209.85,228.058,"The surgeon performs a transition stitch, allowing the suture technique to switch to a forehand approach."
270.01,309.106,"The surgeon meets the last suture with the first suture at the corner, ensuring full thickness bites through the tissue."
309.606,333.195,"The surgeon ties the suture, ensuring it sits smoothly, and places protective lumbers over the staple line to relieve tension. More than the usual four lumbers are used due to the length of the suture line."
411.253,451.16,"The surgeon closes the section of the jejunum that was not addressed by the tinea, using precise suturing techniques to ensure proper closure."
451.66,460.105,The surgeon places one final suture at the corner of the anastomosis and prepares to perform a leak test.
