start,end,text
8.289,14.975,"The patient is a fifty-two years old male with four stage colorectal cancer diagnosed in October, twenty fourteen."
15.475,24.062,"During his first endoscopic evaluation, the sigmoid colon cancer was diagnosed with almost total colon obstruction."
24.562,33.246,Oncological markers were very high. CEA was more than five thousand and CA nineteen and nine was more than three thousand.
33.746,38.41,"On CT scans, multiple below-liver metastatic disease was found."
38.91,55.72,It was represented with large tumors with maximum size about eight centimeters in the right liver and also three metastatic tumors in the left liver with maximum size three and a half centimeters were diagnosed.
56.22,64.764,"On the first stage of treatment, we planned the stenting of the colon, but our colleagues found it technically impossible."
65.264,72.087,"So, we performed open sigmoid colon resection on the background of the partial intestinal obstruction."
72.587,76.889,"The surgeon resects three metastatic tumors from the left liver, carefully excising the affected tissue."
77.389,81.906,"In pathological reports, Kiras positive adenocarcinoma was found."
82.406,93.858,"Patient received twelve courses of the hemotherapy, followed them with the Erbitux."
94.358,99.984,We received good clinical response to hemotherapy. The patient's general condition was improved.
100.344,103.208,Oncological markers became almost normal.
103.708,107.699,"During the CT scan, we found decreasing of the metastasis."
108.199,122.27,"Before treatment, maximum size of right liver metastasis was about eight centimeters, and after hemotherapy, it was about four and a half centimeters."
122.77,128.115,Effective hemotherapy gave us an impulse to continue treatment with surgery.
128.615,135.927,"We evaluated liver volumes. For left liver, it was about thirty-eight percent."
136.427,139.849,The third level of liver fibrosis was diagnosed also.
140.349,150.353,"Preoperatively, we decided to perform the portal vein embolization and at four weeks we received increasing of its volume by eleven percents."
150.853,162.786,Next step of combinated treatment was surgery.
163.286,167.648,We began surgery from the division of multiple occasions after the first operation.
168.148,190.377,"I remind you that one year ago before this surgery, the patient underwent the sigmoid colon resection and atypical resection of the left lobe of the liver."
190.877,204.393,"In segment three of the liver, normal adhesive tissue is visible at the site of the previous atypical resection, with parts of a mantle structure present."
204.893,216.289,"The surgeon begins the hepatotectomy by detecting and encircling the right hepatic vein, preparing for its isolation within the surgical field."
216.789,223.656,"The surgeon mobilizes the right liver lobe, exposing the inferior vena cava for visualization."
224.156,247.44,The surgeon divides the liver from the diaphragm by cutting the phrenic-hepatic ligament.
247.94,259.083,"The surgeon visualizes and divides the short branches of the inferior vena cava, ensuring precise control and observation during the procedure."
259.583,271.586,"Following the maneuvers, the right hepatic lobe is visibly more mobile, allowing the surgeon to proceed with the detection of the right hepatic vein."
272.086,303.384,"The surgeon carefully dissects the surrounding tissue around the right hepatic vein to avoid damaging the vessel wall, ensuring precise separation of the vessel from adjacent structures."
303.884,378.964,The surgeon achieves clear visualization of all walls of the right hepatic vein and encircles the vessel with umbilical tape.
379.464,386.327,"The surgeon begins the dissection of the gastrohepatic ligament, focusing on detecting the portal vein within the surgical field."
386.827,410.21,"The surgeon visualizes the anterior wall of the deeply situated structure, which lies beneath the bile duct and GA arteries, enhancing safety and comfort for subsequent dissection of these structures."
410.71,417.556,"The surgeon identifies the hepatic artery in the area above the main bile duct, utilizing the optimal location for detection."
418.056,446.525,"The surgeon continues dissection in the space between the bile duct laterally and the right hepatic artery medially, carefully dividing surrounding fibrous tissue and small branches of the solar nervous plexus."
447.025,456.993,"The surgeon encircles the common bile duct with a surgical tape, highlighting its location and separation from surrounding tissues."
457.493,474.659,"It is very important to remember the anatomy of the hepatic healer. The most often for right hepatic healer structures, right hepatic artery lies between right portal vein inferiorly and right bile duct superiorly."
475.159,499.468,"The surgeon safely mobilizes the proximal part of the vessel within the space between the bile duct and right hepatic artery, ensuring careful manipulation of surrounding tissues."
499.968,563.583,"The surgeon continues dissection towards the distal part of the hepatic artery, aiming to fully visualize the arterial branch. The proximal part of the right hepatic artery is encircled at the end of the dissection."
564.083,596.979,"The surgeon meticulously dissects to detect the bifurcation of the portal vein, taking care to avoid bleeding due to the thin vessel wall. After mobilizing the right portal vein, it is encircled."
597.479,622.473,"The surgeon proceeds to detect the right hepatic bile duct, focusing on its identification within the anatomical context of the hepatic healer."
622.973,632.121,"The video displays the anatomical structures of the right hepatic hilum, highlighting the spatial arrangement of the right hepatic artery, right portal vein, and right bile duct."
632.621,657.038,"The surgeon ligates and divides the right portal vein, completing the separation of this vessel from surrounding tissues."
657.538,666.761,"The surgeon begins to divide the liver parenchyma along the demarcation line, using a surgical instrument to follow the marked path."
667.261,689.41,"The surgeon resects the right side of the fourth A liver segment, targeting the area where tumor nodules are located at the border between segment eight and segment four."
689.91,766.242,"The surgeon carefully divides the superficial liver tissue using an ultrasound scalpel. As the dissection progresses deeper, small vessels are clipped or ligated to control bleeding."
766.742,823.28,The surgeon identifies the middle hepatic vein and proceeds to divide the veins draining venous blood from the right liver under visual control.
823.78,874.279,"The surgeon completes the separation of segment V and segment VIII of the right liver from segment IV of the left lobe. The right hepatic artery is ligated, followed by the right bile duct, and finally the right hepatic vein."
874.779,904.938,"The surgeon divides the right hepatic vein, completing the right hepatectomy. The remnant liver is visible, and the excised liver specimen is shown."
905.438,922.241,"Multiple colorectal metastases are visible in the right liver, highlighting the areas affected by the metastatic disease."
922.741,945.641,"In one month after surgery, we performed radiological control. In CT scans, we see no signs of relapse or new metastases. Oncological markers are still normal. So now this patient is disease free and this was our aim."
946.141,947.743,Thank you for your kind attention.
