start,end,text
0.531,6.813,"This gentleman presented to the emergency department with right leg pain, abdominal pain with peritonitis and bowel obstruction."
7.313,11.534,He was found to have a herniation of his right iliac artery with small bowel.
12.034,20.996,His history includes having a prostatectomy with lymphadenectomy with large amount of dissection which likely caused the potential hernia space along the right iliac.
21.496,27.917,I show several segments during the procedure of multiple maneuvers that I accomplished
28.238,32.622,Val is stuck underneath the iliac.
32.642,45.453,"Okay, that's good."
45.953,46.774,The aorta is visually identified in the surgical field.
46.794,48.596,Iliac.
48.616,104.662,"There you go, man."
105.162,114.414,"What's really scary about this case was that during the operation, I had not pre-operatively identified this was an internal herniation of the iliac artery."
114.914,121.682,And it appeared that this was a simple band on examination during the exploratory laparotomy.
122.163,124.817,There was no pulse on it.
125.317,130.578,"The surgeon uses a bovie or ligature device to transect across the identified structure, likely addressing the internal herniation of the iliac artery."
131.078,137.66,"However, I felt that the artery was very close by and I just didn't have a good feeling about it."
138.16,145.582,I decided to do it a little bit more dissection and luckily I did as this could have been catastrophic.
146.082,153.465,Taking the extra time at three o'clock in the morning and having that patience to do this saved me in this case.
153.965,169.738,"It's very humbling and if you ever encounter a similar situation, be advised that you may not feel a pulsatile band and pre-operatively have to have a high index of suspicion."
170.238,175.422,Literature review demonstrates there's a handful of cases that have followed in a similar pattern.
